qiime_add_on	qiime_collapse_samples, qiime_make_otu_table	QIIME to perform microbial community analysis	qiime_add_on	qiime_add_on, qiime_core		qiime_add_on	QIIME 2 is a next-generation microbiome bioinformatics platform that is extensible, free, open source, and community developed.	Demultiplexing, Visualisation, Taxonomic classification, Phylogenetic analysis, Sequencing quality control	Microbial ecology, Phylogeny, Metagenomics, Metatranscriptomics	To update	http://www.qiime.org	Metagenomics	qiime	iuc	https://github.com/galaxyproject/tools-iuc/tree/master/tools/qiime/	https://github.com/galaxyproject/tools-iuc/tree/main/tools/qiime/qiime_add_on		qiime	1.9.1	Demultiplexing, Visualisation, Taxonomic classification, Phylogenetic analysis, Sequencing quality control	Microbial ecology, Phylogeny, Metagenomics, Metatranscriptomics	0	0	2	2	0	0	2	2	0	0	0	0	0	0	0	0	0	0	0	0	0	0	0	0	0	0	0	0	0	0	0	0	0	0	0	0	0	0	0	0	2	2	68	1909	True	False	True
qiime_core	qiime_align_seqs, qiime_alpha_diversity, qiime_alpha_rarefaction, qiime_assign_taxonomy, qiime_beta_diversity, qiime_beta_diversity_through_plots, qiime_compare_categories, qiime_core_diversity, qiime_count_seqs, qiime_extract_barcodes, qiime_filter_alignment, qiime_filter_fasta, qiime_filter_otus_from_otu_table, qiime_filter_samples_from_otu_table, qiime_filter_taxa_from_otu_table, qiime_jackknifed_beta_diversity, qiime_make_emperor, qiime_make_otu_heatmap, qiime_make_phylogeny, qiime_multiple_join_paired_ends, qiime_multiple_split_libraries_fastq, qiime_pick_closed_reference_otus, qiime_pick_open_reference_otus, qiime_pick_otus, qiime_pick_rep_set, qiime_plot_taxa_summary, qiime_split_libraries, qiime_split_libraries_fastq, qiime_summarize_taxa, qiime_summarize_taxa_through_plots, qiime_upgma_cluster, qiime_validate_mapping_file	QIIME to perform microbial community analysis	qiime_core	qiime_core		qiime_core	QIIME 2 is a next-generation microbiome bioinformatics platform that is extensible, free, open source, and community developed.	Demultiplexing, Visualisation, Taxonomic classification, Phylogenetic analysis, Sequencing quality control	Microbial ecology, Phylogeny, Metagenomics, Metatranscriptomics	To update	http://www.qiime.org	Metagenomics	qiime	iuc	https://github.com/galaxyproject/tools-iuc/tree/master/tools/qiime/	https://github.com/galaxyproject/tools-iuc/tree/main/tools/qiime/qiime_core		qiime	1.9.1	Demultiplexing, Visualisation, Taxonomic classification, Phylogenetic analysis, Sequencing quality control	Microbial ecology, Phylogeny, Metagenomics, Metatranscriptomics	0	0	32	32	0	0	32	32	0	0	0	0	0	0	0	0	0	0	0	0	0	0	31	0	1	0	0	0	0	0	0	0	0	0	0	0	0	0	0	0	31	31	1155	28681	True	False	True
qualimap	qualimap_bamqc, qualimap_counts, qualimap_multi_bamqc, qualimap_rnaseq		qualimap	qualimap		QualiMap	Platform-independent application written in Java and R that provides both a Graphical User Inteface (GUI) and a command-line interface to facilitate the quality control of alignment sequencing data.	Sequencing quality control	Data quality management	To update	http://qualimap.bioinfo.cipf.es/	Sequence Analysis, Transcriptomics, SAM	qualimap	iuc	https://github.com/galaxyproject/tools-iuc/tree/master/tools/qualimap	https://github.com/galaxyproject/tools-iuc/tree/main/tools/qualimap	2.2.2d	qualimap	2.3	Sequencing quality control	Data quality management	4	4	4	1	4	4	4	1	0	0	0	0	0	0	0	0	0	0	0	0	0	0	0	0	4	0	0	1	0	0	0	1	0	0	0	0	0	0	0	0	4	4	1328	664470	True	False	True
quast	quast	Quast (Quality ASsessment Tool) evaluates genome assemblies.	quast	quast		QUAST	QUAST stands for QUality ASsessment Tool.  It evaluates a quality of genome assemblies by computing various metrics and providing nice reports.	Visualisation, Sequence assembly validation	Sequence assembly	Up-to-date	http://quast.bioinf.spbau.ru/	Assembly	quast	iuc	https://github.com/galaxyproject/tools-iuc/tree/master/tools/quast	https://github.com/galaxyproject/tools-iuc/tree/main/tools/quast	5.2.0	quast	5.2.0	Visualisation, Sequence assembly validation	Sequence assembly	1	1	1	1	1	1	1	1	0	0	0	0	0	0	1	0	0	0	0	0	0	0	1	1	1	0	0	1	0	0	0	1	0	0	0	0	0	0	0	0	1	1	3567	51567	True	False	True
quickmerge	quickmerge	Merge long-read and hybrid assemblies to increase contiguity	quickmerge	quickmerge		quickmerge	Quickmerge is a program that uses complementary information from genomes assembled with long reads in order to improve contiguity, and works with assemblies derived from both Pacific Biosciences or Oxford Nanopore. Quickmerge will even work with hybrid assemblies made by combining long reads and Illumina short reads.	Genome assembly, Scaffolding, De-novo assembly, Genotyping	Structural variation, Sequence assembly, DNA polymorphism, Whole genome sequencing, Genotype and phenotype	Up-to-date	https://github.com/mahulchak/quickmerge	Assembly	quickmerge	galaxy-australia	https://github.com/galaxyproject/tools-iuc/tree/master/tools/quickmerge	https://github.com/galaxyproject/tools-iuc/tree/main/tools/quickmerge	0.3	quickmerge	0.3	Genome assembly, Scaffolding, De-novo assembly, Genotyping	Structural variation, Sequence assembly, DNA polymorphism, Whole genome sequencing, Genotype and phenotype	0	0	0	0	0	0	0	0	0	0	0	0	0	0	0	0	0	0	0	0	0	0	0	0	0	0	0	0	0	0	0	0	0	0	0	0	0	0	0	0	0	1	0	0	True	False	True
rRNA	meta_rna	Identification of ribosomal RNA genes in metagenomic fragments.								To update	http://weizhong-lab.ucsd.edu/meta_rna/	RNA	rrna	rnateam	https://github.com/bgruening/galaxytools/tree/master/tools/rRNA	https://github.com/bgruening/galaxytools/tree/master/tools/rna_tools/rRNA	0.1	hmmsearch3.0				0	0	0	0	0	0	0	0	0	0	0	0	0	0	0	0	0	0	0	0	0	0	0	0	0	0	0	0	0	0	0	0	0	0	0	0	0	0	0	0	0	0	0	0	True	False	True
racon	racon	Consensus module for raw de novo DNA assembly of long uncorrected reads.	Racon	Racon		Racon	Consensus module for raw de novo DNA assembly of long uncorrected readsRacon is intended as a standalone consensus module to correct raw contigs generated by rapid assembly methods which do not include a consensus step. The goal of Racon is to generate genomic consensus which is of similar or better quality compared to the output generated by assembly methods which employ both error correction and consensus steps, while providing a speedup of several times compared to those methods. It supports data produced by both Pacific Biosciences and Oxford Nanopore Technologies.	Genome assembly, Mapping assembly	Whole genome sequencing, Sequence assembly	Up-to-date	https://github.com/isovic/racon	Sequence Analysis	racon	bgruening	https://github.com/bgruening/galaxytools/tree/master/tools/racon	https://github.com/bgruening/galaxytools/tree/master/tools/racon	1.5.0	racon	1.5.0	Genome assembly, Mapping assembly	Whole genome sequencing, Sequence assembly	1	1	1	1	1	1	1	1	0	0	0	0	0	0	0	0	0	0	0	0	0	0	0	0	1	0	0	0	0	0	0	0	0	0	0	0	0	0	0	0	1	1	309	21353	True	False	True
rasusa	rasusa	Randomly subsample sequencing reads to a specified coverage	rasusa	rasusa		rasusa	Produces an unbiased subsample of your reads			To update	https://github.com/mbhall88/rasusa	Sequence Analysis	rasusa	iuc	https://github.com/galaxyproject/tools-iuc/tree/master/tools/rasusa	https://github.com/galaxyproject/tools-iuc/tree/main/tools/rasusa	0.8.0	rasusa	2.0.0			0	0	1	0	0	0	1	0	0	0	0	0	0	0	0	0	0	0	0	0	0	0	0	0	0	0	0	0	0	0	0	0	0	0	0	0	0	0	0	0	0	0	0	0	True	False	True
raxml	raxml	RAxML - A Maximum Likelihood based phylogenetic inference	raxml	raxml		RAxML	A tool for Phylogenetic Analysis and Post-Analysis of Large Phylogenies.	Sequence analysis, Phylogenetic tree analysis	Phylogenetics, Sequence analysis	To update	http://www.exelixis-lab.org/web/software/raxml/	Phylogenetics	raxml	iuc	https://github.com/galaxyproject/tools-iuc/tree/master/tools/raxml	https://github.com/galaxyproject/tools-iuc/tree/main/tools/raxml	8.2.12	raxml	8.2.13	Sequence analysis	Phylogenetics	1	1	1	1	1	1	1	1	0	0	0	0	0	0	1	0	0	0	0	0	0	0	0	0	1	0	0	0	0	0	0	0	0	0	0	0	0	0	0	0	1	1	383	6808	True	False	True
read_it_and_keep	read_it_and_keep	Rapid decontamination of SARS-CoV-2 sequencing reads	read_it_and_keep	read_it_and_keep		read_it_and_keep	Read contamination removal	Filtering, Genome alignment	Pathology, Genomics	To update	https://github.com/GenomePathogenAnalysisService/read-it-and-keep	Sequence Analysis	read_it_and_keep	iuc	https://github.com/galaxyproject/tools-iuc/tree/master/tools/read-it-and-keep	https://github.com/galaxyproject/tools-iuc/tree/main/tools/read_it_and_keep	0.2.2	read-it-and-keep	0.3.0	Filtering, Genome alignment	Pathology, Genomics	1	0	1	0	1	0	1	0	0	0	0	0	0	0	0	0	0	0	0	0	0	0	0	0	1	0	0	0	0	0	0	0	0	0	0	0	0	0	0	0	1	0	71	3370	True	False	True
reago	reago	Reago is tool to assembly 16S ribosomal RNA recovery from metagenomic data.	reago	reago		REAGO	This is an assembly tool for 16S ribosomal RNA recovery from metagenomic data.	Sequence assembly	Sequence assembly, RNA, Metagenomics, Microbiology	Up-to-date	https://github.com/chengyuan/reago-1.1	Metagenomics, RNA	reago	rnateam	https://github.com/bgruening/galaxytools/tree/master/tools/rna_tools/reago	https://github.com/bgruening/galaxytools/tree/master/tools/rna_tools/reago	1.1	reago	1.1	Sequence assembly	Sequence assembly, RNA, Metagenomics, Microbiology	0	0	1	0	0	0	1	0	0	0	0	0	0	0	0	0	0	0	0	0	0	0	0	0	0	0	0	0	0	0	0	0	0	0	0	0	0	0	0	0	0	0	0	0	True	False	True
recentrifuge	recentrifuge	"""With Recentrifuge, researchers can analyze results from taxonomic classifiers using interactive charts with emphasis on the confidence level of the classifications.In addition to contamination-subtracted samples.Recentrifuge provides shared and exclusive taxa per sample,thus enabling robust contamination removal and comparative analysis in environmental and clinical metagenomics."""	Recentrifuge	Recentrifuge		Recentrifuge	Robust comparative analysis and contamination removal for metagenomics.	Taxonomic classification, Expression analysis, Cross-assembly	Metagenomics, Microbial ecology, Metagenomic sequencing	Up-to-date	https://github.com/khyox/recentrifuge	Metagenomics	recentrifuge	iuc	https://github.com/galaxyproject/tools-iuc/blob/master/tools/recentrifuge	https://github.com/galaxyproject/tools-iuc/tree/main/tools/recentrifuge	1.14.0	recentrifuge	1.14.0	Taxonomic classification, Expression analysis, Cross-assembly	Metagenomics, Microbial ecology, Metagenomic sequencing	1	0	1	1	1	0	1	1	0	0	0	0	0	0	0	0	0	0	0	0	0	0	1	0	1	0	0	0	0	0	0	0	0	0	0	0	0	0	0	0	1	0	48	331	True	False	True
repeatexplorer2	repeatexplorer_clustering	Tool for annotation of repeats from unassembled shotgun reads.								To update	https://github.com/repeatexplorer/repex_tarean	Genome annotation	repeatexplorer2	gga	https://github.com/galaxy-genome-annotation/galaxy-tools/tree/master/tools/repeatexplorer2	https://github.com/galaxy-genome-annotation/galaxy-tools/tree/master/tools/repeatexplorer2	2.3.8					0	0	1	0	0	0	1	0	0	0	0	0	0	0	0	0	0	0	0	0	0	0	0	0	0	0	0	0	0	0	0	0	0	0	0	0	0	0	0	0	0	0	0	16	True	False	True
roary	roary	Roary the pangenome pipeline	roary	roary		Roary	A high speed stand alone pan genome pipeline, which takes annotated assemblies in GFF3 format (produced by Prokka (Seemann, 2014)) and calculates the pan genome.	Genome assembly	DNA, Genomics, Mapping	Up-to-date	https://sanger-pathogens.github.io/Roary/	Sequence Analysis	roary	iuc	https://github.com/galaxyproject/tools-iuc/tree/master/tools/roary	https://github.com/galaxyproject/tools-iuc/tree/main/tools/roary	3.13.0	roary	3.13.0	Genome assembly	DNA, Genomics, Mapping	1	1	1	1	1	1	1	1	0	0	0	0	0	0	0	0	0	0	0	0	0	0	0	0	1	0	0	0	0	0	0	0	0	0	0	0	0	0	0	0	1	1	656	12225	True	False	True
rseqc	rseqc_FPKM_count, rseqc_RNA_fragment_size, rseqc_RPKM_saturation, rseqc_bam2wig, rseqc_bam_stat, rseqc_clipping_profile, rseqc_deletion_profile, rseqc_geneBody_coverage, rseqc_geneBody_coverage2, rseqc_infer_experiment, rseqc_inner_distance, rseqc_insertion_profile, rseqc_junction_annotation, rseqc_junction_saturation, rseqc_mismatch_profile, rseqc_read_GC, rseqc_read_NVC, rseqc_read_distribution, rseqc_read_duplication, rseqc_read_hexamer, rseqc_read_quality, rseqc_tin	an RNA-seq quality control package	rseqc	rseqc		RSeQC	Provides a number of useful modules that can comprehensively evaluate high throughput sequence data especially RNA-seq data. Some basic modules quickly inspect sequence quality, nucleotide composition bias, PCR bias and GC bias, while RNA-seq specific modules evaluate sequencing saturation, mapped reads distribution, coverage uniformity, strand specificity, transcript level RNA integrity etc.	Data handling	Sequencing	Up-to-date	https://code.google.com/p/rseqc/	Convert Formats, Sequence Analysis, RNA, Transcriptomics, Visualization	rseqc	nilesh	https://github.com/galaxyproject/tools-iuc/tree/master/tools/rseqc	https://github.com/galaxyproject/tools-iuc/tree/main/tools/rseqc	5.0.3	rseqc	5.0.3	Data handling	Sequencing	22	22	22	22	22	22	22	22	0	0	0	0	0	0	0	0	0	0	0	0	0	0	0	0	0	0	0	22	0	0	0	22	0	0	0	0	0	0	0	0	22	22	3206	133498	True	False	True
salmon	alevin, salmon, salmonquantmerge	Salmon is a wicked-fast program to produce a highly-accurate, transcript-level quantification estimates from RNA-seq and single-cell data.	salmon	salmon		Salmon	A tool for transcript expression quantification from RNA-seq data	Sequence composition calculation, RNA-Seq quantification, Gene expression analysis	RNA-Seq, Gene expression, Transcriptomics	To update	https://github.com/COMBINE-lab/salmon	Sequence Analysis, RNA, Transcriptomics		bgruening	https://github.com/bgruening/galaxytools/tree/master/tools/salmon	https://github.com/bgruening/galaxytools/tree/master/tools/salmon	1.10.1	salmon	1.10.3	Sequence composition calculation, RNA-Seq quantification, Gene expression analysis	RNA-Seq, Transcriptomics	2	1	3	1	2	1	3	1	0	0	0	0	0	0	0	0	0	0	0	0	0	0	0	2	1	0	0	1	0	0	0	1	0	0	0	0	0	0	0	0	3	3	969	61937	True	False	True
sarscov2formatter	sarscov2formatter	sarscov2formatter custom script								Up-to-date	https://github.com/nickeener/sarscov2formatter	Sequence Analysis	sarscov2formatter	iuc	https://github.com/galaxyproject/tools-iuc/tree/master/tools/sarscov2formatter	https://github.com/galaxyproject/tools-iuc/tree/main/tools/sarscov2formatter	1.0	sarscov2formatter	1.0			1	0	1	0	1	0	1	0	0	0	0	0	0	0	0	0	0	0	0	0	0	0	0	0	0	0	0	0	0	0	0	0	0	0	0	0	0	0	0	0	1	1	7	173	True	False	True
sarscov2summary	sarscov2summary	sarscov2summary custom script								To update	https://github.com/nickeener/sarscov2summary	Sequence Analysis	sarscov2summary	iuc	https://github.com/galaxyproject/tools-iuc/tree/master/tools/sarscov2summary	https://github.com/galaxyproject/tools-iuc/tree/main/tools/sarscov2summary	0.1	sarscov2summary	0.5			1	0	1	0	1	0	1	0	0	0	0	0	0	0	0	0	0	0	0	0	0	0	0	0	0	0	0	0	0	0	0	0	0	0	0	0	0	0	0	0	1	1	1	140	True	False	True
scoary	scoary	Scoary calculates the assocations between all genes in the accessory genome and the traits.	scoary	scoary		Scoary	Pan-genome wide association studies and  is designed to take the gene_presence_absence.csv file from Roary as well as a traits file created by the user and calculate the assocations between all genes in the accessory genome (all genes that are present in i genomes where 1 < i < N) and the traits. It reports a list of genes sorted by strength of association per trait.	Analysis	Genotype and phenotype, Model organisms, GWAS study, Functional genomics	Up-to-date	https://github.com/AdmiralenOla/Scoary	Metagenomics	scoary	iuc	https://github.com/galaxyproject/tools-iuc/tree/master/tools/scoary	https://github.com/galaxyproject/tools-iuc/tree/main/tools/scoary	1.6.16	scoary	1.6.16	Analysis	Genotype and phenotype, Model organisms, GWAS study, Functional genomics	0	0	1	0	0	0	1	0	0	0	0	0	0	0	0	0	0	0	0	0	0	0	0	0	1	0	0	0	0	0	0	0	0	0	0	0	0	0	0	0	1	0	61	676	True	False	True
semibin	semibin_bin, semibin_concatenate_fasta, semibin_generate_cannot_links, semibin_generate_sequence_features, semibin, semibin_train	SemiBin: Semi-supervised Metagenomic Binning Using Siamese Neural Networks	semibin	semibin		SemiBin	Command tool for metagenomic binning with semi-supervised deep learning using information from reference genomes.	Sequence assembly, Read binning	Metagenomics, Machine learning, Microbial ecology, Sequence assembly	To update	https://semibin.readthedocs.io/en/latest/	Metagenomics	semibin	iuc	https://github.com/galaxyproject/tools-iuc/tree/master/tools/semibin	https://github.com/galaxyproject/tools-iuc/tree/main/tools/semibin	2.0.2	semibin	2.1.0	Sequence assembly, Read binning	Metagenomics, Machine learning, Microbial ecology, Sequence assembly	0	0	6	1	0	0	6	1	0	0	0	0	0	0	0	0	0	0	0	0	0	0	0	0	0	0	0	0	0	0	0	0	0	0	0	0	0	0	0	0	6	0	39	542	True	False	True
seqkit	seqkit_fx2tab, seqkit_locate, seqkit_sort, seqkit_stats, seqkit_translate	A cross-platform and ultrafast toolkit for FASTA/Q file manipulation	seqkit	seqkit		seqkit	FASTA and FASTQ are basic and ubiquitous formats for storing nucleotide and protein sequences. Common manipulations of FASTA/Q file include converting, searching, filtering, deduplication, splitting, shuffling, and sampling. Existing tools only implement some of these manipulations, and not particularly efficiently, and some are only available for certain operating systems. Furthermore, the complicated installation process of required packages and running environments can render these programs less user friendly. SeqKit demonstrates competitive performance in execution time and memory usage compared to similar tools. The efficiency and usability of SeqKit enable researchers to rapidly accomplish common FASTA/Q file manipulations.	DNA transcription, Sequence trimming, DNA translation, Sequence conversion	Database management, Sequence analysis	Up-to-date	https://bioinf.shenwei.me/seqkit/	Sequence Analysis	seqkit	iuc	https://github.com/galaxyproject/tools-iuc/tree/master/tools/seqkit	https://github.com/galaxyproject/tools-iuc/tree/main/tools/seqkit	2.8.2	seqkit	2.8.2	DNA transcription, Sequence trimming, DNA translation	Database management, Sequence analysis	0	2	3	2	0	2	3	2	0	0	0	0	0	0	0	0	0	0	0	0	0	0	0	0	5	0	0	0	0	0	0	0	0	0	0	0	0	0	0	0	3	0	129	1964	True	False	True
seqprep	seqprep	Tool for merging paired-end Illumina reads and trimming adapters.	seqprep	seqprep		SeqPrep	Strips adapters and optionally merges overlapping paired-end (or paired-end contamination in mate-pair libraries) illumina style reads.	Nucleic acid design	Genomics, Sequence assembly, Sequencing, Probes and primers	Up-to-date	https://github.com/jstjohn/SeqPrep	Fastq Manipulation, Sequence Analysis	seqprep	iuc	https://github.com/galaxyproject/tools-iuc/tree/master/tools/seqprep	https://github.com/galaxyproject/tools-iuc/tree/main/tools/seqprep	1.3.2	seqprep	1.3.2	Nucleic acid design	Genomics, Sequence assembly, Sequencing, Probes and primers	0	0	1	0	0	0	1	0	0	0	0	0	0	0	0	0	0	0	0	0	0	0	0	0	0	0	0	0	0	0	0	0	0	0	0	0	0	0	0	0	0	0	0	0	True	False	True
seqsero2	seqsero2	Salmonella serotype prediction from genome sequencing data	seqsero2	seqsero2		SeqSero2	"rapid and improved Salmonella serotype determination using whole genome sequencing data | SeqSero-Salmonella Serotyping by Whole Genome Sequencing | Salmonella Serotyping by Whole Genome Sequencing | Online version: http://www.denglab.info/SeqSero2 | Salmonella serotype prediction from genome sequencing data | Citation: SeqSero, Zhang et al. 2015; SeqSero2, Zhang et al. 2019 | Salmonella serotype derterminants databases | Upon executing the command, a directory named 'SeqSero_result_Time_your_run' will be created. Your result will be stored in 'SeqSero_result.txt' in that directory. And the assembled alleles can also be found in the directory if using ""-m a"" (allele mode)"	Genome indexing, Antimicrobial resistance prediction, Genome alignment	Whole genome sequencing, Sequence assembly, Genomics	Up-to-date	https://github.com/denglab/SeqSero2	Sequence Analysis	seqsero2	iuc	https://github.com/galaxyproject/tools-iuc/tree/master/tools/seqsero2	https://github.com/galaxyproject/tools-iuc/tree/main/tools/seqsero2	1.3.1	seqsero2	1.3.1	Genome indexing, Antimicrobial resistance prediction, Genome alignment	Whole genome sequencing, Sequence assembly, Genomics	0	0	1	0	0	0	1	0	0	0	0	0	0	0	0	0	0	0	0	0	0	0	0	0	0	0	0	0	0	0	0	0	0	0	0	0	0	0	0	0	0	0	0	12	True	False	True
shorah	shorah_amplicon	Reconstruct haplotypes using ShoRAH in amplicon mode	shorah	shorah		ShoRAH	Inference of a population from a set of short reads. The package contains programs that support mapping of reads to a reference genome, correcting sequencing errors by locally clustering reads in small windows of the alignment, reconstructing a minimal set of global haplotypes that explain the reads, and estimating the frequencies of the inferred haplotypes.	Haplotype mapping, Variant calling	Metagenomics, Sequencing, Genetics	To update	https://github.com/cbg-ethz/shorah/blob/master/README.md	Sequence Analysis	shorah_amplicon	iuc	https://github.com/galaxyproject/tools-iuc/tree/master/tools/shorah	https://github.com/galaxyproject/tools-iuc/tree/main/tools/shorah	1.1.3	shorah	1.99.2	Haplotype mapping, Variant calling	Metagenomics, Sequencing, Genetics	0	0	0	0	0	0	0	0	0	0	0	0	0	0	0	0	0	0	0	0	0	0	0	0	1	0	0	0	0	0	0	0	0	0	0	0	0	0	0	0	0	0	0	0	True	False	True
shovill	shovill	Faster de novo assembly pipeline based around Spades	shovill	shovill		shovill	Shovill is a pipeline for assembly of bacterial isolate genomes from Illumina paired-end reads.  Shovill uses SPAdes at its core, but alters the steps before and after the primary assembly step to get similar results in less time. Shovill also supports other assemblers like SKESA, Velvet and Megahit, so you can take advantage of the pre- and post-processing the Shovill provides with those too.	Genome assembly	Genomics, Microbiology, Sequence assembly	Up-to-date	https://github.com/tseemann/shovill	Assembly	shovill	iuc	https://github.com/galaxyproject/tools-iuc/tree/master/tools/shovill	https://github.com/galaxyproject/tools-iuc/tree/main/tools/shovill	1.1.0	shovill	1.1.0	Genome assembly	Genomics, Microbiology, Sequence assembly	1	1	1	1	1	1	1	1	0	0	0	0	0	0	0	0	0	0	0	0	0	0	1	0	1	0	0	0	0	0	0	0	0	0	0	0	0	0	0	0	1	1	1008	41600	True	False	True
sistr_cmd	sistr_cmd	SISTR in silico serotyping tool								To update	https://github.com/phac-nml/sistr_cmd	Sequence Analysis	sistr_cmd	nml		https://github.com/phac-nml/galaxy_tools/tree/master/tools/sistr_cmd	1.1.1	sistr_cmd	1.1.2			0	1	1	0	0	1	1	0	0	0	0	0	0	0	0	0	0	0	0	0	0	0	0	0	1	0	0	0	0	0	0	0	0	0	0	0	0	0	0	0	1	1	133	2489	True	False	True
smallgenomeutilities	smgu_frameshift_deletions_checks	Set of utilities for manipulating small viral genome data.	v-pipe	v-pipe		V-pipe	Bioinformatics pipeline for the analysis of next-generation sequencing data derived from intra-host viral populations.	Read pre-processing, Sequence alignment, Genetic variation analysis	Genomics, Population genetics, Workflows, Virology, Sequencing	Up-to-date	https://github.com/cbg-ethz/smallgenomeutilities	Sequence Analysis	smallgenomeutilities	iuc	https://github.com/galaxyproject/tools-iuc/tree/master/tools/smallgenomeutilities	https://github.com/galaxyproject/tools-iuc/tree/main/tools/smallgenomeutilities	0.4.1	smallgenomeutilities	0.4.1	Read pre-processing, Sequence alignment, Genetic variation analysis	Genomics, Population genetics, Workflows, Virology, Sequencing	0	0	1	0	0	0	1	0	0	0	0	0	0	0	0	0	0	0	0	0	0	0	0	0	0	0	0	0	0	0	0	0	0	0	0	0	0	0	0	0	1	0	6	121	True	False	True
smalt	smalt	SMALT aligns DNA sequencing reads with a reference genome.								Up-to-date	http://www.sanger.ac.uk/science/tools/smalt-0	Sequence Analysis	smalt	nml	https://sourceforge.net/projects/smalt/	https://github.com/phac-nml/galaxy_tools/tree/master/tools/smalt	0.7.6	smalt	0.7.6			0	0	0	0	0	0	0	0	0	0	0	0	0	0	0	0	0	0	0	0	0	0	0	0	1	0	0	0	0	0	0	0	0	0	0	0	0	0	0	0	0	0	0	0	True	False	True
snap	snap, snap_training	SNAP is a general purpose gene finding program suitable for both eukaryotic and prokaryotic genomes.	snap	snap		SNAP	The Semi-HMM-based Nucleic Acid Parser is a gene prediction tool.	Gene prediction	DNA, DNA polymorphism, Genetics	Up-to-date	https://github.com/KorfLab/SNAP	Sequence Analysis	snap	iuc	https://github.com/galaxyproject/tools-iuc/tree/master/tools/snap	https://github.com/galaxyproject/tools-iuc/tree/main/tools/snap	2013_11_29	snap	2013_11_29	Gene prediction	DNA polymorphism, Genetics	1	1	1	0	1	1	1	0	0	0	0	0	0	0	0	0	0	0	0	0	0	0	0	0	0	0	0	0	0	0	0	0	0	0	0	0	0	0	0	0	1	1	133	1349	True	False	True
snippy	snippy_core, snippy, snippy_clean_full_aln	Contains the snippy tool for characterising microbial snps	snippy	snippy		snippy	Rapid haploid variant calling and core SNP phylogeny generation.	Phylogenetic tree visualisation, Phylogenetic tree generation, Variant calling	Genomics, Model organisms, DNA polymorphism, Phylogenetics	To update	https://github.com/tseemann/snippy	Sequence Analysis	snippy	iuc	https://github.com/galaxyproject/tools-iuc/tree/master/tools/snippy	https://github.com/galaxyproject/tools-iuc/tree/main/tools/snippy		snippy	4.6.0	Phylogenetic tree visualisation, Variant calling	Genomics, Model organisms, DNA polymorphism, Phylogenetics	3	3	3	3	3	3	3	3	0	0	0	0	0	0	2	0	0	0	0	0	0	0	0	0	3	0	0	0	0	0	0	0	0	0	0	0	0	0	0	0	3	2	1372	105708	True	False	True
sonneityping	sonneityping	Scripts for parsing Mykrobe predict results for Shigella sonnei.	sonneityping	sonneityping		sonneityping	Scripts for parsing Mykrobe predict results for Shigella sonnei.	Antimicrobial resistance prediction, Variant calling, Genotyping	Whole genome sequencing, Genotype and phenotype, Genetic variation, Metagenomics	Up-to-date	https://github.com/katholt/sonneityping	Sequence Analysis	sonneityping	iuc	https://github.com/katholt/sonneityping	https://github.com/galaxyproject/tools-iuc/tree/main/tools/sonneityping	20210201	sonneityping	20210201	Antimicrobial resistance prediction, Variant calling, Genotyping	Whole genome sequencing, Genotype and phenotype, Genetic variation, Metagenomics	0	0	1	0	0	0	1	0	0	0	0	0	0	0	0	0	0	0	0	0	0	0	0	0	1	0	0	0	0	0	0	0	0	0	0	0	0	0	0	0	1	0	1	1	True	False	True
