kraken	kraken-filter, kraken-mpa-report, kraken-report, kraken-translate, kraken	Kraken is a system for assigning taxonomic labels to short DNAsequences, usually obtained through metagenomic studies. Previous attempts by otherbioinformatics software to accomplish this task have often used sequence alignmentor machine learning techniques that were quite slow, leading to the developmentof less sensitive but much faster abundance estimation programs. Kraken aims toachieve high sensitivity and high speed by utilizing exact alignments of k-mersand a novel classification algorithm.	kraken	kraken		Kraken	System for assigning taxonomic labels to short DNA sequences, usually obtained through metagenomic studies. Previous attempts by other bioinformatics software to accomplish this task have often used sequence alignment or machine learning techniques that were quite slow, leading to the development of less sensitive but much faster abundance estimation programs. It aims to achieve high sensitivity and high speed by utilizing exact alignments of k-mers and a novel classification algorithm.	Taxonomic classification	Taxonomy, Metagenomics	To update	http://ccb.jhu.edu/software/kraken/	Metagenomics	kraken	devteam	https://github.com/galaxyproject/tools-iuc/blob/master/tool_collections/kraken/	https://github.com/galaxyproject/tools-iuc/tree/main/tool_collections/kraken		kraken	1.1.1	Taxonomic classification	Taxonomy, Metagenomics	5	5	5	5	5	5	5	5	0	0	0	0	0	0	0	0	0	0	0	0	1	0	1	0	0	0	0	0	0	0	0	0	0	0	0	0	2	0	0	0	5	5	1209	33778	True	False	True
kraken2	kraken2	Kraken2 for taxonomic designation.	kraken2	kraken2		kraken2	Kraken 2 is the newest version of Kraken, a taxonomic classification system using exact k-mer matches to achieve high accuracy and fast classification speeds. This classifier matches each k-mer within a query sequence to the lowest common ancestor (LCA) of all genomes containing the given k-mer. The k-mer assignments inform the classification algorithm.	Taxonomic classification	Taxonomy, Metagenomics	Up-to-date	http://ccb.jhu.edu/software/kraken/	Metagenomics	kraken2	iuc	https://github.com/galaxyproject/tools-iuc/blob/master/tool_collections/kraken2/kraken2/	https://github.com/galaxyproject/tools-iuc/tree/main/tool_collections/kraken2/kraken2	2.1.3	kraken2	2.1.3	Taxonomic classification	Taxonomy, Metagenomics	1	1	1	1	1	1	1	1	0	0	0	0	0	0	0	0	0	0	0	0	0	0	1	1	1	0	0	1	0	0	0	0	0	0	0	0	1	0	0	0	1	1	2367	185308	True	False	True
kraken2tax	Kraken2Tax	Convert Kraken output to Galaxy taxonomy data.								To update	https://bitbucket.org/natefoo/taxonomy	Metagenomics	kraken2tax	devteam	https://github.com/galaxyproject/tools-devteam/blob/master/tool_collections/taxonomy/kraken2tax/	https://github.com/galaxyproject/tools-devteam/tree/main/tool_collections/taxonomy/kraken2tax	1.2+galaxy0	gawk				1	1	1	0	1	1	1	0	0	0	0	0	0	0	0	0	0	0	0	0	0	0	1	0	1	0	0	1	0	0	0	0	0	0	0	0	0	0	0	0	1	1	481	14683	True	False	True
kraken_biom	kraken_biom	Create BIOM-format tables (http://biom-format.org) from Kraken output (http://ccb.jhu.edu/software/kraken/)								Up-to-date	https://github.com/smdabdoub/kraken-biom	Metagenomics	kraken_biom	iuc	https://github.com/smdabdoub/kraken-biom	https://github.com/galaxyproject/tools-iuc/tree/main/tools/kraken_biom	1.2.0	kraken-biom	1.2.0			0	1	1	1	0	1	1	1	0	0	0	0	0	0	0	0	0	0	0	0	0	0	0	0	0	0	0	0	0	0	0	0	0	0	0	0	0	0	0	0	1	1	182	1444	True	False	True
kraken_taxonomy_report	kraken_taxonomy_report	Kraken taxonomy report	Kraken-Taxonomy-Report	Kraken-Taxonomy-Report		Kraken-Taxonomy-Report	view report of classification for multiple samples	Visualisation, Classification	Metagenomics, Taxonomy	To update	https://github.com/blankenberg/Kraken-Taxonomy-Report	Metagenomics	kraken_taxonomy_report	iuc	https://github.com/galaxyproject/tools-iuc/tree/master/tools/kraken_taxonomy_report	https://github.com/galaxyproject/tools-iuc/tree/main/tools/kraken_taxonomy_report	0.0.3	biopython	1.70	Visualisation, Classification	Metagenomics, Taxonomy	1	1	1	0	1	1	1	0	0	0	0	0	0	0	0	0	0	0	0	0	0	0	0	0	0	0	0	0	0	0	0	0	0	0	0	0	0	0	0	0	1	1	354	2527	True	False	True
krakentools	krakentools_alpha_diversity, krakentools_beta_diversity, krakentools_combine_kreports, krakentools_extract_kraken_reads, krakentools_kreport2krona, krakentools_kreport2mpa	KrakenTools is a suite of scripts to be used alongside the Kraken	krakentools	krakentools		KrakenTools	KrakenTools provides individual scripts to analyze Kraken/Kraken2/Bracken/KrakenUniq output files	Visualisation, Aggregation	Taxonomy, Metagenomics	Up-to-date	https://github.com/jenniferlu717/KrakenTools	Metagenomics	krakentools	iuc	https://github.com/galaxyproject/tools-iuc/tree/master/tools/krakentools	https://github.com/galaxyproject/tools-iuc/tree/main/tools/krakentools	1.2	krakentools	1.2	Visualisation, Aggregation	Taxonomy, Metagenomics	1	6	6	6	1	6	6	6	0	0	0	0	0	0	0	0	0	0	0	0	0	0	0	4	6	0	0	0	0	0	0	0	0	0	0	0	0	0	0	0	6	0	703	16525	True	False	True
krocus	krocus	Predict MLST directly from uncorrected long reads	krocus	krocus		krocus	Predict MLST directly from uncorrected long reads	Multilocus sequence typing, k-mer counting	Public health and epidemiology	To update	https://github.com/quadram-institute-bioscience/krocus	Sequence Analysis	krocus	iuc	https://github.com/galaxyproject/tools-iuc/tree/master/tools/krocus	https://github.com/galaxyproject/tools-iuc/tree/main/tools/krocus	1.0.1	krocus	1.0.3	Multilocus sequence typing, k-mer counting	Public health and epidemiology	0	0	1	0	0	0	1	0	0	0	0	0	0	0	0	0	0	0	0	0	0	0	0	0	1	0	0	0	0	0	0	0	0	0	0	0	0	0	0	0	0	0	0	0	True	False	True
lca_wrapper	lca1	Find lowest diagnostic rank								To update	https://bitbucket.org/natefoo/taxonomy	Metagenomics	lca_wrapper	devteam	https://github.com/galaxyproject/tools-devteam/tree/master/tool_collections/taxonomy/lca_wrapper	https://github.com/galaxyproject/tools-devteam/tree/main/tool_collections/taxonomy/lca_wrapper	1.0.1	taxonomy	0.10.0			0	0	1	0	0	0	1	0	0	0	0	0	0	0	0	0	0	0	0	0	0	0	0	0	0	0	0	0	0	0	0	0	0	0	0	0	0	0	0	0	1	1	2	137	True	False	True
legsta	legsta	Performs in silico Legionella pneumophila sequence based typing.	legsta	legsta		legsta	Performs in silico Legionella pneumophila sequence based typing	Sequence analysis	Public health and epidemiology	Up-to-date	https://github.com/tseemann/legsta	Sequence Analysis	legsta	iuc	https://github.com/tseemann/legsta	https://github.com/galaxyproject/tools-iuc/tree/main/tools/legsta	0.5.1	legsta	0.5.1	Sequence analysis	Public health and epidemiology	0	0	1	0	0	0	1	0	0	0	0	0	0	0	0	0	0	0	0	0	0	0	0	0	0	0	0	0	0	0	0	0	0	0	0	0	0	0	0	0	1	0	7	55	True	False	True
lighter	lighter	Lighter is a kmer-based error correction method for whole genome sequencing data	lighter	lighter		Lighter	Kmer-based error correction method for whole genome sequencing data. Lighter uses sampling (rather than counting) to obtain a set of kmers that are likely from the genome. Using this information, Lighter can correct the reads containing sequence errors.	k-mer counting, Sequence read processing, Sequencing quality control, Sequencing error detection	Sequencing, Whole genome sequencing, DNA, Genomics	To update	https://github.com/mourisl/Lighter	Sequence Analysis, Fasta Manipulation	lighter	bgruening	https://github.com/bgruening/galaxytools/tree/master/tools/lighter	https://github.com/bgruening/galaxytools/tree/master/tools/lighter	1.0	lighter	1.1.3	k-mer counting, Sequence read processing, Sequencing quality control, Sequencing error detection	Whole genome sequencing, DNA, Genomics	0	0	1	0	0	0	1	0	0	0	0	0	0	0	0	0	0	0	0	0	0	0	0	0	0	0	0	0	0	0	0	0	0	0	0	0	0	0	0	0	1	1	9	152	True	False	True
limma_voom	limma_voom	Perform RNA-Seq differential expression analysis using limma voom pipeline	limma	limma		limma	Data analysis, linear models and differential expression for microarray data.	RNA-Seq analysis	Molecular biology, Genetics	Up-to-date	http://bioconductor.org/packages/release/bioc/html/limma.html	Transcriptomics, RNA, Statistics	limma_voom	iuc	https://github.com/galaxyproject/tools-iuc/tree/master/tools/limma_voom	https://github.com/galaxyproject/tools-iuc/tree/main/tools/limma_voom	3.58.1	bioconductor-limma	3.58.1	RNA-Seq analysis	Molecular biology, Genetics	1	1	1	1	1	1	1	1	0	0	0	0	0	0	0	0	0	0	0	0	0	0	0	0	0	0	0	0	0	0	0	0	0	0	0	0	0	0	0	0	1	1	1012	20344	True	False	True
lineagespot	lineagespot	Identification of SARS-CoV-2 related metagenomic mutations based on a single (or a list of) variant(s) file(s)	lineagespot	lineagespot		lineagespot	Lineagespot is a framework written in R, and aims to identify and assign different SARS-CoV-2 lineages based on a single variant file (i.e., variant calling format).	Variant calling	Metagenomics, Gene transcripts, Evolutionary biology, Sequencing, Genetic variation	To update	https://www.bioconductor.org/packages/release/bioc/html/lineagespot.html	Metagenomics, Sequence Analysis	lineagespot	iuc	https://github.com/galaxyproject/tools-iuc/tree/master/tools/lineagespot	https://github.com/galaxyproject/tools-iuc/tree/main/tools/lineagespot	1.6.0	r-base		Variant calling	Metagenomics, Gene transcripts, Evolutionary biology, Sequencing, Genetic variation	0	0	1	0	0	0	1	0	0	0	0	0	0	0	0	0	0	0	0	0	0	0	0	0	0	0	0	0	0	0	0	0	0	0	0	0	0	0	0	0	1	0	2	37	True	False	True
lorikeet	lorikeet_spoligotype	Tools for M. tuberculosis DNA fingerprinting (spoligotyping)	lorikeet	lorikeet		lorikeet	Tools for M. tuberculosis DNA fingerprinting (spoligotyping)	Sequence analysis, Genotyping	Genotype and phenotype	Up-to-date	https://github.com/AbeelLab/lorikeet	Sequence Analysis	lorikeet_spoligotype	iuc	https://github.com/AbeelLab/lorikeet	https://github.com/galaxyproject/tools-iuc/tree/main/tools/lorikeet	20	lorikeet	20	Sequence analysis, Genotyping	Genotype and phenotype	0	0	1	0	0	0	1	0	0	0	0	0	0	0	0	0	0	0	0	0	0	0	0	0	0	0	0	0	0	0	0	0	0	0	0	0	0	0	0	0	1	0	9	647	True	False	True
lotus2	lotus2	LotuS2 OTU processing pipeline	lotus2	lotus2		lotus2	LotuS2 is a lightweight and user-friendly pipeline that is fast, precise, and streamlined, using extensive pre- and post-ASV/OTU clustering steps to further increase data quality. High data usage rates and reliability enable high-throughput microbiome analysis in minutes.	Sequence feature detection, DNA barcoding	Metagenomics, Taxonomy, Microbial ecology	Up-to-date	http://lotus2.earlham.ac.uk/	Metagenomics	lotus2	earlhaminst	https://github.com/TGAC/earlham-galaxytools/tree/master/tools/lotus2	https://github.com/TGAC/earlham-galaxytools/tree/master/tools/lotus2	2.32	lotus2	2.32	Sequence feature detection, DNA barcoding	Metagenomics, Taxonomy, Microbial ecology	0	0	1	0	0	0	1	0	0	0	0	0	0	0	0	0	0	0	0	0	0	0	0	0	0	0	0	0	0	0	0	0	0	0	0	0	0	0	0	0	1	0	114	936	True	False	True
m6anet	m6anet	m6anet to detect m6A RNA modifications from nanopore data	m6Anet	m6Anet		m6Anet	Detection of m6A from direct RNA sequencing using a Multiple Instance Learning framework.	Quantification, Imputation, Gene expression profiling	RNA-Seq, Transcriptomics, RNA, Machine learning	Up-to-date	https://m6anet.readthedocs.io/en/latest	Sequence Analysis	m6anet	iuc	https://github.com/galaxyproject/tools-iuc/tree/master/tools/m6anet	https://github.com/galaxyproject/tools-iuc/tree/main/tools/m6anet	2.1.0	m6anet	2.1.0	Quantification, Imputation, Gene expression profiling	RNA-Seq, Transcriptomics, RNA, Machine learning	0	0	1	0	0	0	1	0	0	0	0	0	0	0	0	0	0	0	0	0	0	0	0	0	0	0	0	0	0	0	0	0	0	0	0	0	0	0	0	0	0	0	0	3	True	False	True
maaslin2	maaslin2	MaAsLin2 is comprehensive R package for efficiently determining multivariable association between microbial meta'omic features and clinical metadata.	maaslin2	maaslin2		MaAsLin2	MaAsLin2 is comprehensive R package for efficiently determining multivariable association between phenotypes, environments, exposures, covariates and microbial metaomic features. MaAsLin2 relies on general linear models to accommodate most modern epidemiological study designs, including cross-sectional and longitudinal, and offers a variety of data exploration, normalization, and transformation methods.	Filtering, Statistical calculation, Standardisation and normalisation, Visualisation	Metagenomics, Statistics and probability	To update	http://huttenhower.sph.harvard.edu/maaslin	Metagenomics	maaslin2	iuc	https://github.com/biobakery/Maaslin2	https://github.com/galaxyproject/tools-iuc/tree/main/tools/maaslin2	0.99.12	maaslin2	1.16.0	Filtering, Standardisation and normalisation, Visualisation	Metagenomics, Statistics and probability	0	0	1	0	0	0	1	0	0	0	0	0	0	0	0	0	0	0	0	0	0	0	0	0	0	0	0	0	0	0	0	0	0	0	0	0	0	0	0	0	1	0	29	188	True	False	True
mafft	rbc_mafft_add, rbc_mafft	Multiple alignment program for amino acid or nucleotide sequences	MAFFT	MAFFT		MAFFT	MAFFT (Multiple Alignment using Fast Fourier Transform) is a high speed multiple sequence alignment program.	Multiple sequence alignment	Sequence analysis	To update	https://mafft.cbrc.jp/alignment/software/	RNA	mafft	rnateam	https://github.com/bgruening/galaxytools/tree/master/tools/mafft	https://github.com/bgruening/galaxytools/tree/master/tools/mafft	7.520	mafft	7.525	Multiple sequence alignment	Sequence analysis	2	2	2	2	2	2	2	2	0	0	0	1	0	0	2	0	0	0	0	0	0	0	1	0	2	0	0	2	0	0	0	2	0	0	0	0	0	0	0	0	2	2	817	143045	True	False	True
make_nr	make_nr	Make a FASTA file non-redundant								To update	https://github.com/peterjc/galaxy_blast/tree/master/tools/make_nr	Fasta Manipulation, Sequence Analysis	make_nr	peterjc	https://github.com/peterjc/galaxy_blast/tree/master/tools/make_nr	https://github.com/peterjc/galaxy_blast/tree/master/tools/make_nr	0.0.3	biopython	1.70			0	0	0	0	0	0	0	0	0	0	0	0	0	0	0	0	0	0	0	0	0	0	0	0	0	0	0	0	0	0	0	0	0	0	0	0	0	0	0	0	0	0	0	0	True	False	True
maker	maker, maker_map_ids	MAKER is a portable and easily configurable genome annotation pipeline.Its purpose is to allow smaller eukaryotic and prokaryotic genome projects to independently annotate their genomes and to create genome databases.	maker	maker		MAKER	Portable and easily configurable genome annotation pipeline. Its purpose is to allow smaller eukaryotic and prokaryotic genome projects to independently annotate their genomes and to create genome databases.	Genome annotation	Genomics, DNA, Sequence analysis	To update	http://www.yandell-lab.org/software/maker.html	Sequence Analysis		iuc	https://github.com/galaxyproject/tools-iuc/tree/master/tools/maker	https://github.com/galaxyproject/tools-iuc/tree/main/tools/maker	2.31.11	maker	3.01.03	Genome annotation	Genomics, DNA, Sequence analysis	2	2	2	2	2	2	2	2	0	0	0	0	0	0	0	0	0	0	0	0	0	0	0	0	1	0	0	0	0	0	0	0	0	0	0	0	0	0	0	0	2	2	554	5591	True	False	True
mapseq	mapseq	fast and accurate sequence read classification tool designed to assign taxonomy and OTU classifications to ribosomal RNA sequences.	mapseq	mapseq		MAPseq	Highly efficient k-mer search with confidence estimates, for rRNA sequence analysis .	k-mer counting	Functional, regulatory and non-coding RNA, Sequence analysis, Sequence sites, features and motifs	To update	https://github.com/jfmrod/MAPseq	Metagenomics	mapseq	iuc	https://github.com/galaxyproject/tools-iuc/tree/master/tools/mapseq	https://github.com/galaxyproject/tools-iuc/tree/main/tools/mapseq	2.1.1	perl		k-mer counting	Functional, regulatory and non-coding RNA, Sequence analysis, Sequence sites, features and motifs	0	0	1	0	0	0	1	0	0	0	0	0	0	0	0	0	0	0	0	0	0	0	0	0	1	0	0	0	0	0	0	0	0	0	0	0	0	0	0	0	1	0	2	167	True	False	True
mash	mash_screen, mash_sketch	Fast genome and metagenome distance estimation using MinHash	mash	mash		Mash	Fast genome and metagenome distance estimation using MinHash.	Sequence distance matrix generation	Genomics, Metagenomics, Statistics and probability, Sequence analysis, DNA mutation	Up-to-date	https://github.com/marbl/Mash	Metagenomics		iuc	https://github.com/galaxyproject/tools-iuc/tree/master/tools/mash	https://github.com/galaxyproject/tools-iuc/tree/main/tools/mash	2.3	mash	2.3	Sequence distance matrix generation	Metagenomics, Statistics and probability, Sequence analysis, DNA mutation	2	2	2	2	2	2	2	2	0	0	0	0	0	0	0	0	0	0	0	0	0	0	0	0	2	0	0	0	0	0	0	0	0	0	0	0	0	0	0	0	2	2	27	9763	True	False	True
maxbin2	maxbin2	clusters metagenomic contigs into bins	maxbin	maxbin		MaxBin	Software for binning assembled metagenomic sequences based on an Expectation-Maximization algorithm.	Sequence assembly	Metagenomics, Sequence assembly, Microbiology	To update	https://downloads.jbei.org/data/microbial_communities/MaxBin/MaxBin.html	Metagenomics	maxbin2	mbernt	https://github.com/galaxyproject/tools-iuc/tree/master/tools/maxbin2/	https://github.com/galaxyproject/tools-iuc/tree/main/tools/maxbin2		maxbin2	2.2.7	Sequence assembly	Metagenomics, Sequence assembly, Microbiology	1	1	1	1	1	1	1	1	0	0	0	0	0	0	0	0	0	0	0	0	0	0	0	0	1	0	0	0	0	0	0	0	0	0	0	0	1	0	0	0	1	1	118	2059	True	False	True
maxquant	maxquant, maxquant_mqpar	wrapper for MaxQuant	maxquant	maxquant		MaxQuant	Quantitative proteomics software package designed for analyzing large mass-spectrometric data sets. It is specifically aimed at high-resolution MS data.	Imputation, Visualisation, Protein quantification, Statistical calculation, Standardisation and normalisation, Heat map generation, Clustering, Principal component plotting	Proteomics experiment, Proteomics, Statistics and probability	Up-to-date	https://www.maxquant.org/	Proteomics	maxquant	galaxyp	https://github.com/galaxyproteomics/tools-galaxyp/tree/master/tools/maxquant	https://github.com/galaxyproteomics/tools-galaxyp/tree/master/tools/maxquant	2.0.3.0	maxquant	2.0.3.0	Imputation, Visualisation, Protein quantification, Standardisation and normalisation, Heat map generation, Clustering	Proteomics experiment, Proteomics, Statistics and probability	2	2	2	0	2	2	2	0	0	0	0	0	0	0	0	0	0	0	0	0	0	0	0	2	0	0	0	0	0	0	0	0	0	0	0	0	0	0	0	0	2	2	415	6078	True	False	True
mcl	mcl	The Markov Cluster Algorithm, a cluster algorithm for graphs	mcl	mcl		MCL	MCL is a clustering algorithm widely used in bioinformatics and gaining traction in other fields.	Clustering, Network analysis, Gene regulatory network analysis	Molecular interactions, pathways and networks	Up-to-date	https://micans.org/mcl/man/mcl.html	Sequence Analysis	mcl	iuc	https://github.com/galaxyproject/tools-iuc/tree/master/mcl	https://github.com/galaxyproject/tools-iuc/tree/main/tools/mcl	22.282	mcl	22.282	Clustering, Gene regulatory network analysis	Molecular interactions, pathways and networks	0	0	1	0	0	0	1	0	0	0	0	0	0	0	0	0	0	0	0	0	0	0	0	0	0	0	0	0	0	0	0	0	0	0	0	0	0	0	0	0	1	1	10	29	True	False	True
medaka	medaka_consensus, medaka_consensus_pipeline, medaka_snp, medaka_variant	Sequence correction provided by ONT Research	medaka	medaka		Medaka	medaka is a tool to create consensus sequences and variant calls from nanopore sequencing data. This task is performed using neural networks applied a pileup of individual sequencing reads against a draft assembly.	Base-calling, Variant calling, Sequence assembly	Sequence assembly, Machine learning	To update	https://github.com/nanoporetech/medaka	Sequence Analysis		iuc	https://github.com/galaxyproject/tools-iuc/tree/master/tools/medaka	https://github.com/galaxyproject/tools-iuc/tree/main/tools/medaka	1.7.2	medaka	1.11.3	Base-calling, Variant calling, Sequence assembly	Sequence assembly, Machine learning	3	3	3	3	3	3	3	3	0	0	0	0	0	0	0	0	0	0	0	0	0	0	0	0	3	0	0	0	0	0	0	2	0	0	0	0	0	0	0	0	3	3	768	99863	True	False	True
megahit	megahit	An ultra-fast single-node solution for large and complex metagenomics assembly via succinct de Bruijn graph.	megahit	megahit		MEGAHIT	Single node assembler for large and complex metagenomics NGS reads, such as soil. It makes use of succinct de Bruijn graph to achieve low memory usage, whereas its goal is not to make memory usage as low as possible.	Genome assembly	Metagenomics, Sequencing, Ecology, Sequence assembly	Up-to-date	https://github.com/voutcn/megahit	Sequence Analysis, Assembly, Metagenomics	megahit	iuc	https://github.com/galaxyproject/tools-iuc/tree/master/tools/megahit	https://github.com/galaxyproject/tools-iuc/tree/main/tools/megahit	1.2.9	megahit	1.2.9	Genome assembly	Metagenomics, Sequencing, Sequence assembly	1	1	1	1	1	1	1	1	1	0	0	0	0	0	0	0	0	0	0	0	0	0	1	0	1	0	0	1	0	0	0	1	0	0	0	0	1	0	0	0	1	1	548	9530	True	False	True
megahit_contig2fastg	megahit_contig2fastg	A subprogram within the Megahit toolkit for converting contigs to assembly graphs (fastg)	megahit	megahit		MEGAHIT	Single node assembler for large and complex metagenomics NGS reads, such as soil. It makes use of succinct de Bruijn graph to achieve low memory usage, whereas its goal is not to make memory usage as low as possible.	Genome assembly	Metagenomics, Sequencing, Ecology, Sequence assembly	To update	https://github.com/voutcn/megahit/blob/master/tools/toolkit.cpp	Sequence Analysis, Assembly, Metagenomics	megahit_contig2fastg	iuc	https://github.com/galaxyproject/tools-iuc/tree/master/tools/megahit_contig2fastg	https://github.com/galaxyproject/tools-iuc/tree/main/tools/megahit_contig2fastg	1.1.3	megahit	1.2.9	Genome assembly	Metagenomics, Sequencing, Sequence assembly	1	0	1	1	1	0	1	1	0	0	0	0	0	0	0	0	0	0	0	0	0	0	0	0	1	0	0	0	0	0	0	1	0	0	0	0	0	0	0	0	1	1	54	475	True	False	True
megan	megan_blast2lca, megan_blast2rma, megan_daa2info, megan_daa2rma, megan_daa_meganizer, megan_read_extractor, megan_sam2rma	MEGAN Community Edition - Interactive exploration and analysis of large-scale microbiome sequencing data.  MEGAN is a tool for studying the taxonomic content of a set of DNA reads, typically collected in a metagenomics project.In a preprocessing step, a sequence alignment of all reads against a suitable database of reference DNA or proteinsequences must be performed to produce an input file for the program. MEGAN is suitable for DNA reads (metagenomedata), RNA reads (metatranscriptome data), peptide sequences (metaproteomics data) and, using a suitable synonymsfile that maps SILVA ids to taxon ids, for 16S rRNA data (amplicon sequencing).	megan	megan		MEGAN	Metagenome Analysis Software - MEGAN (MEtaGenome ANalyzer) is a new computer program that allows laptop analysis of large metagenomic datasets. In a preprocessing step, the set of DNA reads (or contigs) is compared against databases of known sequences using BLAST or another comparison tool. MEGAN can then be used to compute and interactively explore the taxonomical content of the dataset, employing the NCBI taxonomy to summarize and order the results.	Sequence analysis, Taxonomic classification	Sequence analysis	To update	https://github.com/husonlab/megan-ce	Sequence Analysis	megan	iuc	https://github.com/galaxyproject/tools-iuc/tree/master/tools/megan	https://github.com/galaxyproject/tools-iuc/tree/main/tools/megan	6.21.7	megan	6.25.9	Sequence analysis, Taxonomic classification	Sequence analysis	0	0	7	0	0	0	7	0	0	0	0	0	0	0	0	0	0	0	0	0	0	0	0	0	0	0	0	0	0	0	0	0	0	0	0	0	0	0	0	0	7	0	261	3610	True	False	True
meningotype	meningotype	Assign sequence type to N. meningitidis genome assemblies	meningotype	meningotype		meningotype	In silico typing of Neisseria meningitidis contigs.	Genotyping, Multilocus sequence typing	Microbiology, Genotype and phenotype	Up-to-date	https://github.com/MDU-PHL/meningotype	Sequence Analysis	meningotype	iuc	https://github.com/galaxyproject/tools-iuc/tree/master/tools/meningotype	https://github.com/galaxyproject/tools-iuc/tree/main/tools/meningotype	0.8.5	meningotype	0.8.5	Multilocus sequence typing	Microbiology, Genotype and phenotype	0	0	0	0	0	0	0	0	0	0	0	0	0	0	0	0	0	0	0	0	0	0	0	0	0	0	0	0	0	0	0	0	0	0	0	0	0	0	0	0	0	0	0	0	True	False	True
merqury	merqury, merquryplot	Merqury is a tool for evaluating genomes assemblies based of k-mer operations.	merqury	merqury		Merqury	Reference-free quality, completeness, and phasing assessment for genome assemblies.Evaluate genome assemblies with k-mers and more.Often, genome assembly projects have illumina whole genome sequencing reads available for the assembled individual.Merqury provides a set of tools for this purpose.	Genome assembly, k-mer counting, Scaffolding, Phasing, De-novo assembly	Sequence assembly, Whole genome sequencing, Plant biology	Up-to-date	https://github.com/marbl/merqury	Assembly	merqury	iuc	https://github.com/galaxyproject/tools-iuc/tree/master/tools/merqury	https://github.com/galaxyproject/tools-iuc/tree/main/tools/merqury	1.3	merqury	1.3	Genome assembly, k-mer counting, Scaffolding, Phasing, De-novo assembly	Sequence assembly, Whole genome sequencing, Plant biology	2	2	2	2	2	2	2	2	0	0	0	0	0	0	0	0	0	0	0	0	0	0	0	0	0	0	0	0	0	0	0	0	0	0	0	0	0	0	0	0	1	0	244	2483	True	False	True
meryl	meryl_arithmetic_kmers, meryl_count_kmers, meryl_filter_kmers, meryl_groups_kmers, meryl_histogram_kmers, meryl_print, meryl_trio_mode	Meryl a k-mer counter.	meryl	meryl		Meryl	Meryl is a tool for counting and working with sets of k-mers that was originally developed for use in the Celera Assembler and has since been migrated and maintained as part of Canu.	k-mer counting	Whole genome sequencing, Genomics, Sequence analysis, Sequencing	Up-to-date	https://github.com/marbl/meryl	Assembly	meryl	iuc	https://github.com/galaxyproject/tools-iuc/tree/master/tools/meryl	https://github.com/galaxyproject/tools-iuc/tree/main/tools/meryl	1.3	merqury	1.3	k-mer counting	Whole genome sequencing, Genomics, Sequence analysis	0	0	0	0	0	0	0	0	0	0	0	0	0	0	0	0	0	0	0	0	0	0	0	0	0	0	0	0	0	0	0	0	0	0	0	0	0	0	0	0	0	0	0	0	True	False	True
