emboss_5	EMBOSS: antigenic1, EMBOSS: backtranseq2, EMBOSS: banana3, EMBOSS: biosed4, EMBOSS: btwisted5, EMBOSS: cai6, EMBOSS: cai_custom6, EMBOSS: chaos7, EMBOSS: charge8, EMBOSS: checktrans9, EMBOSS: chips10, EMBOSS: cirdna11, EMBOSS: codcmp12, EMBOSS: coderet13, EMBOSS: compseq14, EMBOSS: cpgplot15, EMBOSS: cpgreport16, EMBOSS: cusp17, EMBOSS: cutseq18, EMBOSS: dan19, EMBOSS: degapseq20, EMBOSS: descseq21, EMBOSS: diffseq22, EMBOSS: digest23, EMBOSS: dotmatcher24, EMBOSS: dotpath25, EMBOSS: dottup26, EMBOSS: dreg27, EMBOSS: einverted28, EMBOSS: epestfind29, EMBOSS: equicktandem31, EMBOSS: est2genome32, EMBOSS: etandem33, EMBOSS: extractfeat34, EMBOSS: extractseq35, EMBOSS: freak36, EMBOSS: fuzznuc37, EMBOSS: fuzzpro38, EMBOSS: fuzztran39, EMBOSS: garnier40, EMBOSS: geecee41, EMBOSS: getorf42, EMBOSS: helixturnhelix43, EMBOSS: hmoment44, EMBOSS: iep45, EMBOSS: infoseq46, EMBOSS: isochore47, EMBOSS: lindna48, EMBOSS: marscan49, EMBOSS: maskfeat50, EMBOSS: maskseq51, EMBOSS: matcher52, EMBOSS: megamerger53, EMBOSS: merger54, EMBOSS: msbar55, EMBOSS: needle56, EMBOSS: newcpgreport57, EMBOSS: newcpgseek58, EMBOSS: newseq59, EMBOSS: noreturn60, EMBOSS: notseq61, EMBOSS: nthseq62, EMBOSS: octanol63, EMBOSS: oddcomp64, EMBOSS: palindrome65, EMBOSS: pasteseq66, EMBOSS: patmatdb67, EMBOSS: pepcoil68, EMBOSS: pepinfo69, EMBOSS: pepnet70, EMBOSS: pepstats71, EMBOSS: pepwheel72, EMBOSS: pepwindow73, EMBOSS: pepwindowall74, EMBOSS: plotcon75, EMBOSS: plotorf76, EMBOSS: polydot77, EMBOSS: preg78, EMBOSS: prettyplot79, EMBOSS: prettyseq80, EMBOSS: primersearch81, EMBOSS: revseq82, EMBOSS: seqmatchall83, EMBOSS: seqret84, EMBOSS: showfeat85, EMBOSS: shuffleseq87, EMBOSS: sigcleave88, EMBOSS: sirna89, EMBOSS: sixpack90, EMBOSS: skipseq91, EMBOSS: splitter92, EMBOSS: supermatcher95, EMBOSS: syco96, EMBOSS: tcode97, EMBOSS: textsearch98, EMBOSS: tmap99, EMBOSS: tranalign100, EMBOSS: transeq101, EMBOSS: trimest102, EMBOSS: trimseq103, EMBOSS: twofeat104, EMBOSS: union105, EMBOSS: vectorstrip106, EMBOSS: water107, EMBOSS: wobble108, EMBOSS: wordcount109, EMBOSS: wordmatch110	Galaxy wrappers for EMBOSS version 5.0.0 tools	emboss	emboss		EMBOSS	Diverse suite of tools for sequence analysis; many programs analagous to GCG; context-sensitive help for each tool.	Sequence analysis, Local alignment, Sequence alignment analysis, Global alignment, Sequence alignment	Molecular biology, Sequence analysis, Biology	To update	http://emboss.open-bio.org/	Sequence Analysis, Fasta Manipulation	emboss_5	devteam	https://github.com/galaxyproject/tools-iuc/tree/master/tools/emboss_5	https://github.com/galaxyproject/tools-iuc/tree/main/tools/emboss_5	5.0.0	emboss	6.6.0	Sequence analysis, Local alignment, Sequence alignment analysis, Global alignment, Sequence alignment	Molecular biology, Sequence analysis	107	107	107	107	107	107	107	107	0	0	0	0	0	0	107	0	0	0	0	0	0	0	0	0	107	0	0	107	0	0	0	107	0	0	0	0	0	0	0	0	107	107	1816	89530	True	False	True
ete	ete_gene_csv_finder, ete_genetree_splitter, ete_homology_classifier, ete_init_taxdb, ete_lineage_generator, ete3_mod, ete_species_tree_generator	Analyse phylogenetic trees using the ETE Toolkit	ete	ete		ete	The Environment for Tree Exploration (ETE) is a computational framework that simplifies the reconstruction, analysis, and visualization of phylogenetic trees and multiple sequence alignments. Here, we present ETE v3, featuring numerous improvements in the underlying library of methods, and providing a novel set of standalone tools to perform common tasks in comparative genomics and phylogenetics. The new features include (i) building gene-based and supermatrix-based phylogenies using a single command, (ii) testing and visualizing evolutionary models, (iii) calculating distances between trees of different size or including duplications, and (iv) providing seamless integration with the NCBI taxonomy database. ETE is freely available at http://etetoolkit.org	Phylogenetic analysis, Phylogenetic tree editing	Phylogenetics	To update	http://etetoolkit.org/	Phylogenetics	ete	earlhaminst	https://github.com/TGAC/earlham-galaxytools/tree/master/tools/ete	https://github.com/TGAC/earlham-galaxytools/tree/master/tools/ete	3.1.2	ete3	3.1.1	Phylogenetic tree editing	Phylogenetics	0	0	7	7	0	0	7	7	0	0	0	0	0	0	0	0	0	0	0	0	0	0	0	0	0	0	0	0	0	0	0	0	0	0	0	0	0	0	0	0	7	7	45	899	True	False	True
export2graphlan	export2graphlan	export2graphlan is a conversion software tool for producing both annotation and tree file for GraPhlAn	export2graphlan	export2graphlan		export2graphlan	export2graphlan is a conversion software tool for producing both annotation and tree file for GraPhlAn. In particular, the annotation file tries to highlight specific sub-trees deriving automatically from input file what nodes are important.	Conversion	Taxonomy, Metabolomics, Biomarkers	To update	https://bitbucket.org/CibioCM/export2graphlan/overview	Metagenomics	export2graphlan	iuc	https://github.com/galaxyproject/tools-iuc/tree/master/tools/export2graphlan/	https://github.com/galaxyproject/tools-iuc/tree/main/tools/export2graphlan	0.20	export2graphlan	0.22	Conversion	Taxonomy, Metabolomics, Biomarkers	1	1	1	1	1	1	1	1	0	0	0	0	0	0	0	0	0	0	0	0	0	0	0	0	1	0	0	0	0	0	0	0	0	0	0	0	0	0	0	0	1	1	200	5265	True	False	True
ez_histograms	ez_histograms	ggplot2 histograms and density plots								To update	https://github.com/tidyverse/ggplot2	Visualization, Statistics	ez_histograms	artbio	https://github.com/artbio/tools-artbio/tree/main/tools/ez_histograms	https://github.com/ARTbio/tools-artbio/tree/main/tools/ez_histograms	3.4.4	r-ggplot2	2.2.1			0	0	0	0	0	0	0	0	0	0	0	0	0	0	0	0	0	0	0	0	0	0	0	0	0	0	0	0	0	0	0	1	0	0	0	0	0	0	0	0	0	0	0	0	True	False	True
fargene	fargene	fARGene (Fragmented Antibiotic Resistance Gene iENntifiEr )	fargene	fargene		fARGene	fARGene (Fragmented Antibiotic Resistance Gene iENntifiEr ) is a tool that takes either fragmented metagenomic data or longer sequences as input and predicts and delivers full-length antiobiotic resistance genes as output.	Antimicrobial resistance prediction	Metagenomics, Microbiology, Public health and epidemiology	Up-to-date	https://github.com/fannyhb/fargene	Sequence Analysis	fargene	iuc	https://github.com/galaxyproject/tools-iuc/tree/master/tools/fargene	https://github.com/galaxyproject/tools-iuc/tree/main/tools/fargene	0.1	fargene	0.1	Antimicrobial resistance prediction	Metagenomics, Microbiology, Public health and epidemiology	1	0	1	0	1	0	1	0	0	0	0	0	0	0	0	0	0	0	0	0	0	0	0	0	1	0	0	0	0	0	0	0	0	0	0	0	0	0	0	0	1	1	52	459	True	False	True
fastani	fastani	Fast alignment-free computation of whole-genome Average Nucleotide Identity	fastani	fastani		FastANI	FastANI is developed for fast alignment-free computation of whole-genome Average Nucleotide Identity (ANI). ANI is defined as mean nucleotide identity of orthologous gene pairs shared between two microbial genomes. FastANI supports pairwise comparison of both complete and draft genome assemblies.	Genome alignment, Sequence similarity search	Microbiology, Genetic variation	To update	https://github.com/ParBLiSS/FastANI	Sequence Analysis	fastani	iuc	https://github.com/galaxyproject/tools-iuc/tree/master/tools/fastani	https://github.com/galaxyproject/tools-iuc/tree/main/tools/fastani	1.3	fastani	1.34	Genome alignment, Sequence similarity search	Microbiology, Genetic variation	0	0	1	1	0	0	1	1	0	0	0	0	0	0	0	0	0	0	0	0	0	0	0	0	1	0	0	0	0	0	0	0	0	0	0	0	0	0	0	0	1	1	250	3498	True	False	True
fastk	fastk_fastk	FastK: A K-mer counter (for HQ assembly data sets)								To update	https://github.com/thegenemyers/FASTK	Assembly	fastk	iuc	https://github.com/galaxyproject/tools-iuc/tree/master/tools/fastk	https://github.com/galaxyproject/tools-iuc/tree/main/tools/fastk	1.0.0	fastk	1.0			0	0	1	0	0	0	1	0	0	0	0	0	0	0	0	0	0	0	0	0	0	0	0	0	0	0	0	0	0	0	0	0	0	0	0	0	0	0	0	0	0	0	0	0	True	False	True
fastp	fastp	Fast all-in-one preprocessing for FASTQ files	fastp	fastp		fastp	A tool designed to provide fast all-in-one preprocessing for FastQ files. This tool is developed in C++ with multithreading supported to afford high performance.	Sequencing quality control, Sequence contamination filtering	Sequence analysis, Probes and primers	Up-to-date	https://github.com/OpenGene/fastp	Sequence Analysis	fastp	iuc	https://github.com/galaxyproject/tools-iuc/tree/master/tools/fastp	https://github.com/galaxyproject/tools-iuc/tree/main/tools/fastp	0.23.4	fastp	0.23.4	Sequence contamination filtering	Probes and primers	1	1	1	1	1	1	1	1	0	0	0	0	0	0	0	0	0	0	0	0	0	0	1	1	1	0	0	1	0	0	0	1	0	0	0	0	0	0	0	0	1	1	2803	1055760	True	False	True
fastqe	fastqe	FASTQE	fastqe	fastqe		FASTQE	Compute quality stats for FASTQ files and print those stats as emoji... for some reason.	Sequencing quality control	Sequence analysis, Sequencing	To update	https://fastqe.com/	Sequence Analysis	fastqe	iuc	https://github.com/galaxyproject/tools-iuc/tree/master/tools/fastqe	https://github.com/galaxyproject/tools-iuc/tree/main/tools/fastqe	0.3.1+galaxy0	fastqe	0.3.1	Sequencing quality control	Sequence analysis, Sequencing	1	1	1	1	1	1	1	1	0	0	0	0	0	0	0	0	0	0	0	0	0	0	1	0	0	0	0	0	0	0	0	0	0	0	0	0	0	0	0	0	1	1	1266	4333	True	False	True
fasttree	fasttree	FastTree infers approximately-maximum-likelihood phylogenetic trees from alignments of nucleotide or protein sequences - GVL	fasttree	fasttree		FastTree	Infers approximately-maximum-likelihood phylogenetic trees from alignments of nucleotide or protein sequences.	Phylogenetic tree generation (from molecular sequences), Phylogenetic tree generation (maximum likelihood and Bayesian methods)	Phylogenetics, Sequence analysis	To update	http://www.microbesonline.org/fasttree/	Phylogenetics	fasttree	iuc	https://github.com/galaxyproject/tools-iuc/tree/master/tools/fasttree	https://github.com/galaxyproject/tools-iuc/tree/main/tools/fasttree	2.1.10	fasttree	2.1.11		Phylogenetics	1	1	1	1	1	1	1	1	0	0	0	1	0	0	0	0	0	0	0	0	0	0	1	1	1	0	0	0	0	0	0	1	0	0	0	0	0	0	0	0	1	1	379	55434	True	False	True
featurecounts	featurecounts	featureCounts counts the number of reads aligned to defined masked regions in a reference genome	featurecounts	featurecounts		FeatureCounts	featureCounts is a very efficient read quantifier. It can be used to summarize RNA-seq reads and gDNA-seq reads to a variety of genomic features such as genes, exons, promoters, gene bodies and genomic bins. It is included in the Bioconductor Rsubread package and also in the SourceForge Subread package.	Read summarisation, RNA-Seq quantification	RNA-Seq	To update	http://bioinf.wehi.edu.au/featureCounts	RNA, Transcriptomics, Sequence Analysis	featurecounts	iuc	https://github.com/galaxyproject/tools-iuc/tree/master/tools/featurecounts	https://github.com/galaxyproject/tools-iuc/tree/main/tools/featurecounts	2.0.3	subread	2.0.6	Read summarisation, RNA-Seq quantification	RNA-Seq	1	1	1	1	1	1	1	1	0	0	0	0	0	0	1	0	0	0	0	0	0	0	1	1	1	0	0	1	0	0	0	1	0	0	0	0	0	1	0	0	1	1	4679	696399	True	False	True
filter_spades_repeats	filter_spades_repeat	Remove short and repeat contigs/scaffolds								To update	https://github.com/phac-nml/galaxy_tools/	Assembly	filter_spades_repeats	nml	https://github.com/phac-nml/galaxy_tools/	https://github.com/phac-nml/galaxy_tools/tree/master/tools/filter_spades_repeats	1.0.1	perl-bioperl	1.7.8			0	0	0	0	0	0	0	0	0	0	0	0	0	0	0	0	0	0	0	0	0	0	0	0	1	0	0	0	0	0	0	0	0	0	0	0	0	0	0	0	0	0	0	0	True	False	True
filtlong	filtlong	Filtlong - Filtering long reads by quality	filtlong	filtlong		Filtlong	Filtlong is a tool for filtering long reads by quality. It can take a set of long reads and produce a smaller, better subset. It uses both read length (longer is better) and read identity (higher is better) when choosing which reads pass the filter.	Filtering, Sequencing quality control		Up-to-date	https://github.com/rrwick/Filtlong	Fastq Manipulation, Sequence Analysis	filtlong	iuc	https://github.com/galaxyproject/tools-iuc/tree/master/tools/filtlong	https://github.com/galaxyproject/tools-iuc/tree/main/tools/filtlong	0.2.1	filtlong	0.2.1	Filtering, Sequencing quality control		1	1	1	1	1	1	1	1	0	0	0	0	0	0	0	0	0	0	0	0	0	0	0	0	1	0	0	0	0	0	0	0	0	0	0	0	0	0	0	0	1	1	617	30483	True	False	True
flashlfq	flashlfq	FlashLFQ mass-spectrometry proteomics label-free quantification	flashlfq	flashlfq		FlashLFQ	FlashLFQ is an ultrafast label-free quantification algorithm for mass-spectrometry proteomics.	Label-free quantification	Proteomics experiment, Proteomics	To update	https://github.com/smith-chem-wisc/FlashLFQ	Proteomics	flashlfq	galaxyp	https://github.com/galaxyproteomics/tools-galaxyp/tree/master/tools/flashlfq	https://github.com/galaxyproteomics/tools-galaxyp/tree/master/tools/flashlfq	1.0.3.1	flashlfq	1.2.6	Label-free quantification	Proteomics experiment, Proteomics	0	1	1	0	0	1	1	0	0	0	0	0	0	0	0	0	0	0	0	0	0	0	0	0	0	0	0	0	0	0	0	0	0	0	0	0	0	0	0	0	1	1	17	645	True	False	True
flye	flye	Assembly of long and error-prone reads.	Flye	Flye		Flye	Flye is a de novo assembler for single molecule sequencing reads, such as those produced by PacBio and Oxford Nanopore Technologies. It is designed for a wide range of datasets, from small bacterial projects to large mammalian-scale assemblies. The package represents a complete pipeline: it takes raw PB / ONT reads as input and outputs polished contigs.	Genome assembly, De-novo assembly, Mapping assembly, Cross-assembly	Sequence assembly, Metagenomics, Whole genome sequencing, Genomics	To update	https://github.com/fenderglass/Flye/	Assembly	flye	bgruening	https://github.com/bgruening/galaxytools/tree/master/tools/flye	https://github.com/bgruening/galaxytools/tree/master/tools/flye	2.9.3	flye	2.9.4	Genome assembly, De-novo assembly, Mapping assembly, Cross-assembly	Sequence assembly, Metagenomics, Whole genome sequencing	1	1	1	1	1	1	1	1	0	0	0	0	0	0	0	0	0	0	0	0	0	0	0	0	1	0	0	1	0	0	0	0	0	0	0	0	0	0	0	0	1	1	1499	20904	True	False	True
format_metaphlan2_output	format_metaphlan2_output	Format MetaPhlAn2 output to extract abundance at different taxonomic levels	format_metaphlan2_output	format_metaphlan2_output		Format metaphlan2 output	This tool format output file of MetaPhlan2 containing community content (abundance) at all taxonomic levels (from kingdom to strains).	Formatting	Taxonomy, Metagenomics	To update		Metagenomics	format_metaphlan2_output	bebatut	https://github.com/bgruening/galaxytools/tree/master/tools/format_metaphlan2_output/	https://github.com/bgruening/galaxytools/tree/master/tools/format_metaphlan2_output	0.2.0			Formatting	Taxonomy, Metagenomics	0	0	1	0	0	0	1	0	0	0	0	0	0	0	0	0	0	0	0	0	0	0	0	0	1	0	0	0	0	0	0	0	0	0	0	0	0	0	0	0	1	1	166	5588	True	False	True
fraggenescan	fraggenescan	Tool for finding (fragmented) genes in short read	fraggenescan	fraggenescan		FragGeneScan	Application for finding (fragmented) genes in short reads	Gene prediction	Genetics, Sequence analysis	To update	https://sourceforge.net/projects/fraggenescan/	Sequence Analysis	fraggenescan	iuc	https://github.com/galaxyproject/tools-iuc/tree/master/tools/fraggenescan/	https://github.com/galaxyproject/tools-iuc/tree/main/tools/fraggenescan		fraggenescan	1.31	Gene prediction	Genetics, Sequence analysis	0	1	1	1	0	1	1	1	1	0	0	0	0	0	0	0	0	0	0	0	0	0	0	0	1	0	0	0	0	0	0	0	0	0	0	0	0	0	0	0	1	1	68	1102	True	False	True
freyja	freyja_aggregate_plot, freyja_boot, freyja_demix, freyja_variants	lineage abundances estimation	freyja	freyja						To update	https://github.com/andersen-lab/Freyja	Metagenomics, Sequence Analysis	freyja	iuc	https://github.com/galaxyproject/tools-iuc/tree/master/tools/freyja	https://github.com/galaxyproject/tools-iuc/tree/main/tools/freyja	1.4.4	freyja	1.5.1			2	0	4	0	2	0	4	0	0	0	0	0	0	0	0	0	0	0	0	0	0	0	0	0	4	0	0	0	0	0	0	0	0	0	0	0	0	0	0	0	4	0	55	20021	True	False	True
frogs	FROGS_affiliation_filters, FROGS_affiliation_postprocess, FROGS_affiliation_stats, FROGS_biom_to_stdBiom, FROGS_biom_to_tsv, FROGS_cluster_filters, FROGS_cluster_stats, FROGS_clustering, FROGS_demultiplex, FROGSSTAT_DESeq2_Preprocess, FROGSSTAT_DESeq2_Visualisation, FROGSFUNC_step2_functions, FROGSFUNC_step3_pathways, FROGSFUNC_step1_placeseqs, FROGS_itsx, FROGS_normalisation, FROGSSTAT_Phyloseq_Alpha_Diversity, FROGSSTAT_Phyloseq_Beta_Diversity, FROGSSTAT_Phyloseq_Sample_Clustering, FROGSSTAT_Phyloseq_Composition_Visualisation, FROGSSTAT_Phyloseq_Import_Data, FROGSSTAT_Phyloseq_Multivariate_Analysis_Of_Variance, FROGSSTAT_Phyloseq_Structure_Visualisation, FROGS_preprocess, FROGS_remove_chimera, FROGS_taxonomic_affiliation, FROGS_Tree, FROGS_tsv_to_biom	Suite for metabarcoding analysis	frogs	frogs		FROGS	The user-friendly and Galaxy-supported pipeline FROGS analyses large sets of DNA amplicons sequences accurately and rapidly, essential for microbe community studies.	Taxonomic classification	Metagenomics, Microbial ecology, Taxonomy, Evolutionary biology, Sequencing	To update	http://frogs.toulouse.inrae.fr/	Metagenomics	frogs	frogs	https://github.com/geraldinepascal/FROGS-wrappers/	https://github.com/geraldinepascal/FROGS-wrappers/tree/master/tools/frogs	4.1.0	frogs	5.0.0	Taxonomic classification	Metagenomics, Microbial ecology, Taxonomy, Evolutionary biology, Sequencing	0	0	0	28	0	0	0	28	0	0	0	0	0	0	0	0	0	0	0	0	0	0	0	18	18	0	0	0	0	0	0	0	0	0	0	0	0	0	0	0	0	0	0	0	True	False	True
funannotate	funannotate_annotate, funannotate_clean, funannotate_compare, funannotate_predict, funannotate_sort	Funannotate is a genome prediction, annotation, and comparison software package.	funannotate	funannotate		funannotate	funannotate is a pipeline for genome annotation (built specifically for fungi, but will also work with higher eukaryotes).	Genome annotation	Genomics	To update	https://funannotate.readthedocs.io	Genome annotation		iuc	https://github.com/galaxyproject/tools-iuc/tree/main/tools/funannotate	https://github.com/galaxyproject/tools-iuc/tree/main/tools/funannotate	1.8.15			Genome annotation	Genomics	3	5	5	5	3	5	5	5	0	0	0	0	0	0	0	0	0	0	0	0	0	0	0	0	0	0	0	0	0	0	0	0	0	0	0	0	0	0	0	0	5	0	900	5906	True	False	True
getmlst	getmlst	Download MLST datasets by species from pubmlst.org								To update		Sequence Analysis	getmlst	nml		https://github.com/phac-nml/galaxy_tools/tree/master/tools/getmlst	0.1.4.1	srst2	0.2.0			0	0	0	0	0	0	0	0	0	0	0	0	0	0	0	0	0	0	0	0	0	0	0	0	1	0	0	0	0	0	0	0	0	0	0	0	0	0	0	0	0	0	0	0	True	False	True
ggplot2	ggplot2_heatmap, ggplot2_pca, ggplot2_histogram, ggplot2_point, ggplot2_violin	ggplot2 is a system for declaratively creating graphics, based on The Grammar of Graphics.You provide the data, tell ggplot2 how to map variables to aesthetics, what graphical primitives to use,and it takes care of the details.	ggplot2	ggplot2		ggplot2	Plotting system for R, based on the grammar of graphics.	Visualisation	Data visualisation	To update	https://github.com/tidyverse/ggplot2	Visualization		iuc	https://github.com/galaxyproject/tools-iuc/tree/master/tools/ggplot2	https://github.com/galaxyproject/tools-iuc/tree/main/tools/ggplot2	3.4.0	r-base		Visualisation	Data visualisation	5	5	5	5	5	5	5	5	0	0	0	0	0	0	0	0	0	0	0	0	0	0	1	0	5	0	0	0	0	0	0	3	0	0	0	0	0	0	0	0	5	5	1388	22148	True	False	True
gi2taxonomy	Fetch Taxonomic Ranks	Fetch taxonomic representation	gi2taxonomy	gi2taxonomy		gi2taxonomy	The tool fetches taxonomic information for a list of sequence identifiers (i.e. GI numbers, as used by the National Center for Biotechnology Information (NCBI).	Database search, ID mapping	Taxonomy	To update	https://bitbucket.org/natefoo/taxonomy	Metagenomics	gi2taxonomy	devteam	https://github.com/galaxyproject/tools-devteam/tree/master/tool_collections/taxonomy/gi2taxonomy	https://github.com/galaxyproject/tools-devteam/tree/main/tool_collections/taxonomy/gi2taxonomy	1.1.1	taxonomy	0.10.0	Database search, ID mapping	Taxonomy	0	0	1	0	0	0	1	0	0	0	0	0	0	0	0	0	0	0	0	0	0	0	0	1	1	0	0	0	0	0	0	0	0	0	0	0	0	0	0	0	1	0	27	660	True	False	True
glimmer	glimmer_acgt_content, glimmer_build_icm, glimmer_extract, glimmer_gbk_to_orf, glimmer_glimmer_to_gff, glimmer_long_orfs, glimmer_knowledge_based, glimmer_not_knowledge_based	Glimmer makes gene predictions.	gemini	gemini		GEMINI	GEMINI (GEnome MINIng) is a flexible framework for exploring genetic variation in the context of the wealth of genome annotations available for the human genome. By placing genetic variants, sample phenotypes and genotypes, as well as genome annotations into an integrated database framework, GEMINI provides a simple, flexible, and powerful system for exploring genetic variation for disease and population genetics.	Sequence analysis, Genetic variation analysis	Sequence analysis	To update	https://ccb.jhu.edu/software/glimmer/	Sequence Analysis		bgruening	https://github.com/galaxyproject/tools-iuc/tree/master/tools/glimmer	https://github.com/galaxyproject/tools-iuc/tree/main/tools/glimmer		glimmer	3.02	Sequence analysis, Genetic variation analysis	Sequence analysis	0	0	4	0	0	0	4	0	0	0	0	0	0	0	0	0	0	0	0	0	0	0	0	0	0	0	0	0	0	0	0	0	0	0	0	0	0	0	0	0	4	0	187	3965	True	False	True
glimmer_hmm		GlimmerHMM is a new gene finder based on a Generalized Hidden Markov Model (GHMM)								To update	https://ccb.jhu.edu/software/glimmerhmm/	Sequence Analysis	glimmer_hmm	bgruening	https://github.com/bgruening/galaxytools/tree/master/tools/glimmer_hmm	https://github.com/bgruening/galaxytools/tree/master/tools/glimmer_hmm						0	0	0	0	0	0	0	0	0	0	0	0	0	0	0	0	0	0	0	0	0	0	0	0	0	0	0	0	0	0	0	0	0	0	0	0	0	0	0	0	0	0	0	0	True	False	True
goenrichment	goenrichment, goslimmer	Performs GO Enrichment analysis.	goenrichment	goenrichment		GOEnrichment	GOEnrichment is a tool for performing GO enrichment analysis of gene sets, such as those obtained from RNA-seq or Microarray experiments, to help characterize them at the functional level. It is available in Galaxy Europe and as a stand-alone tool.GOEnrichment is flexible in that it allows the user to use any version of the Gene Ontology and any GO annotation file they desire. To enable the use of GO slims, it is accompanied by a sister tool GOSlimmer, which can convert annotation files from full GO to any specified GO slim.The tool features an optional graph clustering algorithm to reduce the redundancy in the set of enriched GO terms and simplify its output.It was developed by the BioData.pt / ELIXIR-PT team at the Instituto Gulbenkian de Cincia.	Gene-set enrichment analysis	Transcriptomics	Up-to-date	https://github.com/DanFaria/GOEnrichment	Genome annotation		iuc	https://github.com/galaxyproject/tools-iuc/tree/master/tools/goenrichment	https://github.com/galaxyproject/tools-iuc/tree/main/tools/goenrichment	2.0.1	goenrichment	2.0.1	Gene-set enrichment analysis	Transcriptomics	2	2	2	2	2	2	2	2	0	0	0	0	0	0	0	0	0	0	0	0	0	0	0	0	2	0	0	0	0	0	0	0	0	0	0	0	0	0	0	0	2	2	408	5484	True	False	True
goseq	goseq	goseq does selection-unbiased testing for category enrichment amongst differentially expressed (DE) genes for RNA-seq data	goseq	goseq		GOseq	Detect Gene Ontology and/or other user defined categories which are over/under represented in RNA-seq data.	Gene functional annotation	RNA-Seq	To update	https://bioconductor.org/packages/release/bioc/html/goseq.html	Statistics, RNA, Micro-array Analysis	goseq	iuc	https://github.com/galaxyproject/tools-iuc/tree/master/tools/goseq	https://github.com/galaxyproject/tools-iuc/tree/main/tools/goseq	1.50.0	bioconductor-goseq	1.54.0	Gene functional annotation	RNA-Seq	1	1	1	1	1	1	1	1	0	0	0	0	0	0	0	0	0	0	0	0	0	0	0	0	0	0	0	1	0	0	0	1	0	0	0	0	0	0	0	0	1	1	1210	19167	True	False	True
graphlan	graphlan, graphlan_annotate	GraPhlAn is a software tool for producing high-quality circular representations of taxonomic and phylogenetic trees	graphlan	graphlan		GraPhlAn	GraPhlAn is a software tool for producing high-quality circular representations of taxonomic and phylogenetic trees. GraPhlAn focuses on concise, integrative, informative, and publication-ready representations of phylogenetically- and taxonomically-driven investigation.	Phylogenetic inference, Phylogenetic tree visualisation, Phylogenetic tree editing, Taxonomic classification	Metagenomics, Phylogenetics, Phylogenomics, Cladistics	To update	https://github.com/biobakery/graphlan	Metagenomics, Graphics, Phylogenetics	graphlan	iuc	https://github.com/galaxyproject/tools-iuc/tree/master/tools/humann2/	https://github.com/galaxyproject/tools-iuc/tree/main/tools/graphlan		graphlan	1.1.3	Phylogenetic inference, Phylogenetic tree visualisation, Phylogenetic tree editing, Taxonomic classification	Metagenomics, Phylogenetics, Phylogenomics, Cladistics	2	2	2	2	2	2	2	2	0	0	0	0	0	0	0	0	0	0	0	0	0	0	0	0	2	0	0	0	0	0	0	0	0	0	0	0	0	0	0	0	2	2	432	9277	True	False	True
graphmap	graphmap_align, graphmap_overlap	Mapper for long, error-prone reads.	graphmap	graphmap		graphmap	Splice-aware RNA-seq mapper for long reads | GraphMap - A highly sensitive and accurate mapper for long, error-prone reads http://www.nature.com/ncomms/2016/160415/ncomms11307/full/ncomms11307.html https://www.biorxiv.org/content/10.1101/720458v1	Sequence trimming, EST assembly, Read mapping	Gene transcripts, RNA-Seq, RNA splicing	To update	https://github.com/isovic/graphmap/	Assembly	graphmap	bgruening	https://github.com/bgruening/galaxytools/tree/master/tools/graphmap	https://github.com/bgruening/galaxytools/tree/master/tools/graphmap	0.5.2	graphmap	0.6.3	Sequence trimming, EST assembly, Read mapping	Gene transcripts, RNA-Seq, RNA splicing	0	0	2	0	0	0	2	0	0	0	0	0	0	0	0	0	0	0	0	0	0	0	0	0	2	0	0	0	0	0	0	0	0	0	0	0	0	0	0	0	2	2	136	6651	True	False	True
