Galaxy wrapper id	Galaxy tool ids	Description	bio.tool id	bio.tool ids	biii	bio.tool name	bio.tool description	EDAM operation	EDAM topic	Status	Source	ToolShed categories	ToolShed id	Galaxy wrapper owner	Galaxy wrapper source	Galaxy wrapper parsed folder	Galaxy wrapper version	Conda id	Conda version	EDAM operation (no superclasses)	EDAM topic (no superclasses)	Available on UseGalaxy.org (Main)	Available on UseGalaxy.org.au	Available on UseGalaxy.eu	Available on UseGalaxy.fr	Tools available on UseGalaxy.org (Main)	Tools available on UseGalaxy.org.au	Tools available on UseGalaxy.eu	Tools available on UseGalaxy.fr	Tools available on ANASTASIA	Tools available on APOSTL	Tools available on ARGs-OAP	Tools available on BF2I-MAP	Tools available on BioBix	Tools available on CIRM-CFBP	Tools available on Center for Phage Technology (CPT)	Tools available on ChemFlow	Tools available on Coloc-stats	Tools available on CorGAT	Tools available on CropGalaxy	Tools available on Dintor	Tools available on FreeBioinfo	Tools available on GASLINI	Tools available on Galaxy@AuBi	Tools available on Galaxy@Pasteur	Tools available on GalaxyTrakr	Tools available on Genomic Hyperbrowser	Tools available on GigaGalaxy	Tools available on HyPhy HIV NGS Tools	Tools available on IPK Galaxy Blast Suite	Tools available on ImmPort Galaxy	Tools available on InteractoMIX	Tools available on MISSISSIPPI	Tools available on Mandoiu Lab	Tools available on MiModD NacreousMap	Tools available on Oqtans	Tools available on Palfinder	Tools available on PepSimili	Tools available on PhagePromotor	Tools available on Protologger	Tools available on UseGalaxy.be	Tools available on UseGalaxy.cz	Tools available on UseGalaxy.no	No. of tool users (2022-2023) (usegalaxy.eu)	Total tool usage (usegalaxy.eu)	Reviewed	Deprecated	To keep
PAMPA	pampa_communitymetrics, pampa_presabs, pampa_glmcomm, pampa_glmsp, pampa_plotglm	Tools to compute and analyse biodiversity metrics								To update		Ecology	pampa	ecology	https://github.com/ColineRoyaux/PAMPA-Galaxy	https://github.com/galaxyecology/tools-ecology/tree/master/tools/PAMPA	0.0.2					0	5	5	5	0	5	5	5	0	0	0	0	0	0	0	0	0	0	0	0	0	0	0	0	0	0	0	0	0	0	0	0	0	0	0	0	0	0	0	0	5	4	73	1004	True	False	True
TreeBest	treebest_best	TreeBeST best	treebest	treebest		TreeBeST	TreeBeST, which stands for (gene) Tree Building guided by Species Tree, is a versatile program that builds, manipulates and displays phylogenetic trees. It is particularly designed for building gene trees with a known species tree and is highly efficient and accurate.TreeBeST is previously known as NJTREE. It has been largely used in the TreeFam database, Ensembl Compara and OPTIC database of Chris Ponting group.	Phylogenetic tree visualisation, Phylogenetic analysis, Phylogenetic inference (from molecular sequences)	Phylogenetics	To update	http://treesoft.sourceforge.net/treebest.shtml	Phylogenetics	treebest_best	earlhaminst	https://github.com/TGAC/earlham-galaxytools/tree/master/tools/TreeBest	https://github.com/TGAC/earlham-galaxytools/tree/master/tools/TreeBest	1.9.2.post0	treebest	1.9.2.post1	Phylogenetic tree visualisation, Phylogenetic inference (from molecular sequences)	Phylogenetics	0	0	1	0	0	0	1	0	0	0	0	0	0	0	0	0	0	0	0	0	0	0	0	0	1	0	0	0	0	0	0	0	0	0	0	0	0	0	0	0	1	1	23	984	True	False	True
abacas	abacas	Order and Orientate Contigs								To update	https://github.com/phac-nml/abacas	Assembly	abacas	nml	https://github.com/phac-nml/abacas	https://github.com/phac-nml/galaxy_tools/tree/master/tools/abacas	1.1	mummer	3.23			0	0	0	1	0	0	0	1	0	0	0	0	0	0	0	0	0	0	0	0	0	0	0	0	1	0	0	0	0	0	0	0	0	0	0	0	0	0	0	0	0	0	0	0	True	False	True
abricate	abricate, abricate_list, abricate_summary	Mass screening of contigs for antiobiotic resistance genes	ABRicate	ABRicate		ABRicate	Mass screening of contigs for antimicrobial resistance or virulence genes.	Antimicrobial resistance prediction	Genomics, Microbiology	Up-to-date	https://github.com/tseemann/abricate	Sequence Analysis	abricate	iuc	https://github.com/galaxyproject/tools-iuc/tree/master/tools/abricate/	https://github.com/galaxyproject/tools-iuc/tree/main/tools/abricate	1.0.1	abricate	1.0.1	Antimicrobial resistance prediction	Genomics, Microbiology	3	3	3	3	3	3	3	3	0	0	0	0	0	0	0	0	0	0	0	0	0	0	3	0	3	0	0	0	0	0	0	0	0	0	0	0	0	0	0	0	3	3	1764	496717	True	False	True
abritamr	abritamr	A pipeline for running AMRfinderPlus and collating results into functional classes	abritamr	abritamr		abriTAMR	an AMR gene detection pipeline that runs AMRFinderPlus on a single (or list ) of given isolates and collates the results into a table, separating genes identified into functionally relevant groups.	Antimicrobial resistance prediction	Microbiology, Public health and epidemiology, Infectious disease	To update	https://zenodo.org/record/7370628	Sequence Analysis	abritamr	iuc	https://github.com/galaxyproject/tools-iuc/tree/master/tools/abritamr	https://github.com/galaxyproject/tools-iuc/tree/main/tools/abritamr	1.0.14	abritamr	1.0.18	Antimicrobial resistance prediction	Microbiology, Public health and epidemiology, Infectious disease	0	0	1	0	0	0	1	0	0	0	0	0	0	0	0	0	0	0	0	0	0	0	0	0	0	0	0	0	0	0	0	0	0	0	0	0	0	0	0	0	0	0	0	0	True	False	True
abyss	abyss-pe	Assembly By Short Sequences - a de novo, parallel, paired-end sequence assembler	abyss	abyss		ABySS	De novo genome sequence assembler using short reads.	Genome assembly, De-novo assembly, Scaffolding	Sequence assembly	Up-to-date	http://www.bcgsc.ca/platform/bioinfo/software/abyss	Assembly	abyss	iuc	https://github.com/galaxyproject/tools-iuc/tree/master/tools/abyss	https://github.com/galaxyproject/tools-iuc/tree/main/tools/abyss	2.3.7	abyss	2.3.7	Genome assembly, De-novo assembly, Scaffolding	Sequence assembly	0	1	1	0	0	1	1	0	0	0	0	0	0	0	0	0	0	0	0	0	0	0	0	0	1	0	0	0	0	0	0	1	0	0	0	0	0	0	0	0	1	1	391	4278	True	False	True
aldex2	aldex2	Performs analysis Of differential abundance taking sample variation into account	aldex2	aldex2		ALDEx2	A differential abundance analysis for the comparison of two or more conditions. It uses a Dirichlet-multinomial model to infer abundance from counts, that has been optimized for three or more experimental replicates. Infers sampling variation and calculates the expected FDR given the biological and sampling variation using the Wilcox rank test and Welches t-test, or the glm and Kruskal Wallis tests. Reports both P and fdr values calculated by the Benjamini Hochberg correction.	Statistical inference	Gene expression, Statistics and probability	To update	https://github.com/ggloor/ALDEx_bioc	Metagenomics	aldex2	iuc	https://github.com/galaxyproject/tools-iuc/tree/master/tools/aldex2	https://github.com/galaxyproject/tools-iuc/tree/main/tools/aldex2	1.26.0	bioconductor-aldex2	1.34.0	Statistical inference	Gene expression, Statistics and probability	0	0	1	0	0	0	1	0	0	0	0	0	0	0	0	0	0	0	0	0	0	0	0	0	0	0	0	0	0	0	0	0	0	0	0	0	0	0	0	0	1	0	13	129	True	False	True
amplican	amplican	AmpliCan is an analysis tool for genome editing.	amplican	amplican		amplican	It performs alignment of the amplicon reads, normalizes gathered data, calculates multiple statistics (e.g. cut rates, frameshifts) and presents results in form of aggregated reports. Data and statistics can be broken down by experiments, barcodes, user defined groups, guides and amplicons allowing for quick identification of potential problems.	Alignment, Standardisation and normalisation	PCR experiment, Statistics and probability	To update	https://github.com/valenlab/amplican	Sequence Analysis	amplican	iuc	https://github.com/galaxyproject/tools-iuc/tree/master/tools/amplican	https://github.com/galaxyproject/tools-iuc/tree/main/tools/amplican	1.14.0	bioconductor-amplican	1.24.0	Alignment, Standardisation and normalisation	PCR experiment, Statistics and probability	0	0	1	0	0	0	1	0	0	0	0	0	0	0	0	0	0	0	0	0	0	0	0	0	0	0	0	0	0	0	0	0	0	0	0	0	0	0	0	0	1	0	12	53	True	False	True
amrfinderplus	amrfinderplus	"""AMRFinderPlus is designed to find acquired antimicrobial resistance genes and point mutations in protein and/or assembled nucleotide sequences.It can also search ""plus"", stress, heat, and biocide resistance and virulence factors for some organisms."	amrfinderplus	amrfinderplus		AMRFinderPlus	"AMRFinderPlus is designed to find acquired antimicrobial resistance genes and point mutations in protein and/or assembled nucleotide sequences.It can also search ""plus"", stress, heat, and biocide resistance and virulence factors for some organisms"	Antimicrobial resistance prediction	Microbiology, Public health and epidemiology, Infectious disease	Up-to-date	https://github.com/ncbi/amr	Sequence Analysis	AMRFinderPlus	iuc	https://github.com/galaxyproject/tools-iuc/blob/master/tools/amrfinderplus	https://github.com/galaxyproject/tools-iuc/tree/main/tools/amrfinderplus	3.12.8	ncbi-amrfinderplus	3.12.8	Antimicrobial resistance prediction	Microbiology, Public health and epidemiology, Infectious disease	1	0	1	1	1	0	1	1	0	0	0	0	0	0	0	0	0	0	0	0	0	0	0	0	0	0	0	0	0	0	0	0	0	0	0	0	0	0	0	0	0	0	0	591	True	False	True
ancombc	ancombc	Performs analysis of compositions of microbiomes with bias correction.	ancombc	ancombc		ANCOMBC	Determine taxa whose absolute abundances, per unit volume, of the ecosystem (e.g. gut) are significantly different with changes in the covariate of interest (e.g. group). The current version of ancombc function implements Analysis of Compositions of Microbiomes with Bias Correction (ANCOM-BC) in cross-sectional data while allowing for covariate adjustment.	DNA barcoding	Microbial ecology, Metagenomics, Taxonomy	To update	https://github.com/FrederickHuangLin/ANCOMBC	Metagenomics	ancombc	iuc	https://github.com/galaxyproject/tools-iuc/tree/master/tools/ancombc	https://github.com/galaxyproject/tools-iuc/tree/main/tools/ancombc	1.4.0	bioconductor-ancombc	2.4.0	DNA barcoding	Microbial ecology, Metagenomics, Taxonomy	0	0	1	0	0	0	1	0	0	0	0	0	0	0	0	0	0	0	0	0	0	0	0	0	0	0	0	0	0	0	0	0	0	0	0	0	0	0	0	0	1	0	4	7	True	False	True
antismash	antismash	Antismash allows the genome-wide identification, annotation and analysis of secondary metabolite biosynthesis gene clusters	antismash	antismash		antiSMASH	Rapid genome-wide identification, annotation and analysis of secondary metabolite biosynthesis gene clusters in bacterial and fungal genomes. It integrates and cross-links with a large number of in silico secondary metabolite analysis tools that have been published earlier.	Sequence clustering, Gene prediction, Differential gene expression analysis	Molecular interactions, pathways and networks, Gene and protein families	To update	https://antismash.secondarymetabolites.org	Sequence Analysis	antismash	bgruening	https://github.com/galaxyproject/tools-iuc/tree/master/tools/antismash	https://github.com/bgruening/galaxytools/tree/master/tools/antismash	6.1.1	antismash	7.1.0	Sequence clustering, Gene prediction, Differential gene expression analysis	Molecular interactions, pathways and networks, Gene and protein families	1	1	1	0	1	1	1	0	0	0	0	0	0	0	0	0	0	0	0	0	1	0	0	0	1	0	0	0	0	0	0	0	0	0	0	0	0	0	0	0	1	1	279	14596	True	False	True
artic	artic_guppyplex, artic_minion	The artic pipeline is designed to help run the artic bioinformatics protocols;for example the nCoV-2019 novel coronavirus protocol.Features include: read filtering, primer trimming, amplicon coverage normalisation,variant calling and consensus building	artic	artic		ARTIC	A bioinformatics pipeline for working with virus sequencing data sequenced with nanopore	Sequence alignment	Genomics	To update	https://github.com/artic-network/fieldbioinformatics	Sequence Analysis		iuc	https://github.com/galaxyproject/tools-iuc/tree/master/tools/artic	https://github.com/galaxyproject/tools-iuc/tree/main/tools/artic		artic	1.2.4	Sequence alignment	Genomics	0	0	2	0	0	0	2	0	0	0	0	0	0	0	0	0	0	0	0	0	0	0	0	0	1	0	0	0	0	0	0	0	0	0	0	0	0	0	0	0	2	1	123	8175	True	False	True
assemblystats	assemblystats	Summarise an assembly (e.g. N50 metrics)								To update	https://github.com/phac-nml/galaxy_tools	Assembly	assemblystats	nml	https://github.com/phac-nml/galaxy_tools	https://github.com/phac-nml/galaxy_tools/tree/master/tools/assemblystats	1.1.0	perl-bioperl	1.7.8			0	0	0	0	0	0	0	0	0	0	0	0	0	0	0	0	0	0	0	0	0	0	0	0	1	0	0	0	0	0	0	0	0	0	0	0	0	0	0	0	0	0	0	0	True	False	True
bakta	bakta	"""Bakta is a tool for the rapid & standardized annotation of bacterial genomes and plasmids from both isolates and MAGs.It provides dbxref-rich and sORF-including annotations in machine-readable JSON & bioinformatics standard file formats for automatic downstream analysis."""	bakta	bakta		Bakta	Rapid & standardized annotation of bacterial genomes, MAGs & plasmids	Genome annotation	Genomics, Data submission, annotation and curation, Sequence analysis	To update	https://github.com/oschwengers/bakta	Sequence Analysis	bakta	iuc	https://github.com/galaxyproject/tools-iuc/blob/master/tools/bakta	https://github.com/galaxyproject/tools-iuc/tree/main/tools/bakta	1.9.3	bakta		Genome annotation	Genomics, Data submission, annotation and curation, Sequence analysis	0	1	1	1	0	1	1	1	0	0	0	0	0	0	0	0	0	0	0	0	0	0	1	0	1	0	0	0	0	0	0	0	0	0	0	0	0	0	0	0	1	1	151	2982	True	False	True
bamtools	bamtools	Operate on and transform BAM datasets in various ways using bamtools	bamtools	bamtools		BamTools	BamTools provides a fast, flexible C++ API & toolkit for reading, writing, and managing BAM files.	Data handling, Sequence alignment analysis	Sequencing, Data management, Sequence analysis	Up-to-date	https://github.com/pezmaster31/bamtools	Sequence Analysis, SAM	bamtools	devteam	https://github.com/galaxyproject/tools-iuc/tree/main/tool_collections/bamtools/bamtools	https://github.com/galaxyproject/tools-iuc/tree/main/tool_collections/bamtools/bamtools	2.5.2	bamtools	2.5.2	Data handling, Sequence alignment analysis	Sequencing, Sequence analysis	1	0	1	1	1	0	1	1	0	0	0	0	0	0	0	0	0	0	0	0	0	0	1	0	0	0	0	0	0	0	0	1	0	0	0	0	0	0	0	0	1	1	208	14021	True	False	True
bandage	bandage_image, bandage_info	Bandage - A Bioinformatics Application for Navigating De novo Assembly Graphs Easily	bandage	bandage		Bandage	GUI program that allows users to interact with the assembly graphs made by de novo assemblers such as Velvet, SPAdes, MEGAHIT and others. It visualises assembly graphs, with connections, using graph layout algorithms.	Sequence assembly visualisation	Genomics, Sequence assembly	Up-to-date	https://github.com/rrwick/Bandage	Visualization	bandage	iuc	https://github.com/galaxyproject/tools-iuc/tree/master/tools/bandage	https://github.com/galaxyproject/tools-iuc/tree/main/tools/bandage	2022.09	bandage_ng	2022.09	Sequence assembly visualisation	Genomics, Sequence assembly	2	2	2	2	2	2	2	2	0	0	0	0	0	0	2	0	0	0	0	0	0	0	2	2	2	0	0	0	0	0	0	2	0	0	0	0	0	0	0	0	2	2	2016	44390	True	False	True
bayescan	BayeScan	Detecting natural selection from population-based genetic data	bayescan	bayescan		BayeScan	BAYEsian genome SCAN for outliers, aims at identifying candidate loci under natural selection from genetic data, using differences in allele frequencies between populations. It is based on the multinomial-Dirichlet model.	Statistical inference	Genetics, Evolutionary biology, Statistics and probability, DNA polymorphism	To update	http://cmpg.unibe.ch/software/BayeScan/index.html	Sequence Analysis	bayescan	iuc	https://github.com/galaxyproject/tools-iuc/tree/master/tools/bayescan/	https://github.com/galaxyproject/tools-iuc/tree/main/tools/bayescan	2.1	bayescan	2.0.1	Statistical inference	Genetics, Evolutionary biology, Statistics and probability, DNA polymorphism	0	0	1	0	0	0	1	0	0	0	0	0	0	0	0	0	0	0	0	0	0	0	0	0	0	0	0	0	0	0	0	0	0	0	0	0	0	0	0	0	1	1	8	64	True	False	True
bbtools	bbtools_bbduk, bbtools_bbmap, bbtools_bbmerge, bbtools_bbnorm, bbtools_callvariants, bbtools_tadpole	BBTools is a suite of fast, multithreaded bioinformatics tools designed for analysis of DNA and RNA sequence data.BBTools can handle common sequencing file formats such as fastq, fasta, sam, scarf, fasta+qual, compressed or raw,with autodetection of quality encoding and interleaving. It is written in Java and works on any platform supportingJava, including Linux, MacOS, and Microsoft Windows and Linux; there are no dependencies other than Java (version7 or higher). Program descriptions and options are shown when running the shell scripts with no parameters.	bbmap	bbtools, bbmap		BBMap	BBMap is a fast splice-aware aligner for RNA and DNA.  It is faster than almost all short-read aligners, yet retains unrivaled sensitivity and specificity, particularly for reads with many errors and indels.	RNA-Seq analysis, Sequence trimming, Read mapping, Sequence contamination filtering, Read binning, Sequence alignment	Sequencing, RNA splicing, Whole genome sequencing, Phylogenetics, Metagenomics, RNA-Seq	Up-to-date	https://jgi.doe.gov/data-and-tools/bbtools/	Sequence Analysis	bbtools	iuc	https://github.com/galaxyproject/tools-iuc/tree/master/tools/bbtools	https://github.com/galaxyproject/tools-iuc/tree/main/tools/bbtools	39.06	bbmap	39.06	RNA-Seq analysis, Sequence trimming, Read mapping, Sequence contamination filtering, Read binning, Sequence alignment	RNA splicing, Whole genome sequencing, Phylogenetics, Metagenomics, RNA-Seq	6	1	5	0	6	1	5	0	0	0	0	0	0	0	0	0	0	0	0	0	0	0	0	0	3	0	0	1	0	0	0	0	0	0	0	0	0	0	0	0	4	0	420	6381	True	False	True
bigscape	bigscape	Construct sequence similarity networks of BGCs and groups them into GCF	BiG-SCAPE	BiG-SCAPE		BiG-SCAPE	A computational framework to explore large-scale biosynthetic diversity.BiG-SCAPE (Biosynthetic Gene Similarity Clustering and Prospecting Engine) is a software package, written in Python, that constructs sequence similarity networks of Biosynthetic Gene Clusters (BGCs) and groups them into Gene Cluster Families (GCFs). BiG-SCAPE does this by rapidly calculating a distance matrix between gene clusters based on a comparison of their protein domain content, order, copy number and sequence identity.It defines a distance metric between Gene Clusters using a combination of three indices (Jaccard Index of domain types, Domain Sequence Similarity the Adjacency...BiG-SCAPE and CORASON provide a set of tools to explore the diversity of biosynthetic gene clusters (BGCs) across large numbers of genomes, by constructing BGC sequence similarity networks, grouping BGCs into gene cluster families, and exploring gene cluster diversity linked to enzyme phylogenies.	Clustering, Global alignment, Fold recognition	Phylogeny, Microbial ecology, Mapping, Metabolomics, Bioinformatics, Gene and protein families	Up-to-date	https://github.com/medema-group/BiG-SCAPE	Metagenomics	bigscape	iuc	https://github.com/galaxyproject/tools-iuc/tree/master/tools/bigscape/	https://github.com/galaxyproject/tools-iuc/tree/main/tools/bigscape	1.1.9	bigscape	1.1.9	Clustering, Global alignment, Fold recognition	Phylogeny, Microbial ecology, Mapping, Metabolomics, Bioinformatics, Gene and protein families	0	0	1	0	0	0	1	0	0	0	0	0	0	0	0	0	0	0	0	0	0	0	0	0	0	0	0	0	0	0	0	0	0	0	0	0	0	0	0	0	0	0	0	0	True	False	True
binning_refiner	bin_refiner	Reconciles the outputs of different binning programs with the aim to improve the quality of genome bins,especially with respect to contamination levels.	binning_refiner	binning_refiner		Binning_refiner	Improving genome bins through the combination of different binning programs	Read binning, Sequence clustering	Metagenomics, Sequence assembly, Microbial ecology	Up-to-date	https://github.com/songweizhi/Binning_refiner	Metagenomics	binning_refiner	iuc	https://github.com/galaxyproject/tools-iuc/tree/master/tools/binning_refiner/	https://github.com/galaxyproject/tools-iuc/tree/main/tools/binning_refiner	1.4.3	binning_refiner	1.4.3	Read binning, Sequence clustering	Metagenomics, Sequence assembly, Microbial ecology	0	0	1	0	0	0	1	0	0	0	0	0	0	0	0	0	0	0	0	0	0	0	0	0	1	0	0	0	0	0	0	0	0	0	0	0	0	0	0	0	1	0	21	81	True	False	True
biohansel	biohansel	Heidelberg and Enteritidis SNP Elucidation								To update	https://github.com/phac-nml/biohansel	Sequence Analysis	biohansel	nml	https://github.com/phac-nml/biohansel	https://github.com/phac-nml/galaxy_tools/tree/master/tools/biohansel	2.4.0	bio_hansel	2.6.1			0	0	0	0	0	0	0	0	0	0	0	0	0	0	0	0	0	0	0	0	0	0	0	0	0	0	0	0	0	0	0	0	0	0	0	0	0	0	0	0	0	0	0	0	True	False	True
biom_format	biom_add_metadata, biom_convert, biom_from_uc, biom_normalize_table, biom_subset_table, biom_summarize_table	The biom-format package provides a command line interface and Python API for working with BIOM files.	biomformat	biomformat		biomformat	"This package includes basic tools for reading biom-format files, accessing and subsetting data tables from a biom object, as well as limited support for writing a biom-object back to a biom-format file. The design of this API is intended to match the python API and other tools included with the biom-format project, but with a decidedly ""R flavor"" that should be familiar to R users. This includes S4 classes and methods, as well as extensions of common core functions/methods."	Formatting	Laboratory information management, Sequence analysis	To update	https://github.com/biocore/biom-format	Metagenomics		iuc	https://github.com/galaxyproject/tools-iuc/tree/master/tools/biom_format	https://github.com/galaxyproject/tools-iuc/tree/main/tools/biom_format	2.1.15	biom-format	2.1.7	Formatting	Laboratory information management, Sequence analysis	2	2	6	0	2	2	6	0	0	0	0	0	0	0	0	0	0	0	0	0	0	0	0	1	0	0	0	0	0	0	0	0	0	0	0	0	0	0	0	0	1	1	98	3906	True	False	True
biotradis	bacteria_tradis, tradis_essentiality, tradis_gene_insert_sites	Bio-Tradis is a tool suite dedicated to essentiality analyses with TraDis data.	biotradis	biotradis		biotradis	The Bio::TraDIS pipeline provides software utilities for the processing, mapping, and analysis of transposon insertion sequencing data. The pipeline was designed with the data from the TraDIS sequencing protocol in mind, but should work with a variety of transposon insertion sequencing protocols as long as they produce data in the expected format.	Sequence analysis	Mobile genetic elements, Workflows	Up-to-date	https://www.sanger.ac.uk/science/tools/bio-tradis	Genome annotation	biotradis	iuc	https://github.com/galaxyproject/tools-iuc/tree/master/tool_collections/biotradis	https://github.com/galaxyproject/tools-iuc/tree/main/tool_collections/biotradis	1.4.5	biotradis	1.4.5	Sequence analysis	Mobile genetic elements, Workflows	3	0	0	0	3	0	0	0	0	0	0	0	0	0	0	0	0	0	0	0	0	0	0	0	0	0	0	0	0	0	0	0	0	0	0	0	0	0	0	0	0	0	0	0	True	False	True
blast2go	blast2go	Maps BLAST results to GO annotation terms								To update	https://github.com/peterjc/galaxy_blast/tree/master/tools/blast2go	Ontology Manipulation, Sequence Analysis	blast2go	peterjc	https://github.com/peterjc/galaxy_blast/tree/master/tools/blast2go	https://github.com/peterjc/galaxy_blast/tree/master/tools/blast2go	0.0.11	b2g4pipe				0	0	0	0	0	0	0	0	0	0	0	1	0	0	0	0	0	0	0	0	0	0	0	0	0	0	0	0	0	0	0	0	0	0	0	0	0	0	0	0	1	1	101	1232	True	False	True
blast_rbh	blast_reciprocal_best_hits	BLAST Reciprocal Best Hits (RBH) from two FASTA files								To update	https://github.com/peterjc/galaxy_blast/tree/master/tools/blast_rbh	Fasta Manipulation, Sequence Analysis	blast_rbh	peterjc	https://github.com/peterjc/galaxy_blast/tree/master/tools/blast_rbh	https://github.com/peterjc/galaxy_blast/tree/master/tools/blast_rbh	0.3.0	biopython	1.70			0	0	1	0	0	0	1	0	0	0	0	0	0	0	0	0	0	0	0	0	0	0	0	0	1	0	0	0	0	0	0	0	0	0	0	0	0	0	0	0	1	1	121	22499	True	False	True
blastxml_to_top_descr	blastxml_to_top_descr	Make table of top BLAST match descriptions								To update	https://github.com/peterjc/galaxy_blast/tree/master/tools/blastxml_to_top_descr	Convert Formats, Sequence Analysis, Text Manipulation	blastxml_to_top_descr	peterjc	https://github.com/peterjc/galaxy_blast/tree/master/tools/blastxml_to_top_descr	https://github.com/peterjc/galaxy_blast/tree/master/tools/blastxml_to_top_descr	0.1.2	python				0	0	1	0	0	0	1	0	0	0	0	0	0	0	0	0	0	0	0	0	0	0	0	0	0	0	0	0	0	0	0	0	0	0	0	0	0	0	0	0	1	1	159	264558	True	False	True
bracken	est_abundance	Bayesian Reestimation of Abundance with KrakEN	bracken	bracken		Bracken	Statistical method that computes the abundance of species in DNA sequences from a metagenomics sample.	Statistical calculation	Metagenomics, Microbial ecology	Up-to-date	https://ccb.jhu.edu/software/bracken/	Sequence Analysis, Metagenomics	bracken	iuc	https://github.com/galaxyproject/tools-iuc/tree/master/tools/bracken	https://github.com/galaxyproject/tools-iuc/tree/main/tools/bracken	2.9	bracken	2.9	Statistical calculation	Metagenomics, Microbial ecology	1	1	1	1	1	1	1	1	0	0	0	0	0	0	0	0	0	0	0	0	0	0	1	0	1	0	0	0	0	0	0	0	0	0	0	0	0	0	0	0	1	1	326	18351	True	False	True
busco	busco	BUSCO assess genome and annotation completeness	busco	busco		BUSCO	Provides measures for quantitative assessment of genome assembly, gene set, and transcriptome completeness based on evolutionarily informed expectations of gene content from near-universal single-copy orthologs.	Sequence assembly validation, Scaffolding, Genome assembly, Transcriptome assembly	Sequence assembly, Genomics, Transcriptomics, Sequence analysis	To update	https://gitlab.com/ezlab/busco/-/releases	Sequence Analysis	busco	iuc	https://github.com/galaxyproject/tools-iuc/tree/master/tools/busco/	https://github.com/galaxyproject/tools-iuc/tree/main/tools/busco	5.5.0	busco	5.7.1	Sequence assembly validation, Scaffolding, Genome assembly, Transcriptome assembly	Sequence assembly, Transcriptomics, Sequence analysis	1	1	1	1	1	1	1	1	0	0	0	0	0	0	0	0	0	0	0	0	0	0	0	0	1	0	0	1	0	0	0	0	0	0	0	0	0	0	0	0	1	1	1804	86180	True	False	True
