music_deconvolution	music_construct_eset, music_inspect_eset, music_manipulate_eset, music_compare, music_deconvolution	Multi-subject Single Cell deconvolution (MuSiC)								Up-to-date	https://github.com/xuranw/MuSiC	Transcriptomics	music	2021-09-12	bgruening	https://github.com/galaxyproject/tools-iuc/tree/master/tools/music/	https://github.com/bgruening/galaxytools/tree/master/tools/music_deconvolution	0.1.1	music-deconvolution	0.1.1			5	5	4	0	5	5	4	0	0	0	0	0	0	0	0	0	0	0	0	0	0	0	0	0	0	0	0	0	0	0	0	0	0	5	0	0	2801	2801	289	289	364	364	80	80	1357	1357	21	21	4522	4522	390	390	True	True	False
pyscenic	pyscenic_aucell, pyscenic_binarize, pyscenic_ctx, pyscenic_grn	PySCENIC scripts based on usage at https://pyscenic.readthedocs.io/								To update		Transcriptomics, RNA, Sequence Analysis	suite_pyscenic	2024-08-20	ebi-gxa	https://github.com/ebi-gene-expression-group/container-galaxy-sc-tertiary/	https://github.com/ebi-gene-expression-group/container-galaxy-sc-tertiary/tree/main/tools/tertiary-analysis/pyscenic	0.12.1					0	0	0	0	0	0	0	0	0	0	0	0	0	0	0	0	0	0	0	0	0	0	0	0	0	0	0	0	0	0	0	0	0	0	0	0	0	0	0	0	0	0	0	0	0	0	0	0	0	0	0	0	True	True	False
raceid	raceid_clustering, raceid_filtnormconf, raceid_inspectclusters, raceid_inspecttrajectory, raceid_trajectory	RaceID3, StemID2, FateID - scRNA analysis								To update	https://github.com/dgrun/RaceID3_StemID2_package/	Single Cell, Transcriptomics		2021-04-14	iuc	https://github.com/galaxyproject/tools-iuc/tree/master/tools/raceid3	https://github.com/galaxyproject/tools-iuc/tree/main/tools/raceid	0.2.3	r-raceid	0.1.3			5	5	5	1	5	5	5	1	0	0	0	0	0	0	0	0	0	0	0	0	0	0	0	0	0	0	0	0	0	0	0	0	5	5	5	0	3077	4581	395	518	2856	2856	1093	1093	1977	1977	19	19	7910	9414	1507	1630	True	True	False
rgrnastar	rna_star, rna_starsolo	RNA STAR is an ultra fast universal RNA and scRNA-seq aligner and mapper	star	star		STAR	Ultrafast universal RNA-seq data aligner	Sequence alignment	RNA-Seq, Transcriptomics	To update	https://github.com/alexdobin/STAR	Next Gen Mappers, Transcriptomics	rgrnastar	2023-02-27	iuc	https://github.com/galaxyproject/tools-iuc/tree/master/tools/rgrnastar	https://github.com/galaxyproject/tools-iuc/tree/main/tools/rgrnastar	2.7.11a	star	2.7.11b	Sequence alignment	RNA-Seq, Transcriptomics	2	2	2	2	2	2	2	2	0	0	0	0	0	0	0	0	1	1	1	0	0	2	0	0	0	2	0	0	0	0	0	0	2	2	2	0	438078	473957	10142	10900	325474	403925	15284	18791	49662	53138	1359	1449	813214	931020	26785	31140	True	True	False
salmon	alevin, salmon, salmonquantmerge	Salmon is a wicked-fast program to produce a highly-accurate, transcript-level quantification estimates from RNA-seq and single-cell data.	salmon	salmon		Salmon	A tool for transcript expression quantification from RNA-seq data	Sequence composition calculation, RNA-Seq quantification, Gene expression analysis	RNA-Seq, Gene expression, Transcriptomics	To update	https://github.com/COMBINE-lab/salmon	Sequence Analysis, RNA, Transcriptomics		2019-09-18	bgruening	https://github.com/bgruening/galaxytools/tree/master/tools/salmon	https://github.com/bgruening/galaxytools/tree/master/tools/salmon	1.10.1	salmon	1.10.3	Sequence composition calculation, RNA-Seq quantification, Gene expression analysis	RNA-Seq, Transcriptomics	2	2	3	1	2	2	3	1	0	0	0	0	0	0	0	0	0	2	1	0	0	1	0	0	0	2	0	0	0	0	0	0	3	3	3	0	73085	77081	2243	2319	90634	122835	3402	4726	13371	15818	513	586	177090	215734	6158	7631	True	True	False
sc3	sc3_calc_biology, sc3_calc_consens, sc3_calc_dists, sc3_calc_transfs, sc3_estimate_k, sc3_kmeans, sc3_prepare	De-composed SC3 functionality tools, based on https://github.com/ebi-gene-expression-group/bioconductor-sc3-scripts and SC3 1.8.0.								To update		Transcriptomics, RNA, Statistics, Sequence Analysis	suite_sc3	2018-11-05	ebi-gxa	https://github.com/ebi-gene-expression-group/container-galaxy-sc-tertiary/	https://github.com/ebi-gene-expression-group/container-galaxy-sc-tertiary/tree/main/tools/tertiary-analysis/sc3	1.8.0	sc3-scripts	0.0.6			0	0	7	0	0	0	7	0	0	0	0	0	0	0	0	0	0	0	0	0	0	0	0	0	0	0	0	0	0	0	0	0	0	0	0	0	13	13	10	10	0	0	0	0	0	0	0	0	13	13	10	10	True	True	False
scanpy	scanpy_cluster_reduce_dimension, scanpy_filter, scanpy_inspect, scanpy_normalize, scanpy_plot, scanpy_remove_confounders	Scanpy – Single-Cell Analysis in Python	scanpy	scanpy		SCANPY	Scalable toolkit for analyzing single-cell gene expression data. It includes preprocessing, visualization, clustering, pseudotime and trajectory inference and differential expression testing. The Python-based implementation efficiently deals with datasets of more than one million cells.	Differential gene expression analysis	Gene expression, Cell biology, Genetics	To update	https://scanpy.readthedocs.io	Single Cell, Spatial Omics, Transcriptomics	scanpy	2024-09-03	iuc	https://github.com/galaxyproject/tools-iuc/tree/master/tools/scanpy/	https://github.com/galaxyproject/tools-iuc/tree/main/tools/scanpy	1.10.2	scanpy	1.7.2	Differential gene expression analysis	Gene expression, Cell biology, Genetics	6	6	6	0	6	6	6	0	0	0	0	0	0	0	0	0	0	0	0	0	0	0	0	0	0	0	0	0	0	0	0	0	6	6	6	0	63789	64034	2543	2547	29962	29962	1185	1185	18028	18028	379	379	111779	112024	4107	4111	True	True	False
scanpy	anndata_ops, scanpy_filter_cells, scanpy_filter_genes, scanpy_find_cluster, scanpy_find_markers, scanpy_find_variable_genes, scanpy_integrate_bbknn, scanpy_integrate_combat, scanpy_integrate_harmony, scanpy_integrate_mnn, scanpy_plot_scrublet, scanpy_multiplet_scrublet, scanpy_compute_graph, scanpy_normalise_data, scanpy_parameter_iterator, scanpy_plot_embed, scanpy_plot_trajectory, scanpy_read_10x, scanpy_regress_variable, scanpy_run_diffmap, scanpy_run_dpt, scanpy_run_fdg, scanpy_run_paga, scanpy_run_pca, scanpy_run_tsne, scanpy_run_umap, scanpy_scale_data	scanpy-scripts, command-line wrapper scripts around Scanpy.								To update	https://scanpy.readthedocs.io	Transcriptomics, Sequence Analysis, RNA	scanpy_scripts	2020-09-29	ebi-gxa	https://github.com/ebi-gene-expression-group/container-galaxy-sc-tertiary/tree/develop/tools/tertiary-analysis/scanpy	https://github.com/ebi-gene-expression-group/container-galaxy-sc-tertiary/tree/main/tools/tertiary-analysis/scanpy	1.9.3	scanpy-scripts	1.9.301			27	27	27	0	27	27	27	0	0	0	0	0	0	0	0	0	0	0	0	0	0	0	0	0	0	0	0	0	0	0	0	0	0	14	13	0	45501	45666	4832	4868	7304	7304	1846	1846	3106	3106	457	457	55911	56076	7135	7171	True	True	False
scater	scater_calculate_cpm, scater_calculate_qc_metrics, scater_filter, scater_is_outlier, scater_normalize, scater_read_10x_results	De-composed Scater functionality tools, based on https://github.com/ebi-gene-expression-group/bioconductor-scater-scripts and Scater 1.8.4.								To update		Transcriptomics, RNA, Statistics, Sequence Analysis	suite_scater	2018-10-11	ebi-gxa	https://github.com/ebi-gene-expression-group/container-galaxy-sc-tertiary/	https://github.com/ebi-gene-expression-group/container-galaxy-sc-tertiary/tree/main/tools/tertiary-analysis/scater	1.10.0	scater-scripts	0.0.5			1	2	6	0	1	2	6	0	0	0	0	0	0	0	0	0	0	0	0	0	0	0	0	0	0	0	0	0	0	0	0	0	2	2	2	0	381	388	99	100	0	0	0	0	297	297	9	9	678	685	108	109	True	True	False
scater	scater_create_qcmetric_ready_sce, scater_filter, scater_plot_dist_scatter, scater_plot_pca, scater_plot_tsne	Scater (Single-Cell Analysis Toolkit for gene Expression data in R) is acollection of tools for doing various analyses of single-cell RNA-seq geneexpression data, with a focus on quality control and visualization.	scater	scater		scater	Pre-processing, quality control, normalization and visualization of single-cell RNA-seq data.	Read pre-processing, Sequencing quality control, Sequence visualisation	RNA-seq, Quality affairs, Molecular genetics	To update	http://bioconductor.org/packages/scater/	Single Cell, Transcriptomics, Visualization		2019-07-18	iuc	https://github.com/galaxyproject/tools-iuc/tree/master/tools/scater	https://github.com/galaxyproject/tools-iuc/tree/main/tools/scater	1.22.0	bioconductor-scater	1.30.1	Read pre-processing, Sequence visualisation	Quality affairs, Molecular genetics	0	5	5	0	0	5	5	0	0	0	0	0	0	0	0	0	0	0	0	0	0	0	0	0	0	0	0	0	0	0	0	0	5	5	5	0	1345	1371	350	351	0	0	0	0	903	903	29	29	2248	2274	379	380	True	True	False
sccaf	run_sccaf, sccaf_asses, sccaf_asses_merger, sccaf_regress_out	SCCAF: Single Cell Clustering Assessment Framework.								To update	https://github.com/sccaf/sccaf	Transcriptomics	SCCAF	2019-10-20	ebi-gxa	https://github.com/ebi-gene-expression-group/container-galaxy-sc-tertiary/tree/develop/tools/tertiary-analysis/sccaf	https://github.com/ebi-gene-expression-group/container-galaxy-sc-tertiary/tree/main/tools/tertiary-analysis/sccaf	0.0.9	sccaf	0.0.10			4	3	4	0	4	3	4	0	0	0	0	0	0	0	0	0	0	0	0	0	0	0	0	0	0	0	0	0	0	0	0	0	0	0	0	0	110	110	19	19	0	0	0	0	0	0	0	0	110	110	19	19	True	True	False
sceasy	sceasy_convert	Convert scRNA data object between popular formats								To update		Transcriptomics	sceasy	2019-10-14	ebi-gxa	https://github.com/ebi-gene-expression-group/container-galaxy-sc-tertiary/	https://github.com/ebi-gene-expression-group/container-galaxy-sc-tertiary/tree/main/tools/tertiary-analysis/sceasy	0.0.5	r-sceasy	0.0.7			1	1	1	0	1	1	1	0	0	0	0	0	0	0	0	0	0	0	0	0	0	0	0	0	0	1	0	0	0	0	0	0	0	0	0	0	1059	1059	222	222	426	426	71	71	1	1	1	1	1486	1486	294	294	True	True	False
sceasy	sceasy_convert	Converter between difference single-cell formats								Up-to-date	https://github.com/cellgeni/sceasy/	Single Cell, Spatial Omics, Convert Formats	sceasy_convert	2023-11-10	iuc	https://github.com/galaxyproject/tools-iuc/tree/master/tools/sceasy/	https://github.com/galaxyproject/tools-iuc/tree/main/tools/sceasy	0.0.7	r-sceasy	0.0.7			1	1	1	0	1	1	1	0	0	0	0	0	0	0	0	0	0	0	0	0	0	0	0	0	0	1	0	0	0	0	0	0	0	0	0	0	1059	1059	222	222	426	426	71	71	1	1	1	1	1486	1486	294	294	True	True	False
schicexplorer	schicexplorer_schicadjustmatrix, schicexplorer_schiccluster, schicexplorer_schicclustercompartments, schicexplorer_schicclusterminhash, schicexplorer_schicclustersvl, schicexplorer_schicconsensusmatrices, schicexplorer_schiccorrectmatrices, schicexplorer_schiccreatebulkmatrix, schicexplorer_schicdemultiplex, schicexplorer_schicinfo, schicexplorer_schicmergematrixbins, schicexplorer_schicmergetoscool, schicexplorer_schicnormalize, schicexplorer_schicplotclusterprofiles, schicexplorer_schicplotconsensusmatrices, schicexplorer_schicqualitycontrol	scHiCExplorer: Set of programs to process, analyze and visualize scHi-C data.								To update	https://github.com/joachimwolff/schicexplorer	Sequence Analysis, Transcriptomics, Visualization, Single Cell	schicexplorer	2019-12-16	iuc	https://github.com/galaxyproject/tools-iuc/tree/master/tools/schicexplorer	https://github.com/galaxyproject/tools-iuc/tree/main/tools/schicexplorer	4	schicexplorer	7			16	16	16	0	16	16	16	0	0	0	0	0	0	0	0	0	0	0	0	0	0	0	0	0	0	0	0	0	0	0	0	0	16	16	16	0	809	809	78	78	3	3	2	2	105	105	16	16	917	917	96	96	True	True	False
scmap	scmap_get_std_output, scmap_index_cell, scmap_index_cluster, scmap_preprocess_sce, scmap_scmap_cell, scmap_scmap_cluster, scmap_select_features	De-composed scmap functionality tools, based on https://github.com/ebi-gene-expression-group/scmap-cli and scmap 1.6.0.								To update		Transcriptomics, RNA, Statistics, Sequence Analysis	suite_scmap	2019-08-30	ebi-gxa	https://github.com/ebi-gene-expression-group/container-galaxy-sc-tertiary/	https://github.com/ebi-gene-expression-group/container-galaxy-sc-tertiary/tree/main/tools/tertiary-analysis/scmap	1.6.4	scmap-cli	0.1.0			0	0	7	0	0	0	7	0	0	0	0	0	0	0	0	0	0	0	0	0	0	0	0	0	0	0	0	0	0	0	0	0	0	1	0	0	97	97	41	41	0	0	0	0	0	0	0	0	97	97	41	41	True	True	False
scpipe	scpipe	A flexible preprocessing pipeline for single-cell RNA-sequencing data	scpipe	scpipe		scPipe	A preprocessing pipeline for single cell RNA-seq data that starts from the fastq files and produces a gene count matrix with associated quality control information. It can process fastq data generated by CEL-seq, MARS-seq, Drop-seq, Chromium 10x and SMART-seq protocols.	Genome annotation, Validation, Alignment, Visualisation	Gene expression, RNA-Seq, Sequencing	To update	http://bioconductor.org/packages/release/bioc/html/scPipe.html	Transcriptomics, Single Cell	scpipe	2018-08-13	iuc	https://github.com/galaxyproject/tools-iuc/tree/master/tools/scpipe	https://github.com/galaxyproject/tools-iuc/tree/main/tools/scpipe	1.0.0+galaxy2	bioconductor-scpipe	2.2.0	Genome annotation, Validation, Alignment, Visualisation	Gene expression, RNA-Seq	1	0	1	0	1	0	1	0	0	0	0	0	0	0	0	0	0	0	0	0	0	0	0	0	0	0	0	0	0	0	0	0	1	1	1	0	284	632	34	38	786	786	61	61	1	1	1	1	1071	1419	96	100	True	True	False
scpred	scpred_get_feature_space, scpred_get_std_output, scpred_predict_labels, scpred_train_model	De-composed scPred functionality tools, see https://github.com/ebi-gene-expression-group/scpred-cli and r-scPred 1.0								To update		Transcriptomics, RNA, Statistics, Sequence Analysis	suite_scpred	2020-04-07	ebi-gxa	https://github.com/ebi-gene-expression-group/container-galaxy-sc-tertiary/	https://github.com/ebi-gene-expression-group/container-galaxy-sc-tertiary/tree/main/tools/tertiary-analysis/scpred	1.0.2	scpred-cli	0.1.0			0	0	4	0	0	0	4	0	0	0	0	0	0	0	0	0	0	0	0	0	0	0	0	0	0	0	0	0	0	0	0	0	0	0	0	0	25	25	5	5	0	0	0	0	0	0	0	0	25	25	5	5	True	True	False
seurat	seurat_convert, seurat_dim_plot, seurat_export_cellbrowser, seurat_filter_cells, seurat_find_clusters, seurat_find_markers, seurat_find_neighbours, seurat_find_variable_genes, seurat_hover_locator, seurat_integration, seurat_map_query, seurat_normalise_data, seurat_plot, seurat_read10x, seurat_run_pca, seurat_run_tsne, seurat_run_umap, seurat_scale_data, seurat_select_integration_features	De-composed Seurat functionality tools, based on https://github.com/ebi-gene-expression-group/r-seurat-scripts and Seurat 2.3.1								To update	https://github.com/ebi-gene-expression-group/container-galaxy-sc-tertiary/	Transcriptomics, RNA, Statistics, Sequence Analysis	suite_seurat	2018-07-09	ebi-gxa		https://github.com/ebi-gene-expression-group/container-galaxy-sc-tertiary/tree/main/tools/tertiary-analysis/seurat	4.0.0	seurat-scripts	4.4.0			14	14	14	11	14	14	14	11	0	0	0	0	0	0	0	0	0	0	0	0	0	0	0	0	0	19	0	0	0	0	0	0	0	0	0	0	2296	2328	673	676	141	141	39	39	0	0	0	0	2437	2469	712	715	True	True	False
seurat	seurat_create, seurat_data, seurat_integrate, seurat_clustering, seurat_preprocessing, seurat_plot, seurat_reduce_dimension	Seurat - R toolkit for single cell genomics								To update	https://satijalab.org/seurat/	Single Cell, Transcriptomics, Sequence Analysis	seurat	2020-07-22	iuc	https://github.com/galaxyproject/tools-iuc/tree/master/tools/seurat_v5	https://github.com/galaxyproject/tools-iuc/tree/main/tools/seurat	5.0	r-seurat	3.0.2			1	1	7	1	1	1	7	1	0	0	0	0	0	0	0	0	0	0	0	0	0	0	0	0	0	7	0	0	0	0	0	0	0	0	0	0	121	121	11	11	32	32	5	5	0	0	0	0	153	153	16	16	True	True	False
sinto	sinto_barcode, sinto_fragments	Sinto single-cell analysis tools								Up-to-date	https://github.com/timoast/sinto	Single Cell, Epigenetics		2023-04-12	iuc	https://github.com/galaxyproject/tools-iuc/tree/master/tools/sinto	https://github.com/galaxyproject/tools-iuc/tree/main/tools/sinto	0.10.1	sinto	0.10.1			2	2	2	0	2	2	2	0	0	0	0	0	0	0	0	0	0	0	0	0	0	0	0	0	0	0	0	0	0	0	0	0	0	2	0	0	284	284	70	70	165	165	38	38	14	14	2	2	463	463	110	110	True	True	False
snapatac2	snapatac2_clustering, snapatac2_peaks_and_motif, snapatac2_plotting, snapatac2_preprocessing	SnapATAC2 – A Python/Rust package for single-cell epigenomics analysis								To update	https://kzhang.org/SnapATAC2/	Single Cell, Epigenetics	snapatac2	2024-05-16	iuc	https://github.com/galaxyproject/tools-iuc/tree/master/tools/snapatac2	https://github.com/galaxyproject/tools-iuc/tree/main/tools/snapatac2	2.6.4					4	4	4	0	4	4	4	0	0	0	0	0	0	0	0	0	0	0	0	0	0	0	0	0	0	0	0	0	0	0	0	0	0	0	0	0	1817	1817	14	14	4	4	2	2	136	136	4	4	1957	1957	20	20	True	True	False
spapros	spapros_evaluation, spapros_selection	Select and evaluate probe sets for targeted spatial transcriptomics.								Up-to-date	https://github.com/theislab/spapros	Single Cell, Transcriptomics, Sequence Analysis	spapros	2024-08-25	iuc	https://github.com/galaxyproject/tools-iuc/tree/master/tools/spapros/	https://github.com/galaxyproject/tools-iuc/tree/main/tools/spapros	0.1.5	spapros	0.1.5			0	0	2	0	0	0	2	0	0	0	0	0	0	0	0	0	0	0	0	0	0	0	0	0	0	0	0	0	0	0	0	0	0	0	0	0	0	0	0	0	0	0	0	0	0	0	0	0	0	0	0	0	True	True	False
ucsc-cell-browser	ucsc_cell_browser	Python pipeline and Javascript scatter plot library for single-cell datasets								To update	https://cells.ucsc.edu/	Transcriptomics	ucsc_cell_browser	2018-09-11	ebi-gxa	https://github.com/ebi-gene-expression-group/container-galaxy-sc-tertiary/tree/develop/tools/tertiary-analysis/ucsc-cell-browser/.shed.yml	https://github.com/ebi-gene-expression-group/container-galaxy-sc-tertiary/tree/main/tools/tertiary-analysis/ucsc-cell-browser	1.0.0+galaxy1	ucsc-cell-browser	1.2.8			0	0	1	0	0	0	1	0	0	0	0	0	0	0	0	0	0	0	0	0	0	0	0	0	0	0	0	0	0	0	0	0	0	1	1	0	965	975	178	181	0	0	0	0	0	0	0	0	965	975	178	181	True	True	False
umi_tools	umi_tools_count, umi_tools_dedup, umi_tools_extract, umi_tools_group, umi_tools_whitelist	UMI-tools extract - Extract UMIs from fastq	umi-tools	umi-tools		UMI-tools	Tools for handling Unique Molecular Identifiers in NGS data sets.	Sequencing quality control	NGS, Sequence sites, features and motifs, Quality affairs	Up-to-date	https://github.com/CGATOxford/UMI-tools	Sequence Analysis, Transcriptomics, Single Cell		2021-07-15	iuc	https://github.com/galaxyproject/tools-iuc/tree/master/tools/umi_tools	https://github.com/galaxyproject/tools-iuc/tree/main/tools/umi_tools	1.1.5	umi_tools	1.1.5	Sequencing quality control	Sequence sites, features and motifs, Quality affairs	5	5	5	5	5	5	5	5	0	0	0	0	0	0	0	0	0	0	1	0	0	0	0	0	0	5	0	0	0	0	0	0	3	5	5	0	55050	68123	1090	1223	9001	9001	906	906	12444	12444	187	187	76495	89568	2183	2316	True	True	False
velocyto	velocyto_cli	Velocyto is a library for the analysis of RNA velocity.								Up-to-date	http://velocyto.org/	Transcriptomics, Single Cell	velocyto	2021-04-30	iuc	https://github.com/galaxyproject/tools-iuc/tree/master/tools/velocyto	https://github.com/galaxyproject/tools-iuc/tree/main/tools/velocyto	0.17.17	velocyto.py	0.17.17			1	1	1	0	1	1	1	0	0	0	0	0	0	0	0	0	0	0	0	0	0	0	0	0	0	0	0	0	0	0	0	0	0	1	0	0	7	7	4	4	22	22	6	6	16	16	1	1	45	45	11	11	True	True	False
volcanoplot	volcanoplot	Tool to create a Volcano Plot								To update	https://ggplot2.tidyverse.org/	Visualization, Transcriptomics, Statistics	volcanoplot	2018-10-14	iuc	https://github.com/galaxyproject/tools-iuc/tree/master/tools/volcanoplot	https://github.com/galaxyproject/tools-iuc/tree/main/tools/volcanoplot	0.0.6	r-ggplot2	2.2.1			1	1	1	1	1	1	1	1	0	0	0	0	0	0	0	0	1	0	1	0	0	0	0	0	0	1	0	0	0	0	0	0	1	1	1	0	34917	36852	3670	3786	54931	54931	5597	5597	7183	7183	905	905	97031	98966	10172	10288	True	True	False
