picrust	picrust_categorize, picrust_compare_biom, picrust_format_tree_and_trait_table, picrust_metagenome_contributions, picrust_normalize_by_copy_number, picrust_predict_metagenomes	PICRUSt wrappers	2016-11-08	https://picrust.github.io/picrust/	1.1.1	picrust	1.1.4	To update	Metagenomics	Phylogenetic reconstruction, Expression analysis, Genome annotation, DNA barcoding	Phylogenetic reconstruction, Expression analysis, Genome annotation, DNA barcoding	Metagenomics, Microbial ecology, Functional, regulatory and non-coding RNA, Metagenomic sequencing	Metagenomics, Microbial ecology, Functional, regulatory and non-coding RNA, Metagenomic sequencing	iuc	https://github.com/galaxyproject/tools-iuc/tree/master/tools/picrust	https://github.com/galaxyproject/tools-iuc/tree/main/tools/picrust	picrust	PICRUSt	PICRUSt (Phylogenetic Investigation of Communities by Reconstruction of Unobserved States) is a bioinformatics software package designed to predict metagenome functional content from marker gene (e.g., 16S rRNA) surveys and full genomes.		0	6	5	6	0	0	0	0	0	0	0	0	0	0	0	0	0	6	0	0	0	0	0	0	0	0	0	0	0	0	0	5	5	0	134	167	759	1136	0	0	0	0	123	123	2322	2322	60	60	429	429	317	984	3510	10907	True	False
picrust2	picrust2_add_descriptions, picrust2_hsp, picrust2_metagenome_pipeline, picrust2_pathway_pipeline, picrust2_pipeline, picrust2_place_seqs, picrust2_shuffle_predictions	PICRUSt2: Phylogenetic Investigation of Communities by Reconstruction of Unobserved States	2021-07-09	https://github.com/picrust/picrust2/wiki	2.5.3	picrust2	2.6.2	To update	Metagenomics	Phylogenetic reconstruction, Expression analysis, Rarefaction, Pathway analysis	Phylogenetic reconstruction, Expression analysis, Rarefaction, Pathway analysis	Metagenomics, Microbiology, Phylogenetics, Metagenomic sequencing	Metagenomics, Microbiology, Phylogenetics, Metagenomic sequencing	iuc	https://github.com/picrust/picrust2	https://github.com/galaxyproject/tools-iuc/tree/main/tools/picrust2	picrust2	PICRUSt2	PICRUSt2 (Phylogenetic Investigation of Communities by Reconstruction of Unobserved States) is a software for predicting functional abundances based only on marker gene sequences.		0	7	7	0	0	0	0	0	0	0	0	0	0	0	0	0	0	0	0	0	0	0	0	0	0	0	0	0	0	0	0	7	0	0	561	561	3685	3685	1	1	1	1	119	119	1742	1742	0	0	0	0	681	2043	5428	16284	True	False
plasflow	PlasFlow	PlasFlow - Prediction of plasmid sequences in metagenomic contigs.	2018-09-05	https://github.com/smaegol/PlasFlow	1.1.0	plasflow	1.1.0	Up-to-date	Sequence Analysis	Sequence analysis	Sequence analysis	Metagenomics, Sequence assembly, Mobile genetic elements, Machine learning	Metagenomics, Sequence assembly, Mobile genetic elements, Machine learning	iuc	https://github.com/galaxyproject/tools-iuc/tree/master/tools/plasflow	https://github.com/galaxyproject/tools-iuc/tree/main/tools/plasflow	plasflow	PlasFlow	PlasFlow is a set of scripts used for prediction of plasmid sequences in metagenomic contigs.		1	1	1	0	0	0	0	0	0	0	0	0	0	0	0	1	0	0	0	0	0	0	0	0	0	0	0	0	0	0	1	1	1	0	805	857	51000	51597	702	704	7425	7427	68	68	3148	3148	0	0	0	0	1575	4779	61573	185318	True	False
plasmidfinder	plasmidfinder	"""PlasmidFinder provides the detection of replicons in the WGSand assigns the plasmids under study to lineages that trace backthe information to the existing knowledge on Inc groups and suggestspossible reference plasmids for each lineage"""	2022-09-19	https://bitbucket.org/genomicepidemiology/plasmidfinder/src/master/	2.1.6	plasmidfinder	2.1.6	Up-to-date	Sequence Analysis	Genome assembly, Scaffolding, Multilocus sequence typing	Genome assembly, Scaffolding, Multilocus sequence typing	Whole genome sequencing, Sequence assembly, Mapping, Probes and primers	Whole genome sequencing, Sequence assembly, Mapping, Probes and primers	iuc	https://github.com/galaxyproject/tools-iuc/blob/master/tools/plasmidfinder	https://github.com/galaxyproject/tools-iuc/tree/main/tools/plasmidfinder	PlasmidFinder	PlasmidFinder	PlasmidFinder is a tool for the identification and typing of Plasmid Replicons in Whole-Genome Sequencing (WGS).		1	1	1	1	0	0	0	0	0	0	0	0	0	0	0	1	0	0	0	0	0	0	0	0	0	0	0	0	0	0	0	1	0	0	622	622	21867	21867	263	263	2923	2923	99	99	1462	1462	34	34	6370	6370	1018	3054	32622	97866	True	False
plasmidspades	plasmidspades	Genome assembler for assemblying plasmid	2016-06-06		1.1	spades	4.2.0	To update	Assembly					nml		https://github.com/phac-nml/galaxy_tools/tree/master/tools/plasmidspades					0	0	0	0	0	0	0	0	0	0	0	0	0	0	0	0	1	1	0	0	0	0	0	0	0	0	0	0	0	0	0	0	0	0	0	0	0	0	0	0	0	0	0	0	0	0	0	0	0	0	0	0	0	0	True	False
polypolish	polypolish	"""Polypolish is a tool for polishing genome assemblies with short reads.Polypolish uses SAM files where each read has been aligned to all possible locations (not just a single best location).This allows it to repair errors in repeat regions that other alignment-based polishers cannot fix."""	2022-09-22	https://github.com/rrwick/Polypolish	0.6.0	polypolish	0.6.0	Up-to-date	Sequence Analysis	Genome assembly, Read mapping, Mapping assembly, Sequencing error detection	Genome assembly, Read mapping, Mapping assembly, Sequencing error detection	Sequence assembly, Sequence composition, complexity and repeats, Mapping	Sequence assembly, Sequence composition, complexity and repeats, Mapping	iuc	https://github.com/mesocentre-clermont-auvergne/galaxy-tools/tree/master/tools/polypolish	https://github.com/galaxyproject/tools-iuc/tree/main/tools/polypolish	Polypolish	Polypolish	Polypolish is a tool for polishing genome assemblies with short reads. Unlike other tools in this category, Polypolish uses SAM files where each read has been aligned to all possible locations (not just a single best location). This allows it to repair errors in repeat regions that other alignment-based polishers cannot fix.		0	1	1	1	0	0	0	0	0	0	0	0	0	0	0	0	0	1	0	0	0	0	0	0	0	0	0	0	0	0	0	1	0	0	112	112	890	890	0	0	0	0	9	9	276	276	8	8	76	76	129	387	1242	3726	True	False
ppanggolin	ppanggolin_all, ppanggolin_msa	Microbial Partitioned PanGenome	2025-01-22	https://github.com/labgem/PPanGGOLiN	2.2.2	ppanggolin	2.2.2	Up-to-date	Genome annotation	Rarefaction, Essential dynamics, Sequence assembly, Genome annotation	Rarefaction, Essential dynamics, Sequence assembly, Genome annotation	Metagenomics, Gene and protein families, Model organisms, Public health and epidemiology, Mapping	Metagenomics, Gene and protein families, Model organisms, Public health and epidemiology, Mapping	iuc	https://github.com/galaxyproject/tools-iuc/tree/master/tools/ppanggolin	https://github.com/galaxyproject/tools-iuc/tree/main/tools/ppanggolin	ppanggolin	PPanGGOLiN	PPanGGOLiN is a software suite used to create and manipulate prokaryotic pangenomes from a set of either genomic DNA sequences or provided genome annotations. It is designed to scale up to tens of thousands of genomes. It has the specificity to partition the pangenome using a statistical approach rather than using fixed thresholds which gives it the ability to work with low-quality data such as Metagenomic Assembled Genomes (MAGs) or Single-cell Amplified Genomes (SAGs) thus taking advantage of large scale environmental studies and letting users study the pangenome of uncultivable species		0	0	2	2	0	0	0	0	0	0	0	0	0	0	0	0	0	0	0	0	0	0	0	0	0	0	0	0	0	0	0	0	0	0	0	0	0	0	0	0	0	0	0	0	0	0	0	0	0	0	0	0	0	0	True	False
prodigal	prodigal	A protein-coding gene prediction software tool for bacterial and archaeal genomes	2024-03-14	https://github.com/hyattpd/Prodigal	2.6.3	prodigal	2.6.3	Up-to-date	Genome annotation	Genome annotation	Genome annotation	Genomics, Sequence analysis	Genomics, Sequence analysis	iuc	https://github.com/galaxyproject/tools-iuc/tree/main/tools/prodigal	https://github.com/galaxyproject/tools-iuc/tree/main/tools/prodigal	prodigal	Prodigal	Fast, reliable protein-coding gene prediction for prokaryotic genomes.		0	1	1	1	0	0	0	0	0	0	0	0	0	1	0	0	0	1	0	0	0	0	0	0	0	0	0	0	0	0	0	0	0	0	233	233	2484	2484	0	0	0	0	23	23	187	187	12	12	1432	1432	268	804	4103	12309	True	False
prokka	prokka	Rapid annotation of prokaryotic genomes	2016-10-07	http://github.com/tseemann/prokka	1.14.6	prokka	1.14.6	Up-to-date	Sequence Analysis	Gene prediction, Coding region prediction, Genome annotation	Coding region prediction, Genome annotation	Genomics, Model organisms, Virology	Genomics, Model organisms, Virology	crs4	https://github.com/galaxyproject/tools-iuc/tree/master/tools/prokka/	https://github.com/galaxyproject/tools-iuc/tree/main/tools/prokka	prokka	Prokka	Software tool to annotate bacterial, archaeal and viral genomes quickly and produce standards-compliant output files.		1	1	1	1	0	0	0	0	0	0	0	0	0	0	0	1	1	1	0	0	0	0	0	1	0	0	0	0	1	0	1	1	1	0	8552	8940	525752	544268	12582	14164	377905	404664	4647	5382	163580	178101	340	340	5425	5425	26121	81068	1072662	3277782	True	False
promer	promer4_substitutions	Aligns two sets of contigs and reports amino acid substitutions between them	2019-12-14	https://github.com/phac-nml/promer	1.2	python		To update	Assembly					nml	https://github.com/phac-nml/promer	https://github.com/phac-nml/galaxy_tools/tree/master/tools/promer					0	0	0	0	0	0	0	0	0	0	0	0	0	0	0	0	0	0	0	0	0	0	0	0	0	0	0	0	0	0	0	0	0	0	0	0	0	0	0	0	0	0	0	0	0	0	0	0	0	0	0	0	0	0	True	False
proteinortho	proteinortho, proteinortho_grab_proteins, proteinortho_summary	Proteinortho is a tool to detect orthologous proteins/genes within different species.	2020-02-05	https://gitlab.com/paulklemm_PHD/proteinortho	6.3.5	proteinortho	6.3.5	Up-to-date	Proteomics	Sequence clustering, Sequence analysis	Sequence clustering, Sequence analysis	Comparative genomics	Comparative genomics	iuc	https://gitlab.com/paulklemm_PHD/proteinortho	https://github.com/galaxyproject/tools-iuc/tree/main/tools/proteinortho	proteinortho	Proteinortho	Proteinortho is a tool to detect orthologous genes within different species		0	0	3	3	0	0	0	0	0	0	0	0	0	0	0	0	0	1	0	0	0	0	0	0	0	0	0	0	0	0	3	3	3	0	549	549	4314	4314	0	0	0	0	0	0	0	0	0	0	0	0	549	1647	4314	12942	True	False
pycoqc	pycoqc	QC metrics for ONT Basecalling	2021-03-02	https://github.com/tleonardi/pycoQC	2.5.2	pycoqc	2.5.2	Up-to-date	Nanopore	Sequencing quality control, Statistical calculation	Sequencing quality control, Statistical calculation	Sequence analysis, Data quality management, Sequencing	Sequence analysis, Data quality management, Sequencing	iuc	https://github.com/galaxyproject/tools-iuc/tree/master/tools/pycoqc	https://github.com/galaxyproject/tools-iuc/tree/main/tools/pycoqc	pycoqc	pycoQC	PycoQC computes metrics and generates interactive QC plots for Oxford Nanopore technologies sequencing data.		1	1	1	1	0	0	0	0	0	0	0	0	0	0	0	1	1	1	0	0	0	0	0	0	0	0	0	0	0	0	0	1	0	0	665	665	23072	23072	911	911	2798	2798	486	486	946	946	146	146	292	292	2208	6624	27108	81324	True	False
pygenometracks	pygenomeTracks	pyGenomeTracks: Standalone program and library to plot beautiful genome browser tracks.	2018-06-08	https://github.com/deeptools/pyGenomeTracks	3.8	pygenometracks	3.9	To update	Visualization	Visualisation, Formatting	Visualisation, Formatting	Model organisms, Imaging, Workflows	Model organisms, Imaging, Workflows	iuc	https://github.com/galaxyproject/tools-iuc/tree/master/tools/pygenometracks	https://github.com/galaxyproject/tools-iuc/tree/main/tools/pygenometracks	pygenometracks	pyGenomeTracks	reproducible plots for multivariate genomic data sets.Standalone program and library to plot beautiful genome browser tracks.pyGenomeTracks aims to produce high-quality genome browser tracks that are highly customizable. Currently, it is possible to plot:.		1	1	1	1	0	0	0	0	0	0	0	0	0	0	0	1	0	0	0	0	0	0	0	0	0	0	0	0	0	0	1	1	1	0	1147	1191	13678	14617	1204	1204	9770	9770	155	155	4012	4012	31	31	62	62	2537	7655	27522	83505	True	False
qiime2_dbotu_q2	qiime2_dbotu_q2	q2-dbotu is a Qiime 2 plugin for performing OTU clustering	2025-03-20	https://github.com/cduvallet/q2-dbotu/tree/master	2022.11.1+galaxy0			To update	Metagenomics	Demultiplexing, Visualisation, Taxonomic classification, Phylogenetic analysis, Sequencing quality control	Demultiplexing, Visualisation, Taxonomic classification, Phylogenetic analysis, Sequencing quality control	Microbial ecology, Phylogeny, Metatranscriptomics, Metagenomics	Microbial ecology, Phylogeny, Metatranscriptomics, Metagenomics	bgruening	https://github.com/bgruening/galaxytools/tree/master/tools/qiime2_dbotu_q2/	https://github.com/bgruening/galaxytools/tree/master/tools/qiime2_dbotu_q2	qiime2	QIIME 2	QIIME 2 is a next-generation microbiome bioinformatics platform that is extensible, free, open source, and community developed.		0	0	1	0	0	0	0	0	0	0	0	0	0	0	0	0	0	0	0	0	0	0	0	0	0	0	0	0	0	0	0	0	0	0	0	0	0	0	0	0	0	0	0	0	0	0	0	0	0	0	0	0	0	0	True	False
qualimap	qualimap_bamqc, qualimap_counts, qualimap_multi_bamqc, qualimap_rnaseq	Qualimap 2 is a platform-independent application written in Java andR that facilitates the quality control of alignment sequencing data and itsderivatives like feature counts.	2019-10-10	http://qualimap.bioinfo.cipf.es/	2.3	qualimap	2.3	Up-to-date	Sequence Analysis, Transcriptomics, SAM	Sequencing quality control	Sequencing quality control	Data quality management	Data quality management	iuc	https://github.com/galaxyproject/tools-iuc/tree/master/tools/qualimap	https://github.com/galaxyproject/tools-iuc/tree/main/tools/qualimap	qualimap	QualiMap	Platform-independent application written in Java and R that provides both a Graphical User Inteface (GUI) and a command-line interface to facilitate the quality control of alignment sequencing data.		4	4	4	4	0	0	0	0	0	0	0	0	0	0	0	0	4	4	0	0	0	0	0	1	0	0	0	0	0	0	4	4	4	0	3427	3520	703635	704758	4439	4450	109291	109374	876	876	37544	37544	48	48	6750	6750	8790	26474	857220	2572866	True	False
quast	quast	Quast (Quality ASsessment Tool) evaluates genome assemblies.	2016-09-07	http://quast.bioinf.spbau.ru/	5.3.0	quast	5.3.0	Up-to-date	Assembly	Visualisation, Sequence assembly validation	Visualisation, Sequence assembly validation	Sequence assembly	Sequence assembly	iuc	https://github.com/galaxyproject/tools-iuc/tree/master/tools/quast	https://github.com/galaxyproject/tools-iuc/tree/main/tools/quast	quast	QUAST	QUAST stands for QUality ASsessment Tool.  It evaluates a quality of genome assemblies by computing various metrics and providing nice reports.		1	1	1	1	0	0	0	0	0	0	0	0	0	0	0	1	1	1	0	0	0	0	0	1	0	0	0	0	0	0	1	1	1	0	8965	9298	91117	94741	11073	12385	66080	72394	4262	4551	38178	40828	463	465	8175	8213	24763	76225	203550	623276	True	False
quickmerge	quickmerge	Merge long-read and hybrid assemblies to increase contiguity	2022-07-08	https://github.com/mahulchak/quickmerge	0.3	quickmerge	0.3	Up-to-date	Assembly	Genome assembly, Scaffolding, De-novo assembly, Genotyping	Genome assembly, Scaffolding, De-novo assembly, Genotyping	Structural variation, Sequence assembly, DNA polymorphism, Whole genome sequencing, Genotype and phenotype	Structural variation, Sequence assembly, DNA polymorphism, Whole genome sequencing, Genotype and phenotype	iuc	https://github.com/galaxyproject/tools-iuc/tree/master/tools/quickmerge	https://github.com/galaxyproject/tools-iuc/tree/main/tools/quickmerge	quickmerge	quickmerge	Quickmerge is a program that uses complementary information from genomes assembled with long reads in order to improve contiguity, and works with assemblies derived from both Pacific Biosciences or Oxford Nanopore. Quickmerge will even work with hybrid assemblies made by combining long reads and Illumina short reads.		0	0	0	0	0	0	0	0	0	0	0	0	0	0	0	0	0	1	0	0	0	0	0	0	0	0	0	0	0	0	0	0	1	0	0	0	0	0	0	0	0	0	0	0	0	0	0	0	0	0	0	0	0	0	True	False
quicktree	quicktree	neighbour-joining phylogenetic inference	2024-11-21	https://github.com/khowe/quicktree	2.5	quicktree	2.5	Up-to-date	Phylogenetics	Phylogenetic inference (from molecular sequences)	Phylogenetic inference (from molecular sequences)	Phylogenetics	Phylogenetics	iuc	https://github.com/galaxyproject/tools-iuc/tree/master/tools/quicktree	https://github.com/galaxyproject/tools-iuc/tree/main/tools/quicktree	quicktree	QuickTree	QuickTree is an efficient implementation of the Neighbor-Joining algorithm (PMID: 3447015), capable of reconstructing phylogenies from huge alignments in time less than the age of the universe.		0	0	1	0	0	0	0	0	0	0	0	0	0	0	0	0	0	1	0	0	0	0	0	0	0	0	0	0	0	0	0	0	0	0	7	7	65	65	0	0	0	0	0	0	0	0	0	0	0	0	7	21	65	195	True	False
racon	racon	Consensus module for raw de novo DNA assembly of long uncorrected reads.	2018-06-11	https://github.com/isovic/racon	1.5.0	racon	1.5.0	Up-to-date	Sequence Analysis	Genome assembly, Mapping assembly	Genome assembly, Mapping assembly	Whole genome sequencing, Sequence assembly	Whole genome sequencing, Sequence assembly	bgruening	https://github.com/bgruening/galaxytools/tree/master/tools/racon	https://github.com/bgruening/galaxytools/tree/master/tools/racon	Racon	Racon	Consensus module for raw de novo DNA assembly of long uncorrected readsRacon is intended as a standalone consensus module to correct raw contigs generated by rapid assembly methods which do not include a consensus step. The goal of Racon is to generate genomic consensus which is of similar or better quality compared to the output generated by assembly methods which employ both error correction and consensus steps, while providing a speedup of several times compared to those methods. It supports data produced by both Pacific Biosciences and Oxford Nanopore Technologies.		1	1	1	1	0	0	0	0	0	0	0	0	0	0	0	0	0	1	0	0	0	0	0	0	0	0	0	0	0	0	1	1	1	0	942	975	29815	30641	572	572	16335	16335	193	193	6569	6569	27	27	239	239	1734	5235	52958	159700	True	False
rasusa	rasusa	Randomly subsample sequencing reads to a specified coverage	2024-02-16	https://github.com/mbhall88/rasusa	2.0.0	rasusa	2.1.0	To update	Sequence Analysis	Sequence assembly validation, Sequencing quality control	Sequence assembly validation	Genomics, Sequence analysis, Sequence assembly, Sequencing, RNA-Seq	Genomics, Sequence analysis, Sequence assembly, RNA-Seq	iuc	https://github.com/galaxyproject/tools-iuc/tree/master/tools/rasusa	https://github.com/galaxyproject/tools-iuc/tree/main/tools/rasusa	rasusa	rasusa	Rasusa: Randomly subsample sequencing reads to aspecified coverageProduces an unbiased subsample of your reads		0	0	1	1	0	0	0	0	0	0	0	0	0	0	0	0	0	0	0	0	0	0	0	0	0	0	0	0	0	0	0	0	0	0	13	13	71	71	0	0	0	0	0	0	0	0	0	0	0	0	13	39	71	213	True	False
raxml	raxml	RAxML - A Maximum Likelihood based phylogenetic inference	2015-11-05	http://www.exelixis-lab.org/web/software/raxml/	8.2.12	raxml	8.2.13	To update	Phylogenetics	Sequence analysis, Phylogenetic tree analysis	Sequence analysis	Phylogenetics, Sequence analysis	Phylogenetics	iuc	https://github.com/galaxyproject/tools-iuc/tree/master/tools/raxml	https://github.com/galaxyproject/tools-iuc/tree/main/tools/raxml	raxml	RAxML	A tool for Phylogenetic Analysis and Post-Analysis of Large Phylogenies.		1	1	1	1	0	0	0	0	0	0	0	0	0	0	0	1	0	1	0	0	0	0	0	0	0	0	0	0	0	0	1	1	1	0	1139	1139	13457	13457	759	759	10784	10800	740	933	5201	6560	14	14	222	222	2652	8149	29664	90367	True	False
read_it_and_keep	read_it_and_keep	Rapid decontamination of SARS-CoV-2 sequencing reads	2022-01-28	https://github.com/GenomePathogenAnalysisService/read-it-and-keep	0.2.2	read-it-and-keep	0.3.0	To update	Sequence Analysis	Filtering, Genome alignment	Filtering, Genome alignment	Pathology, Genomics	Pathology, Genomics	iuc	https://github.com/galaxyproject/tools-iuc/tree/master/tools/read-it-and-keep	https://github.com/galaxyproject/tools-iuc/tree/main/tools/read_it_and_keep	read_it_and_keep	read_it_and_keep	Read-it-and-keep is a bioinformatics tool designed to filter and extract sequencing reads according to user-defined criteria, such as the presence of specific motifs or coverage of regions of interest. This type of filtering can be particularly useful for targeted analyses, where only relevant sequences are retained for further study, optimising computing and storage resources.		1	0	1	0	0	0	0	0	0	0	0	0	0	0	0	0	0	1	0	0	0	0	0	0	0	0	0	0	0	0	0	1	0	0	81	81	3777	3777	7	7	8	8	0	0	0	0	0	0	0	0	88	264	3785	11355	True	False
reago	reago	Reago is tool to assembly 16S ribosomal RNA recovery from metagenomic data.	2015-12-09	https://github.com/chengyuan/reago-1.1	1.1	reago	1.1	Up-to-date	Metagenomics, RNA	Sequence assembly	Sequence assembly	Sequence assembly, RNA, Metagenomics, Microbiology	Sequence assembly, RNA, Metagenomics, Microbiology	rnateam	https://github.com/bgruening/galaxytools/tree/master/tools/rna_tools/reago	https://github.com/bgruening/galaxytools/tree/master/tools/rna_tools/reago	reago	REAGO	This is an assembly tool for 16S ribosomal RNA recovery from metagenomic data.		0	0	1	0	0	0	0	0	0	0	0	0	0	0	0	0	0	0	0	0	0	0	0	0	0	0	0	0	0	0	0	0	0	0	1	1	1	1	0	0	0	0	0	0	0	0	0	0	0	0	1	3	1	3	True	False
recentrifuge	recentrifuge	"""With Recentrifuge, researchers can analyze results from taxonomic classifiers using interactive charts with emphasis on the confidence level of the classifications.In addition to contamination-subtracted samples.Recentrifuge provides shared and exclusive taxa per sample,thus enabling robust contamination removal and comparative analysis in environmental and clinical metagenomics."""	2022-05-04	https://github.com/khyox/recentrifuge	1.16.1	recentrifuge	1.16.1	Up-to-date	Metagenomics	Taxonomic classification, Expression analysis, Cross-assembly	Taxonomic classification, Expression analysis, Cross-assembly	Metagenomics, Microbial ecology, Metagenomic sequencing	Metagenomics, Microbial ecology, Metagenomic sequencing	iuc	https://github.com/galaxyproject/tools-iuc/blob/master/tools/recentrifuge	https://github.com/galaxyproject/tools-iuc/tree/main/tools/recentrifuge	Recentrifuge	Recentrifuge	Robust comparative analysis and contamination removal for metagenomics.		1	1	1	1	0	0	0	0	0	0	0	0	0	0	0	1	0	1	0	0	0	0	0	0	0	0	0	0	0	0	0	1	0	0	187	187	792	792	100	100	259	259	23	23	52	52	20	20	1374	1374	330	990	2477	7431	True	False
repeatexplorer2	repeatexplorer_clustering	Tool for annotation of repeats from unassembled shotgun reads.	2023-11-01	https://github.com/repeatexplorer/repex_tarean	2.3.8			To update	Genome annotation					gga	https://github.com/galaxy-genome-annotation/galaxy-tools/tree/master/tools/repeatexplorer2	https://github.com/galaxy-genome-annotation/galaxy-tools/tree/master/tools/repeatexplorer2					0	0	1	0	0	0	0	0	0	0	0	0	0	0	0	0	0	0	0	0	0	0	0	0	0	0	0	0	0	0	0	0	0	0	61	61	225	225	0	0	0	0	0	0	0	0	0	0	0	0	61	183	225	675	True	False
roary	roary	Roary the pangenome pipeline	2017-06-21	https://sanger-pathogens.github.io/Roary/	3.13.0	roary	3.13.0	Up-to-date	Sequence Analysis	Genome assembly	Genome assembly	DNA, Genomics, Mapping	DNA, Genomics, Mapping	iuc	https://github.com/galaxyproject/tools-iuc/tree/master/tools/roary	https://github.com/galaxyproject/tools-iuc/tree/main/tools/roary	roary	Roary	A high speed stand alone pan genome pipeline, which takes annotated assemblies in GFF3 format (produced by Prokka (Seemann, 2014)) and calculates the pan genome.		1	1	1	1	0	0	0	0	0	0	0	0	0	0	0	0	0	1	0	0	0	0	0	0	0	0	0	0	0	0	1	1	1	0	1728	1804	16888	18042	2070	2070	14013	14013	573	626	5106	6163	41	41	139	139	4412	13365	36146	110649	True	False
rrna	meta_rna	Identification of ribosomal RNA genes in metagenomic fragments.	2015-02-28	http://weizhong-lab.ucsd.edu/meta_rna/	0.1	hmmsearch3.0		To update	RNA					rnateam	https://github.com/bgruening/galaxytools/tree/master/tools/rRNA	https://github.com/bgruening/galaxytools/tree/master/tools/rna_tools/rRNA					0	0	0	0	0	0	0	0	0	0	0	0	0	0	0	0	0	0	0	0	0	0	0	0	0	0	0	0	0	0	0	0	0	0	0	0	0	0	0	0	0	0	0	0	0	0	0	0	0	0	0	0	0	0	True	False
rseqc	rseqc_FPKM_count, rseqc_RNA_fragment_size, rseqc_RPKM_saturation, rseqc_bam2wig, rseqc_bam_stat, rseqc_clipping_profile, rseqc_deletion_profile, rseqc_geneBody_coverage, rseqc_geneBody_coverage2, rseqc_infer_experiment, rseqc_inner_distance, rseqc_insertion_profile, rseqc_junction_annotation, rseqc_junction_saturation, rseqc_mismatch_profile, rseqc_read_GC, rseqc_read_NVC, rseqc_read_distribution, rseqc_read_duplication, rseqc_read_hexamer, rseqc_read_quality, rseqc_tin	an RNA-seq quality control package	2017-02-27	https://code.google.com/p/rseqc/	5.0.3	rseqc	5.0.4	To update	Convert Formats, Sequence Analysis, RNA, Transcriptomics, Visualization	Data handling	Data handling	Sequencing	Sequencing	nilesh	https://github.com/galaxyproject/tools-iuc/tree/master/tools/rseqc	https://github.com/galaxyproject/tools-iuc/tree/main/tools/rseqc	rseqc	RSeQC	Provides a number of useful modules that can comprehensively evaluate high throughput sequence data especially RNA-seq data. Some basic modules quickly inspect sequence quality, nucleotide composition bias, PCR bias and GC bias, while RNA-seq specific modules evaluate sequencing saturation, mapped reads distribution, coverage uniformity, strand specificity, transcript level RNA integrity etc.		22	22	22	22	0	0	0	0	0	0	0	0	0	0	0	22	0	0	0	0	0	0	0	22	0	0	0	0	0	0	22	22	22	0	9037	10464	149222	164718	11267	14066	141933	179278	1871	1999	26252	28021	1496	1496	43650	43650	23671	75367	361057	1137781	True	False
