lca_wrapper	lca1	Find lowest diagnostic rank	2014-01-27	https://bitbucket.org/natefoo/taxonomy	1.0.1	taxonomy	0.10.1	To update	Metagenomics					devteam	https://github.com/galaxyproject/tools-devteam/tree/master/tool_collections/taxonomy/lca_wrapper	https://github.com/galaxyproject/tools-devteam/tree/main/tool_collections/taxonomy/lca_wrapper					0	0	1	0	0	0	0	0	0	0	0	0	0	0	0	0	0	0	0	0	0	0	0	0	0	0	0	0	0	0	1	1	1	0	4	20	68	137	14	1112	112	6136	0	0	0	0	0	0	0	0	18	1168	180	6633	True	False
legsta	legsta	Performs in silico Legionella pneumophila sequence based typing.	2022-02-21	https://github.com/tseemann/legsta	0.5.1	legsta	0.5.1	Up-to-date	Sequence Analysis	Sequence analysis	Sequence analysis	Public health and epidemiology	Public health and epidemiology	iuc	https://github.com/tseemann/legsta	https://github.com/galaxyproject/tools-iuc/tree/main/tools/legsta	legsta	legsta	Performs in silico Legionella pneumophila sequence based typing		0	0	1	0	0	0	0	0	0	0	0	0	0	0	0	0	0	0	0	0	0	0	0	0	0	0	0	0	0	0	0	1	0	0	9	9	103	103	0	0	0	0	0	0	0	0	0	0	0	0	9	27	103	309	True	False
lighter	lighter	Lighter is a kmer-based error correction method for whole genome sequencing data	2016-06-04	https://github.com/mourisl/Lighter	1.0	lighter	1.1.3	To update	Sequence Analysis, Fasta Manipulation	k-mer counting, Sequence read processing, Sequencing quality control, Sequencing error detection	k-mer counting, Sequence read processing, Sequencing quality control, Sequencing error detection	Sequencing, Whole genome sequencing, DNA, Genomics	Whole genome sequencing, DNA, Genomics	bgruening	https://github.com/bgruening/galaxytools/tree/master/tools/lighter	https://github.com/bgruening/galaxytools/tree/master/tools/lighter	lighter	Lighter	Kmer-based error correction method for whole genome sequencing data. Lighter uses sampling (rather than counting) to obtain a set of kmers that are likely from the genome. Using this information, Lighter can correct the reads containing sequence errors.		0	0	1	1	0	0	0	0	0	0	0	0	0	0	0	0	0	0	0	0	0	0	0	0	0	0	0	0	0	0	0	1	1	0	29	32	144	180	0	0	0	0	0	0	0	0	0	0	0	0	29	90	144	468	True	False
limma_voom	limma_voom	Perform RNA-Seq differential expression analysis using limma voom pipeline	2017-05-24	http://bioconductor.org/packages/release/bioc/html/limma.html	3.58.1	bioconductor-limma	3.62.1	To update	Transcriptomics, RNA, Statistics	RNA-Seq analysis	RNA-Seq analysis	Molecular biology, Genetics	Molecular biology, Genetics	iuc	https://github.com/galaxyproject/tools-iuc/tree/master/tools/limma_voom	https://github.com/galaxyproject/tools-iuc/tree/main/tools/limma_voom	limma	limma	Data analysis, linear models and differential expression for microarray data.		1	1	1	1	0	0	0	0	0	0	0	0	0	0	0	0	0	0	0	0	0	0	0	0	0	0	0	0	0	0	1	1	1	0	2653	2800	25289	26939	4842	5568	48656	54386	923	947	9863	10425	22	22	289	289	8440	26217	84097	260233	True	False
lineagespot	lineagespot	Identification of SARS-CoV-2 related metagenomic mutations based on a single (or a list of) variant(s) file(s)	2023-07-04	https://www.bioconductor.org/packages/release/bioc/html/lineagespot.html	1.6.0	r-base		To update	Metagenomics, Sequence Analysis	Variant calling	Variant calling	Metagenomics, Gene transcripts, Evolutionary biology, Sequencing, Genetic variation	Metagenomics, Gene transcripts, Evolutionary biology, Sequencing, Genetic variation	iuc	https://github.com/galaxyproject/tools-iuc/tree/master/tools/lineagespot	https://github.com/galaxyproject/tools-iuc/tree/main/tools/lineagespot	lineagespot	lineagespot	Lineagespot is a framework written in R, and aims to identify and assign different SARS-CoV-2 lineages based on a single variant file (i.e., variant calling format).		0	0	1	0	0	0	0	0	0	0	0	0	0	0	0	0	0	0	0	0	0	0	0	0	0	0	0	0	0	0	0	1	0	0	4	4	39	39	0	0	0	0	0	0	0	0	0	0	0	0	4	12	39	117	True	False
logol	logol_wrapper	Logol is a pattern matching grammar language and a set of tools to search a pattern in a sequence	2018-06-06	http://logol.genouest.org/web/app.php/logol	1.7.8	logol	1.7.8	Up-to-date	Sequence Analysis					genouest	https://github.com/genouest/galaxy-tools/tree/master/tools/logol	https://github.com/genouest/galaxy-tools/tree/master/tools/logol					0	0	0	0	0	0	0	0	0	0	0	0	0	0	0	0	0	0	0	0	0	0	0	0	0	0	0	0	0	0	0	0	0	0	0	0	0	0	0	0	0	0	0	0	0	0	0	0	0	0	0	0	0	0	True	False
longorf	longORF	obtain longest ORF in six-frame translations	2018-06-01		0.3.0			To update	Sequence Analysis					mbernt	https://github.com/bernt-matthias/mb-galaxy-tools/blob/master/tools/longorf/	https://github.com/Helmholtz-UFZ/galaxy-tools/tree/main/tools/longorf					0	0	0	0	0	0	0	0	0	0	0	0	0	0	0	0	0	0	0	0	0	0	0	0	0	0	0	0	0	0	0	0	0	0	0	0	0	0	0	0	0	0	0	0	0	0	0	0	0	0	0	0	0	0	True	False
lorikeet_spoligotype	lorikeet_spoligotype	Tools for M. tuberculosis DNA fingerprinting (spoligotyping)	2018-05-07	https://github.com/AbeelLab/lorikeet	20	lorikeet	20	Up-to-date	Sequence Analysis	Sequence analysis, Genotyping	Sequence analysis, Genotyping	Genotype and phenotype	Genotype and phenotype	iuc	https://github.com/AbeelLab/lorikeet	https://github.com/galaxyproject/tools-iuc/tree/main/tools/lorikeet	lorikeet	lorikeet	Tools for M. tuberculosis DNA fingerprinting (spoligotyping)		0	0	1	0	0	0	0	0	0	0	0	0	0	0	0	0	0	0	0	0	0	0	0	0	0	0	0	0	0	0	0	1	0	0	16	16	903	903	0	0	0	0	0	0	0	0	0	0	0	0	16	48	903	2709	True	False
lotus2	lotus2	LotuS2 OTU processing pipeline	2021-05-13	https://lotus2.earlham.ac.uk/	2.32	lotus2	2.34.1	To update	Metagenomics	Sequence feature detection, DNA barcoding	Sequence feature detection, DNA barcoding	Metagenomics, Taxonomy, Microbial ecology	Metagenomics, Taxonomy, Microbial ecology	earlhaminst	https://github.com/TGAC/earlham-galaxytools/tree/main/tools/lotus2	https://github.com/TGAC/earlham-galaxytools/tree/main/tools/lotus2	lotus2	lotus2	LotuS2 is a lightweight and user-friendly pipeline that is fast, precise, and streamlined, using extensive pre- and post-ASV/OTU clustering steps to further increase data quality. High data usage rates and reliability enable high-throughput microbiome analysis in minutes.		0	1	1	1	0	0	0	0	0	0	0	0	0	0	0	0	0	0	0	0	0	0	0	0	0	0	0	0	0	0	1	1	0	0	202	202	1566	1566	0	0	0	0	14	14	181	181	0	0	0	0	216	648	1747	5241	True	False
m6anet	m6anet	m6anet to detect m6A RNA modifications from nanopore data	2023-10-25	https://m6anet.readthedocs.io/en/latest	2.1.0	m6anet	2.1.0	Up-to-date	Sequence Analysis	Quantification, Imputation, Gene expression profiling	Quantification, Imputation, Gene expression profiling	RNA-Seq, Transcriptomics, RNA, Machine learning	RNA-Seq, Transcriptomics, RNA, Machine learning	iuc	https://github.com/galaxyproject/tools-iuc/tree/master/tools/m6anet	https://github.com/galaxyproject/tools-iuc/tree/main/tools/m6anet	m6Anet	m6Anet	Detection of m6A from direct RNA sequencing using a Multiple Instance Learning framework.		0	0	1	0	0	0	0	0	0	0	0	0	0	0	0	0	0	0	0	0	0	0	0	0	0	0	0	0	0	0	0	0	1	0	11	11	44	44	0	0	0	0	0	0	0	0	0	0	0	0	11	33	44	132	True	False
maaslin2	maaslin2	MaAsLin2 is comprehensive R package for efficiently determining multivariable association between microbial meta'omic features and clinical metadata.	2021-11-05	http://huttenhower.sph.harvard.edu/maaslin	1.18.0	bioconductor-maaslin2	1.18.0	Up-to-date	Metagenomics	Filtering, Statistical calculation, Standardisation and normalisation, Visualisation	Filtering, Standardisation and normalisation, Visualisation	Metagenomics, Statistics and probability	Metagenomics, Statistics and probability	iuc	https://github.com/biobakery/Maaslin2	https://github.com/galaxyproject/tools-iuc/tree/main/tools/maaslin2	maaslin2	MaAsLin2	MaAsLin2 is comprehensive R package for efficiently determining multivariable association between phenotypes, environments, exposures, covariates and microbial metaomic features. MaAsLin2 relies on general linear models to accommodate most modern epidemiological study designs, including cross-sectional and longitudinal, and offers a variety of data exploration, normalization, and transformation methods.		0	0	1	1	0	0	0	0	0	0	0	0	0	0	0	0	0	0	0	0	0	0	0	0	0	0	0	0	0	0	0	1	0	0	73	73	3109	3109	0	0	0	0	0	0	0	0	0	0	0	0	73	219	3109	9327	True	False
mafft	rbc_mafft_add, rbc_mafft	Multiple alignment program for amino acid or nucleotide sequences	2015-06-16	https://mafft.cbrc.jp/alignment/software/	7.526	mafft	7.525	To update	RNA	Multiple sequence alignment	Multiple sequence alignment	Sequence analysis	Sequence analysis	rnateam	https://github.com/bgruening/galaxytools/tree/master/tools/mafft	https://github.com/bgruening/galaxytools/tree/master/tools/mafft	MAFFT	MAFFT	MAFFT (Multiple Alignment using Fast Fourier Transform) is a high speed multiple sequence alignment program.		2	2	2	2	0	0	0	0	0	0	0	0	0	0	0	1	0	2	0	0	0	0	0	2	0	0	0	0	0	0	2	2	2	0	2260	2371	188287	190662	4700	6141	114726	130987	1134	1265	21429	22090	156	156	1783	1783	8250	26433	326225	997972	True	False
make_nr	make_nr	Make a FASTA file non-redundant	2018-11-06	https://github.com/peterjc/galaxy_blast/tree/master/tools/make_nr	0.0.3	biopython	1.70	To update	Fasta Manipulation, Sequence Analysis	Sequence alignment, Genome annotation	Sequence alignment, Genome annotation	Molecular biology, Sequence analysis	Molecular biology, Sequence analysis	peterjc	https://github.com/peterjc/galaxy_blast/tree/master/tools/make_nr	https://github.com/peterjc/galaxy_blast/tree/master/tools/make_nr	make_nr	make_nr	Make a FASTA file non-redundant, with a Galaxy wrapperThis tool is copyright 2018 by Peter Cock, The James Hutton Institute, UK. All rights reserved.This tool is a short Python script intended to be run prior to calling the NCBI BLAST+ command line tool makeblastdb or in other settings where you want to collapse duplicated sequences in a FASTA file to a single representative.		0	0	0	0	0	0	0	0	0	0	0	0	0	0	0	0	0	0	0	0	0	0	0	0	0	0	0	0	0	0	0	0	0	0	0	0	0	0	0	0	0	0	0	0	0	0	0	0	0	0	0	0	0	0	True	False
maker	maker, maker_map_ids	MAKER is a portable and easily configurable genome annotation pipeline.Its purpose is to allow smaller eukaryotic and prokaryotic genome projects to independently annotate their genomes and to create genome databases.	2017-10-04	http://www.yandell-lab.org/software/maker.html	2.31.11	maker	3.01.03	To update	Sequence Analysis	Genome annotation	Genome annotation	Genomics, DNA, Sequence analysis	Genomics, DNA, Sequence analysis	iuc	https://github.com/galaxyproject/tools-iuc/tree/master/tools/maker	https://github.com/galaxyproject/tools-iuc/tree/main/tools/maker	maker	MAKER	Portable and easily configurable genome annotation pipeline. Its purpose is to allow smaller eukaryotic and prokaryotic genome projects to independently annotate their genomes and to create genome databases.		2	2	2	2	0	0	0	0	0	0	0	0	0	0	0	0	0	1	0	0	0	0	0	0	0	0	0	0	0	0	2	2	2	0	1460	1564	6686	7557	2048	2048	9650	9650	930	930	4410	4410	28	28	129	129	4466	13502	20875	63496	True	False
mapseq	mapseq	fast and accurate sequence read classification tool designed to assign taxonomy and OTU classifications to ribosomal RNA sequences.	2023-08-02	https://github.com/jfmrod/MAPseq	2.1.1b	perl		To update	Metagenomics	k-mer counting	k-mer counting	Functional, regulatory and non-coding RNA, Sequence analysis, Sequence sites, features and motifs	Functional, regulatory and non-coding RNA, Sequence analysis, Sequence sites, features and motifs	iuc	https://github.com/galaxyproject/tools-iuc/tree/master/tools/mapseq	https://github.com/galaxyproject/tools-iuc/tree/main/tools/mapseq	mapseq	MAPseq	Highly efficient k-mer search with confidence estimates, for rRNA sequence analysis .		1	0	1	0	0	0	0	0	0	0	0	0	0	0	0	0	0	1	0	0	0	0	0	0	0	0	0	0	0	0	0	1	0	0	48	48	9212	9212	4	4	17	17	0	0	0	0	0	0	0	0	52	156	9229	27687	True	False
marine_omics	sanntis_marine	The Sanntis tool identify biosynthetic gene clusters (BGCs) in genomic & metagenomic data	2024-07-26	https://github.com/Finn-Lab/SanntiS	0.9.3.5	sanntis	0.9.4.1	To update	Ecology					ecology	https://github.com/galaxyecology/tools-ecology/tree/master/tools/marine_omics	https://github.com/galaxyecology/tools-ecology/tree/master/tools/marine_omics					0	1	1	0	0	0	0	0	0	0	0	0	0	0	0	0	0	0	0	0	0	0	0	0	0	0	0	0	0	0	0	0	0	0	7	7	67	67	0	0	0	0	2	2	42	42	0	0	0	0	9	27	109	327	True	False
mash	mash_screen, mash_sketch	Fast genome and metagenome distance estimation using MinHash	2018-12-07	https://github.com/marbl/Mash	2.3	mash	2.3	Up-to-date	Metagenomics	Sequence distance matrix generation	Sequence distance matrix generation	Genomics, Metagenomics, Statistics and probability, Sequence analysis, DNA mutation	Metagenomics, Statistics and probability, Sequence analysis, DNA mutation	iuc	https://github.com/galaxyproject/tools-iuc/tree/master/tools/mash	https://github.com/galaxyproject/tools-iuc/tree/main/tools/mash	mash	Mash	Fast genome and metagenome distance estimation using MinHash.		2	2	2	2	0	0	0	0	0	0	0	0	0	0	0	0	0	2	0	0	0	0	0	0	0	0	0	0	0	0	2	2	2	0	64	64	10171	10171	12	12	333	333	12	12	1980	1980	2	2	21	21	90	270	12505	37515	True	False
maxbin2	maxbin2	clusters metagenomic contigs into bins	2019-10-24	https://downloads.jbei.org/data/microbial_communities/MaxBin/MaxBin.html		maxbin2	2.2.7	To update	Metagenomics	Sequence assembly	Sequence assembly	Metagenomics, Sequence assembly, Microbiology	Metagenomics, Sequence assembly, Microbiology	mbernt	https://github.com/galaxyproject/tools-iuc/tree/master/tools/maxbin2/	https://github.com/galaxyproject/tools-iuc/tree/main/tools/maxbin2	maxbin	MaxBin	Software for binning assembled metagenomic sequences based on an Expectation-Maximization algorithm.		1	1	1	1	0	0	0	0	0	0	0	0	0	0	0	0	0	1	0	0	0	0	0	0	0	0	0	0	1	0	1	1	1	0	360	366	3368	3444	568	572	2616	2625	91	91	1002	1002	4	4	620	620	1023	3079	7606	22903	True	False
maxquant	maxquant, maxquant_mqpar	wrapper for MaxQuant	2015-01-24	https://www.maxquant.org/	2.0.3.0	maxquant	2.0.3.0	Up-to-date	Proteomics	Imputation, Visualisation, Protein quantification, Statistical calculation, Standardisation and normalisation, Heat map generation, Clustering, Principal component plotting	Imputation, Visualisation, Protein quantification, Standardisation and normalisation, Heat map generation, Clustering	Proteomics experiment, Proteomics, Statistics and probability	Proteomics experiment, Proteomics, Statistics and probability	galaxyp	https://github.com/galaxyproteomics/tools-galaxyp/tree/master/tools/maxquant	https://github.com/galaxyproteomics/tools-galaxyp/tree/master/tools/maxquant	maxquant	MaxQuant	Quantitative proteomics software package designed for analyzing large mass-spectrometric data sets. It is specifically aimed at high-resolution MS data.		2	2	2	2	0	0	0	0	0	0	0	0	0	0	0	0	2	0	0	0	0	0	0	0	0	0	0	0	0	0	2	2	2	0	1600	1629	7822	8085	672	672	3257	3257	377	377	3472	3472	0	0	0	0	2649	7976	14551	43916	True	False
mcl	mcl	The Markov Cluster Algorithm, a cluster algorithm for graphs	2022-05-12	https://micans.org/mcl/man/mcl.html	22.282	mcl	22.282	Up-to-date	Sequence Analysis	Clustering, Network analysis, Gene regulatory network analysis	Clustering, Gene regulatory network analysis	Molecular interactions, pathways and networks	Molecular interactions, pathways and networks	iuc	https://github.com/galaxyproject/tools-iuc/tree/master/mcl	https://github.com/galaxyproject/tools-iuc/tree/main/tools/mcl	mcl	MCL	MCL is a clustering algorithm widely used in bioinformatics and gaining traction in other fields.		0	0	1	0	0	0	0	0	0	0	0	0	0	0	0	0	0	0	0	0	0	0	0	0	0	0	0	0	0	0	0	1	1	0	18	18	153	153	0	0	0	0	0	0	0	0	0	0	0	0	18	54	153	459	True	False
medaka	medaka_consensus, medaka_consensus_pipeline, medaka_snp, medaka_variant	Sequence correction provided by ONT Research	2020-02-23	https://github.com/nanoporetech/medaka	1.7.2	medaka	2.0.1	To update	Sequence Analysis	Base-calling, Variant calling, Sequence assembly	Base-calling, Variant calling, Sequence assembly	Sequence assembly, Machine learning	Sequence assembly, Machine learning	iuc	https://github.com/galaxyproject/tools-iuc/tree/master/tools/medaka	https://github.com/galaxyproject/tools-iuc/tree/main/tools/medaka	medaka	Medaka	medaka is a tool to create consensus sequences and variant calls from nanopore sequencing data. This task is performed using neural networks applied a pileup of individual sequencing reads against a draft assembly.		3	3	3	3	0	0	0	0	0	0	0	0	0	0	0	0	0	3	0	0	0	0	0	2	0	0	0	0	0	0	3	3	3	0	1895	1895	126369	126369	980	980	59930	59930	708	708	10431	10431	43	43	2510	2510	3626	10878	199240	597720	True	False
megahit	megahit	An ultra-fast single-node solution for large and complex metagenomics assembly via succinct de Bruijn graph.	2017-09-22	https://github.com/voutcn/megahit	1.2.9	megahit	1.2.9	Up-to-date	Sequence Analysis, Assembly, Metagenomics	Genome assembly	Genome assembly	Metagenomics, Sequencing, Ecology, Sequence assembly	Metagenomics, Sequencing, Sequence assembly	iuc	https://github.com/galaxyproject/tools-iuc/tree/master/tools/megahit	https://github.com/galaxyproject/tools-iuc/tree/main/tools/megahit	megahit	MEGAHIT	Single node assembler for large and complex metagenomics NGS reads, such as soil. It makes use of succinct de Bruijn graph to achieve low memory usage, whereas its goal is not to make memory usage as low as possible.		1	1	1	1	0	0	0	0	0	0	0	0	0	0	0	1	1	1	0	0	0	0	0	1	0	0	0	0	1	0	1	1	1	0	1635	1720	14667	16136	2453	2464	19200	19231	506	506	7542	7542	31	31	1147	1147	4625	13971	42556	129168	True	False
megahit_contig2fastg	megahit_contig2fastg	A subprogram within the Megahit toolkit for converting contigs to assembly graphs (fastg)	2018-11-09	https://github.com/voutcn/megahit/blob/master/tools/toolkit.cpp	1.1.3	megahit	1.2.9	To update	Sequence Analysis, Assembly, Metagenomics	Genome assembly	Genome assembly	Metagenomics, Sequencing, Ecology, Sequence assembly	Metagenomics, Sequencing, Sequence assembly	iuc	https://github.com/galaxyproject/tools-iuc/tree/master/tools/megahit_contig2fastg	https://github.com/galaxyproject/tools-iuc/tree/main/tools/megahit_contig2fastg	megahit	MEGAHIT	Single node assembler for large and complex metagenomics NGS reads, such as soil. It makes use of succinct de Bruijn graph to achieve low memory usage, whereas its goal is not to make memory usage as low as possible.		1	1	1	1	0	0	0	0	0	0	0	0	0	0	0	0	0	1	0	0	0	0	0	1	0	0	0	0	0	0	0	1	1	0	171	175	566	619	67	67	188	188	17	17	76	76	3	3	44	44	258	778	874	2675	True	False
megan	megan_blast2lca, megan_blast2rma, megan_daa2info, megan_daa2rma, megan_daa_meganizer, megan_read_extractor, megan_sam2rma	MEGAN Community Edition - Interactive exploration and analysis of large-scale microbiome sequencing data.  MEGAN is a tool for studying the taxonomic content of a set of DNA reads, typically collected in a metagenomics project.In a preprocessing step, a sequence alignment of all reads against a suitable database of reference DNA or proteinsequences must be performed to produce an input file for the program. MEGAN is suitable for DNA reads (metagenomedata), RNA reads (metatranscriptome data), peptide sequences (metaproteomics data) and, using a suitable synonymsfile that maps SILVA ids to taxon ids, for 16S rRNA data (amplicon sequencing).	2021-11-24	https://github.com/husonlab/megan-ce	6.21.7	megan	6.25.10	To update	Sequence Analysis	Sequence analysis, Taxonomic classification	Sequence analysis, Taxonomic classification	Sequence analysis	Sequence analysis	iuc	https://github.com/galaxyproject/tools-iuc/tree/master/tools/megan	https://github.com/galaxyproject/tools-iuc/tree/main/tools/megan	megan	MEGAN	Metagenome Analysis Software - MEGAN (MEtaGenome ANalyzer) is a new computer program that allows laptop analysis of large metagenomic datasets. In a preprocessing step, the set of DNA reads (or contigs) is compared against databases of known sequences using BLAST or another comparison tool. MEGAN can then be used to compute and interactively explore the taxonomical content of the dataset, employing the NCBI taxonomy to summarize and order the results.		0	1	7	7	0	0	0	0	0	0	0	0	0	0	0	0	0	0	0	0	0	0	0	0	0	0	0	0	0	0	0	7	0	0	507	507	4619	4619	0	0	0	0	0	0	0	0	0	0	0	0	507	1521	4619	13857	True	False
meningotype	meningotype	Assign sequence type to N. meningitidis genome assemblies	2023-06-06	https://github.com/MDU-PHL/meningotype	0.8.5	meningotype	0.8.5	Up-to-date	Sequence Analysis	Genotyping, Multilocus sequence typing	Multilocus sequence typing	Microbiology, Genotype and phenotype	Microbiology, Genotype and phenotype	iuc	https://github.com/galaxyproject/tools-iuc/tree/master/tools/meningotype	https://github.com/galaxyproject/tools-iuc/tree/main/tools/meningotype	meningotype	meningotype	In silico typing of Neisseria meningitidis contigs.		0	0	0	0	0	0	0	0	0	0	0	0	0	0	0	0	0	0	0	0	0	0	0	0	0	0	0	0	0	0	0	0	0	0	0	0	0	0	0	0	0	0	0	0	0	0	0	0	0	0	0	0	0	0	True	False
merqury	merqury, merquryplot	Merqury is a tool for evaluating genomes assemblies based of k-mer operations.	2021-04-18	https://github.com/marbl/merqury	1.3	merqury	1.3	Up-to-date	Assembly	Genome assembly, k-mer counting, Scaffolding, Phasing, De-novo assembly	Genome assembly, k-mer counting, Scaffolding, Phasing, De-novo assembly	Sequence assembly, Whole genome sequencing, Plant biology	Sequence assembly, Whole genome sequencing, Plant biology	iuc	https://github.com/galaxyproject/tools-iuc/tree/master/tools/merqury	https://github.com/galaxyproject/tools-iuc/tree/main/tools/merqury	merqury	Merqury	Reference-free quality, completeness, and phasing assessment for genome assemblies.Evaluate genome assemblies with k-mers and more.Often, genome assembly projects have illumina whole genome sequencing reads available for the assembled individual.Merqury provides a set of tools for this purpose.		2	2	2	2	0	0	0	0	0	0	0	0	0	0	0	0	0	0	0	0	0	0	0	0	0	0	0	0	0	0	0	2	0	0	561	561	3593	3593	239	239	1048	1048	190	190	1523	1523	88	88	396	396	1078	3234	6560	19680	True	False
meryl	meryl_arithmetic_kmers, meryl_count_kmers, meryl_filter_kmers, meryl_groups_kmers, meryl_histogram_kmers, meryl_print, meryl_trio_mode	Meryl a k-mer counter.	2021-04-05	https://github.com/marbl/meryl	1.3	merqury	1.3	Up-to-date	Assembly	k-mer counting	k-mer counting	Whole genome sequencing, Genomics, Sequence analysis, Sequencing	Whole genome sequencing, Genomics, Sequence analysis	iuc	https://github.com/galaxyproject/tools-iuc/tree/master/tools/meryl	https://github.com/galaxyproject/tools-iuc/tree/main/tools/meryl	meryl	Meryl	Meryl is a tool for counting and working with sets of k-mers that was originally developed for use in the Celera Assembler and has since been migrated and maintained as part of Canu.		7	0	7	0	0	0	0	0	0	0	0	0	0	0	0	0	0	0	0	0	0	0	0	0	0	0	0	0	0	0	0	0	0	0	1	1	2	2	38	38	209	209	0	0	0	0	0	0	0	0	39	117	211	633	True	False
metabat2	metabat2_jgi_summarize_bam_contig_depths, metabat2	MetaBAT2 (Metagenome Binning based on Abundance and Tetranucleotide frequency) is an automated metagenome binningsoftware that integrates empirical probabilistic distances of genome abundance and tetranucleotide frequency.	2022-01-28	https://bitbucket.org/berkeleylab/metabat/src/master/	2.17	metabat2	2.17	Up-to-date	Metagenomics	Read binning, Sequence assembly, Genome annotation	Read binning, Sequence assembly, Genome annotation	Metagenomics, Sequence assembly, Metagenomic sequencing	Metagenomics, Sequence assembly, Metagenomic sequencing	iuc	https://github.com/galaxyproject/tools-iuc/tree/master/tools/metabat2/	https://github.com/galaxyproject/tools-iuc/tree/main/tools/metabat2	MetaBAT_2	MetaBAT 2	"an adaptive binning algorithm for robust and efficient genome reconstruction from metagenome assemblies | MetaBAT2 clusters metagenomic contigs into different ""bins"", each of which should correspond to a putative genome | MetaBAT2 uses nucleotide composition information and source strain abundance (measured by depth-of-coverage by aligning the reads to the contigs) to perform binning"		2	1	2	2	0	0	0	0	0	0	0	0	0	0	0	0	0	1	0	0	0	0	0	0	0	0	0	0	1	0	0	2	0	0	562	562	8413	8413	241	241	1312	1312	126	126	1248	1248	19	19	1281	1281	948	2844	12254	36762	True	False
metabuli	metabuli_classify	Classifying metagenomes by jointly analysing both DNA and amino acid (AA) sequences	2024-06-04	https://github.com/steineggerlab/Metabuli	1.0.5	metabuli	1.1.0	To update	Sequence Analysis, Metagenomics	Taxonomic classification	Taxonomic classification	Taxonomy	Taxonomy	iuc	https://github.com/galaxyproject/tools-iuc/tree/master/tools/metabuli	https://github.com/galaxyproject/tools-iuc/tree/main/tools/metabuli	metabuli	metabuli	Metabuli: specific and sensitive metagenomic classification via joint analysis of DNA and amino acid		0	0	1	0	0	0	0	0	0	0	0	0	0	0	0	0	0	0	0	0	0	0	0	0	0	0	0	0	0	0	0	0	0	0	0	0	0	0	0	0	0	0	0	0	0	0	0	0	0	0	0	0	0	0	True	False
metaeuk	metaeuk_easy_predict	MetaEuk is a modular toolkit designed for large-scale gene discovery andannotation in eukaryotic metagenomic contigs. Metaeuk combines the fast andsensitive homology search capabilities of MMseqs2 with a dynamic programmingprocedure to recover optimal exons sets. It reduces redundancies in multiplediscoveries of the same gene and resolves conflicting gene predictions onthe same strand. 	2020-08-04	https://github.com/soedinglab/metaeuk	7.bba0d80	metaeuk	6.a5d39d9	To update	Sequence Analysis, Genome annotation	Homology-based gene prediction	Homology-based gene prediction	Metagenomics, Gene and protein families	Metagenomics, Gene and protein families	iuc	https://github.com/galaxyproject/tools-iuc/tree/master/tools/metaeuk	https://github.com/galaxyproject/tools-iuc/tree/main/tools/metaeuk	MetaEuk	MetaEuk	MetaEuk - sensitive, high-throughput gene discovery and annotation for large-scale eukaryotic metagenomics		0	0	1	0	0	0	0	0	0	0	0	0	0	0	0	0	0	0	0	0	0	0	0	0	0	0	0	0	0	0	1	1	1	0	50	50	496	496	0	0	0	0	0	0	0	0	0	0	0	0	50	150	496	1488	True	False
