Suite ID	bio.tool name	EDAM operations	EDAM topics
structure	Structure	Genetic variation analysis	Population genetics
syri	SyRI	Haplotype mapping, Variant calling, Genotyping, Sequence assembly, Read mapping	DNA polymorphism, Sequence assembly, DNA structural variation, Mapping, Sequencing
t2ps	Draw phylogeny	Phylogenetic tree visualisation	Phylogenomics
taxonkit	TaxonKit	Formatting, Data retrieval	Taxonomy, Biotechnology, Ecology
taxonomy_krona_chart	Krona	Visualisation	Metagenomics
taxpasta	taxpasta	Standardisation and normalisation, Aggregation, Formatting, Conversion	Taxonomy, Metagenomics
tbprofiler	tb-profiler	Antimicrobial resistance prediction	
tiara	TIARA	Genome comparison, Data retrieval, Variant calling, Genome visualisation, Structural variation detection	Sequencing, Genomics, DNA polymorphism, DNA structural variation
tooldistillator	ToolDistillator	Data handling, Parsing	Microbiology, Bioinformatics, Sequence analysis
transtermhp	TransTermHP	Transcriptional regulatory element prediction	Transcription factors and regulatory sites
treebest_best	TreeBeST	Phylogenetic tree visualisation, Phylogenetic analysis, Phylogenetic inference (from molecular sequences)	Phylogenetics
trim_galore	Trim Galore	Sequence trimming, Primer removal, Read pre-processing	Sequence analysis
trycycler	Trycycler	Genome assembly, Sequence trimming, Scaffold gap completion, Sequence assembly validation	Sequence assembly, DNA, Human biology, Whole genome sequencing, Genomics
tsebra	TSEBRA	Homology-based gene prediction, Alternative splicing prediction	Gene expression, RNA-Seq, Gene transcripts, Model organisms
unicycler	Unicycler	Genome assembly, Aggregation	Microbiology, Genomics, Sequencing, Sequence assembly
unipept	Unipept	Prediction and recognition, Visualisation	Proteomics, Proteogenomics, Biodiversity, Workflows
usher	usher	Classification, Phylogenetic tree visualisation, Phylogenetic inference (from molecular sequences)	Phylogeny, Evolutionary biology, Cladistics, Genotype and phenotype, Phylogenomics
valet	VALET	Sequence assembly, Sequence assembly visualisation	Metagenomics, Sequence assembly
vapor	VAPOR	Data retrieval, De-novo assembly, Read mapping	Whole genome sequencing, Mapping, Sequence assembly
varvamp	varVAMP	PCR primer design	Virology, Probes and primers
vegan	vegan	Standardisation and normalisation, Analysis	Ecology, Phylogenetics, Environmental science
velvet	Velvet	Formatting, De-novo assembly	Sequence assembly
vibrant	VIBRANT	Sequence trimming, Scaffolding, Genome annotation	Metagenomics, Microbial ecology, Sequence assembly, Molecular interactions, pathways and networks, Endocrinology and metabolism
virannot	virAnnot	Sequence annotation, Sequence clustering, Sequence cluster visualisation	Metagenomics, Virology, Microbial ecology
virsorter	virsorter	Taxonomic classification	Metagenomics
vsearch	VSEARCH	DNA mapping, Chimera detection	Metagenomics, Sequence analysis
wtdbg	wtdbg2	Genome assembly, De-novo assembly	Sequence assembly, Sequencing
