decontam	decontam	Removes decontamination features (ASVs/OTUs) using control samples	2024-09-13	https://github.com/benjjneb/decontam	1.22.0	bioconductor-decontam	1.26.0	To update	Metagenomics	Classification	Classification	Metagenomics, Microbial ecology, Sequencing	Metagenomics, Microbial ecology, Sequencing	iuc	https://github.com/galaxyproject/tools-iuc/tree/master/tools/decontam	https://github.com/galaxyproject/tools-iuc/tree/main/tools/decontam	decontam	decontam	Simple statistical identification of contaminating sequence features in marker-gene or metagenomics data. Works on any kind of feature derived from environmental sequencing data. Requires DNA quantitation data or sequenced negative control samples.		0	0	1	0	0	0	0	0	0	0	0	0	0	0	0	0	0	0	0	0	0	0	0	0	0	0	0	0	0	0	0	0	0	0	1	1	1	1	0	0	0	0	0	0	0	0	0	0	0	0	1	3	1	3	True	False
deeparg	deeparg_predict, deeparg_short_reads	A deep learning based approach to predict Antibiotic Resistance Genes (ARGs) from metagenomes	2024-10-07	https://github.com/gaarangoa/deeparg	1.0.4	deeparg	1.0.4	Up-to-date	Sequence Analysis	Antimicrobial resistance prediction, Antimicrobial resistance prediction	Antimicrobial resistance prediction, Antimicrobial resistance prediction	Microbiology	Microbiology	iuc	https://github.com/galaxyproject/tools-iuc/tree/master/tools/deeparg	https://github.com/galaxyproject/tools-iuc/tree/main/tools/deeparg	deeparg	DeepARG	A deep learning based approach to predict Antibiotic Resistance Genes (ARGs) from metagenomes.		0	0	2	2	0	0	0	0	0	0	0	0	0	0	0	0	0	0	0	0	0	0	0	0	0	0	0	0	0	0	0	0	0	0	0	0	0	0	0	0	0	0	0	0	0	0	0	0	0	0	0	0	0	0	True	False
deseq2	deseq2	Differential gene expression analysis based on the negative binomial distribution	2014-12-03	https://www.bioconductor.org/packages/release/bioc/html/DESeq2.html	2.11.40.8	bioconductor-deseq2	1.46.0	To update	Transcriptomics, RNA, Statistics, Single Cell	Differential gene expression analysis, RNA-Seq analysis	Differential gene expression analysis, RNA-Seq analysis	RNA-Seq	RNA-Seq	iuc	https://github.com/galaxyproject/tools-iuc/tree/master/tools/deseq2	https://github.com/galaxyproject/tools-iuc/tree/main/tools/deseq2	DESeq2	DESeq2	R/Bioconductor package for differential gene expression analysis based on the negative binomial distribution. Estimate variance-mean dependence in count data from high-throughput sequencing assays and test for differential expression based on a model using the negative binomial distribution.		1	1	1	1	0	0	0	0	0	0	0	0	0	0	0	1	1	1	0	0	0	0	0	1	0	0	0	0	0	1	1	1	1	0	12207	13832	103247	118972	26210	34723	188764	263515	2634	3047	18883	21378	701	701	3584	3584	41752	135807	314478	1036405	True	False
dfast	dfast	Prokaryotic genome annotation	2025-04-16	https://github.com/nigyta/dfast_core/	1.3.6	dfast	1.3.6	Up-to-date	Genome annotation	Genome annotation	Genome annotation	Nucleic acid structure analysis, Genomics, Sequence analysis	Nucleic acid structure analysis, Genomics, Sequence analysis	ufz	https://github.com/Helmholtz-UFZ/ufz-galaxy-tools/blob/main/tools/dfast/	https://github.com/Helmholtz-UFZ/galaxy-tools/tree/main/tools/dfast	dfast	DFAST	Flexible prokaryotic genome annotation pipeline for faster genome publication.		0	0	0	0	0	0	0	0	0	0	0	0	0	0	0	0	0	0	0	0	0	0	0	0	0	0	0	0	0	0	0	0	0	0	0	0	0	0	0	0	0	0	0	0	0	0	0	0	0	0	0	0	0	0	True	False
diamond	bg_diamond, bg_diamond_makedb, bg_diamond_view	DIAMOND is a new alignment tool for aligning short DNA sequencing reads to a protein reference database such as NCBI-NR.	2021-03-21	https://github.com/bbuchfink/diamond	2.1.11	diamond	2.1.11	Up-to-date	Sequence Analysis	Sequence alignment analysis	Sequence alignment analysis	Sequence analysis, Proteins	Sequence analysis, Proteins	bgruening	https://github.com/galaxyproject/tools-iuc/tree/master/tools/diamond	https://github.com/galaxyproject/tools-iuc/tree/main/tools/diamond	diamond	Diamond	Sequence aligner for protein and translated DNA searches and functions as a drop-in replacement for the NCBI BLAST software tools. It is suitable for protein-protein search as well as DNA-protein search on short reads and longer sequences including contigs and assemblies, providing a speedup of BLAST ranging up to x20,000.		3	3	3	3	0	0	0	0	0	0	0	0	0	0	0	3	3	3	0	0	1	0	0	0	0	0	0	0	0	0	0	3	3	0	2052	2133	64013	64783	1195	1698	23835	30041	598	598	64629	64629	221	221	2055	2073	4066	12782	154532	470590	True	False
disco	disco	DISCO is a overlap-layout-consensus (OLC) metagenome assembler	2017-10-26	http://disco.omicsbio.org/		disco	1.2	To update	Metagenomics, Assembly	Protein sequence analysis	Protein sequence analysis	Structure determination	Structure determination	iuc	https://github.com/galaxyproject/tools-iuc/tree/master/tools/disco/	https://github.com/galaxyproject/tools-iuc/tree/main/tools/disco	disco	DISCO	DISCO is software to perform structure determination of protein homo-oligomers with cyclic symmetry.DISCO computes oligomeric protein structures using geometric constraints derived from RDCs and intermolecular distance restraints such as NOEs or disulfide bonds. When a reliable subunit structure can be calculated from intramolecular restraints, DISCO guarantees that all satisfying oligomer structures will be discovered, yet can run in minutes to hours on only a single desktop-class computer.		1	0	1	0	0	0	0	0	0	0	0	0	0	0	0	0	0	1	0	0	0	0	0	0	0	0	0	0	0	0	1	1	1	0	128	150	345	427	412	413	1443	1449	0	0	0	0	0	0	0	0	540	1643	1788	5452	True	False
dose_response_analysis_tool	dr_curve	A  tool for analyzing and visualizing the relationship between various doses and their corresponding biological responses	2024-04-06	https://github.com/bernt-matthias/mb-galaxy-tools	3.0.1	r-drc	3.0_1	To update	Ecology					ufz	https://github.com/Helmholtz-UFZ/galaxy-tools/tree/main/tools/tox_tools/dose_responses	https://github.com/Helmholtz-UFZ/galaxy-tools/tree/main/tools/tox_tools/dose_responses					0	0	0	0	0	0	0	0	0	0	0	0	0	0	0	0	0	0	0	0	0	0	0	0	0	0	0	0	0	0	0	0	0	0	0	0	0	0	0	0	0	0	0	0	0	0	0	0	0	0	0	0	0	0	True	False
dram	dram_annotate, dram_distill, dram_merge_annotations, dram_neighborhoods, dram_strainer	DRAM for distilling microbial metabolism to automate the curation of microbiome function	2022-09-01	https://github.com/WrightonLabCSU/DRAM	1.5.0	dram	1.5.0	Up-to-date	Metagenomics	Gene functional annotation	Gene functional annotation	Metagenomics, Biological databases, Molecular genetics	Metagenomics, Biological databases, Molecular genetics	iuc	https://github.com/galaxyproject/tools-iuc/tree/master/tools/dram	https://github.com/galaxyproject/tools-iuc/tree/main/tools/dram	dram	DRAM	Distilled and Refined Annotation of Metabolism: A tool for the annotation and curation of function for microbial and viral genomes		0	0	5	0	0	0	0	0	0	0	0	0	0	0	0	0	0	0	0	0	0	0	0	0	0	0	0	0	0	0	0	5	0	0	131	131	7707	7707	0	0	0	0	0	0	0	0	0	0	0	0	131	393	7707	23121	True	False
drep	drep_compare, drep_dereplicate	dRep compares and dereplicates genome sets	2020-01-06	https://github.com/MrOlm/drep	3.6.2	drep	3.6.2	Up-to-date	Metagenomics	Genome comparison	Genome comparison	Metagenomics, Genomics, Sequence analysis	Metagenomics, Sequence analysis	iuc	https://github.com/galaxyproject/tools-iuc/tree/master/tools/drep	https://github.com/galaxyproject/tools-iuc/tree/main/tools/drep	drep	dRep	Fast and accurate genomic comparisons that enables improved genome recovery from metagenomes through de-replication.		2	0	2	2	0	0	0	0	0	0	0	0	0	0	0	0	0	2	0	0	0	0	0	0	0	0	0	0	0	0	2	2	2	0	145	145	1057	1057	0	0	0	0	0	0	0	0	33	33	515	515	178	534	1572	4716	True	False
ectyper	ectyper	EC-Typer - in silico serotyping of Escherichia coli species	2018-12-21	https://github.com/phac-nml/ecoli_serotyping	2.0.0	ectyper	2.0.0	Up-to-date	Sequence Analysis	Sequence assembly, Read pre-processing, Variant calling	Sequence assembly, Read pre-processing, Variant calling	Whole genome sequencing, Public health and epidemiology, Sequence assembly, Genotype and phenotype, Workflows	Whole genome sequencing, Public health and epidemiology, Sequence assembly, Genotype and phenotype, Workflows	nml	https://github.com/phac-nml/galaxy_tools/tree/master/tools/ectyper	https://github.com/phac-nml/galaxy_tools/tree/master/tools/ectyper	ectyper	ECTyper	Ectyper is a standalone serotyping module for Escherichia coli. It supports fasta and fastq file formats. (Galaxy Version 1.0.0)		0	0	1	0	0	0	0	0	0	0	0	0	0	0	0	0	0	1	0	0	0	0	0	0	0	0	0	0	0	0	0	1	0	0	163	163	16569	16569	1	1	10	10	0	0	0	0	0	0	0	0	164	492	16579	49737	True	False
effectivet3	effectiveT3	Find bacterial type III effectors in protein sequences	2013-04-30	http://effectors.org	0.0.21	effectiveT3	1.0.1	To update	Sequence Analysis	Sequence classification	Sequence classification	Sequence analysis	Sequence analysis	peterjc	https://github.com/peterjc/pico_galaxy/tree/master/tools/effectiveT3	https://github.com/peterjc/pico_galaxy/tree/master/tools/effectiveT3	effectivet3	EffectiveT3	Prediction of putative Type-III secreted proteins.		0	0	0	0	0	0	0	0	0	0	0	0	0	0	0	0	0	0	0	0	0	0	0	0	0	0	0	0	0	0	0	0	0	0	0	0	0	0	0	0	0	0	0	0	0	0	0	0	0	0	0	0	0	0	True	False
eggnog_mapper	eggnog_mapper, eggnog_mapper_annotate, eggnog_mapper_search	eggnog-mapper fast functional annotation of novel sequences	2019-11-11		2.1.8	eggnog-mapper	2.1.12	To update	Proteomics	Homology-based gene prediction, Genome annotation, Fold recognition, Information extraction, Query and retrieval	Homology-based gene prediction, Genome annotation, Fold recognition, Information extraction, Query and retrieval	Metagenomics, Phylogeny, Transcriptomics, Workflows, Sequence analysis	Metagenomics, Phylogeny, Transcriptomics, Workflows, Sequence analysis	galaxyp	https://github.com/galaxyproteomics/tools-galaxyp/tree/master/tools/eggnog_mapper/eggnog_mapper	https://github.com/galaxyproteomics/tools-galaxyp/tree/master/tools/eggnog_mapper/eggnog_mapper	eggnog-mapper-v2	eggNOG-mapper v2	EggNOG-mapper is a tool for fast functional annotation of novel sequences. It uses precomputed orthologous groups and phylogenies from the eggNOG database (http://eggnog5.embl.de) to transfer functional information from fine-grained orthologs only.		3	3	3	3	0	0	0	0	0	0	0	0	0	0	0	0	0	0	0	0	0	0	0	0	0	0	0	0	3	0	1	3	1	0	1450	1456	39884	40140	134	134	985	985	498	498	22184	22184	149	149	65332	65332	2231	6699	128385	385411	True	False
emboss	emboss_needle, emboss_needleall	Galaxy wrappers for EMBOSS6 tools	2025-01-17	http://emboss.open-bio.org/	6.6.0	emboss	6.6.0	Up-to-date	Sequence Analysis, Fasta Manipulation	Sequence analysis, Local alignment, Sequence alignment analysis, Global alignment, Sequence alignment	Sequence analysis, Local alignment, Sequence alignment analysis, Global alignment, Sequence alignment	Molecular biology, Sequence analysis, Biology	Molecular biology, Sequence analysis	iuc	https://github.com/galaxyproject/tools-iuc/tree/master/tools/emboss	https://github.com/galaxyproject/tools-iuc/tree/main/tools/emboss	emboss	EMBOSS	Diverse suite of tools for sequence analysis; many programs analagous to GCG; context-sensitive help for each tool.		0	0	2	0	0	0	0	0	0	0	0	0	0	0	0	0	0	0	0	0	0	0	0	0	0	0	0	0	0	0	0	0	0	0	1	1	2	2	0	0	0	0	0	0	0	0	0	0	0	0	1	3	2	6	True	False
emboss_5	EMBOSS: antigenic1, EMBOSS: backtranseq2, EMBOSS: banana3, EMBOSS: biosed4, EMBOSS: btwisted5, EMBOSS: cai6, EMBOSS: cai_custom6, EMBOSS: chaos7, EMBOSS: charge8, EMBOSS: checktrans9, EMBOSS: chips10, EMBOSS: cirdna11, EMBOSS: codcmp12, EMBOSS: coderet13, EMBOSS: compseq14, EMBOSS: cpgplot15, EMBOSS: cpgreport16, EMBOSS: cusp17, EMBOSS: cutseq18, EMBOSS: dan19, EMBOSS: degapseq20, EMBOSS: descseq21, EMBOSS: diffseq22, EMBOSS: digest23, EMBOSS: dotmatcher24, EMBOSS: dotpath25, EMBOSS: dottup26, EMBOSS: dreg27, EMBOSS: einverted28, EMBOSS: epestfind29, EMBOSS: equicktandem31, EMBOSS: est2genome32, EMBOSS: etandem33, EMBOSS: extractfeat34, EMBOSS: extractseq35, EMBOSS: freak36, EMBOSS: fuzznuc37, EMBOSS: fuzzpro38, EMBOSS: fuzztran39, EMBOSS: garnier40, EMBOSS: geecee41, EMBOSS: getorf42, EMBOSS: helixturnhelix43, EMBOSS: hmoment44, EMBOSS: iep45, EMBOSS: infoseq46, EMBOSS: isochore47, EMBOSS: lindna48, EMBOSS: marscan49, EMBOSS: maskfeat50, EMBOSS: maskseq51, EMBOSS: matcher52, EMBOSS: megamerger53, EMBOSS: merger54, EMBOSS: msbar55, EMBOSS: needle56, EMBOSS: newcpgreport57, EMBOSS: newcpgseek58, EMBOSS: newseq59, EMBOSS: noreturn60, EMBOSS: notseq61, EMBOSS: nthseq62, EMBOSS: octanol63, EMBOSS: oddcomp64, EMBOSS: palindrome65, EMBOSS: pasteseq66, EMBOSS: patmatdb67, EMBOSS: pepcoil68, EMBOSS: pepinfo69, EMBOSS: pepnet70, EMBOSS: pepstats71, EMBOSS: pepwheel72, EMBOSS: pepwindow73, EMBOSS: pepwindowall74, EMBOSS: plotcon75, EMBOSS: plotorf76, EMBOSS: polydot77, EMBOSS: preg78, EMBOSS: prettyplot79, EMBOSS: prettyseq80, EMBOSS: primersearch81, EMBOSS: revseq82, EMBOSS: seqmatchall83, EMBOSS: seqret84, EMBOSS: showfeat85, EMBOSS: shuffleseq87, EMBOSS: sigcleave88, EMBOSS: sirna89, EMBOSS: sixpack90, EMBOSS: skipseq91, EMBOSS: splitter92, EMBOSS: supermatcher95, EMBOSS: syco96, EMBOSS: tcode97, EMBOSS: textsearch98, EMBOSS: tmap99, EMBOSS: tranalign100, EMBOSS: transeq101, EMBOSS: trimest102, EMBOSS: trimseq103, EMBOSS: twofeat104, EMBOSS: union105, EMBOSS: vectorstrip106, EMBOSS: water107, EMBOSS: wobble108, EMBOSS: wordcount109, EMBOSS: wordmatch110	Galaxy wrappers for EMBOSS version 5.0.0 tools	2017-01-11	http://emboss.open-bio.org/	5.0.0	emboss	6.6.0	To update	Sequence Analysis, Fasta Manipulation	Sequence analysis, Local alignment, Sequence alignment analysis, Global alignment, Sequence alignment	Sequence analysis, Local alignment, Sequence alignment analysis, Global alignment, Sequence alignment	Molecular biology, Sequence analysis, Biology	Molecular biology, Sequence analysis	devteam	https://github.com/galaxyproject/tools-iuc/tree/master/tools/emboss_5	https://github.com/galaxyproject/tools-iuc/tree/main/tools/emboss_5	emboss	EMBOSS	Diverse suite of tools for sequence analysis; many programs analagous to GCG; context-sensitive help for each tool.		107	107	107	107	0	0	0	0	0	0	0	0	0	0	0	0	0	107	0	0	0	0	0	107	0	0	0	0	0	0	107	107	107	0	4852	5582	251089	258085	13516	32583	161146	311665	2555	2895	28056	31289	163	163	869	882	21086	83395	441160	1484241	True	False
ete	ete_gene_csv_finder, ete_genetree_splitter, ete_homology_classifier, ete_init_taxdb, ete_lineage_generator, ete3_mod, ete_species_tree_generator	Analyse phylogenetic trees using the ETE Toolkit	2016-06-01	https://etetoolkit.org/	3.1.3	ete3	3.1.1	To update	Phylogenetics	Phylogenetic analysis, Phylogenetic tree editing	Phylogenetic tree editing	Phylogenetics	Phylogenetics	earlhaminst	https://github.com/TGAC/earlham-galaxytools/tree/main/tools/ete	https://github.com/TGAC/earlham-galaxytools/tree/main/tools/ete	ete	ete	The Environment for Tree Exploration (ETE) is a computational framework that simplifies the reconstruction, analysis, and visualization of phylogenetic trees and multiple sequence alignments. Here, we present ETE v3, featuring numerous improvements in the underlying library of methods, and providing a novel set of standalone tools to perform common tasks in comparative genomics and phylogenetics. The new features include (i) building gene-based and supermatrix-based phylogenies using a single command, (ii) testing and visualizing evolutionary models, (iii) calculating distances between trees of different size or including duplications, and (iv) providing seamless integration with the NCBI taxonomy database. ETE is freely available at http://etetoolkit.org		0	0	7	7	0	0	0	0	0	0	0	0	0	0	0	0	0	0	0	0	0	0	0	0	0	0	0	0	0	0	0	7	7	0	86	111	674	976	0	0	0	0	0	0	0	0	3	3	9	9	89	292	683	2351	True	False
ete_treeviewer	ete_treeviewer	A toolkit for the analysis and visualization of trees.	2024-11-25	http://etetoolkit.org	3.1.3	curl		To update	Phylogenetics	Phylogenetic analysis, Phylogenetic tree editing	Phylogenetic tree editing	Phylogenetics	Phylogenetics	iuc	https://github.com/galaxyproject/tools-iuc/tree/master/tools/ete-toolkit	https://github.com/galaxyproject/tools-iuc/tree/main/tools/ete-toolkit	ete	ete	The Environment for Tree Exploration (ETE) is a computational framework that simplifies the reconstruction, analysis, and visualization of phylogenetic trees and multiple sequence alignments. Here, we present ETE v3, featuring numerous improvements in the underlying library of methods, and providing a novel set of standalone tools to perform common tasks in comparative genomics and phylogenetics. The new features include (i) building gene-based and supermatrix-based phylogenies using a single command, (ii) testing and visualizing evolutionary models, (iii) calculating distances between trees of different size or including duplications, and (iv) providing seamless integration with the NCBI taxonomy database. ETE is freely available at http://etetoolkit.org		0	0	1	1	0	0	0	0	0	0	0	0	0	0	0	0	0	0	0	0	0	0	0	0	0	0	0	0	0	0	0	0	0	0	0	0	0	0	0	0	0	0	0	0	0	0	0	0	0	0	0	0	0	0	True	False
export2graphlan	export2graphlan	export2graphlan is a conversion software tool for producing both annotation and tree file for GraPhlAn	2017-03-03	https://bitbucket.org/CibioCM/export2graphlan/overview	0.20	export2graphlan	0.22	To update	Metagenomics	Conversion	Conversion	Taxonomy, Metabolomics, Biomarkers	Taxonomy, Metabolomics, Biomarkers	iuc	https://github.com/galaxyproject/tools-iuc/tree/master/tools/export2graphlan/	https://github.com/galaxyproject/tools-iuc/tree/main/tools/export2graphlan	export2graphlan	export2graphlan	export2graphlan is a conversion software tool for producing both annotation and tree file for GraPhlAn. In particular, the annotation file tries to highlight specific sub-trees deriving automatically from input file what nodes are important.		1	1	1	1	0	0	0	0	0	0	0	0	0	0	0	0	0	1	0	0	0	0	0	0	0	0	0	0	0	0	1	1	1	0	615	653	5799	6416	186	186	690	690	110	110	572	572	0	0	0	0	911	2771	7061	21800	True	False
ez_histograms	ez_histograms	ggplot2 histograms and density plots	2024-02-07	https://github.com/tidyverse/ggplot2	3.4.4	r-ggplot2	2.2.1	To update	Visualization, Statistics	Data analysis, Statistical calculation, Visualisation	Statistical calculation, Visualisation	Ecology	Ecology	artbio	https://github.com/artbio/tools-artbio/tree/main/tools/ez_histograms	https://github.com/ARTbio/tools-artbio/tree/main/tools/ez_histograms	ez_histograms	ez_histograms	This tool produces histograms or density plots from any tabular datasets, using ggplot2.You may provide headerless tables as well as tables with column headers. Any non-numeric columns will be filtered out. Your first column may contains row names, but it will also work if your first column already corresponds to the numeric values of a variable.		0	0	0	0	0	0	0	0	0	0	0	0	0	0	0	0	0	0	0	0	0	0	0	1	0	0	0	0	0	0	0	0	0	0	0	0	0	0	0	0	0	0	0	0	0	0	0	0	0	0	0	0	0	0	True	False
fairy	fairy_cov, fairy_sketch	Fast approximate contig coverage for metagenomic binning	2024-12-20	https://github.com/bluenote-1577/fairy	0.5.8	fairy	0.5.8	Up-to-date	Metagenomics	Read binning, Sequence assembly validation	Read binning, Sequence assembly validation	Metagenomics	Metagenomics	iuc	https://github.com/galaxyproject/tools-iuc/tree/main/tools/fairy	https://github.com/galaxyproject/tools-iuc/tree/main/tools/fairy	fairy	fairy	fast approximate contig coverage for metagenomic binningFairy computes multi-sample contig coverage for metagenome-assembled genome (MAG) binning.Fairy is used after metagenomic assembly and before binning. It can- Calculate coverage 100x-1000x faster than read alignment (e.g. BWA)- Give comparable bins for multi-sample binning (short read or nanopore reads)- Output formats that are compatible with MetaBAT2, MaxBin2, SemiBin2, and more		0	0	2	0	0	0	0	0	0	0	0	0	0	0	0	0	0	0	0	0	0	0	0	0	0	0	0	0	0	0	0	0	0	0	3	3	13	13	0	0	0	0	0	0	0	0	0	0	0	0	3	9	13	39	True	False
falco	falco	A high throughput sequence QC analysis tool	2024-04-17	https://github.com/smithlabcode/falco/	1.2.4	falco	1.2.5	To update	Sequence Analysis	Sequencing quality control, Visualisation, Read mapping	Sequencing quality control, Visualisation, Read mapping	Workflows, Mapping, Imaging	Workflows, Mapping, Imaging	iuc	https://github.com/galaxyproject/tools-iuc/tree/master/tools/falco	https://github.com/galaxyproject/tools-iuc/tree/main/tools/falco	falco	Falco	A high-speed FastQC emulation for quality control of sequencing data.		1	1	1	1	0	0	0	0	0	0	0	0	0	0	0	0	0	0	0	0	0	0	0	0	0	0	0	0	0	0	0	0	0	0	83	83	6114	6114	0	0	0	0	9	9	84	84	0	0	0	0	92	276	6198	18594	True	False
fargene	fargene	fARGene (Fragmented Antibiotic Resistance Gene iENntifiEr )	2019-08-30	https://github.com/fannyhb/fargene	0.1	fargene	0.1	Up-to-date	Sequence Analysis	Antimicrobial resistance prediction	Antimicrobial resistance prediction	Metagenomics, Microbiology, Public health and epidemiology, Antimicrobial resistance	Metagenomics, Microbiology, Public health and epidemiology	iuc	https://github.com/galaxyproject/tools-iuc/tree/master/tools/fargene	https://github.com/galaxyproject/tools-iuc/tree/main/tools/fargene	fargene	fARGene	fARGene (Fragmented Antibiotic Resistance Gene iENntifiEr ) is a tool that takes either fragmented metagenomic data or longer sequences as input and predicts and delivers full-length antiobiotic resistance genes as output.		1	0	1	1	0	0	0	0	0	0	0	0	0	0	0	0	0	1	0	0	0	0	0	0	0	0	0	0	0	0	1	1	1	0	135	138	614	631	260	260	1270	1270	0	0	0	0	0	0	0	0	395	1188	1884	5669	True	False
fastani	fastani	Fast alignment-free computation of whole-genome Average Nucleotide Identity	2020-02-17	https://github.com/ParBLiSS/FastANI	1.3	fastani	1.34	To update	Sequence Analysis	Genome alignment, Sequence similarity search	Genome alignment, Sequence similarity search	Microbiology, Genetic variation	Microbiology, Genetic variation	iuc	https://github.com/galaxyproject/tools-iuc/tree/master/tools/fastani	https://github.com/galaxyproject/tools-iuc/tree/main/tools/fastani	fastani	FastANI	FastANI is developed for fast alignment-free computation of whole-genome Average Nucleotide Identity (ANI). ANI is defined as mean nucleotide identity of orthologous gene pairs shared between two microbial genomes. FastANI supports pairwise comparison of both complete and draft genome assemblies.		0	1	1	1	0	0	0	0	0	0	0	0	0	0	0	0	0	1	0	0	0	0	0	0	0	0	0	0	0	0	1	1	1	0	744	744	24894	24894	0	0	0	0	37	37	1177	1177	51	51	843	843	832	2496	26914	80742	True	False
fastk	fastk_fastk, fastk_histex, fastk_logex	FastK: A K-mer counter (for HQ assembly data sets)	2024-05-03	https://github.com/thegenemyers/FASTK	1.1.0	fastk	1.1.0	Up-to-date	Assembly	k-mer counting, Sequence analysis	k-mer counting, Sequence analysis	Genomics, Sequence analysis	Genomics, Sequence analysis	iuc	https://github.com/galaxyproject/tools-iuc/tree/master/tools/fastk	https://github.com/galaxyproject/tools-iuc/tree/main/tools/fastk	fastk	FASTK	FastK is a kmer counter that is optimized for processing high quality DNA assembly data sets such as those produced with an Illumina instrument or a PacBio run in HiFi mode.		3	0	3	0	0	0	0	0	0	0	0	0	0	0	0	0	0	0	0	0	0	0	0	0	0	0	0	0	0	0	0	0	0	0	19	19	156	156	6	6	12	12	0	0	0	0	0	0	0	0	25	75	168	504	True	False
fastp	fastp	Fast all-in-one preprocessing for FASTQ files	2018-03-07	https://github.com/OpenGene/fastp	0.24.1	fastp	0.24.1	Up-to-date	Sequence Analysis	Sequencing quality control, Sequence contamination filtering	Sequence contamination filtering	Sequence analysis, Probes and primers	Probes and primers	iuc	https://github.com/galaxyproject/tools-iuc/tree/master/tools/fastp	https://github.com/galaxyproject/tools-iuc/tree/main/tools/fastp	fastp	fastp	A tool designed to provide fast all-in-one preprocessing for FastQ files. This tool is developed in C++ with multithreading supported to afford high performance.		1	1	1	1	0	0	0	0	0	0	0	0	0	0	0	1	1	1	0	0	0	0	0	1	0	0	0	0	0	0	1	1	1	1	8030	8192	1196298	1200047	12337	12428	466144	467016	2529	2529	92654	92654	225	225	18568	18568	23121	69616	1773664	5325613	True	False
fastplong	fastplong	Fastplong is used for ultrafast preprocessing and quality control for long reads (Nanopore, PacBio, Cyclone, etc.).	2025-05-06	https://github.com/OpenGene/fastplong	0.2.2	fastplong	0.2.2	Up-to-date	Sequence Analysis, Assembly					iuc	https://github.com/galaxyproject/tools-iuc/tree/master/tools/fastplong	https://github.com/galaxyproject/tools-iuc/tree/main/tools/fastplong					0	0	0	0	0	0	0	0	0	0	0	0	0	0	0	0	0	0	0	0	0	0	0	0	0	0	0	0	0	0	0	0	0	0	0	0	0	0	0	0	0	0	0	0	0	0	0	0	0	0	0	0	0	0	True	False
fastqe	fastqe	FASTQE	2020-07-13	https://fastqe.com/	0.3.1+galaxy0	fastqe	0.3.3	To update	Sequence Analysis	Sequencing quality control	Sequencing quality control	Sequence analysis, Sequencing	Sequence analysis, Sequencing	iuc	https://github.com/galaxyproject/tools-iuc/tree/master/tools/fastqe	https://github.com/galaxyproject/tools-iuc/tree/main/tools/fastqe	fastqe	FASTQE	Compute quality stats for FASTQ files and print those stats as emoji... for some reason.		1	1	1	1	0	0	0	0	0	0	0	0	0	0	0	1	1	0	0	0	0	0	0	0	0	0	0	0	0	0	1	1	1	0	2748	2748	5999	5999	5370	5370	11770	11770	1047	1047	2786	2786	268	268	453	453	9433	28299	21008	63024	True	False
fasttree	fasttree	FastTree infers approximately-maximum-likelihood phylogenetic trees from alignments of nucleotide or protein sequences - GVL	2018-02-02	http://www.microbesonline.org/fasttree/	2.1.10	fasttree	2.1.11	To update	Phylogenetics	Phylogenetic tree generation (from molecular sequences), Phylogenetic tree generation (maximum likelihood and Bayesian methods)		Phylogenetics, Sequence analysis	Phylogenetics	iuc	https://github.com/galaxyproject/tools-iuc/tree/master/tools/fasttree	https://github.com/galaxyproject/tools-iuc/tree/main/tools/fasttree	fasttree	FastTree	Infers approximately-maximum-likelihood phylogenetic trees from alignments of nucleotide or protein sequences.		1	1	1	1	0	0	0	0	0	0	0	0	0	0	0	1	1	1	0	0	0	0	0	1	0	0	0	0	0	0	1	1	1	0	1355	1398	72006	72254	2526	2527	28673	28676	700	815	7608	8265	45	45	304	304	4626	14037	108591	326681	True	False
