Variant Analysis	M. tuberculosis Variant Analysis	https://training.galaxyproject.org//topics/variant-analysis/tutorials/tb-variant-analysis/tutorial.html	Genomics, Microbiology, Sequence assembly, Genetic variation, Public health and epidemiology, Infectious disease	Sequence composition calculation, Phylogenetic tree visualisation, Genome visualisation, Global alignment, Sequence alignment, Sequence alignment analysis, Variant calling, Sequence analysis, Validation, Phylogenetic tree generation, Antimicrobial resistance prediction, Taxonomic classification, Sequencing quality control, Sequence contamination filtering, Local alignment, Statistical calculation	2020-07-25	2024-07-26	30	True	False	True	True	tp_sed_tool, __FLATTEN__, jbrowse, bcftools_consensus, EMBOSS: seqret84, EMBOSS:%20seqret84, kraken2, fastqc, fastp, samtools_stats, upload1, tb_variant_filter, multiqc, tp_awk_tool, mosdepth, snippy, jvarkit_wgscoverageplotter, tb_profiler_profile, qualimap_bamqc, tbvcfreport			0		6371	9915	2.85	0
Proteomics	metaQuantome 3: Taxonomy	https://training.galaxyproject.org//topics/proteomics/tutorials/metaquantome-taxonomy/tutorial.html	Proteomics, Proteogenomics, Metatranscriptomics, Microbial ecology, Metagenomics, Taxonomy	Principal component visualisation, Heat map generation, Filtering, Statistical inference, Visualisation, Query and retrieval, Quantification, Differential protein expression analysis, Functional clustering, Indexing	2020-10-29	2024-03-15	14	True	False	False	True	metaquantome_stat, metaquantome_expand, metaquantome_db, metaquantome_viz, metaquantome_filter, metaquantome_sample	UseGalaxy.be, UseGalaxy.eu	UseGalaxy.cz, UseGalaxy.fr, UseGalaxy.no, UseGalaxy.org.au	0		400	533	2.6	0
Proteomics	metaQuantome 2: Function	https://training.galaxyproject.org//topics/proteomics/tutorials/metaquantome-function/tutorial.html	Proteomics, Proteogenomics, Metatranscriptomics, Microbial ecology, Metagenomics	Principal component visualisation, Heat map generation, Filtering, Statistical inference, Visualisation, Query and retrieval, Quantification, Differential protein expression analysis, Functional clustering, Indexing	2020-10-29	2024-03-15	14	True	False	False	True	metaquantome_stat, metaquantome_expand, metaquantome_db, metaquantome_viz, metaquantome_filter, metaquantome_sample	UseGalaxy.eu	UseGalaxy.be, UseGalaxy.cz, UseGalaxy.fr, UseGalaxy.no, UseGalaxy.org.au	0		382	547	4.383333333333334	0
Proteomics	metaQuantome 1: Data creation	https://training.galaxyproject.org//topics/proteomics/tutorials/metaquantome-data-creation/tutorial.html	Proteomics, Proteogenomics, Biodiversity, Taxonomy	Label-free quantification, Formatting, Visualisation, Prediction and recognition, Filtering	2020-10-16	2024-03-14	20	True	False	False	True	tp_replace_in_line, query_tabular, flashlfq, peptide_shaker, msconvert, unipept, Cut1, Grep1, regex1, Remove beginning1, tp_replace_in_column, Filter1, search_gui	UseGalaxy.eu	UseGalaxy.be, UseGalaxy.cz, UseGalaxy.no, UseGalaxy.org.au	0		825	1428	3.85	0
Proteomics	Metaproteomics tutorial	https://training.galaxyproject.org//topics/proteomics/tutorials/metaproteomics/tutorial.html	Proteomics, Proteogenomics, Biodiversity, Taxonomy	Prediction and recognition, Visualisation	2017-06-28	2024-06-14	41	True	False	True	True	query_tabular, peptide_shaker, unipept, sqlite_to_tabular, search_gui	UseGalaxy.eu, UseGalaxy.no, UseGalaxy.org (Main), UseGalaxy.org.au	UseGalaxy.be, UseGalaxy.cz	0		2549	4152	2.7333333333333334	0
Sequence analysis	Quality and contamination control in bacterial isolate using Illumina MiSeq Data	https://training.galaxyproject.org//topics/sequence-analysis/tutorials/quality-contamination-control/tutorial.html	Whole genome sequencing, Genomics, Microbiology, Microbial ecology	Sequence composition calculation, Expression analysis, Cross-assembly, Taxonomic classification, Sequencing quality control, Sequence contamination filtering, Statistical calculation	2024-07-15	2024-10-09	3	True	False	True	True	fastp, recentrifuge, kraken2, est_abundance, upload1, fastqc	UseGalaxy.eu, UseGalaxy.fr	Galaxy@AuBi, GalaxyTrakr, UseGalaxy.cz, UseGalaxy.org (Main)	0		805	1055	3.933333333333333	0
Variant Analysis	Calling variants in non-diploid systems	https://training.galaxyproject.org//topics/variant-analysis/tutorials/non-dip/tutorial.html	Genomics, Sequence assembly, DNA polymorphism, Microbiology, Sequence analysis, Genetic variation	Genome indexing, Sequence composition calculation, Variant calling, Sequence alignment, Sequence alignment analysis, Generation, Formatting, Read mapping, Sequencing quality control, Data handling, Statistical calculation	2017-02-16	2024-03-15	23	True	False	False	True	bamleftalign, picard_MarkDuplicates, vcf2tsv, Cut1, bwa_mem, bamFilter, freebayes, vcffilter2, picard_MergeSamFiles, fastqc	UseGalaxy.be, UseGalaxy.eu, UseGalaxy.fr, UseGalaxy.no, UseGalaxy.org (Main)	UseGalaxy.cz, UseGalaxy.org.au	0		7756	14438	2.1666666666666665	0
