Variant Analysis	M. tuberculosis Variant Analysis	https://training.galaxyproject.org//topics/variant-analysis/tutorials/tb-variant-analysis/tutorial.html	Genomics, Microbiology, Sequence assembly, Genetic variation, Public health and epidemiology, Infectious disease	Global alignment, Variant calling, Sequencing quality control, Genome visualisation, Sequence composition calculation, Sequence alignment analysis, Sequence alignment, Phylogenetic tree generation, Taxonomic classification, Sequence contamination filtering, Sequence analysis, Statistical calculation, Antimicrobial resistance prediction, Validation, Local alignment, Phylogenetic tree visualisation	2020-07-25	2024-07-26	30	True	False	True	True	jbrowse, snippy, bcftools_consensus, fastqc, tb_profiler_profile, EMBOSS:%20seqret84, qualimap_bamqc, jvarkit_wgscoverageplotter, upload1, fastp, samtools_stats, multiqc, mosdepth, tp_sed_tool, kraken2, tb_variant_filter, tp_awk_tool, tbvcfreport, __FLATTEN__, EMBOSS: seqret84			0		6988	10808	2.9166666666666665	0
Proteomics	metaQuantome 3: Taxonomy	https://training.galaxyproject.org//topics/proteomics/tutorials/metaquantome-taxonomy/tutorial.html	Proteomics, Proteogenomics, Metatranscriptomics, Microbial ecology, Metagenomics, Taxonomy	Functional clustering, Statistical inference, Quantification, Heat map generation, Differential protein expression analysis, Query and retrieval, Filtering, Principal component visualisation, Indexing, Visualisation	2020-10-29	2024-03-15	14	True	False	False	True	metaquantome_expand, metaquantome_stat, metaquantome_filter, metaquantome_viz, metaquantome_db, metaquantome_sample	UseGalaxy.be, UseGalaxy.eu	UseGalaxy.cz, UseGalaxy.fr, UseGalaxy.no, UseGalaxy.org.au	0		425	563	2.4833333333333334	0
Proteomics	metaQuantome 2: Function	https://training.galaxyproject.org//topics/proteomics/tutorials/metaquantome-function/tutorial.html	Proteomics, Proteogenomics, Metatranscriptomics, Microbial ecology, Metagenomics	Functional clustering, Statistical inference, Quantification, Heat map generation, Differential protein expression analysis, Query and retrieval, Filtering, Principal component visualisation, Indexing, Visualisation	2020-10-29	2024-03-15	14	True	False	False	True	metaquantome_expand, metaquantome_stat, metaquantome_filter, metaquantome_viz, metaquantome_db, metaquantome_sample	UseGalaxy.eu	UseGalaxy.be, UseGalaxy.cz, UseGalaxy.fr, UseGalaxy.no, UseGalaxy.org.au	0		397	565	4.333333333333333	0
Proteomics	Metaproteomics tutorial	https://training.galaxyproject.org//topics/proteomics/tutorials/metaproteomics/tutorial.html	Proteomics, Proteogenomics, Biodiversity, Taxonomy	Prediction and recognition, Visualisation	2017-06-28	2024-06-14	41	True	False	True	True	query_tabular, sqlite_to_tabular, search_gui, peptide_shaker, unipept	UseGalaxy.eu, UseGalaxy.no, UseGalaxy.org (Main), UseGalaxy.org.au	UseGalaxy.be, UseGalaxy.cz	0		2757	4440	2.7	0
Proteomics	metaQuantome 1: Data creation	https://training.galaxyproject.org//topics/proteomics/tutorials/metaquantome-data-creation/tutorial.html	Proteomics, Proteogenomics, Biodiversity, Taxonomy	Label-free quantification, Prediction and recognition, Formatting, Filtering, Visualisation	2020-10-16	2024-03-14	20	True	False	False	True	msconvert, tp_replace_in_line, query_tabular, flashlfq, Remove beginning1, Grep1, Cut1, search_gui, Filter1, regex1, peptide_shaker, tp_replace_in_column, unipept	UseGalaxy.eu	UseGalaxy.cz, UseGalaxy.no, UseGalaxy.org.au	0		852	1461	3.8	0
Sequence analysis	Quality and contamination control in bacterial isolate using Illumina MiSeq Data	https://training.galaxyproject.org//topics/sequence-analysis/tutorials/quality-contamination-control/tutorial.html	Whole genome sequencing, Genomics, Microbiology, Microbial ecology	Taxonomic classification, Sequence contamination filtering, Expression analysis, Statistical calculation, Read mapping, Sequencing quality control, Visualisation, Cross-assembly	2024-07-15	2025-03-20	4	True	False	True	True	falco, fastp, kraken2, recentrifuge, upload1, est_abundance	UseGalaxy.eu, UseGalaxy.fr	UseGalaxy.org (Main)	0		1253	1623	3.15	0
Variant Analysis	Calling variants in non-diploid systems	https://training.galaxyproject.org//topics/variant-analysis/tutorials/non-dip/tutorial.html	Genomics, Sequence assembly, DNA polymorphism, Microbiology, Sequence analysis, Genetic variation	Variant calling, Genome indexing, Sequencing quality control, Sequence alignment, Sequence alignment analysis, Sequence composition calculation, Data handling, Generation, Statistical calculation, Formatting, Read mapping	2017-02-16	2024-03-15	23	True	False	False	True	freebayes, picard_MergeSamFiles, bwa_mem, vcffilter2, vcf2tsv, bamFilter, Cut1, picard_MarkDuplicates, fastqc, bamleftalign	UseGalaxy.eu, UseGalaxy.fr, UseGalaxy.org (Main)	UseGalaxy.be, UseGalaxy.cz, UseGalaxy.no, UseGalaxy.org.au	0		8175	14945	2.1666666666666665	0
