Topic	Title	Link	EDAM topic	EDAM operation	Creation	Last modification	Version	Tutorial	Slides	Video	Workflows	Tools	Servers with precise tool versions	Servers with tool but different versions	Feedback number	Feedback mean note	Visitors	Page views	Visit duration	Video views
Assembly	Genome Assembly of MRSA from Oxford Nanopore MinION data (and optionally Illumina data)	https://training.galaxyproject.org//topics/assembly/tutorials/mrsa-nanopore/tutorial.html	Sequence assembly, Whole genome sequencing, Public health and epidemiology, Genomics, Microbiology, Antimicrobial resistance	Sequencing error detection, Read mapping, Cross-assembly, Box-Whisker plot plotting, Statistical calculation, Sequence assembly visualisation, De-novo assembly, Sequencing quality control, Sequence contamination filtering, Scatter plot plotting, Sequence assembly validation, Visualisation, Filtering, Sequence alignment, Sequence composition calculation, Genome assembly, Mapping assembly	2021-03-24	2024-11-29	15	True	False	False	True	porechop, fastp, nanoplot, fastqc, upload1, filtlong, CONVERTER_bz2_to_uncompressed, quast, polypolish, bandage_image, bwa_mem2, flye	UseGalaxy.eu	UseGalaxy.cz, UseGalaxy.fr	0		10230	15331	3.4166666666666665	0
Assembly	Genome Assembly of a bacterial genome (MRSA) sequenced using Illumina MiSeq Data	https://training.galaxyproject.org//topics/assembly/tutorials/mrsa-illumina/tutorial.html	Sequence assembly, Whole genome sequencing, Public health and epidemiology, Genomics, Microbiology	Sequence contamination filtering, Read mapping, Statistical calculation, Visualisation, Sequence assembly visualisation, Sequence assembly validation, Sequencing quality control, Sequence composition calculation, Genome assembly	2021-03-24	2025-03-20	16	True	False	True	True	shovill, fastp, bandage_info, fastqc, upload1, falco, quast, bandage_image	UseGalaxy.be, UseGalaxy.cz, UseGalaxy.eu, UseGalaxy.fr, UseGalaxy.org (Main)		0		9911	15312	3.6166666666666667	0
Assembly	Assembly of metagenomic sequencing data	https://training.galaxyproject.org//topics/assembly/tutorials/metagenomics-assembly/tutorial.html	Metagenomics, Sequence assembly	Read pre-processing, Sequence composition calculation, Read mapping, Sequence file editing, Formatting, Statistical calculation, Sequence assembly visualisation, Data handling, Sequencing quality control, Local alignment, Sequence trimming, Sequence contamination filtering, Sequence alignment analysis, Variant calling, Sequence assembly validation, Visualisation, Primer removal, Genome assembly	2025-10-22	2025-10-22	0	True	False	True	True	collection_column_join, ngsutils_bam_filter, bowtie2, bandage_info, fastqc, filter_tabular, random_lines1, bamtools, tp_cat, bg_uniq, cutadapt, metaspades, quast, seqtk_subseq, bandage_image, coverm_contig, megahit_contig2fastg, megahit		UseGalaxy.cz, UseGalaxy.eu	0		16	16	1.8166666666666667	0
Assembly	Unicycler Assembly	https://training.galaxyproject.org//topics/assembly/tutorials/unicycler-assembly/tutorial.html	Sequence assembly, Genomics, Microbiology	Validation, Coding region prediction, Gene prediction, Statistical calculation, Sequence assembly validation, Visualisation, Aggregation, Sequencing quality control, Sequence composition calculation, Genome assembly, Genome annotation	2017-10-11	2025-05-15	24	True	True	False	True	prokka, multiqc, fastqc, unicycler, quast	UseGalaxy.eu, UseGalaxy.org (Main), UseGalaxy.org.au	Galaxy@AuBi, GalaxyTrakr, MISSISSIPPI, UseGalaxy.be, UseGalaxy.cz, UseGalaxy.fr, UseGalaxy.no	0		2886916	7596222	4.5	0
Assembly	Making sense of a newly assembled genome	https://training.galaxyproject.org//topics/assembly/tutorials/ecoli_comparison/tutorial.html	Sequence assembly, Genomics, Microbiology	Mapping, Sequence visualisation, Sequence alignment, Genome visualisation, Read mapping	2018-06-14	2024-06-24	29	True	False	False	True	Cut1, tp_grep_tool, datamash_ops, upload1, Grep1, lastz_wrapper_2, tp_replace_in_column, bedtools_complementbed, addValue, jbrowse, mergeCols1, tp_sed_tool, random_lines1, tp_replace_in_line, fasta_filter_by_length, collapse_dataset, circos_interval_to_tiles, circos_aln_to_links, Filter1, fasta_compute_length, bedtools_sortbed, circos, bedtools_intersectbed, join1, cat1, tp_cat, tp_sort_header_tool			0		6724	12974	2.933333333333333	0
Ecology	Checking expected species and contamination in bacterial isolate	https://training.galaxyproject.org//topics/ecology/tutorials/bacterial-isolate-species-contamination-checking/tutorial.html	Whole genome sequencing, Genomics, Microbiology, Microbial ecology	Taxonomic classification, Statistical calculation, Cross-assembly, Expression analysis	2024-03-04	2024-06-27	4	True	False	False	True	upload1, kraken2, est_abundance, recentrifuge	UseGalaxy.eu, UseGalaxy.fr	Galaxy@AuBi, GalaxyTrakr, UseGalaxy.cz, UseGalaxy.org (Main)	0		828	1111	3.3666666666666667	0
Evolution	Identifying tuberculosis transmission links: from SNPs to transmission clusters	https://training.galaxyproject.org//topics/evolution/tutorials/mtb_transmission/tutorial.html	Genomics, Microbiology, Infectious disease, DNA polymorphism	Phylogenetic tree visualisation, Variant calling, Antimicrobial resistance prediction, Phylogenetic tree generation	2022-03-16	2025-05-26	13	True	False	False	True	tp_grep_tool, snippy, upload1, Grep1, tb_variant_filter, tb_profiler_profile, tp_sed_tool, bcftools_consensus, addName, tp_replace_in_line, tp_easyjoin_tool, collapse_dataset, snp_dists, snp_sites, samtools_view, tp_cat, clustering_from_distmat, trimmomatic, __MERGE_COLLECTION__	UseGalaxy.eu		0		2699	3870	2.8333333333333335	0
Evolution	Tree thinking for tuberculosis evolution and epidemiology	https://training.galaxyproject.org//topics/evolution/tutorials/mtb_phylogeny/tutorial.html	Genomics, Microbiology, Phylogeny, Infectious disease	Phylogenetic tree analysis, Sequence analysis	2022-03-16	2025-06-04	12	True	False	False	True	upload1, interactive_tool_rstudio, raxml	UseGalaxy.eu		0		2177	3139	2.2666666666666666	0
Evolution	Phylogenetic analysis for bacterial comparative genomics	https://training.galaxyproject.org//topics/evolution/tutorials/bacterial-comparative-genomics/tutorial.html	Genomics, Microbiology, Phylogeny	Phylogenetic tree generation (maximum likelihood and Bayesian methods), Phylogenetic tree generation (from molecular sequences)	2025-03-14	2025-03-14	1	True	False	False	False	fasttree, upload1	GalaxyTrakr, MISSISSIPPI, UseGalaxy.be, UseGalaxy.cz, UseGalaxy.eu, UseGalaxy.fr, UseGalaxy.no, UseGalaxy.org (Main)	Galaxy@AuBi	0		81	102	3.966666666666667	0
Genome Annotation	Genome annotation with Prokka	https://training.galaxyproject.org//topics/genome-annotation/tutorials/annotation-with-prokka/tutorial.html	Genomics, Microbiology, Gene and protein families, Sequence analysis	Genome annotation, Gene prediction, Coding region prediction, Genome visualisation	2018-03-06	2025-03-19	26	True	True	True	True	prokka, jbrowse	UseGalaxy.be, UseGalaxy.eu, UseGalaxy.org (Main)	Galaxy@AuBi, GalaxyTrakr, MISSISSIPPI, UseGalaxy.cz, UseGalaxy.fr, UseGalaxy.no, UseGalaxy.org.au	0		2892491	7605472	4.35	0
Genome Annotation	Identification of AMR genes in an assembled bacterial genome	https://training.galaxyproject.org//topics/genome-annotation/tutorials/amr-gene-detection/tutorial.html	Whole genome sequencing, Public health and epidemiology, Genomics, Microbiology, Sequence analysis, Infectious disease, Antimicrobial resistance	Genome visualisation, Read mapping, Antimicrobial resistance prediction, Genome annotation	2024-01-23	2025-06-10	9	True	False	True	True	jbrowse, staramr_search, tbl2gff3, bowtie2, upload1, Grep1, bakta	UseGalaxy.cz, UseGalaxy.eu, UseGalaxy.fr	Galaxy@AuBi, UseGalaxy.org (Main)	0		3244	4459	2.95	0
Genome Annotation	Refining Genome Annotations with Apollo (prokaryotes)	https://training.galaxyproject.org//topics/genome-annotation/tutorials/apollo/tutorial.html	Genomics, Microbiology, Gene and protein families, Sequence analysis	Genome visualisation	2021-06-04	2025-05-15	22	True	True	True	True	jbrowse, iframe, list_organism, create_or_update, create_account		UseGalaxy.cz, UseGalaxy.eu, UseGalaxy.no	0		2648888	6797515	5.216666666666667	0
Genome Annotation	Bacterial Genome Annotation	https://training.galaxyproject.org//topics/genome-annotation/tutorials/bacterial-genome-annotation/tutorial.html	Genomics, Microbiology, Gene and protein families, Sequence analysis, Whole genome sequencing, Functional genomics, Mobile genetic elements	Nucleic acid feature detection, Genome visualisation, Structural variation detection, Protein feature detection, Scaffolding, Multilocus sequence typing, Genome assembly, Sequence motif recognition, Genome annotation	2024-02-01	2024-10-15	6	True	False	True	True	jbrowse, isescan, tp_tail_tool, tbl2gff3, integron_finder, upload1, Grouping1, tp_replace_in_column, bakta, plasmidfinder	UseGalaxy.eu, UseGalaxy.fr	Galaxy@AuBi, UseGalaxy.cz, UseGalaxy.org (Main)	0		5981	8049	2.6	0
Genome Annotation	Dataset construction for bacterial comparative genomics	https://training.galaxyproject.org//topics/genome-annotation/tutorials/bacterial-comparative-genomics-dataset-construction/tutorial.html	Genomics, Microbiology	Sequence database search, Data retrieval, Data handling	2025-03-14	2025-03-14	1	True	False	False	False	Cut1, datasets_download_genome, upload1, cat1, sort1, bg_uniq, Remove beginning1	UseGalaxy.fr	UseGalaxy.cz	0		68	81	3.1166666666666667	0
Genome Annotation	Bacterial genome quality control	https://training.galaxyproject.org//topics/genome-annotation/tutorials/bacterial-genome-quality-control/tutorial.html	Genomics, Microbiology	Statistical calculation, Sequence assembly validation, Sequencing quality control, Sequence composition calculation, Validation, Genome comparison	2025-03-14	2025-03-14	1	True	False	False	False	drep_dereplicate, upload1, checkm2	UseGalaxy.eu, UseGalaxy.fr, UseGalaxy.org (Main)		0		71	79	2.9166666666666665	0
Genome Annotation	Comparative gene analysis in unannotated genomes	https://training.galaxyproject.org//topics/genome-annotation/tutorials/gene-centric/tutorial.html	Genomics, Gene and protein families, Sequence analysis, Phylogeny, Comparative genomics	Database search, Phylogenetic tree generation, De-novo assembly, Sequence alignment analysis, Multiple sequence alignment, Coding region prediction, Transcriptome assembly	2022-09-08	2025-06-03	10	True	False	False	True	Cut1, tp_split_on_column, gops_intersect_1, bg_diamond_view, cat1, bg_diamond, rapidnj, rbc_mafft, bg_diamond_makedb, collapse_dataset, orfipy, tab2fasta, Add_a_column1, regexColumn1, Filter1, join1	UseGalaxy.eu, UseGalaxy.org (Main)	UseGalaxy.cz	0		1800	2546	3.0833333333333335	0
Genome Annotation	Essential genes detection with Transposon insertion sequencing	https://training.galaxyproject.org//topics/genome-annotation/tutorials/tnseq/tutorial.html	Genomics, Microbiology, Sequence analysis, Mobile genetic elements	Sequence trimming, Primer removal, Read pre-processing, Transposon prediction	2019-07-02	2024-03-18	12	True	True	False	True	deeptools_bam_coverage, Cut1, transit_gumbel, __EXTRACT_DATASET__, bowtie_wrapper, tp_easyjoin_tool, gff_to_prot, tp_sort_header_tool, Add_a_column1, Filter1, cutadapt, bg_find_subsequences	UseGalaxy.no, UseGalaxy.org.au	UseGalaxy.cz, UseGalaxy.eu	0		2882027	7588724	4.183333333333334	0
Variant Analysis	Microbial Variant Calling	https://training.galaxyproject.org//topics/variant-analysis/tutorials/microbial-variants/tutorial.html	Genomics, Sequence assembly, DNA polymorphism, Microbiology, Sequence analysis, Genetic variation	Phylogenetic tree visualisation, Variant calling, Genome visualisation, Phylogenetic tree generation	2018-02-26	2025-03-19	24	True	False	False	True	jbrowse, snippy	UseGalaxy.be, UseGalaxy.eu, UseGalaxy.org (Main)	GalaxyTrakr, UseGalaxy.cz, UseGalaxy.fr, UseGalaxy.no, UseGalaxy.org.au	0		14947	23921	2.05	0
Microbiome	Analyses of metagenomics data - The global picture	https://training.galaxyproject.org//topics/microbiome/tutorials/general-tutorial/tutorial.html	Metagenomics, Microbial ecology, Taxonomy, Sequence analysis, Metabarcoding	Taxonomic classification, DNA barcoding, Phylogenetic analysis, Sequence read processing, Sequence clustering, Visualisation, Sequencing quality control	2017-06-22	2024-08-09	4	True	False	False	True	metaphlan2krona, mothur_unique_seqs, humann2, mothur_count_seqs, mothur_make_biom, mothur_align_seqs, mothur_screen_seqs, taxonomy_krona_chart, mothur_classify_seqs, metaphlan2, mothur_pre_cluster, mothur_merge_files, mothur_make_group, krona-text, mothur_summary_seqs, mothur_filter_seqs, humann2_regroup_table, mothur_make_shared, mothur_classify_otu, mothur_cluster_split, humann2_renorm_table		UseGalaxy.fr, UseGalaxy.no, UseGalaxy.org.au	0		8017	10871	2.716666666666667	0
Microbiome	Antibiotic resistance detection	https://training.galaxyproject.org//topics/microbiome/tutorials/plasmid-metagenomics-nanopore/tutorial.html	Metagenomic sequencing, Public health and epidemiology, Metagenomics, Microbiology, Infectious disease, Sequence analysis, Antimicrobial resistance	Pairwise sequence alignment, Scatter plot plotting, Antimicrobial resistance prediction, Box-Whisker plot plotting, Sequence analysis, Sequence assembly visualisation, De-novo assembly, Aggregation, Genome assembly, Mapping assembly	2019-06-25	2024-06-14	4	True	False	True	True	staramr_search, PlasFlow, nanoplot, minimap2, miniasm, racon, unicycler, gfa_to_fa, bandage_image	UseGalaxy.eu	UseGalaxy.be, UseGalaxy.cz, UseGalaxy.fr, UseGalaxy.no, UseGalaxy.org (Main), UseGalaxy.org.au	0		3112	4365	2.95	0
Microbiome	Pathogen detection from (direct Nanopore) sequencing data using Galaxy - Foodborne Edition	https://training.galaxyproject.org//topics/microbiome/tutorials/pathogen-detection-from-nanopore-foodborne-data/tutorial.html	Metagenomics, Public health and epidemiology, Taxonomy, Sequence assembly, Pathology, Sequence analysis	Taxonomic classification, Phylogenetic tree generation (maximum likelihood and Bayesian methods), Sequence composition calculation, Cross-assembly, Validation, Box-Whisker plot plotting, Sequence assembly, Phylogenetic tree analysis, Mapping, Statistical calculation, Multilocus sequence typing, Sequence assembly visualisation, Data handling, Sequencing quality control, De-novo assembly, Aggregation, Multiple sequence alignment, Sequence contamination filtering, Pairwise sequence alignment, Base-calling, Scatter plot plotting, Antimicrobial resistance prediction, Phylogenetic tree generation (from molecular sequences), Variant calling, Visualisation, Phylogenetic tree generation, Phylogenetic tree reconstruction, Sequence alignment analysis, Genome assembly, Mapping assembly	2023-01-26	2024-09-27	11	True	False	True	True	add_line_to_file, collection_column_join, Cut1, fasta2tab, multiqc, fastp, split_file_to_collection, nanoplot, compose_text_param, abricate, bamtools_split_mapped, Grep1, tp_head_tool, tp_replace_in_column, samtools_depth, Remove beginning1, Add_a_column1, CONVERTER_gz_to_uncompressed, bandage_image, collection_element_identifiers, kraken2, regex1, flye, bedtools_getfastabed, snpSift_extractFields, fasttree, samtools_fastx, tp_split_on_column, fasta_merge_files_and_filter_unique_sequences, tp_multijoin_tool, minimap2, bcftools_norm, bcftools_consensus, tp_sorted_uniq, snpSift_filter, taxonomy_krona_chart, collapse_dataset, krakentools_kreport2krona, regexColumn1, table_compute, porechop, param_value_from_file, fastqc, samtools_coverage, tab2fasta, Paste1, clustalw, newick_display, tp_cut_tool, krakentools_extract_kraken_reads, __FILTER_FAILED_DATASETS__, mlst, __FILTER_EMPTY_DATASETS__, barchart_gnuplot, medaka_consensus_pipeline, Grouping1, __BUILD_LIST__, Count1, tp_find_and_replace, clair3, ggplot2_heatmap	UseGalaxy.eu	UseGalaxy.cz, UseGalaxy.org.au	0		4646	6999	3.4166666666666665	0
Microbiome	Taxonomic Profiling and Visualization of Metagenomic Data	https://training.galaxyproject.org//topics/microbiome/tutorials/taxonomic-profiling/tutorial.html	Metagenomics, Microbial ecology, Taxonomy, Sequence analysis	Taxonomic classification, Statistical calculation, Visualisation, Aggregation, Genome annotation	2023-05-03	2025-04-24	6	True	False	True	True	__UNZIP_COLLECTION__, interactive_tool_pavian, kraken_biom, taxonomy_krona_chart, krakentools_kreport2krona, metaphlan, kraken2, est_abundance, interactive_tool_phinch	UseGalaxy.eu, UseGalaxy.fr, UseGalaxy.org (Main), UseGalaxy.org.au		0		11512	15417	2.033333333333333	0
Microbiome	Assembly of metagenomic sequencing data	https://training.galaxyproject.org//topics/microbiome/tutorials/metagenomics-assembly/tutorial.html	Metagenomics, Sequence assembly	Read pre-processing, Sequence composition calculation, Read mapping, Sequence file editing, Formatting, Statistical calculation, Sequence assembly visualisation, Data handling, Sequencing quality control, Local alignment, Sequence trimming, Sequence contamination filtering, Sequence alignment analysis, Variant calling, Sequence assembly validation, Visualisation, Primer removal, Genome assembly	2022-12-05	2025-06-16	6	True	False	True	True	collection_column_join, ngsutils_bam_filter, bowtie2, bandage_info, fastqc, filter_tabular, random_lines1, bamtools, tp_cat, bg_uniq, cutadapt, metaspades, quast, seqtk_subseq, bandage_image, coverm_contig, megahit_contig2fastg, megahit		UseGalaxy.cz, UseGalaxy.eu	0		4157	5821	3.066666666666667	0
Microbiome	Building an amplicon sequence variant (ASV) table from 16S data using DADA2	https://training.galaxyproject.org//topics/microbiome/tutorials/dada-16S/tutorial.html	Microbial ecology, Taxonomy, Sequence analysis, Metabarcoding	Variant calling, Deposition, Visualisation, DNA barcoding, Analysis	2024-06-05	2025-07-03	11	True	False	True	True	dada2_dada, tp_head_tool, tp_replace_in_column, phyloseq_from_dada2, Add_a_column1, collection_element_identifiers, dada2_removeBimeraDenovo, __UNZIP_COLLECTION__, __SORTLIST__, tp_replace_in_line, interactive_tool_phyloseq, dada2_plotQualityProfile, dada2_seqCounts, dada2_assignTaxonomyAddspecies, dada2_mergePairs, dada2_filterAndTrim, cat1, Grouping1, dada2_learnErrors, dada2_makeSequenceTable	UseGalaxy.eu, UseGalaxy.fr, UseGalaxy.org (Main), UseGalaxy.org.au		0		6340	8953	2.3833333333333333	0
Microbiome	16S Microbial analysis with Nanopore data	https://training.galaxyproject.org//topics/microbiome/tutorials/nanopore-16S-metagenomics/tutorial.html	Microbial ecology, Taxonomy, Sequence analysis, Metabarcoding	Taxonomic classification, Sequence contamination filtering, Statistical calculation, Visualisation, Sequencing quality control, Sequence composition calculation, Validation	2020-11-24	2024-07-31	5	True	False	False	True	porechop, multiqc, fastp, fastqc, datamash_reverse, tp_replace_in_line, taxonomy_krona_chart, Remove beginning1, kraken2	UseGalaxy.eu, UseGalaxy.no, UseGalaxy.org (Main), UseGalaxy.org.au	GalaxyTrakr, UseGalaxy.be, UseGalaxy.cz, UseGalaxy.fr	0		7652	10550	2.6	0
Microbiome	Identification of the micro-organisms in a beer using Nanopore sequencing	https://training.galaxyproject.org//topics/microbiome/tutorials/beer-data-analysis/tutorial.html	Metagenomics, Microbial ecology, Taxonomy, Sequence analysis	Taxonomic classification, Sequence contamination filtering, Statistical calculation, Visualisation, Sequencing quality control, Sequence composition calculation, Aggregation	2022-09-29	2024-11-29	5	True	False	True	True	porechop, fastp, fastqc, kraken2, taxonomy_krona_chart, krakentools_kreport2krona, Filter1	GalaxyTrakr, UseGalaxy.eu, UseGalaxy.org (Main), UseGalaxy.org.au	UseGalaxy.cz, UseGalaxy.fr, UseGalaxy.no	0		2516	3648	2.8333333333333335	0
Microbiome	Metatranscriptomics analysis using microbiome RNA-seq data (short)	https://training.galaxyproject.org//topics/microbiome/tutorials/metatranscriptomics-short/tutorial.html	Metatranscriptomics, Microbial ecology, Taxonomy, Function analysis, Sequence analysis	Taxonomic classification, Phylogenetic tree editing, Read pre-processing, Phylogenetic analysis, Validation, Sequence similarity search, Sequence comparison, Phylogenetic inference, Statistical calculation, Sequencing quality control, Phylogenetic tree visualisation, Sequence trimming, Primer removal, Species frequency estimation, Conversion, Sequence alignment analysis, Visualisation, Sequence composition calculation	2020-02-13	2025-06-16	6	True	False	True	True	Cut1, multiqc, Grep1, fastq_paired_end_interlacer, metaphlan, humann_regroup_table, graphlan, export2graphlan, combine_metaphlan2_humann2, taxonomy_krona_chart, graphlan_annotate, bg_sortmerna, fastqc, humann_split_stratified_table, humann_unpack_pathways, humann, cutadapt, humann_rename_table, tp_sort_header_tool, tp_find_and_replace, humann_renorm_table	UseGalaxy.org (Main), UseGalaxy.org.au	UseGalaxy.cz, UseGalaxy.no	0		696	886	2.283333333333333	0
Microbiome	Metatranscriptomics analysis using microbiome RNA-seq data	https://training.galaxyproject.org//topics/microbiome/tutorials/metatranscriptomics/tutorial.html	Metatranscriptomics, Microbial ecology, Taxonomy, Function analysis, Sequence analysis	Taxonomic classification, Phylogenetic tree editing, Read pre-processing, Phylogenetic analysis, Validation, Sequence similarity search, Sequence comparison, Phylogenetic inference, Statistical calculation, Sequencing quality control, Phylogenetic tree visualisation, Sequence trimming, Primer removal, Species frequency estimation, Conversion, Sequence alignment analysis, Visualisation, Sequence composition calculation, Aggregation	2019-11-21	2025-06-16	6	True	True	True	True	Cut1, multiqc, Grep1, fastq_paired_end_interlacer, metaphlan, humann_regroup_table, graphlan, export2graphlan, combine_metaphlan_humann, taxonomy_krona_chart, graphlan_annotate, bg_sortmerna, fastqc, humann_split_stratified_table, humann_unpack_pathways, humann, cutadapt, humann_rename_table, Grouping1, tp_sort_header_tool, tp_find_and_replace, humann_renorm_table	UseGalaxy.cz, UseGalaxy.fr, UseGalaxy.org (Main)	UseGalaxy.eu	0		2880567	7582597	4.316666666666666	0
Microbiome	QIIME 2 Cancer Microbiome Intervention	https://training.galaxyproject.org//topics/microbiome/tutorials/qiime2-cancer-microbiome-intervention/tutorial.html	Microbial ecology, Taxonomy, Sequence analysis, Metabarcoding		2024-02-12	2024-03-14	3	external	False	False	False			UseGalaxy.eu, UseGalaxy.org, UseGalaxy.org.au, UseGalaxy.fr	0		387	624	3.183333333333333	0
Microbiome	Binning of metagenomic sequencing data	https://training.galaxyproject.org//topics/microbiome/tutorials/metagenomics-binning/tutorial.html	Metagenomics, Sequence assembly	Statistical calculation, Sequence assembly validation, Sequencing quality control, Sequence composition calculation, Genome assembly, Validation	2023-12-05	2025-05-15	6	True	False	True	False	checkm_lineage_wf, megahit	GalaxyTrakr, UseGalaxy.cz, UseGalaxy.eu, UseGalaxy.fr	UseGalaxy.org (Main), UseGalaxy.org.au	0		5251	6440	1.5333333333333334	0
Microbiome	QIIME 2 Moving Pictures	https://training.galaxyproject.org//topics/microbiome/tutorials/qiime2-moving-pictures/tutorial.html	Microbial ecology, Taxonomy, Sequence analysis, Metabarcoding		2024-03-14	2024-03-14	1	external	False	False	False			UseGalaxy.eu, UseGalaxy.org, UseGalaxy.org.au, UseGalaxy.fr	0		529	823	2.9166666666666665	0
Microbiome	16S Microbial Analysis with mothur (short)	https://training.galaxyproject.org//topics/microbiome/tutorials/mothur-miseq-sop-short/tutorial.html	Microbial ecology, Taxonomy, Sequence analysis, Metabarcoding	Taxonomic classification, DNA barcoding, Phylogenetic analysis, Phylogenetic tree reconstruction, Sequence read processing, Sequence clustering, Phylogenetic tree analysis, Visualisation, Phylogenetic tree generation, Sequencing quality control	2019-05-13	2024-06-14	5	True	False	True	True	mothur_dist_shared, mothur_unique_seqs, mothur_summary_single, mothur_count_groups, mothur_venn, mothur_count_seqs, mothur_dist_seqs, mothur_cluster, mothur_chimera_vsearch, mothur_remove_seqs, mothur_screen_seqs, collapse_dataset, mothur_pre_cluster, mothur_classify_seqs, mothur_remove_groups, XY_Plot_1, mothur_heatmap_sim, mothur_filter_seqs, mothur_sub_sample, mothur_summary_seqs, newick_display, mothur_make_shared, mothur_tree_shared, mothur_classify_otu, mothur_remove_lineage, mothur_cluster_split, mothur_rarefaction_single	UseGalaxy.be, UseGalaxy.eu, UseGalaxy.no, UseGalaxy.org (Main), UseGalaxy.org.au	UseGalaxy.cz, UseGalaxy.fr	0		4975	8276	4.616666666666666	0
Microbiome	16S Microbial Analysis with mothur (extended)	https://training.galaxyproject.org//topics/microbiome/tutorials/mothur-miseq-sop/tutorial.html	Microbial ecology, Taxonomy, Sequence analysis, Metabarcoding	Taxonomic classification, DNA barcoding, Phylogenetic analysis, Phylogenetic tree reconstruction, Sequence read processing, Sequence clustering, Phylogenetic tree analysis, Visualisation, Phylogenetic tree generation, Sequencing quality control	2017-02-12	2024-03-14	4	True	False	False	True	mothur_dist_shared, mothur_get_groups, mothur_seq_error, mothur_unique_seqs, mothur_summary_single, mothur_count_groups, mothur_make_contigs, mothur_venn, mothur_count_seqs, mothur_dist_seqs, mothur_cluster, mothur_taxonomy_to_krona, mothur_make_biom, mothur_chimera_vsearch, mothur_align_seqs, mothur_remove_seqs, mothur_screen_seqs, taxonomy_krona_chart, mothur_classify_seqs, mothur_pre_cluster, mothur_remove_groups, XY_Plot_1, mothur_heatmap_sim, mothur_filter_seqs, mothur_sub_sample, mothur_summary_seqs, newick_display, mothur_make_shared, mothur_tree_shared, mothur_classify_otu, mothur_remove_lineage, mothur_cluster_split, mothur_rarefaction_single	UseGalaxy.be, UseGalaxy.eu	UseGalaxy.cz, UseGalaxy.fr, UseGalaxy.no, UseGalaxy.org (Main), UseGalaxy.org.au	0		11498	16887	2.7666666666666666	0
