Variant Analysis	M. tuberculosis Variant Analysis	https://training.galaxyproject.org//topics/variant-analysis/tutorials/tb-variant-analysis/tutorial.html	Genomics, Microbiology, Sequence assembly, Genetic variation, Public health and epidemiology, Infectious disease	Taxonomic classification, Sequence contamination filtering, Local alignment, Sequence composition calculation, Genome visualisation, Sequence alignment, Validation, Variant calling, Sequence analysis, Global alignment, Statistical calculation, Phylogenetic tree generation, Sequencing quality control, Phylogenetic tree visualisation, Sequence alignment analysis, Antimicrobial resistance prediction	2020-07-25	2024-07-26	30	True	False	True	True	multiqc, snippy, fastp, upload1, kraken2, tb_variant_filter, qualimap_bamqc, jbrowse, tb_profiler_profile, __FLATTEN__, tp_sed_tool, bcftools_consensus, EMBOSS: seqret84, mosdepth, EMBOSS:%20seqret84, jvarkit_wgscoverageplotter, fastqc, samtools_stats, tp_awk_tool, tbvcfreport			0		7410	11461	3.0166666666666666	0
Proteomics	metaQuantome 3: Taxonomy	https://training.galaxyproject.org//topics/proteomics/tutorials/metaquantome-taxonomy/tutorial.html	Proteomics, Proteogenomics, Metatranscriptomics, Microbial ecology, Metagenomics, Taxonomy	Quantification, Statistical inference, Principal component visualisation, Functional clustering, Differential protein expression analysis, Heat map generation, Query and retrieval, Visualisation, Filtering, Indexing	2020-10-29	2024-03-15	14	True	False	False	True	metaquantome_sample, metaquantome_expand, metaquantome_filter, metaquantome_db, metaquantome_viz, metaquantome_stat	UseGalaxy.be, UseGalaxy.eu	UseGalaxy.cz, UseGalaxy.fr, UseGalaxy.no, UseGalaxy.org.au	0		439	577	2.3666666666666667	0
Proteomics	Metaproteomics tutorial	https://training.galaxyproject.org//topics/proteomics/tutorials/metaproteomics/tutorial.html	Proteomics, Proteogenomics, Biodiversity, Taxonomy	Visualisation, Prediction and recognition	2017-06-28	2024-06-14	41	True	False	True	True	search_gui, sqlite_to_tabular, peptide_shaker, query_tabular, unipept	UseGalaxy.eu, UseGalaxy.no, UseGalaxy.org (Main), UseGalaxy.org.au	UseGalaxy.be, UseGalaxy.cz	0		2871	4576	2.716666666666667	0
Proteomics	metaQuantome 2: Function	https://training.galaxyproject.org//topics/proteomics/tutorials/metaquantome-function/tutorial.html	Proteomics, Proteogenomics, Metatranscriptomics, Microbial ecology, Metagenomics	Quantification, Statistical inference, Principal component visualisation, Functional clustering, Differential protein expression analysis, Heat map generation, Query and retrieval, Visualisation, Filtering, Indexing	2020-10-29	2024-03-15	14	True	False	False	True	metaquantome_sample, metaquantome_expand, metaquantome_filter, metaquantome_db, metaquantome_viz, metaquantome_stat	UseGalaxy.eu	UseGalaxy.be, UseGalaxy.cz, UseGalaxy.fr, UseGalaxy.no, UseGalaxy.org.au	0		411	582	4.183333333333334	0
Proteomics	metaQuantome 1: Data creation	https://training.galaxyproject.org//topics/proteomics/tutorials/metaquantome-data-creation/tutorial.html	Proteomics, Proteogenomics, Biodiversity, Taxonomy	Visualisation, Prediction and recognition, Filtering, Label-free quantification, Formatting	2020-10-16	2024-03-14	20	True	False	False	True	search_gui, Cut1, msconvert, flashlfq, Grep1, tp_replace_in_column, tp_replace_in_line, Remove beginning1, peptide_shaker, query_tabular, Filter1, unipept, regex1	UseGalaxy.eu	UseGalaxy.cz, UseGalaxy.no, UseGalaxy.org.au	0		880	1493	3.8	0
Sequence analysis	Quality and contamination control in bacterial isolate using Illumina MiSeq Data	https://training.galaxyproject.org//topics/sequence-analysis/tutorials/quality-contamination-control/tutorial.html	Whole genome sequencing, Genomics, Microbiology, Microbial ecology	Taxonomic classification, Sequence contamination filtering, Cross-assembly, Statistical calculation, Visualisation, Sequencing quality control, Read mapping, Expression analysis	2024-07-15	2025-03-20	4	True	False	True	True	fastp, upload1, falco, recentrifuge, kraken2, est_abundance	UseGalaxy.eu, UseGalaxy.fr	UseGalaxy.cz, UseGalaxy.org (Main)	0		1498	1945	2.8333333333333335	0
Variant Analysis	Calling variants in non-diploid systems	https://training.galaxyproject.org//topics/variant-analysis/tutorials/non-dip/tutorial.html	Genomics, Sequence assembly, DNA polymorphism, Microbiology, Sequence analysis, Genetic variation	Genome indexing, Read mapping, Sequence alignment analysis, Formatting, Generation, Variant calling, Statistical calculation, Data handling, Sequencing quality control, Sequence alignment, Sequence composition calculation	2017-02-16	2024-03-15	23	True	False	False	True	Cut1, picard_MergeSamFiles, vcffilter2, fastqc, bwa_mem, bamleftalign, bamFilter, freebayes, picard_MarkDuplicates, vcf2tsv	UseGalaxy.eu, UseGalaxy.fr, UseGalaxy.org (Main)	UseGalaxy.be, UseGalaxy.cz, UseGalaxy.no, UseGalaxy.org.au	0		8537	15402	2.15	0
