Proteomics	Metaproteomics tutorial	https://training.galaxyproject.org//topics/proteomics/tutorials/metaproteomics/tutorial.html	Proteomics, Proteogenomics, Biodiversity, Taxonomy	Visualisation, Prediction and recognition	2017-06-28	2024-06-14	41	True	False	True	True	query_tabular, sqlite_to_tabular, unipept, search_gui, peptide_shaker	UseGalaxy.eu, UseGalaxy.no, UseGalaxy.org (Main), UseGalaxy.org.au	UseGalaxy.be, UseGalaxy.cz	0		2867	4572	2.716666666666667	0
Proteomics	Single Cell Proteomics data analysis with bioconductor-scp	https://training.galaxyproject.org//topics/proteomics/tutorials/bioconductor-scp/tutorial.html		Expression analysis, Visualisation	2025-02-07	2025-02-10	2	True	False	False	False	bioconductor_scp, Grouping1	UseGalaxy.eu, UseGalaxy.org.au		0		173	226	1.2	0
Proteomics	Neoantigen 2: Database merge and FragPipe discovery	https://training.galaxyproject.org//topics/proteomics/tutorials/neoantigen-fragpipe-discovery/tutorial.html			2025-01-14	2025-07-02	1	True	False	False	True	fragpipe, query_tabular, Remove beginning1, collapse_dataset, fasta_merge_files_and_filter_unique_sequences, Grep1, validate_fasta_database	UseGalaxy.eu, UseGalaxy.org (Main)	UseGalaxy.org.au	0		125	150	1.5	0
Proteomics	Secretome Prediction	https://training.galaxyproject.org//topics/proteomics/tutorials/secretome-prediction/tutorial.html			2017-04-13	2025-04-08	15	True	False	False	True	term_id_vs_term_name, tp_cut_tool, wolf_psort, tp_easyjoin_tool, uniprot, tp_sorted_uniq, Filter1, get_subontology_from, bg_uniq, Grep1, Convert characters1, comp1			0		636	955	1.5	0
Proteomics	Neoantigen 4: Variant Annotation	https://training.galaxyproject.org//topics/proteomics/tutorials/neoantigen-variant-annotation/tutorial.html			2025-01-14	2025-07-02	1	True	False	False	True	query_tabular, tab2fasta, regexColumn1, pep_pointer, Convert characters1	UseGalaxy.eu, UseGalaxy.org (Main), UseGalaxy.org.au	UseGalaxy.be, UseGalaxy.cz, UseGalaxy.no	0		58	72	1.6833333333333333	0
Proteomics	Proteogenomics 2: Database Search	https://training.galaxyproject.org//topics/proteomics/tutorials/proteogenomics-dbsearch/tutorial.html		Conversion, Peptide database search	2018-11-20	2025-05-08	24	True	False	True	True	query_tabular, tab2fasta, mz_to_sqlite, search_gui, ident_params, peptide_shaker	UseGalaxy.eu, UseGalaxy.org (Main), UseGalaxy.org.au	UseGalaxy.cz	0		1514	2256	4.8	0
Proteomics	Neoantigen 3: PepQuery2 Verification	https://training.galaxyproject.org//topics/proteomics/tutorials/neoantigen-peptide-verification/tutorial.html		Formatting, Filtering	2025-01-14	2025-07-02	1	True	False	False	True	msconvert, ncbi_blastp_wrapper, query_tabular, tab2fasta, pepquery2	UseGalaxy.eu, UseGalaxy.org (Main), UseGalaxy.org.au	UseGalaxy.cz	0		46	54	2.4833333333333334	0
Proteomics	MaxQuant and MSstats for the analysis of TMT data	https://training.galaxyproject.org//topics/proteomics/tutorials/maxquant-msstats-tmt/tutorial.html		Statistical calculation, Visualisation, Heat map generation, Standardisation and normalisation, Clustering, Protein quantification, Principal component plotting, Imputation	2021-08-13	2025-01-08	11	True	False	False	True	maxquant, msstatstmt	UseGalaxy.eu, UseGalaxy.org.au	UseGalaxy.cz, UseGalaxy.org (Main)	0		4196	5618	1.65	0
Proteomics	Multiomics data analysis using MultiGSEA	https://training.galaxyproject.org//topics/proteomics/tutorials/multiGSEA-tutorial/tutorial.html		Pathway analysis, Gene-set enrichment analysis, Aggregation	2025-03-10	2025-03-11	2	True	False	False	True	Filter1, multigsea, tp_grep_tool	UseGalaxy.eu	UseGalaxy.cz, UseGalaxy.org.au	0		225	247	1.8333333333333333	0
Proteomics	Clinical Metaproteomics 2: Discovery	https://training.galaxyproject.org//topics/proteomics/tutorials/clinical-mp-2-discovery/tutorial.html		Statistical calculation, Heat map generation, Standardisation and normalisation, Filtering, Imputation, Formatting, Clustering, Protein quantification, Principal component plotting, Visualisation	2024-02-06	2025-08-10	5	True	False	True	True	dbbuilder, msconvert, filter_tabular, Grouping1, fasta_cli, query_tabular, Remove beginning1, maxquant, Filter1, peptide_shaker, search_gui, Cut1, fasta_merge_files_and_filter_unique_sequences, Grep1, ident_params, fasta2tab, tp_cat	UseGalaxy.cz, UseGalaxy.eu, UseGalaxy.org (Main), UseGalaxy.org.au		0		329	442	7.366666666666666	0
Proteomics	Neoantigen 1b: Non-Reference-Database-Generation	https://training.galaxyproject.org//topics/proteomics/tutorials/neoantigen-non-reference-database-generation/tutorial.html		Statistical calculation, Sequence alignment, Transcriptome assembly, RNA-Seq analysis, Sequence annotation, Variant calling	2025-01-14	2025-07-02	1	True	False	False	True	custom_pro_db, bed_to_protein_map, hisat2, translate_bed, stringtie, CONVERTER_gz_to_uncompressed, query_tabular, tab2fasta, regexColumn1, gffcompare, sqlite_to_tabular, fasta_merge_files_and_filter_unique_sequences, filter_tabular, freebayes, gffcompare_to_bed, fasta2tab, tp_cat	UseGalaxy.eu, UseGalaxy.org (Main), UseGalaxy.org.au	UseGalaxy.be, UseGalaxy.cz, UseGalaxy.no	0		59	67	0.5333333333333333	0
Proteomics	Clinical Metaproteomics 5: Data Interpretation	https://training.galaxyproject.org//topics/proteomics/tutorials/clinical-mp-5-data-interpretation/tutorial.html		Visualisation, Prediction and recognition	2024-02-06	2025-08-10	4	True	False	True	True	Grep1, msstatstmt, unipept	UseGalaxy.cz, UseGalaxy.eu, UseGalaxy.org (Main), UseGalaxy.org.au		0		267	356	2.9	0
Proteomics	MaxQuant and MSstats for the analysis of label-free data	https://training.galaxyproject.org//topics/proteomics/tutorials/maxquant-msstats-dda-lfq/tutorial.html		Statistical calculation, Visualisation, Tag-based peptide identification, Heat map generation, Differential protein expression profiling, Standardisation and normalisation, Spectrum calculation, Clustering, Protein quantification, Principal component plotting, Imputation	2021-02-17	2025-09-22	19	True	False	True	True	Summary_Statistics1, tp_easyjoin_tool, tp_replace_in_column, uniprot, maxquant, Filter1, datamash_ops, ggplot2_heatmap2, Cut1, Grep1, fasta2tab, msstats		UseGalaxy.cz, UseGalaxy.eu, UseGalaxy.no, UseGalaxy.org (Main), UseGalaxy.org.au	0		8401	13564	2.6666666666666665	0
Proteomics	Neoantigen 5b: IEDB binding PepQuery Validated Neopeptides	https://training.galaxyproject.org//topics/proteomics/tutorials/neoantigen-hla-binding-novel-peptides/tutorial.html			2025-01-14	2025-07-02	1	True	False	False	True	table_compute, iedb_api, query_tabular, Remove beginning1, Filter1, Cut1, pepquery2	UseGalaxy.eu, UseGalaxy.org (Main), UseGalaxy.org.au	UseGalaxy.cz	0		36	38	1.0166666666666666	0
Proteomics	EncyclopeDIA	https://training.galaxyproject.org//topics/proteomics/tutorials/encyclopedia/tutorial.html		Formatting, Filtering	2021-06-21	2025-05-19	12	True	False	True	True	msconvert, encyclopedia_searchtolib, encyclopedia_quantify		UseGalaxy.cz, UseGalaxy.eu, UseGalaxy.org (Main), UseGalaxy.org.au	0		1957	2672	1.7666666666666666	0
Proteomics	Introduction to proteomics, protein identification, quantification and statistical modelling	https://training.galaxyproject.org//topics/proteomics/tutorials/introduction/slides.html			2017-12-01	2024-08-08	3	False	True	True	False			UseGalaxy.eu, UseGalaxy.org, UseGalaxy.org.au, UseGalaxy.fr	0		2845375	7530066	2.45	0
Proteomics	Label-free versus Labelled - How to Choose Your Quantitation Method	https://training.galaxyproject.org//topics/proteomics/tutorials/labelfree-vs-labelled/tutorial.html			2017-03-17	2025-05-27	18	True	False	False	False			UseGalaxy.eu, UseGalaxy.org, UseGalaxy.org.au, UseGalaxy.fr	0		7613	12321	0.9	0
Sequence analysis	Primer and primer scheme design for pan-specific detection and sequencing of viral pathogens across genotypes	https://training.galaxyproject.org//topics/sequence-analysis/tutorials/viral_primer_design/tutorial.html		PCR primer design, Local alignment, Sequence alignment, Sequence alignment analysis, Global alignment, Sequence analysis, Multiple sequence alignment	2025-03-20	2025-03-20	2	True	False	False	True	varvamp, rbc_mafft, split_file_to_collection, ncbi_makeblastdb, EMBOSS: degapseq20, fasta_compute_length	UseGalaxy.eu		0		473	555	1.0833333333333333	0
Sequence analysis	Screening assembled genomes for contamination using NCBI FCS	https://training.galaxyproject.org//topics/sequence-analysis/tutorials/ncbi-fcs/tutorial.html		Sequence contamination filtering, Sequence trimming, Sequence assembly validation	2024-04-16	2024-04-16	2	True	False	False	True	ncbi_fcs_gx, ncbi_fcs_adaptor	GalaxyTrakr, UseGalaxy.org (Main)		0		1735	2361	2.316666666666667	0
Sequence analysis	Mapping	https://training.galaxyproject.org//topics/sequence-analysis/tutorials/mapping/tutorial.html	Mapping	Statistical calculation, Read mapping, Sequence alignment analysis, Data handling, Primer removal, Sequence trimming, Genome visualisation, Sequencing quality control, Sequence composition calculation, Validation, Read pre-processing	2016-10-04	2025-03-31	43	True	True	True	True	jbrowse, multiqc, fastqc, bamFilter, trim_galore, bowtie2, samtools_stats	UseGalaxy.eu, UseGalaxy.org (Main), UseGalaxy.org.au	Galaxy@AuBi, GalaxyTrakr, UseGalaxy.be, UseGalaxy.cz, UseGalaxy.fr, UseGalaxy.no	0		2909813	7638513	5.166666666666667	0
Sequence analysis	Quality and contamination control in bacterial isolate using Illumina MiSeq Data	https://training.galaxyproject.org//topics/sequence-analysis/tutorials/quality-contamination-control/tutorial.html	Whole genome sequencing, Genomics, Microbiology, Microbial ecology	Statistical calculation, Expression analysis, Sequencing quality control, Taxonomic classification, Cross-assembly, Read mapping, Visualisation, Sequence contamination filtering	2024-07-15	2025-03-20	4	True	False	True	True	upload1, falco, kraken2, fastp, est_abundance, recentrifuge	UseGalaxy.eu, UseGalaxy.fr	UseGalaxy.cz, UseGalaxy.org (Main)	0		1487	1934	2.85	0
Sequence analysis	Clean and manage Sanger sequences from raw files to aligned consensus	https://training.galaxyproject.org//topics/sequence-analysis/tutorials/Manage_AB1_Sanger/tutorial.html		Data handling, Phylogenetic analysis, Demultiplexing, DNA barcoding, Sequencing quality control, Taxonomic classification, Sequence read processing, Sequence clustering, Visualisation, Sequence file editing	2024-01-08	2024-03-05	2	True	False	False	True	seqtk_trimfq, tab2fasta, ab1_fastq_converter, fastq_groomer, fastq_to_tabular, ncbi_blastn_wrapper, fastq_masker_by_quality, unzip, mothur_merge_files, seqtk_mergepe, filter_by_fasta_ids, __SORTLIST__, aligned_to_consensus, regex1, cshl_fastq_to_fasta, __FILTER_FROM_FILE__, qiime_align_seqs, cshl_fastx_reverse_complement, collection_element_identifiers, mothur_degap_seqs	UseGalaxy.cz, UseGalaxy.eu, UseGalaxy.fr		0		3137	3947	1.75	0
Sequence analysis	Quality Control	https://training.galaxyproject.org//topics/sequence-analysis/tutorials/quality-control/tutorial.html		Statistical calculation, Box-Whisker plot plotting, Sequence trimming, Primer removal, Sequencing quality control, Scatter plot plotting, Sequence composition calculation, Validation, Read pre-processing	2016-10-04	2025-03-29	48	True	True	True	True	fastqe, multiqc, cutadapt, fastqc, pycoqc, nanoplot	UseGalaxy.eu, UseGalaxy.org (Main), UseGalaxy.org.au	Galaxy@AuBi, UseGalaxy.cz, UseGalaxy.fr	0		2950164	7721541	5.483333333333333	0
Single Cell	Bulk RNA Deconvolution with MuSiC	https://training.galaxyproject.org//topics/single-cell/tutorials/bulk-music/tutorial.html			2022-02-11	2025-02-14	10	True	False	True	True	music_deconvolution, music_construct_eset, music_inspect_eset	UseGalaxy.cz, UseGalaxy.eu, UseGalaxy.org (Main), UseGalaxy.org.au		0		3816	4836	1.6166666666666667	0
Single Cell	Generating a single cell matrix using Alevin	https://training.galaxyproject.org//topics/single-cell/tutorials/scrna-case_alevin/tutorial.html		Sequence composition calculation, RNA-Seq quantification, Gene expression analysis	2021-03-03	2025-05-07	24	True	False	True	True	join1, sceasy_convert, anndata_manipulate, alevin, dropletutils_empty_drops, dropletutils_read_10x, anndata_inspect, _ensembl_gtf2gene_list, _salmon_kallisto_mtx_to_10x, Cut1, _dropletBarcodePlot	UseGalaxy.eu, UseGalaxy.fr, UseGalaxy.org (Main), UseGalaxy.org.au		0		3384	5158	3.5166666666666666	0
Single Cell	GO Enrichment Analysis on Single-Cell RNA-Seq Data	https://training.galaxyproject.org//topics/single-cell/tutorials/GO-enrichment/tutorial.html		Gene-set enrichment analysis	2024-09-17	2025-04-08	8	True	True	False	True	goenrichment, gprofiler_gost, Cut1, tp_split_on_column	UseGalaxy.cz, UseGalaxy.eu, UseGalaxy.no, UseGalaxy.org (Main)		0		738970	1703907	3.0	0
Single Cell	Pseudobulk Analysis with Decoupler and EdgeR	https://training.galaxyproject.org//topics/single-cell/tutorials/pseudobulk-analysis/tutorial.html		Differential gene expression analysis, Principal component visualisation, Expression profile clustering	2025-02-12	2025-05-09	8	True	False	True	True	column_remove_by_header, decoupler_pseudobulk, anndata_manipulate, tp_awk_tool, tp_replace_in_column, tp_replace_in_line, anndata_inspect, edger, volcanoplot, __EXTRACT_DATASET__, scanpy_filter	UseGalaxy.eu, UseGalaxy.fr, UseGalaxy.org (Main), UseGalaxy.org.au		0		1366	1586	0.65	0
Single Cell	Pre-processing of 10X Single-Cell RNA Datasets	https://training.galaxyproject.org//topics/single-cell/tutorials/scrna-preprocessing-tenx/tutorial.html		Sequence alignment, Loading, Validation, Community profiling, Sequencing quality control	2019-09-11	2025-04-29	13	True	False	True	True	rna_starsolo, dropletutils, multiqc	UseGalaxy.eu, UseGalaxy.org (Main), UseGalaxy.org.au	UseGalaxy.be, UseGalaxy.cz, UseGalaxy.fr, UseGalaxy.no	0		12085	15601	1.8666666666666667	0
Single Cell	Pre-processing of Single-Cell RNA Data	https://training.galaxyproject.org//topics/single-cell/tutorials/scrna-preprocessing/tutorial.html		Sequence alignment, Sequencing quality control, Sequence alignment analysis, Data handling, Read summarisation, Validation, RNA-Seq quantification	2019-02-22	2025-04-08	5	True	True	False	True	umi_tools_extract, featurecounts, tp_sed_tool, multiqc, rna_star, umi_tools_count, bamFilter, collection_column_join, __FLATTEN__, samtools_stats	UseGalaxy.eu	UseGalaxy.be, UseGalaxy.cz, UseGalaxy.fr, UseGalaxy.no, UseGalaxy.org (Main), UseGalaxy.org.au	0		2851580	7538145	4.716666666666667	0
Single Cell	Single-cell quality control with scater	https://training.galaxyproject.org//topics/single-cell/tutorials/scrna-scater-qc/tutorial.html		Read pre-processing, Sequence visualisation, Sequencing quality control	2019-10-23	2025-02-14	6	True	False	False	True	scater_plot_pca, scater_create_qcmetric_ready_sce, scater_plot_dist_scatter, scater_filter	UseGalaxy.be, UseGalaxy.eu, UseGalaxy.no, UseGalaxy.org.au	UseGalaxy.cz	0		683	773	0.75	0
Single Cell	Pre-processing of 10X Single-Cell ATAC-seq Datasets	https://training.galaxyproject.org//topics/single-cell/tutorials/scatac-preprocessing-tenx/tutorial.html		Statistical calculation, Generation, Visualisation, Mapping, Genome indexing, Peak calling, Enrichment analysis, Sequencing quality control, Differential gene expression analysis, Expression profile clustering, Sequence alignment, Principal component visualisation, Sequence composition calculation, Read mapping, Imputation, Gene regulatory network analysis	2023-04-24	2025-10-16	10	True	False	False	True	bwa_mem, tp_sorted_uniq, fastqc, sinto_barcode, anndata_inspect, episcanpy_preprocess, scanpy_plot, episcanpy_build_matrix, falco, macs2_callpeak, sinto_fragments, bedtools_sortbed	UseGalaxy.org (Main), UseGalaxy.org.au	UseGalaxy.cz	0		5855	6903	1.1	0
Single Cell	Converting between common single cell data formats	https://training.galaxyproject.org//topics/single-cell/tutorials/scrna-data-ingest/tutorial.html		Community profiling, Loading	2024-02-13	2025-03-11	4	True	False	False	True	join1, tp_cut_tool, tabular_to_fastq, anndata_ops, sceasy_convert, monocle3_create, dropletutils, tp_tail_tool, dropletutils_read_10x, datamash_transpose, anndata_inspect, regexColumn1, Filter1, seurat_read10x, Cut1, scanpy_filter_cells, fastq_to_tabular		UseGalaxy.org (Main)	0		2375	2832	1.3166666666666667	0
Single Cell	An introduction to scRNA-seq data analysis	https://training.galaxyproject.org//topics/single-cell/tutorials/scrna-intro/slides.html			2021-01-29	2025-02-13	8	False	True	True	False			UseGalaxy.eu, UseGalaxy.org, UseGalaxy.org.au, UseGalaxy.fr	0		2812957	7416028	2.45	0
Single Cell	Generating a single cell matrix using Alevin and combining datasets (bash + R)	https://training.galaxyproject.org//topics/single-cell/tutorials/alevin-commandline/tutorial.html			2023-12-08	2025-04-22	5	True	False	False	False			UseGalaxy.eu, UseGalaxy.org, UseGalaxy.org.au, UseGalaxy.fr	0		593	829	3.8	0
Single Cell	Importing files from public atlases	https://training.galaxyproject.org//topics/single-cell/tutorials/EBI-retrieval/tutorial.html			2023-11-14	2025-03-11	8	True	False	True	True	sceasy_convert, anndata_ops, retrieve_scxa, hca_matrix_downloader, regexColumn1, scanpy_read_10x, seurat_read10x, tp_find_and_replace, tp_grep_tool			0		536	709	3.95	0
Single Cell	Understanding Barcodes	https://training.galaxyproject.org//topics/single-cell/tutorials/scrna-umis/tutorial.html		Sequence composition calculation, Statistical calculation, Sequencing quality control	2019-02-20	2025-02-14	11	True	False	True	True	umi_tools_extract, fastqc, seq_filter_by_id	UseGalaxy.cz, UseGalaxy.eu, UseGalaxy.fr, UseGalaxy.org (Main), UseGalaxy.org.au	Galaxy@AuBi, UseGalaxy.no	0		6197	7721	1.2333333333333334	0
Single Cell	Downstream Single-cell RNA analysis with RaceID	https://training.galaxyproject.org//topics/single-cell/tutorials/scrna-raceid/tutorial.html		Molecular dynamics, Expression analysis, Expression profile clustering	2019-03-25	2025-02-14	7	True	False	False	True	tp_sed_tool, raceid_inspecttrajectory, raceid_trajectory, tp_head_tool, datamash_transpose, raceid_clustering, raceid_filtnormconf, datamash_ops, raceid_inspectclusters	UseGalaxy.eu, UseGalaxy.no, UseGalaxy.org (Main)	UseGalaxy.be, UseGalaxy.cz, UseGalaxy.org.au	0		1051	1242	1.3	0
Single Cell	Clustering 3K PBMCs with Scanpy	https://training.galaxyproject.org//topics/single-cell/tutorials/scrna-scanpy-pbmc3k/tutorial.html		Principal component visualisation, Differential gene expression analysis, Expression profile clustering	2019-12-19	2025-04-29	16	True	True	True	True	scanpy_cluster_reduce_dimension, anndata_manipulate, scanpy_remove_confounders, anndata_import, scanpy_inspect, anndata_inspect, scanpy_plot, scanpy_normalize, datamash_ops, scanpy_filter	UseGalaxy.eu, UseGalaxy.org (Main), UseGalaxy.org.au	UseGalaxy.be, UseGalaxy.cz, UseGalaxy.fr, UseGalaxy.no	0		2853222	7541271	4.466666666666667	0
Single Cell	Filter, plot, and explore single cell RNA-seq data with Seurat (R)	https://training.galaxyproject.org//topics/single-cell/tutorials/scrna-case_FilterPlotandExploreRStudio/tutorial.html			2023-10-02	2025-03-11	11	True	False	False	False			UseGalaxy.eu, UseGalaxy.org, UseGalaxy.org.au, UseGalaxy.fr	0		3157	3612	0.9666666666666667	0
Single Cell	Combining single cell datasets after pre-processing	https://training.galaxyproject.org//topics/single-cell/tutorials/scrna-case_alevin-combine-datasets/tutorial.html			2022-09-08	2025-04-22	22	True	False	True	True	anndata_ops, anndata_manipulate, tp_replace_in_column, anndata_inspect, Cut1, Paste1	UseGalaxy.eu, UseGalaxy.org.au	UseGalaxy.be, UseGalaxy.org (Main)	0		2452	3434	2.5166666666666666	0
Single Cell	Removing the effects of the cell cycle	https://training.galaxyproject.org//topics/single-cell/tutorials/scrna-case_cell-cycle/tutorial.html		Principal component visualisation, Differential gene expression analysis, Expression profile clustering	2023-01-25	2025-03-11	14	True	False	False	True	scanpy_cluster_reduce_dimension, anndata_manipulate, tp_easyjoin_tool, table_compute, addValue, scanpy_regress_variable, anndata_inspect, scanpy_inspect, scanpy_plot, cat1, sort1			0		2050	2419	0.7833333333333333	0
Single Cell	Single-cell ATAC-seq standard processing with SnapATAC2	https://training.galaxyproject.org//topics/single-cell/tutorials/scatac-standard-processing-snapatac2/tutorial.html		Generation, Essential dynamics, Genome indexing, Differential gene expression analysis, Expression profile clustering, Sequence alignment, Dimensionality reduction, Principal component visualisation, Read mapping, Gene expression profiling	2024-07-11	2025-07-02	5	True	False	False	True	anndata_ops, bwa_mem, anndata_manipulate, snapatac2_preprocessing, scanpy_filter, snapatac2_plotting, snapatac2_peaks_and_motif, scanpy_inspect, anndata_inspect, scanpy_plot, Cut1, replace_column_with_key_value_file, snapatac2_clustering, scanpy_normalize, fasta_compute_length			0		1439	1749	1.1	0
Single Cell	Comparing inferred cell compositions using MuSiC deconvolution	https://training.galaxyproject.org//topics/single-cell/tutorials/bulk-music-4-compare/tutorial.html			2023-01-20	2025-02-13	10	True	False	False	True	music_compare	UseGalaxy.cz, UseGalaxy.eu, UseGalaxy.org (Main), UseGalaxy.org.au		0		269	412	1.0333333333333334	0
Single Cell	Filter, plot and explore single-cell RNA-seq data with Scanpy (Python)	https://training.galaxyproject.org//topics/single-cell/tutorials/scrna-case-jupyter_basic-pipeline/tutorial.html			2023-08-25	2025-03-11	13	True	False	True	False			UseGalaxy.eu, UseGalaxy.org, UseGalaxy.org.au, UseGalaxy.fr	0		3181	3775	1.5	0
Single Cell	Converting NCBI Data to the AnnData Format	https://training.galaxyproject.org//topics/single-cell/tutorials/scrna-ncbi-anndata/tutorial.html			2023-12-13	2025-03-11	7	True	False	True	True	anndata_ops, anndata_manipulate, tp_replace_in_column, unzip, anndata_import, anndata_inspect, Cut1, Paste1, scanpy_filter_cells	UseGalaxy.org.au		0		420	497	1.7666666666666666	0
Single Cell	Scanpy Parameter Iterator	https://training.galaxyproject.org//topics/single-cell/tutorials/scanpy_parameter_iterator/tutorial.html			2023-07-19	2025-02-13	8	True	False	False	True	scanpy_compute_graph, scanpy_parameter_iterator, scanpy_plot_embed, scanpy_find_cluster, scanpy_run_tsne, scanpy_run_umap	UseGalaxy.org (Main), UseGalaxy.org.au		0		268	302	1.1666666666666667	0
Single Cell	Multi-sample batch correction with Harmony and SnapATAC2	https://training.galaxyproject.org//topics/single-cell/tutorials/scatac-batch-correction-snapatac2/tutorial.html		Essential dynamics, Dimensionality reduction, Gene expression profiling	2025-02-28	2025-07-02	2	True	False	False	True	anndata_manipulate, snapatac2_preprocessing, snapatac2_plotting, collection_element_identifiers, snapatac2_peaks_and_motif, __FILTER_FROM_FILE__, anndata_inspect, Show beginning1, snapatac2_clustering, __EXTRACT_DATASET__, fasta_compute_length	UseGalaxy.eu, UseGalaxy.org (Main), UseGalaxy.org.au		0		421	476	0.9333333333333333	0
Single Cell	Evaluating Reference Data for Bulk RNA Deconvolution	https://training.galaxyproject.org//topics/single-cell/tutorials/bulk-deconvolution-evaluate/tutorial.html		Visualisation, Annotation	2025-02-02	2025-03-11	3	True	False	False	True	music_deconvolution, tp_sed_tool, tp_multijoin_tool, collapse_dataset, Add_a_column1, Count1, join1, tp_cut_tool, music_construct_eset, table_compute, Remove beginning1, __DUPLICATE_FILE_TO_COLLECTION__, ggplot2_violin, tp_easyjoin_tool, tp_awk_tool, ggplot2_point, Paste1, annotatemyids, datamash_transpose, Cut1, collection_column_join, bg_column_arrange_by_header	UseGalaxy.eu, UseGalaxy.org (Main), UseGalaxy.org.au	UseGalaxy.cz	0		97	117	1.05	0
Single Cell	Filter, plot, and explore single cell RNA-seq data with Seurat	https://training.galaxyproject.org//topics/single-cell/tutorials/scrna-case_FilterPlotandExplore_SeuratTools/tutorial.html			2024-04-09	2025-03-11	10	True	False	False	True	seurat_run_pca, seurat_filter_cells, retrieve_scxa, seurat_normalise_data, seurat_run_umap, seurat_find_clusters, seurat_scale_data, seurat_find_neighbours, seurat_read10x, seurat_find_markers, seurat_plot, seurat_find_variable_genes	UseGalaxy.eu, UseGalaxy.fr, UseGalaxy.org (Main), UseGalaxy.org.au		0		1769	2160	1.35	0
Single Cell	Clustering 3K PBMCs with Seurat	https://training.galaxyproject.org//topics/single-cell/tutorials/scrna-seurat-pbmc3k/tutorial.html			2025-01-23	2025-05-09	5	True	False	True	True	csv_to_tabular, seurat_reduce_dimension, seurat_preprocessing, Filter1, Cut1, seurat_data, seurat_clustering, seurat_plot, seurat_create	UseGalaxy.eu, UseGalaxy.fr, UseGalaxy.org (Main), UseGalaxy.org.au	MISSISSIPPI	0		1100	1301	1.2166666666666666	0
Single Cell	Filter, plot and explore single-cell RNA-seq data with Scanpy	https://training.galaxyproject.org//topics/single-cell/tutorials/scrna-case_basic-pipeline/tutorial.html		Principal component visualisation, Differential gene expression analysis, Expression profile clustering	2021-03-24	2025-04-23	24	True	False	True	True	scanpy_cluster_reduce_dimension, anndata_ops, anndata_manipulate, scanpy_plot_embed, join1, scanpy_find_markers, interactive_tool_cellxgene_vip, scanpy_inspect, anndata_inspect, scanpy_plot, scanpy_normalise_data, scanpy_compute_graph, retrieve_scxa, scanpy_run_pca, scanpy_find_variable_genes, scanpy_scale_data, scanpy_filter_genes, Cut1, scanpy_normalize, scanpy_filter_cells, scanpy_find_cluster, scanpy_run_tsne, scanpy_run_umap, scanpy_filter			0		5175	7894	2.6166666666666667	0
Single Cell	Plates, Batches, and Barcodes	https://training.galaxyproject.org//topics/single-cell/tutorials/scrna-plates-batches-barcodes/slides.html			2019-02-16	2025-02-13	4	False	True	True	False			UseGalaxy.eu, UseGalaxy.org, UseGalaxy.org.au, UseGalaxy.fr	0		2845375	7530072	2.45	0
Single Cell	Inferring single cell trajectories with Scanpy (Python)	https://training.galaxyproject.org//topics/single-cell/tutorials/scrna-case_JUPYTER-trajectories/tutorial.html			2021-04-07	2025-03-11	20	True	False	True	False			UseGalaxy.eu, UseGalaxy.org, UseGalaxy.org.au, UseGalaxy.fr	0		4436	5252	1.3	0
