Topic	Title	Link	EDAM topic	EDAM operation	Creation	Last modification	Version	Tutorial	Slides	Video	Workflows	Tools	Servers with precise tool versions	Servers with tool but different versions	Feedback number	Feedback mean note	Visitors	Page views	Visit duration	Video views
Galaxy Server administration	Galaxy on the Cloud	https://training.galaxyproject.org//topics/admin/tutorials/cloudbursting/slides.html			2019-01-31	2024-12-19	7	False	True	False	False				0		3076617	7898945	2.3333333333333335	0
Galaxy Server administration	Galaxy Tool Management with Ephemeris	https://training.galaxyproject.org//topics/admin/tutorials/tool-management/tutorial.html			2019-01-27	2025-04-03	39	True	True	True	False				0		3078427	7901525	5.716666666666667	0
Galaxy Server administration	Galaxy Installation with Ansible	https://training.galaxyproject.org//topics/admin/tutorials/ansible-galaxy/tutorial.html	Database management, Informatics, Data management		2019-01-28	2025-11-28	108	True	True	True	False				0		3102239	7946542	4.066666666666666	0
Galaxy Server administration	Connecting Galaxy to a compute cluster	https://training.galaxyproject.org//topics/admin/tutorials/connect-to-compute-cluster/tutorial.html			2018-01-07	2025-11-24	65	True	True	True	False				0		3080713	7905988	5.583333333333333	0
Galaxy Server administration	Galaxy Monitoring with gxadmin	https://training.galaxyproject.org//topics/admin/tutorials/gxadmin/tutorial.html			2019-01-28	2025-11-13	27	True	True	True	False				0		3077519	7900353	5.083333333333333	0
Galaxy Server administration	Reference Data with CVMFS	https://training.galaxyproject.org//topics/admin/tutorials/cvmfs/tutorial.html			2019-01-27	2025-11-24	54	True	True	True	False				0		3078786	7902143	5.466666666666667	0
Galaxy Server administration	Galaxy Monitoring with Telegraf and Grafana	https://training.galaxyproject.org//topics/admin/tutorials/monitoring/tutorial.html			2019-01-31	2025-11-24	54	True	True	True	False				0		3079516	7904303	3.2	0
Galaxy Server administration	User, Role, Group, Quota, and Authentication managment	https://training.galaxyproject.org//topics/admin/tutorials/users-groups-quotas/slides.html			2018-01-07	2024-08-08	19	False	True	True	False				0		3076617	7898947	2.3333333333333335	0
Galaxy Server administration	Distributed Object Storage	https://training.galaxyproject.org//topics/admin/tutorials/object-store/tutorial.html			2019-01-28	2025-03-24	28	True	True	True	False				0		3077980	7901079	3.9	0
Galaxy Server administration	Galaxy Interactive Tools	https://training.galaxyproject.org//topics/admin/tutorials/interactive-tools/tutorial.html			2020-02-27	2025-11-27	28	True	True	True	False				0		3078950	7902446	4.966666666666667	0
Galaxy Server administration	Gearing towards production	https://training.galaxyproject.org//topics/admin/tutorials/production/slides.html			2019-01-28	2025-11-20	11	False	True	True	False				0		3076617	7898947	2.3333333333333335	0
Galaxy Server administration	Data Libraries	https://training.galaxyproject.org//topics/admin/tutorials/data-library/tutorial.html			2021-01-14	2025-11-24	35	True	True	True	False				0		3060386	7835839	4.366666666666666	0
Galaxy Server administration	Server Maintenance: Cleanup, Backup, and Restoration	https://training.galaxyproject.org//topics/admin/tutorials/backup-cleanup/tutorial.html	Database management, Informatics, Data management		2019-01-31	2025-11-24	10	True	True	True	False				0		3077217	7899745	10.933333333333334	0
Galaxy Server administration	Running Jobs on Remote Resources with Pulsar	https://training.galaxyproject.org//topics/admin/tutorials/pulsar/tutorial.html			2019-01-28	2025-11-25	58	True	True	True	False				0		3079198	7903181	5.183333333333334	0
Galaxy Server administration	Ansible	https://training.galaxyproject.org//topics/admin/tutorials/ansible/tutorial.html			2018-07-11	2024-08-08	48	True	True	True	False				0		3083094	7910505	4.016666666666667	0
Galaxy Server administration	Docker and Galaxy	https://training.galaxyproject.org//topics/admin/tutorials/galaxy-docker/slides.html			2016-09-29	2022-10-18	16	False	True	False	False				0		3076617	7898949	2.3333333333333335	0
Galaxy Server administration	uWSGI	https://training.galaxyproject.org//topics/admin/tutorials/uwsgi/slides.html			2019-01-28	2022-03-01	9	False	True	False	False				0		3076617	7898949	2.3333333333333335	0
Galaxy Server administration	Galaxy from an administrator's point of view	https://training.galaxyproject.org//topics/admin/tutorials/introduction/slides.html			2017-06-12	2024-06-25	6	False	True	False	False				0		3076617	7898949	2.3333333333333335	0
Galaxy Server administration	Galaxy Troubleshooting	https://training.galaxyproject.org//topics/admin/tutorials/troubleshooting/slides.html			2019-01-28	2024-06-25	15	False	True	False	False				0		3076617	7898949	2.3333333333333335	0
Galaxy Server administration	External Authentication	https://training.galaxyproject.org//topics/admin/tutorials/external-auth/tutorial.html			2019-01-28	2022-10-18	14	True	True	False	False				0		3077328	7900062	3.1166666666666667	0
Galaxy Server administration	Galactic Database	https://training.galaxyproject.org//topics/admin/tutorials/database/slides.html			2019-01-28	2025-11-20	6	False	True	True	False				0		3076617	7898949	2.3333333333333335	0
Galaxy Server administration	Controlling Galaxy with systemd or Supervisor	https://training.galaxyproject.org//topics/admin/tutorials/systemd-supervisor/slides.html			2019-01-28	2023-04-16	5	False	True	True	False				0		3076617	7898949	2.3333333333333335	0
Galaxy Server administration	Galaxy Monitoring	https://training.galaxyproject.org//topics/admin/tutorials/general-monitoring/slides.html			2019-04-26	2022-03-01	5	False	True	False	False				0		3076617	7898949	2.3333333333333335	0
Galaxy Server administration	Galaxy Administrator Time Burden and Technology Usage	https://training.galaxyproject.org//topics/admin/tutorials/poll-ssa/slides.html			2024-07-10	2024-07-10	1	False	True	False	False				0		1068741	2303034	1.9666666666666666	0
Galaxy Server administration	Server: Other	https://training.galaxyproject.org//topics/admin/tutorials/stuff/slides.html			2018-01-07	2023-02-17	6	False	True	False	False				0		3076617	7898949	2.3333333333333335	0
Galaxy Server administration	Reference Data with Data Managers	https://training.galaxyproject.org//topics/admin/tutorials/reference-genomes/tutorial.html		Sequence alignment, Read mapping, Generation, Genome indexing	2019-01-28	2023-04-21	7	True	True	False	False	bwa_mem_index_builder_data_manager, bwa, data_manager_fetch_genome_all_fasta_dbkey			0		3077200	7899707	6.533333333333333	0
Galaxy Server administration	Advanced customisation of a Galaxy instance	https://training.galaxyproject.org//topics/admin/tutorials/advanced-galaxy-customisation/slides.html			2017-06-27	2023-04-17	18	False	True	False	False				0		3076617	7898949	2.3333333333333335	0
Galaxy Server administration	Setting up Celery Workers for Galaxy	https://training.galaxyproject.org//topics/admin/tutorials/celery/tutorial.html			2022-07-16	2025-11-24	19	True	True	False	False				0		2221394	5078454	3.716666666666667	0
Galaxy Server administration	Empathy	https://training.galaxyproject.org//topics/admin/tutorials/empathy/slides.html			2019-01-31	2021-04-06	4	False	True	False	False				0		3076617	7898949	2.3333333333333335	0
Galaxy Server administration	Deploying a Beacon v1 in Galaxy	https://training.galaxyproject.org//topics/admin/tutorials/beacon/tutorial.html			2023-04-16	2025-11-22	7	True	False	False	False				0		153	171	1.9	0
Galaxy Server administration	Configuring the Onedata connectors (remotes, Object Store, BYOS, BYOD)	https://training.galaxyproject.org//topics/admin/tutorials/onedata-configuration/tutorial.html			2025-03-24	2025-04-08	2	True	False	False	False				0		53	58	3.2333333333333334	0
Galaxy Server administration	Enable upload via FTP	https://training.galaxyproject.org//topics/admin/tutorials/ftp/tutorial.html			2021-06-18	2025-11-24	28	True	False	False	False				0		1255	1716	1.6166666666666667	0
Galaxy Server administration	Upgrading Galaxy	https://training.galaxyproject.org//topics/admin/tutorials/upgrading/tutorial.html			2021-06-08	2024-11-25	10	True	False	True	False				0		724	1104	2.8833333333333333	0
Galaxy Server administration	Create a subdomain for your community on UseGalaxy.eu	https://training.galaxyproject.org//topics/admin/tutorials/subdomain/tutorial.html			2024-11-27	2024-12-13	2	True	False	False	False				0		46	52	2.566666666666667	0
Galaxy Server administration	Performant Uploads with TUS	https://training.galaxyproject.org//topics/admin/tutorials/tus/tutorial.html			2022-03-01	2025-11-22	22	True	False	True	False				0		885	1291	5.45	0
Galaxy Server administration	Monitoring Galaxy and Pulsar with Sentry	https://training.galaxyproject.org//topics/admin/tutorials/sentry/tutorial.html			2023-04-19	2025-11-25	12	True	False	False	False				0		231	279	1.4166666666666667	0
Galaxy Server administration	Galaxy Monitoring with Reports	https://training.galaxyproject.org//topics/admin/tutorials/reports/tutorial.html			2019-01-31	2025-11-24	47	True	False	False	False				0		506	673	2.7	0
Galaxy Server administration	How I learned to stop worrying and love the systemd	https://training.galaxyproject.org//topics/admin/tutorials/stop-worrying-love-systemd/tutorial.html			2022-07-06	2023-09-28	3	True	False	False	False				0		688	791	0.6166666666666667	0
Galaxy Server administration	Training Infrastructure as a Service (TIaaS)	https://training.galaxyproject.org//topics/admin/tutorials/tiaas/tutorial.html			2020-02-12	2025-11-24	45	True	False	True	False				0		557	742	3.183333333333333	0
Galaxy Server administration	Mapping Jobs to Destinations using TPV	https://training.galaxyproject.org//topics/admin/tutorials/job-destinations/tutorial.html			2021-01-17	2025-11-24	43	True	False	True	False				0		1705	2661	3.35	0
Galaxy Server administration	Customizing the look of Galaxy (Manual)	https://training.galaxyproject.org//topics/admin/tutorials/customization-manual/tutorial.html			2023-04-16	2025-04-08	2	True	False	False	False				0		204	243	2.05	0
Galaxy Server administration	Customizing the look of Galaxy	https://training.galaxyproject.org//topics/admin/tutorials/customization/tutorial.html			2023-04-16	2025-11-22	8	True	False	False	False				0		599	731	4.366666666666666	0
Galaxy Server administration	Alternative Celery Deployment for Galaxy	https://training.galaxyproject.org//topics/admin/tutorials/celeryless/tutorial.html			2024-11-07	2024-11-07	1	True	False	False	False				0		67	73	2.5833333333333335	0
Galaxy Server administration	Use Apptainer containers for running Galaxy jobs	https://training.galaxyproject.org//topics/admin/tutorials/apptainer/tutorial.html			2021-01-08	2025-11-24	19	True	False	True	False				0		1097	1395	2.6	0
Galaxy Server administration	Galaxy Database schema	https://training.galaxyproject.org//topics/admin/tutorials/database-schema/tutorial.html			2016-07-20	2025-04-08	23	True	False	False	False				0		3044	4969	1.0666666666666667	0
Galaxy Server administration	Adding file-sources to Galaxy	https://training.galaxyproject.org//topics/admin/tutorials/file_sources/tutorial.html			2025-01-20	2025-01-20	1	True	False	False	False				0		59	77	2.6666666666666665	0
Galaxy Server administration	Automation with Jenkins	https://training.galaxyproject.org//topics/admin/tutorials/jenkins/tutorial.html			2019-08-06	2022-10-18	10	True	False	False	False				0		8325	16474	0.7166666666666667	0
Galaxy Server administration	Reference Data with CVMFS without Ansible	https://training.galaxyproject.org//topics/admin/tutorials/cvmfs-manual/tutorial.html			2020-06-17	2023-11-23	9	True	False	False	False				0		405	542	2.3833333333333333	0
Galaxy Server administration	Galaxy Installation on Kubernetes	https://training.galaxyproject.org//topics/admin/tutorials/k8s-deploying-galaxy/tutorial.html			2019-07-02	2024-06-30	7	True	False	False	False				0		1620	2671	2.2666666666666666	0
Galaxy Server administration	Managing Galaxy on Kubernetes	https://training.galaxyproject.org//topics/admin/tutorials/k8s-managing-galaxy/tutorial.html			2019-07-02	2024-12-19	7	True	False	False	False				0		677	987	2.1	0
Galaxy Server administration	Galaxy usage on SURF Research Cloud	https://training.galaxyproject.org//topics/admin/tutorials/surf-research-cloud-galaxy/tutorial.html	Informatics, Data management		2024-12-18	2025-08-05	4	True	False	False	False				0		79	98	1.65	0
Galaxy Server administration	Pulsar usage on SURF Research Cloud	https://training.galaxyproject.org//topics/admin/tutorials/surf-research-cloud-pulsar/tutorial.html	Informatics, Data management		2024-12-18	2024-12-19	3	True	False	False	False				0		77	85	0.48333333333333334	0
Galaxy Server administration	Deploying Wireguard for private mesh networking	https://training.galaxyproject.org//topics/admin/tutorials/wireguard/tutorial.html			2022-09-21	2024-12-19	4	True	False	False	False				0		1110	1264	0.3333333333333333	0
Galaxy Server administration	Deploying Tailscale/Headscale for private mesh networking	https://training.galaxyproject.org//topics/admin/tutorials/wireguard-headscale/tutorial.html	Data security, Software engineering		2022-09-21	2024-12-19	4	True	False	False	False				0		2378	3061	0.43333333333333335	0
Galaxy Server administration	Deploying a compute cluster in OpenStack via Terraform	https://training.galaxyproject.org//topics/admin/tutorials/terraform/tutorial.html			2018-10-27	2024-12-19	15	True	True	False	False				0		3092706	7929132	3.283333333333333	0
Image analysis using Deep Learning	Contribute to the BioImage.IO models	https://training.galaxyproject.org//topics/ai4life/tutorials/contribute-materials/slides.html			2023-05-18	2023-05-24	3	False	True	True	False			UseGalaxy.eu, UseGalaxy.org, UseGalaxy.org.au, UseGalaxy.fr	0		1714550	3790802	2.1166666666666667	0
Image analysis using Deep Learning	Welcome to the BioImage Model Zoo	https://training.galaxyproject.org//topics/ai4life/tutorials/welcome-bioimageio/slides.html			2023-05-11	2023-05-18	3	False	True	True	False			UseGalaxy.eu, UseGalaxy.org, UseGalaxy.org.au, UseGalaxy.fr	0		1728836	3823178	2.1166666666666667	0
Image analysis using Deep Learning	BioImage Model Zoo: Advanced models in one-click	https://training.galaxyproject.org//topics/ai4life/tutorials/getting-started/slides.html			2023-04-18	2023-05-24	4	False	True	True	False			UseGalaxy.eu, UseGalaxy.org, UseGalaxy.org.au, UseGalaxy.fr	0		1775785	3926574	2.1333333333333333	0
Assembly	An Introduction to Genome Assembly	https://training.galaxyproject.org//topics/assembly/tutorials/general-introduction/tutorial.html		Sequence assembly validation, De-novo assembly, Validation, Sequencing quality control, Visualisation, Formatting, Statistical calculation, Sequence composition calculation	2017-05-23	2024-09-12	29	True	True	True	True	velvetg, multiqc, fastq_paired_end_interlacer, quast, fastqc, velveth	Galaxy@AuBi, UseGalaxy.org (Main), UseGalaxy.org.au	UseGalaxy.be, UseGalaxy.cz, UseGalaxy.eu, UseGalaxy.fr	0		3112603	7957789	5.183333333333334	0
Assembly	Genome Assembly Quality Control	https://training.galaxyproject.org//topics/assembly/tutorials/assembly-quality-control/tutorial.html	Biodiversity, Sequence assembly, Data quality management	Genome assembly, Visualisation, Sequence assembly validation, k-mer counting, De-novo assembly, Phasing, Scaffolding	2022-08-26	2025-06-04	6	True	True	False	True	meryl, chromeister, quast, busco, merqury	UseGalaxy.eu, UseGalaxy.fr, UseGalaxy.org.au	UseGalaxy.cz	0		2176032	4945250	4.383333333333334	0
Assembly	Genome Assembly of MRSA from Oxford Nanopore MinION data (and optionally Illumina data)	https://training.galaxyproject.org//topics/assembly/tutorials/mrsa-nanopore/tutorial.html	Sequence assembly, Whole genome sequencing, Public health and epidemiology, Genomics, Microbiology, Antimicrobial resistance	Sequence assembly visualisation, Read mapping, Sequence assembly validation, Box-Whisker plot plotting, Scatter plot plotting, Cross-assembly, Genome assembly, Visualisation, Sequencing quality control, Mapping assembly, Sequence contamination filtering, Sequencing error detection, Sequence composition calculation, De-novo assembly, Statistical calculation, Sequence alignment, Filtering	2021-03-24	2024-11-29	15	True	False	False	True	bandage_image, polypolish, flye, CONVERTER_bz2_to_uncompressed, quast, bwa_mem2, fastp, filtlong, porechop, upload1, fastqc, nanoplot	UseGalaxy.eu	UseGalaxy.cz, UseGalaxy.fr	0		10528	15763	3.4	0
Assembly	Large genome assembly and polishing	https://training.galaxyproject.org//topics/assembly/tutorials/largegenome/tutorial.html	Genomics, Sequence assembly, Biodiversity	Sequence assembly visualisation, Sequence assembly validation, Box-Whisker plot plotting, Pairwise sequence alignment, Scatter plot plotting, Cross-assembly, Validation, Sequencing quality control, Genome assembly, Mapping assembly, Visualisation, Sequence contamination filtering, Variant calling, De-novo assembly, Statistical calculation, Sequence composition calculation, Base-calling, Sequence assembly	2023-03-06	2025-06-04	14	True	False	True	True	bandage_image, meryl, fasta-stats, multiqc, flye, genomescope, barchart_gnuplot, quast, busco, racon, fastp, medaka_consensus_pipeline, fastqc, minimap2, nanoplot	UseGalaxy.eu, UseGalaxy.org.au	UseGalaxy.cz	0		7508	9737	1.9833333333333334	0
Assembly	Hybrid genome assembly - Nanopore and Illumina	https://training.galaxyproject.org//topics/assembly/tutorials/hybrid_denovo_assembly/tutorial.html		Read mapping, Sequence assembly validation, Genome indexing, Cross-assembly, Genome assembly, Sequencing quality control, Validation, Mapping assembly, Read alignment, Aggregation, Visualisation, De-novo assembly, Generation, Sequence alignment, Sequence assembly, Analysis	2025-11-03	2025-11-06	2	True	False	False	True	unicycler, multiqc, flye, pilon, quast, busco, bwa_mem	UseGalaxy.cz, UseGalaxy.eu, UseGalaxy.fr, UseGalaxy.org (Main), UseGalaxy.org.au	GalaxyTrakr, UseGalaxy.be, UseGalaxy.no	0		174	224	2.066666666666667	0
Assembly	ERGA post-assembly QC	https://training.galaxyproject.org//topics/assembly/tutorials/ERGA-post-assembly-QC/tutorial.html	Genomics, Sequence assembly, Biodiversity	Sequence trimming, Sequence assembly visualisation, Sequence assembly validation, Data parsing, k-mer counting, Pairwise sequence alignment, Scaffolding, Genome assembly, Visualisation, Sequence alignment, Data handling, De-novo assembly, Sequence alignment analysis, Phasing, Data deposition, Genotyping	2023-06-23	2025-06-04	8	True	False	True	True	merqury, smudgeplot, bandage_image, __EXTRACT_DATASET__, pretext_snapshot, genomescope, busco, bg_diamond, minimap2, collapse_dataset, bellerophon, blobtoolkit, tp_find_and_replace, gfastats, interactive_tool_blobtoolkit, meryl, CONVERTER_gz_to_uncompressed, pretext_map, bwa_mem2, samtools_stats	UseGalaxy.eu	UseGalaxy.org (Main), UseGalaxy.org.au	0		2003	2598	2.033333333333333	0
Assembly	Chloroplast genome assembly	https://training.galaxyproject.org//topics/assembly/tutorials/chloroplast-assembly/tutorial.html		Sequence assembly visualisation, Read mapping, Genome annotation, Cross-assembly, Genome assembly, De-novo assembly, Sequence alignment, Gene prediction, Genome visualisation, Analysis, Coding region prediction, Box-Whisker plot plotting, Genome indexing, Scatter plot plotting, Read alignment, Mapping assembly, Generation, Sequence assembly	2020-12-04	2025-05-15	21	True	False	True	True	bandage_image, fasta-stats, jbrowse, flye, nanoplot, pilon, prokka, bwa_mem, upload1, bandage_info	UseGalaxy.eu	UseGalaxy.be, UseGalaxy.cz, UseGalaxy.fr, UseGalaxy.no, UseGalaxy.org (Main)	0		8108	12612	2.8	0
Assembly	Assembly of the mitochondrial genome from PacBio HiFi reads	https://training.galaxyproject.org//topics/assembly/tutorials/mitochondrion-assembly/tutorial.html	Genomics, Sequence assembly, Biodiversity, Mitochondria		2024-09-03	2025-06-04	4	True	False	True	True	mitohifi, compress_file	UseGalaxy.cz, UseGalaxy.eu, UseGalaxy.org (Main), UseGalaxy.org.au		0		903	1094	1.85	0
Assembly	Decontamination of a genome assembly	https://training.galaxyproject.org//topics/assembly/tutorials/assembly-decontamination/tutorial.html	Genomics, Sequence assembly, Biodiversity	Taxonomic classification, Data handling	2024-09-04	2025-06-04	5	True	False	True	True	Filter1, ncbi_dustmasker_wrapper, tp_cat, kraken2, tp_sed_tool, Cut1, parse_mito_blast, ncbi_blastn_wrapper, gfastats	UseGalaxy.eu, UseGalaxy.org (Main), UseGalaxy.org.au	UseGalaxy.cz	0		1691	2090	2.433333333333333	0
Assembly	Genome Assembly of a bacterial genome (MRSA) sequenced using Illumina MiSeq Data	https://training.galaxyproject.org//topics/assembly/tutorials/mrsa-illumina/tutorial.html	Sequence assembly, Whole genome sequencing, Public health and epidemiology, Genomics, Microbiology	Sequence assembly visualisation, Read mapping, Sequence assembly validation, Sequence contamination filtering, Sequencing quality control, Visualisation, Genome assembly, Statistical calculation, Sequence composition calculation	2021-03-24	2025-11-18	17	True	False	True	True	bandage_image, falco, quast, fastp, shovill, upload1, fastqc, bandage_info	UseGalaxy.be, UseGalaxy.cz, UseGalaxy.eu, UseGalaxy.fr, UseGalaxy.org (Main)		0		10274	15773	3.566666666666667	0
Assembly	Assembly of metagenomic sequencing data	https://training.galaxyproject.org//topics/assembly/tutorials/metagenomics-assembly/tutorial.html	Metagenomics, Sequence assembly	Sequence assembly visualisation, Sequence trimming, Read mapping, Sequence file editing, Sequence assembly validation, Local alignment, Sequence contamination filtering, Genome assembly, Data handling, Sequence alignment analysis, Statistical calculation, Primer removal, Sequencing quality control, Visualisation, Read pre-processing, Variant calling, Formatting, Sequence composition calculation	2025-12-04	2025-12-04	0	True	False	True	True	filter_tabular, collection_column_join, bowtie2, bandage_image, coverm_contig, seqtk_subseq, megahit_contig2fastg, metaspades, tp_cat, quast, bamtools, random_lines1, megahit, cutadapt, ngsutils_bam_filter, fastqc, bg_uniq, bandage_info		UseGalaxy.cz, UseGalaxy.eu	0		5	5	2.9833333333333334	0
Assembly	De Bruijn Graph Assembly	https://training.galaxyproject.org//topics/assembly/tutorials/debruijn-graph-assembly/tutorial.html		Genome assembly, Sequence assembly, Optimisation and refinement	2017-05-24	2024-02-01	25	True	True	False	True	fasta-stats, spades, velvetoptimiser	Galaxy@AuBi, UseGalaxy.be, UseGalaxy.eu, UseGalaxy.no, UseGalaxy.org (Main), UseGalaxy.org.au	UseGalaxy.cz	0		3083250	7909423	5.033333333333333	0
Assembly	Unicycler Assembly	https://training.galaxyproject.org//topics/assembly/tutorials/unicycler-assembly/tutorial.html	Sequence assembly, Genomics, Microbiology	Coding region prediction, Sequence assembly validation, Genome annotation, Genome assembly, Sequencing quality control, Validation, Visualisation, Aggregation, Statistical calculation, Sequence composition calculation, Gene prediction	2017-10-11	2025-05-15	24	True	True	False	True	unicycler, multiqc, quast, prokka, fastqc	UseGalaxy.eu, UseGalaxy.org (Main), UseGalaxy.org.au	Galaxy@AuBi, GalaxyTrakr, MISSISSIPPI, UseGalaxy.be, UseGalaxy.cz, UseGalaxy.fr, UseGalaxy.no	0		3089668	7921193	4.4	0
Assembly	Unicycler assembly of SARS-CoV-2 genome with preprocessing to remove human genome reads	https://training.galaxyproject.org//topics/assembly/tutorials/assembly-with-preprocessing/tutorial.html		Sequence assembly visualisation, Read mapping, Sequence file editing, Box-Whisker plot plotting, Scatter plot plotting, Sequence contamination filtering, Genome assembly, Validation, Sequencing quality control, Aggregation, Data handling, Pairwise sequence alignment	2020-04-21	2025-05-15	14	True	True	True	True	unicycler, samtools_view, bowtie2, bandage_image, samtools_fastx, multiqc, nanoplot, seqtk_sample, collapse_dataset, __ZIP_COLLECTION__, fastp, fasterq_dump, samtools_stats, minimap2, fasta_filter_by_length, bandage_info	UseGalaxy.eu, UseGalaxy.org.au	Galaxy@AuBi, MISSISSIPPI, UseGalaxy.be, UseGalaxy.cz, UseGalaxy.fr, UseGalaxy.no, UseGalaxy.org (Main)	0		3082662	7908974	5.533333333333333	0
Assembly	Vertebrate genome assembly using HiFi, Bionano and Hi-C data - Step by Step	https://training.galaxyproject.org//topics/assembly/tutorials/vgp_genome_assembly/tutorial.html	Genomics, Sequence assembly, Biodiversity	Sequence trimming, Primer removal, Sequence assembly validation, k-mer counting, Pairwise sequence alignment, Scaffolding, Mapping, Genome assembly, Visualisation, Read pre-processing, Sequence alignment, Data handling, De-novo assembly, Phasing, Read binning	2021-06-04	2025-06-04	57	True	False	True	True	purge_dups, tp_grep_tool, cutadapt, merqury, bionano_scaffold, pretext_snapshot, genomescope, tp_cut_tool, quast, busco, yahs, Add_a_column1, minimap2, cat1, salsa, hifiasm, gfa_to_fa, collapse_dataset, bellerophon, tp_find_and_replace, gfastats, Convert characters1, collection_column_join, meryl, bedtools_bamtobed, pretext_map, bwa_mem2, sort1		UseGalaxy.cz	0		16045	24164	1.9666666666666666	0
Assembly	Genome assembly using PacBio data	https://training.galaxyproject.org//topics/assembly/tutorials/hifi-assembly/tutorial.html	Genomics, Sequence assembly, Biodiversity	Genome assembly, Visualisation, Mapping assembly, Sequence assembly validation, De-novo assembly, Cross-assembly	2021-11-29	2025-06-04	2	True	False	False	True	hifiasm, gfa_to_fa, fasta-stats, flye, quast, busco	UseGalaxy.eu, UseGalaxy.fr, UseGalaxy.org (Main), UseGalaxy.org.au	UseGalaxy.cz, UseGalaxy.no	0		878	1031	1.5333333333333334	0
