Using Galaxy and Managing your Data	Extracting Workflows from Histories	https://training.galaxyproject.org//topics/galaxy-interface/tutorials/history-to-workflow/tutorial.html			2017-10-18	2024-12-02	8	True	False	False	False			UseGalaxy.eu, UseGalaxy.org, UseGalaxy.org.au, UseGalaxy.fr	0		2888	3744	3.716666666666667	0
Using Galaxy and Managing your Data	Downloading and Deleting Data in Galaxy	https://training.galaxyproject.org//topics/galaxy-interface/tutorials/download-delete-data/tutorial.html			2019-10-17	2023-11-09	6	True	False	False	False			UseGalaxy.eu, UseGalaxy.org, UseGalaxy.org.au, UseGalaxy.fr	0		7244	9637	1.6333333333333333	0
Using Galaxy and Managing your Data	JupyterLab in Galaxy	https://training.galaxyproject.org//topics/galaxy-interface/tutorials/jupyterlab/tutorial.html			2020-03-05	2025-04-25	9	True	False	False	False	interactive_tool_jupyter_notebook	UseGalaxy.eu, UseGalaxy.org (Main), UseGalaxy.org.au		0		2073	3336	2.85	0
Using Galaxy and Managing your Data	Using dataset collections	https://training.galaxyproject.org//topics/galaxy-interface/tutorials/collections/tutorial.html		Sequence alignment, Generation, Genome indexing, Read mapping	2016-09-30	2024-12-05	20	True	False	True	False	collapse_dataset, lofreq_call, bwa_mem, snpSift_extractFields	UseGalaxy.eu, UseGalaxy.org (Main), UseGalaxy.org.au	GalaxyTrakr, MISSISSIPPI, UseGalaxy.be, UseGalaxy.cz, UseGalaxy.fr, UseGalaxy.no	0		15384	21111	3.0166666666666666	0
Using Galaxy and Managing your Data	Onedata user-owned storage	https://training.galaxyproject.org//topics/galaxy-interface/tutorials/onedata-byos/tutorial.html			2025-03-24	2025-04-08	3	True	False	False	False			UseGalaxy.eu, UseGalaxy.org, UseGalaxy.org.au, UseGalaxy.fr	0		60	73	6.383333333333334	0
Using Galaxy and Managing your Data	Understanding Galaxy history system	https://training.galaxyproject.org//topics/galaxy-interface/tutorials/history/tutorial.html			2017-02-20	2025-04-28	12	True	False	True	False			UseGalaxy.eu, UseGalaxy.org, UseGalaxy.org.au, UseGalaxy.fr	0		5377	6945	2.8666666666666667	0
Using Galaxy and Managing your Data	Searching Your History	https://training.galaxyproject.org//topics/galaxy-interface/tutorials/search/tutorial.html			2020-07-15	2023-11-16	4	True	False	False	False			UseGalaxy.eu, UseGalaxy.org, UseGalaxy.org.au, UseGalaxy.fr	0		394	600	2.35	0
Using Galaxy and Managing your Data	Creating high resolution images of Galaxy Workflows	https://training.galaxyproject.org//topics/galaxy-interface/tutorials/workflow-posters/tutorial.html			2024-02-05	2025-04-08	3	True	False	False	False	graphicsmagick_image_convert	UseGalaxy.eu	UseGalaxy.be, UseGalaxy.cz, UseGalaxy.no	0		243	295	2.5166666666666666	0
Using Galaxy and Managing your Data	RStudio in Galaxy	https://training.galaxyproject.org//topics/galaxy-interface/tutorials/rstudio/tutorial.html			2019-10-08	2025-07-04	15	True	False	False	False	interactive_tool_rstudio	UseGalaxy.eu, UseGalaxy.org.au		0		4970	7743	2.1666666666666665	0
Using Galaxy and Managing your Data	Getting started with Onedata distributed storage	https://training.galaxyproject.org//topics/galaxy-interface/tutorials/onedata-getting-started/tutorial.html			2025-03-24	2025-04-08	2	True	False	False	False			UseGalaxy.eu, UseGalaxy.org, UseGalaxy.org.au, UseGalaxy.fr	0		95	136	5.35	0
Using Galaxy and Managing your Data	Importing (uploading) data from Onedata	https://training.galaxyproject.org//topics/galaxy-interface/tutorials/onedata-remote-import/tutorial.html			2025-03-24	2025-04-08	2	True	False	False	False			UseGalaxy.eu, UseGalaxy.org, UseGalaxy.org.au, UseGalaxy.fr	0		136	158	3.2333333333333334	0
Using Galaxy and Managing your Data	Exporting to Onedata remote	https://training.galaxyproject.org//topics/galaxy-interface/tutorials/onedata-remote-export/tutorial.html			2025-03-24	2025-04-08	2	True	False	False	False			UseGalaxy.eu, UseGalaxy.org, UseGalaxy.org.au, UseGalaxy.fr	0		25	27	0.03333333333333333	0
Using Galaxy and Managing your Data	Name tags for following complex histories	https://training.galaxyproject.org//topics/galaxy-interface/tutorials/name-tags/tutorial.html			2019-04-08	2023-11-09	8	True	False	False	False			UseGalaxy.eu, UseGalaxy.org, UseGalaxy.org.au, UseGalaxy.fr	0		1578	2123	2.75	0
Using Galaxy and Managing your Data	Rule Based Uploader	https://training.galaxyproject.org//topics/galaxy-interface/tutorials/upload-rules/tutorial.html			2020-07-04	2024-06-14	11	True	False	True	False			UseGalaxy.eu, UseGalaxy.org, UseGalaxy.org.au, UseGalaxy.fr	0		4273	5693	3.2333333333333334	0
Using Galaxy and Managing your Data	Annotate, prepare tests and publish Galaxy workflows in workflow registries	https://training.galaxyproject.org//topics/galaxy-interface/tutorials/workflow-fairification/tutorial.html		Visualisation, Read mapping, Validation, Sequencing quality control	2025-05-26	2025-05-26	1	True	False	False	False	multiqc, falco	UseGalaxy.be, UseGalaxy.cz, UseGalaxy.eu, UseGalaxy.fr, UseGalaxy.org (Main), UseGalaxy.org.au		0		145	175	1.5	0
Using Galaxy and Managing your Data	Use Jupyter notebooks in Galaxy	https://training.galaxyproject.org//topics/galaxy-interface/tutorials/galaxy-intro-jupyter/tutorial.html			2018-07-02	2025-05-11	10	True	False	True	False	interactive_tool_jupyter_notebook	UseGalaxy.eu, UseGalaxy.org (Main), UseGalaxy.org.au		0		2311	3066	2.4166666666666665	0
Using Galaxy and Managing your Data	Rule Based Uploader: Advanced	https://training.galaxyproject.org//topics/galaxy-interface/tutorials/upload-rules-advanced/tutorial.html			2018-05-25	2024-06-14	11	True	False	True	False			UseGalaxy.eu, UseGalaxy.org, UseGalaxy.org.au, UseGalaxy.fr	0		757	1015	4.8	0
Using Galaxy and Managing your Data	Group tags for complex experimental designs	https://training.galaxyproject.org//topics/galaxy-interface/tutorials/group-tags/tutorial.html			2019-03-06	2023-11-09	11	True	False	False	False			UseGalaxy.eu, UseGalaxy.org, UseGalaxy.org.au, UseGalaxy.fr	0		2687	3643	3.316666666666667	0
Genome Annotation	Genome annotation with Prokka	https://training.galaxyproject.org//topics/genome-annotation/tutorials/annotation-with-prokka/tutorial.html	Genomics, Microbiology, Gene and protein families, Sequence analysis	Genome visualisation, Coding region prediction, Genome annotation, Gene prediction	2018-03-06	2025-03-19	26	True	True	True	True	jbrowse, prokka	UseGalaxy.be, UseGalaxy.eu, UseGalaxy.org (Main)	Galaxy@AuBi, GalaxyTrakr, MISSISSIPPI, UseGalaxy.cz, UseGalaxy.fr, UseGalaxy.no, UseGalaxy.org.au	0		2741445	7345317	4.433333333333334	0
Genome Annotation	Genome annotation with Helixer	https://training.galaxyproject.org//topics/genome-annotation/tutorials/helixer/tutorial.html	Biodiversity, Genomics, Zoology, Plant biology	Differential protein expression profiling, Genome visualisation, Genome annotation, Sequence annotation, Gene prediction, Sequence assembly validation	2024-08-21	2025-06-04	8	True	False	False	True	omark, jbrowse, busco, helixer, jcvi_gff_stats, gffread			0		1013	1221	1.8	0
Genome Annotation	Secondary metabolite discovery	https://training.galaxyproject.org//topics/genome-annotation/tutorials/secondary-metabolite-discovery/tutorial.html		Data handling, Sequence clustering, Service invocation, Differential gene expression analysis, Gene prediction	2024-02-21	2024-09-27	2	True	False	False	True	ctb_np-likeness-calculator, ncbi_acc_download, collapse_dataset, Remove beginning1, interactive_tool_jupyter_notebook, bp_genbank2gff3, ctb_silicos_qed, openbabel_remDuplicates, edu.tamu.cpt.gff3.customGbkToGff, tp_awk_tool, ctb_chemfp_mol2fps, ctb_simsearch, antismash	UseGalaxy.eu		0		581	734	1.3	0
Genome Annotation	Comparison of two annotation tools - Helixer and Braker3	https://training.galaxyproject.org//topics/genome-annotation/tutorials/comparison-braker-helixer-annotation/tutorial.html	Sequence assembly, Genomics	Differential protein expression profiling, Genome visualisation, Genome annotation, Sequence annotation, Gene prediction, Sequence alignment, Sequence assembly validation	2025-06-20	2025-06-25	2	True	False	False	True	omark, jbrowse, busco, rna_star, braker3, helixer, gffread			0		183	226	2.4	0
Genome Annotation	From small to large-scale genome comparison	https://training.galaxyproject.org//topics/genome-annotation/tutorials/hpc-for-lsgc/tutorial.html		Multiple sequence alignment	2021-02-08	2024-07-31	8	True	True	False	True	tp_awk_tool, clustalw, chromeister, gecko	UseGalaxy.eu, UseGalaxy.org.au	GalaxyTrakr, UseGalaxy.be, UseGalaxy.cz	0		2678499	7153822	4.683333333333334	0
Genome Annotation	Masking repeats with RepeatMasker	https://training.galaxyproject.org//topics/genome-annotation/tutorials/repeatmasker/tutorial.html	Sequence composition, complexity and repeats, Genomics	Genome annotation, Editing, RNA-Seq analysis, Repeat sequence detection, Mapping	2021-11-29	2025-06-03	22	True	False	True	True	bedtools_maskfastabed, red, repeatmodeler, repeatmasker_wrapper	UseGalaxy.cz, UseGalaxy.eu, UseGalaxy.fr, UseGalaxy.org (Main), UseGalaxy.org.au		0		9624	12307	1.3833333333333333	0
Genome Annotation	Identification of AMR genes in an assembled bacterial genome	https://training.galaxyproject.org//topics/genome-annotation/tutorials/amr-gene-detection/tutorial.html	Whole genome sequencing, Public health and epidemiology, Genomics, Microbiology, Sequence analysis, Infectious disease, Antimicrobial resistance	Antimicrobial resistance prediction, Genome visualisation, Genome annotation, Read mapping	2024-01-23	2025-06-10	9	True	False	True	True	jbrowse, Grep1, upload1, bowtie2, tbl2gff3, bakta, staramr_search	UseGalaxy.cz, UseGalaxy.eu, UseGalaxy.fr	Galaxy@AuBi, UseGalaxy.org (Main)	0		3098	4231	3.0166666666666666	0
Genome Annotation	Bacterial Genome Annotation	https://training.galaxyproject.org//topics/genome-annotation/tutorials/bacterial-genome-annotation/tutorial.html	Genomics, Microbiology, Gene and protein families, Sequence analysis, Whole genome sequencing, Functional genomics, Mobile genetic elements	Genome assembly, Genome visualisation, Sequence motif recognition, Structural variation detection, Protein feature detection, Multilocus sequence typing, Genome annotation, Nucleic acid feature detection, Scaffolding	2024-02-01	2024-10-15	6	True	False	True	True	plasmidfinder, Grouping1, jbrowse, upload1, tp_replace_in_column, tbl2gff3, bakta, integron_finder, tp_tail_tool, isescan	UseGalaxy.eu, UseGalaxy.fr	Galaxy@AuBi, UseGalaxy.cz, UseGalaxy.org (Main)	0		5654	7598	2.566666666666667	0
Genome Annotation	Refining Genome Annotations with Apollo (prokaryotes)	https://training.galaxyproject.org//topics/genome-annotation/tutorials/apollo/tutorial.html	Genomics, Microbiology, Gene and protein families, Sequence analysis	Genome visualisation	2021-06-04	2025-05-15	22	True	True	True	True	create_account, jbrowse, list_organism, iframe, create_or_update		UseGalaxy.cz, UseGalaxy.eu, UseGalaxy.no	0		2498056	6537590	5.216666666666667	0
Genome Annotation	Genome annotation with Braker3	https://training.galaxyproject.org//topics/genome-annotation/tutorials/braker3/tutorial.html	Sequence assembly, Genomics, Biodiversity, Zoology, Plant biology	Differential protein expression profiling, Genome visualisation, Genome annotation, Sequence annotation, Gene prediction, Sequence alignment, Sequence assembly validation	2025-03-17	2025-06-20	4	True	False	False	True	omark, jbrowse, busco, rna_star, braker3, fasta-stats, gffread			0		1013	1274	2.216666666666667	0
Genome Annotation	Introduction to Genome Annotation	https://training.galaxyproject.org//topics/genome-annotation/tutorials/introduction/slides.html			2019-05-13	2025-04-23	5	False	True	False	False			UseGalaxy.eu, UseGalaxy.org, UseGalaxy.org.au, UseGalaxy.fr	0		2723256	7314404	2.5166666666666666	0
Genome Annotation	Dataset construction for bacterial comparative genomics	https://training.galaxyproject.org//topics/genome-annotation/tutorials/bacterial-comparative-genomics-dataset-construction/tutorial.html	Genomics, Microbiology	Data handling, Data retrieval, Sequence database search	2025-03-14	2025-03-14	1	True	False	False	False	Cut1, Remove beginning1, datasets_download_genome, cat1, upload1, sort1, bg_uniq	UseGalaxy.fr	UseGalaxy.cz	0		56	69	4.916666666666667	0
Genome Annotation	Bacterial genome quality control	https://training.galaxyproject.org//topics/genome-annotation/tutorials/bacterial-genome-quality-control/tutorial.html	Genomics, Microbiology	Genome comparison, Validation, Statistical calculation, Sequence composition calculation, Sequence assembly validation, Sequencing quality control	2025-03-14	2025-03-14	1	True	False	False	False	checkm2, drep_dereplicate, upload1	UseGalaxy.eu, UseGalaxy.fr, UseGalaxy.org (Main)		0		60	66	3.3	0
Genome Annotation	Bacterial pangenomics	https://training.galaxyproject.org//topics/genome-annotation/tutorials/bacterial-pangenomics/tutorial.html	Genomics, Microbiology	Essential dynamics, Rarefaction, Sequence assembly, Genome annotation	2025-03-14	2025-03-14	1	True	False	False	False	ppanggolin_all, ppanggolin_msa, upload1	UseGalaxy.eu, UseGalaxy.fr		0		61	72	1.3	0
Genome Annotation	Genome Annotation	https://training.galaxyproject.org//topics/genome-annotation/tutorials/genome-annotation/tutorial.html			2015-06-29	2025-06-10	19	True	False	False	False			UseGalaxy.eu, UseGalaxy.org, UseGalaxy.org.au, UseGalaxy.fr	0		34776	63514	1.45	0
Genome Annotation	Creating an Official Gene Set	https://training.galaxyproject.org//topics/genome-annotation/tutorials/official-gene-set/tutorial.html			2023-11-02	2024-02-29	2	True	False	False	False			UseGalaxy.eu, UseGalaxy.org, UseGalaxy.org.au, UseGalaxy.fr	0		38	44	1.75	0
Genome Annotation	Genome annotation with Funannotate	https://training.galaxyproject.org//topics/genome-annotation/tutorials/funannotate/tutorial.html	Gene and protein families	Query and retrieval, Genome visualisation, Sequence annotation, Sequence alignment, Formatting, Sequence motif recognition, Homology-based gene prediction, Protein feature detection, Genome annotation, Fold recognition, Information extraction, Sequence assembly validation	2021-11-29	2025-06-10	26	True	False	True	True	interproscan, jbrowse, busco, rna_star, picard_MergeSamFiles, aegean_parseval, eggnog_mapper, funannotate_annotate, funannotate_compare, funannotate_predict	UseGalaxy.eu, UseGalaxy.fr, UseGalaxy.org (Main)	UseGalaxy.be, UseGalaxy.cz, UseGalaxy.org.au	0		10061	14367	1.9833333333333334	0
Genome Annotation	Comparative gene analysis in unannotated genomes	https://training.galaxyproject.org//topics/genome-annotation/tutorials/gene-centric/tutorial.html	Genomics, Gene and protein families, Sequence analysis, Phylogeny, Comparative genomics	Sequence alignment analysis, De-novo assembly, Transcriptome assembly, Database search, Phylogenetic tree generation, Multiple sequence alignment, Coding region prediction	2022-09-08	2025-06-03	10	True	False	False	True	join1, bg_diamond, Cut1, collapse_dataset, tab2fasta, cat1, regexColumn1, orfipy, rapidnj, rbc_mafft, tp_split_on_column, gops_intersect_1, bg_diamond_makedb, Add_a_column1, Filter1, bg_diamond_view	UseGalaxy.eu, UseGalaxy.org (Main)	UseGalaxy.cz	0		1748	2485	3.15	0
Genome Annotation	Genome annotation with Maker (short)	https://training.galaxyproject.org//topics/genome-annotation/tutorials/annotation-with-maker-short/tutorial.html		Genome visualisation, Genome annotation, Sequence annotation, Sequence assembly validation	2021-01-12	2024-02-29	3	True	False	False	True	maker, jbrowse, busco, jcvi_gff_stats, fasta-stats, maker_map_ids, gffread		UseGalaxy.be	0		3803	5374	3.0	0
Genome Annotation	Essential genes detection with Transposon insertion sequencing	https://training.galaxyproject.org//topics/genome-annotation/tutorials/tnseq/tutorial.html	Genomics, Microbiology, Sequence analysis, Mobile genetic elements	Read pre-processing, Primer removal, Sequence trimming, Transposon prediction	2019-07-02	2024-03-18	12	True	True	False	True	Cut1, gff_to_prot, tp_easyjoin_tool, cutadapt, deeptools_bam_coverage, Add_a_column1, transit_gumbel, tp_sort_header_tool, bowtie_wrapper, __EXTRACT_DATASET__, Filter1, bg_find_subsequences	UseGalaxy.no, UseGalaxy.org.au	UseGalaxy.cz, UseGalaxy.eu	0		2731128	7328762	4.266666666666667	0
Genome Annotation	Genome annotation with Maker	https://training.galaxyproject.org//topics/genome-annotation/tutorials/annotation-with-maker/tutorial.html		Sequence annotation, Operation, Homology-based gene prediction, Genome visualisation, Genome annotation, Ab-initio gene prediction, Gene prediction, Sequence assembly validation	2018-09-24	2024-02-29	14	True	False	False	True	maker, jbrowse, busco, augustus_training, jcvi_gff_stats, snap_training, fasta-stats, maker_map_ids, gffread	UseGalaxy.be, UseGalaxy.eu, UseGalaxy.no, UseGalaxy.org (Main)	UseGalaxy.cz, UseGalaxy.org.au	0		13542	24096	1.8666666666666667	0
Genome Annotation	Functional annotation of protein sequences	https://training.galaxyproject.org//topics/genome-annotation/tutorials/functional/tutorial.html	Function analysis, Protein sites, features and motifs	Sequence alignment analysis, Query and retrieval, Sequence motif recognition, Homology-based gene prediction, Protein feature detection, Genome annotation, Fold recognition, Information extraction	2022-07-20	2025-06-03	12	True	False	False	True	bg_diamond, interproscan, ncbi_blastp_wrapper, eggnog_mapper	UseGalaxy.cz, UseGalaxy.eu, UseGalaxy.fr, UseGalaxy.org (Main), UseGalaxy.org.au	UseGalaxy.no	0		3871	5258	1.6833333333333333	0
Genome Annotation	Refining Genome Annotations with Apollo (eukaryotes)	https://training.galaxyproject.org//topics/genome-annotation/tutorials/apollo-euk/tutorial.html	Genomics	Genome visualisation	2022-08-22	2025-06-03	16	True	False	False	False	iframe, jbrowse, create_or_update	UseGalaxy.no	UseGalaxy.cz, UseGalaxy.eu	0		1331	2076	2.4833333333333334	0
Genome Annotation	Long non-coding RNAs (lncRNAs) annotation with FEELnc	https://training.galaxyproject.org//topics/genome-annotation/tutorials/lncrna/tutorial.html		Classification, Transcriptome assembly, RNA-Seq analysis, Sequence annotation, Annotation	2022-09-23	2024-09-18	11	True	False	True	True	stringtie, feelnc, Extract_features1, gffread, tp_cat		UseGalaxy.cz, UseGalaxy.eu, UseGalaxy.fr, UseGalaxy.no, UseGalaxy.org (Main), UseGalaxy.org.au	0		1808	2430	2.1666666666666665	0
Genome Annotation	CRISPR screen analysis	https://training.galaxyproject.org//topics/genome-annotation/tutorials/crispr-screen/tutorial.html		Read pre-processing, Genetic variation analysis, Primer removal, Statistical calculation, Sequence composition calculation, Sequencing quality control, Sequence trimming, Validation	2021-10-15	2024-08-08	12	True	True	True	True	fastqc, cutadapt, mageck_count, multiqc, volcanoplot, mageck_test, mageck_mle, tp_awk_tool	UseGalaxy.fr, UseGalaxy.org (Main), UseGalaxy.org.au	UseGalaxy.be, UseGalaxy.cz, UseGalaxy.eu, UseGalaxy.no	0		2330217	5948733	4.416666666666667	0
Variant Analysis	Microbial Variant Calling	https://training.galaxyproject.org//topics/variant-analysis/tutorials/microbial-variants/tutorial.html	Genomics, Sequence assembly, DNA polymorphism, Microbiology, Sequence analysis, Genetic variation	Phylogenetic tree visualisation, Variant calling, Genome visualisation, Phylogenetic tree generation	2018-02-26	2025-03-19	24	True	False	False	True	snippy, jbrowse	UseGalaxy.be, UseGalaxy.eu, UseGalaxy.org (Main)	GalaxyTrakr, UseGalaxy.cz, UseGalaxy.fr, UseGalaxy.no, UseGalaxy.org.au	0		14795	23742	2.033333333333333	0
Visualisation	Genomic Data Visualisation with JBrowse	https://training.galaxyproject.org//topics/visualisation/tutorials/jbrowse/tutorial.html		Genome visualisation	2020-01-10	2024-10-15	17	True	True	False	False	jbrowse	Galaxy@AuBi, UseGalaxy.be, UseGalaxy.eu, UseGalaxy.fr, UseGalaxy.no, UseGalaxy.org (Main), UseGalaxy.org.au	Galaxy@Pasteur, GalaxyTrakr, MISSISSIPPI, UseGalaxy.cz	0		2728128	7320892	4.866666666666666	0
Imaging	Quantification of single-molecule RNA fluorescence in situ hybridization (smFISH) in yeast cell lines	https://training.galaxyproject.org//topics/imaging/tutorials/2D-spot-detection/tutorial.html		Data handling, Image analysis, Visualisation, Image annotation	2025-03-20	2025-03-20	2	True	False	False	True	ip_histogram_equalization, ip_spot_detection_2d, ip_overlay_images, ip_points_to_label, unzip, ip_binary_to_labelimage, idr_download_by_ids	UseGalaxy.cz, UseGalaxy.eu		0		123	157	1.7333333333333334	0
Imaging	Quantification of electrophoresis gel bands using QuPath and Galaxy imaging tools	https://training.galaxyproject.org//topics/imaging/tutorials/electrophoresis-gel-bands-image-analysis/tutorial.html		Data handling, Image analysis, Visualisation, Image annotation	2025-08-11	2025-08-11	1	True	False	False	True	graphicsmagick_image_convert, ip_points_to_label, ip_imageinfo, interactive_tool_qupath, ip_split_image, __EXTRACT_DATASET__, ip_2d_feature_extraction	UseGalaxy.eu		0		97	121	1.5	0
Imaging	Using BioImage.IO models for image analysis in Galaxy	https://training.galaxyproject.org//topics/imaging/tutorials/process-image-bioimageio/tutorial.html		Data handling, Image analysis, Visualisation, Image annotation	2025-04-09	2025-04-16	5	True	False	False	True	image_math, ip_overlay_images, ip_binary_to_labelimage, ip_split_image, bioimage_inference, ip_threshold, __EXTRACT_DATASET__	UseGalaxy.eu		0		150	181	3.7666666666666666	0
Imaging	End-to-End Tissue Microarray Image Analysis with Galaxy-ME	https://training.galaxyproject.org//topics/imaging/tutorials/multiplex-tissue-imaging-TMA/tutorial.html			2023-02-14	2025-03-14	6	True	False	False	True	vitessce_spatial, ip_convertimage, basic_illumination, scimap_phenotyping, palom, unet_coreograph, quantification, gate_finder, celesta, mesmer, squidpy_spatial, ashlar, rename_tiff_channels, scanpy_compute_graph, scimap_mcmicro_to_anndata			0		1299	1772	1.9166666666666667	0
Imaging	Training Custom YOLO Models for Segmentation of Bioimages	https://training.galaxyproject.org//topics/imaging/tutorials/yolo-segmentation-training/tutorial.html		Data handling, Image analysis, Visualisation, Image annotation	2025-07-25	2025-07-31	2	True	False	False	True	json2yolosegment, graphicsmagick_image_convert, ip_histogram_equalization, interactive_tool_anylabeling, unzip, yolo_training	UseGalaxy.eu		0		119	142	0.5166666666666667	0
Imaging	Overview of the Galaxy OMERO-suite - Upload images and metadata in OMERO using Galaxy	https://training.galaxyproject.org//topics/imaging/tutorials/omero-suite/tutorial.html		Image analysis	2024-12-04	2025-04-08	3	True	False	False	False	omero_get_id, omero_get_value, omero_roi_import, omero_metadata_import, omero_filter, omero_import			0		149	191	3.35	0
Imaging	Nucleoli segmentation and feature extraction using CellProfiler	https://training.galaxyproject.org//topics/imaging/tutorials/tutorial-CP/tutorial.html		Parsing, Image analysis, Quantification	2020-07-01	2024-10-15	9	True	True	False	True	cp_export_to_spreadsheet, cp_identify_primary_objects, cp_relate_objects, cp_gray_to_color, cp_measure_object_intensity, cp_cellprofiler, cp_image_math, cp_measure_texture, cp_save_images, cp_measure_granularity, cp_mask_image, cp_convert_objects_to_image, cp_common, cp_enhance_or_suppress_features, cp_display_data_on_image, idr_download_by_ids, cp_measure_object_size_shape, cp_measure_image_area_occupied, cp_measure_image_quality, cp_measure_image_intensity	UseGalaxy.be, UseGalaxy.eu	Galaxy@AuBi, UseGalaxy.cz, UseGalaxy.fr, UseGalaxy.no, UseGalaxy.org.au	0		2727054	7319973	3.7666666666666666	0
Imaging	Voronoi segmentation	https://training.galaxyproject.org//topics/imaging/tutorials/voronoi-segmentation/tutorial.html		Data handling, Image analysis, Visualisation, Image annotation	2025-05-13	2025-07-11	4	True	False	False	True	ip_convertimage, image_math, ip_overlay_images, ip_count_objects, ip_imageinfo, unzip, voronoi_tessellation, repeat_channels, ip_binary_to_labelimage, ip_filter_standard, colorize_labels, ip_threshold, ip_2d_feature_extraction	UseGalaxy.eu		0		200	333	4.65	0
Imaging	Introduction to Image Analysis using Galaxy	https://training.galaxyproject.org//topics/imaging/tutorials/imaging-introduction/tutorial.html		Data handling, Image analysis, Visualisation, Image annotation	2019-08-13	2025-03-20	14	True	False	False	True	ip_histogram_equalization, ip_overlay_images, ip_count_objects, ip_imageinfo, unzip, ip_binary_to_labelimage, ip_filter_standard, ip_threshold	UseGalaxy.cz, UseGalaxy.eu, UseGalaxy.org.au		0		2572	3616	1.7666666666666666	0
Imaging	Parameter tuning and optimization - Evaluating nuclei segmentation with Galaxy	https://training.galaxyproject.org//topics/imaging/tutorials/parameter-tuning/tutorial.html		Data handling, Image analysis, Image annotation, Visualisation	2025-04-28	2025-04-28	1	True	False	False	True	ip_histogram_equalization, collapse_dataset, param_value_from_file, ip_filter_standard, ip_threshold, tp_split_on_column, ip_segmetrics	UseGalaxy.eu	UseGalaxy.cz	0		57	68	2.5	0
Imaging	Tracking of mitochondria and capturing mitoflashes	https://training.galaxyproject.org//topics/imaging/tutorials/detection-of-mitoflashes/tutorial.html		Image analysis	2024-11-20	2024-11-20	2	True	False	False	True	ip_spot_detection_2d, ip_curve_fitting, ip_points_association_nn	UseGalaxy.cz, UseGalaxy.eu		0		126	147	0.9333333333333333	0
Imaging	Analyse HeLa fluorescence siRNA screen	https://training.galaxyproject.org//topics/imaging/tutorials/hela-screen-analysis/tutorial.html		Data handling, Image analysis, Visualisation, Image annotation	2019-08-13	2024-11-07	12	True	False	False	True	collapse_dataset, ip_2d_filter_segmentation_by_features, unzip, ip_binary_to_labelimage, ip_filter_standard, ip_threshold, ip_2d_feature_extraction	UseGalaxy.cz, UseGalaxy.eu, UseGalaxy.org.au	UseGalaxy.be, UseGalaxy.no	0		730	937	2.216666666666667	0
