Sequence analysis	Quality and contamination control in bacterial isolate using Illumina MiSeq Data	https://training.galaxyproject.org//topics/sequence-analysis/tutorials/quality-contamination-control/tutorial.html	Whole genome sequencing, Genomics, Microbiology, Microbial ecology	Expression analysis, Sequencing quality control, Statistical calculation, Sequence contamination filtering, Visualisation, Cross-assembly, Taxonomic classification, Read mapping	2024-07-15	2025-12-18	5	True	False	True	True	upload1, recentrifuge, fastp, falco, est_abundance, kraken2	GalaxyTrakr, UseGalaxy.be, UseGalaxy.cz, UseGalaxy.eu, UseGalaxy.fr, UseGalaxy.org (Main)		0		2176	2857	10.35	0
Sequence analysis	Primer and primer scheme design for pan-specific detection and sequencing of viral pathogens across genotypes	https://training.galaxyproject.org//topics/sequence-analysis/tutorials/viral_primer_design/tutorial.html		Global alignment, Sequence alignment analysis, Multiple sequence alignment, PCR primer design, Local alignment, Sequence analysis, Sequence alignment	2025-03-20	2025-11-20	3	True	False	False	True	rbc_mafft, EMBOSS: degapseq20, split_file_to_collection, ncbi_makeblastdb, fasta_compute_length, varvamp	UseGalaxy.be, UseGalaxy.eu		0		1204	1434	3.1	0
Single Cell	Bulk RNA Deconvolution with MuSiC	https://training.galaxyproject.org//topics/single-cell/tutorials/bulk-music/tutorial.html			2022-02-11	2026-06-25	11	True	False	True	True	music_construct_eset, music_deconvolution, music_inspect_eset	UseGalaxy.org.au, UseGalaxy.be, UseGalaxy.cz, UseGalaxy.eu, UseGalaxy.org (Main)		0		4558	5677	4.033333333333333	0
Single Cell	GO Enrichment Analysis on Single-Cell RNA-Seq Data	https://training.galaxyproject.org//topics/single-cell/tutorials/GO-enrichment/tutorial.html		Gene-set enrichment analysis	2024-09-17	2026-06-25	9	True	True	False	True	gprofiler_gost, goenrichment, Cut1, tp_split_on_column	UseGalaxy.be, UseGalaxy.cz, UseGalaxy.eu, UseGalaxy.no, UseGalaxy.org (Main)		0		1823255	3411605	5.716666666666667	0
Single Cell	Converting between common single cell data formats	https://training.galaxyproject.org//topics/single-cell/tutorials/scrna-data-ingest/tutorial.html		Loading, Community profiling	2024-02-13	2026-06-25	5	True	False	False	True	tabular_to_fastq, dropletutils, sceasy_convert, tp_cut_tool, Filter1, dropletutils_read_10x, regexColumn1, join1, datamash_transpose, scanpy_filter_cells, monocle3_create, seurat_read10x, anndata_ops, fastq_to_tabular, anndata_inspect, Cut1, tp_tail_tool		UseGalaxy.org (Main)	0		3146	3681	3.9166666666666665	0
Single Cell	Single-cell quality control with scater	https://training.galaxyproject.org//topics/single-cell/tutorials/scrna-scater-qc/tutorial.html		Sequencing quality control, Read pre-processing, Sequence visualisation	2019-10-23	2025-02-14	6	True	False	False	True	scater_plot_pca, scater_create_qcmetric_ready_sce, scater_filter, scater_plot_dist_scatter	UseGalaxy.org.au, UseGalaxy.be, UseGalaxy.eu, UseGalaxy.no	UseGalaxy.cz	0		796	891	6.366666666666666	0
Single Cell	Generating a single cell matrix using Alevin	https://training.galaxyproject.org//topics/single-cell/tutorials/scrna-case_alevin/tutorial.html		RNA-Seq quantification, Gene expression analysis, Sequence composition calculation	2021-03-03	2025-11-18	25	True	False	True	True	dropletutils_empty_drops, sceasy_convert, anndata_manipulate, dropletutils_read_10x, alevin, _salmon_kallisto_mtx_to_10x, join1, _dropletBarcodePlot, anndata_inspect, _ensembl_gtf2gene_list, Cut1	UseGalaxy.org.au, UseGalaxy.be, UseGalaxy.eu, UseGalaxy.fr, UseGalaxy.org (Main)		0		3881	5843	10.95	0
Single Cell	Pre-processing of 10X Single-Cell ATAC-seq Datasets	https://training.galaxyproject.org//topics/single-cell/tutorials/scatac-preprocessing-tenx/tutorial.html		Statistical calculation, Sequencing quality control, Principal component visualisation, Expression profile clustering, Visualisation, Genome indexing, Sequence composition calculation, Sequence alignment, Differential gene expression analysis, Generation, Mapping, Enrichment analysis, Gene regulatory network analysis, Peak calling, Imputation, Read mapping	2023-04-24	2025-10-16	10	True	False	False	True	episcanpy_preprocess, sinto_barcode, bedtools_sortbed, scanpy_plot, macs2_callpeak, sinto_fragments, fastqc, falco, anndata_inspect, episcanpy_build_matrix, bwa_mem, tp_sorted_uniq	UseGalaxy.org.au, UseGalaxy.org (Main)	UseGalaxy.be, UseGalaxy.cz	0		6667	7836	2.4166666666666665	0
Single Cell	Pseudobulk Analysis with Decoupler and EdgeR	https://training.galaxyproject.org//topics/single-cell/tutorials/pseudobulk-analysis/tutorial.html		Differential gene expression analysis, Principal component visualisation, Expression profile clustering	2025-02-12	2025-05-09	8	True	False	True	True	column_remove_by_header, edger, tp_replace_in_line, tp_replace_in_column, decoupler_pseudobulk, __EXTRACT_DATASET__, anndata_manipulate, tp_awk_tool, volcanoplot, anndata_inspect, scanpy_filter	UseGalaxy.org.au, UseGalaxy.be, UseGalaxy.eu, UseGalaxy.fr, UseGalaxy.org (Main)	UseGalaxy.cz	0		2411	2732	2.8333333333333335	0
Single Cell	Pre-processing of 10X Single-Cell RNA Datasets	https://training.galaxyproject.org//topics/single-cell/tutorials/scrna-preprocessing-tenx/tutorial.html		Loading, Sequencing quality control, Community profiling, Validation, Sequence alignment	2019-09-11	2025-04-29	13	True	False	True	True	dropletutils, rna_starsolo, multiqc	UseGalaxy.org.au, UseGalaxy.cz, UseGalaxy.eu, UseGalaxy.org (Main)	UseGalaxy.be, UseGalaxy.fr, UseGalaxy.no	0		14263	18447	5.783333333333333	0
Single Cell	Pre-processing of Single-Cell RNA Data	https://training.galaxyproject.org//topics/single-cell/tutorials/scrna-preprocessing/tutorial.html		RNA-Seq quantification, Sequence alignment analysis, Sequencing quality control, Read summarisation, Data handling, Validation, Sequence alignment	2019-02-22	2025-04-08	5	True	True	False	True	umi_tools_count, samtools_stats, featurecounts, collection_column_join, bamFilter, __FLATTEN__, rna_star, umi_tools_extract, tp_sed_tool, multiqc	UseGalaxy.eu	UseGalaxy.org.au, UseGalaxy.be, UseGalaxy.cz, UseGalaxy.fr, UseGalaxy.no, UseGalaxy.org (Main)	0		3925142	9246188	8.566666666666666	0
Single Cell	An introduction to scRNA-seq data analysis	https://training.galaxyproject.org//topics/single-cell/tutorials/scrna-intro/slides.html			2021-01-29	2025-02-13	8	False	True	True	False			UseGalaxy.eu, UseGalaxy.org, UseGalaxy.org.au, UseGalaxy.fr, UseGalaxy.ca	0		3885845	9123174	2.066666666666667	0
Single Cell	Generating a single cell matrix using Alevin and combining datasets (bash + R)	https://training.galaxyproject.org//topics/single-cell/tutorials/alevin-commandline/tutorial.html			2023-12-08	2025-04-22	5	True	False	False	False			UseGalaxy.eu, UseGalaxy.org, UseGalaxy.org.au, UseGalaxy.fr, UseGalaxy.ca	0		778	1029	10.066666666666666	0
Single Cell	Understanding Barcodes	https://training.galaxyproject.org//topics/single-cell/tutorials/scrna-umis/tutorial.html		Statistical calculation, Sequencing quality control, Sequence composition calculation	2019-02-20	2026-06-25	12	True	False	True	True	umi_tools_extract, seq_filter_by_id, fastqc	UseGalaxy.org.au, UseGalaxy.be, UseGalaxy.cz, UseGalaxy.eu, UseGalaxy.fr, UseGalaxy.org (Main)	Galaxy@AuBi, UseGalaxy.no	0		6963	8631	5.1	0
Single Cell	Filter, plot, and explore single cell RNA-seq data with Seurat (R)	https://training.galaxyproject.org//topics/single-cell/tutorials/scrna-case_FilterPlotandExploreRStudio/tutorial.html			2023-10-02	2025-03-11	11	True	False	False	False			UseGalaxy.eu, UseGalaxy.org, UseGalaxy.org.au, UseGalaxy.fr, UseGalaxy.ca	0		3889	4400	3.3	0
Single Cell	Clustering 3K PBMCs with Scanpy	https://training.galaxyproject.org//topics/single-cell/tutorials/scrna-scanpy-pbmc3k/tutorial.html		Differential gene expression analysis, Principal component visualisation, Expression profile clustering	2019-12-19	2026-05-05	17	True	True	True	True	celltypist, scanpy_remove_confounders, scanpy_normalize, anndata_manipulate, scanpy_cluster_reduce_dimension, anndata_import, datamash_ops, scanpy_inspect, anndata_inspect, scanpy_plot, scanpy_filter	UseGalaxy.eu		0		3927335	9249984	8.016666666666667	0
Single Cell	Downstream Single-cell RNA analysis with RaceID	https://training.galaxyproject.org//topics/single-cell/tutorials/scrna-raceid/tutorial.html		Expression analysis, Expression profile clustering, Molecular dynamics	2019-03-25	2025-02-14	7	True	False	False	True	raceid_clustering, raceid_filtnormconf, raceid_inspectclusters, datamash_transpose, tp_head_tool, datamash_ops, raceid_trajectory, tp_sed_tool, raceid_inspecttrajectory	UseGalaxy.be, UseGalaxy.eu, UseGalaxy.no, UseGalaxy.org (Main)	UseGalaxy.org.au, UseGalaxy.cz	0		1206	1417	7.65	0
Single Cell	Importing files from public atlases	https://training.galaxyproject.org//topics/single-cell/tutorials/EBI-retrieval/tutorial.html			2023-11-14	2026-06-25	9	True	False	True	True	scanpy_read_10x, retrieve_scxa, sceasy_convert, seurat_read10x, regexColumn1, hca_matrix_downloader, tp_grep_tool, tp_find_and_replace, anndata_ops			0		695	889	11.933333333333334	0
Single Cell	Single-cell ATAC-seq standard processing with SnapATAC2	https://training.galaxyproject.org//topics/single-cell/tutorials/scatac-standard-processing-snapatac2/tutorial.html		Dimensionality reduction, Principal component visualisation, Expression profile clustering, Gene expression profiling, Genome indexing, Sequence alignment, Differential gene expression analysis, Generation, Essential dynamics, Read mapping	2024-07-11	2025-07-02	5	True	False	False	True	snapatac2_clustering, snapatac2_preprocessing, scanpy_normalize, scanpy_filter, snapatac2_peaks_and_motif, replace_column_with_key_value_file, anndata_manipulate, fasta_compute_length, snapatac2_plotting, scanpy_inspect, anndata_ops, scanpy_plot, bwa_mem, anndata_inspect, Cut1			0		2240	2630	3.1166666666666667	0
Single Cell	Removing the effects of the cell cycle	https://training.galaxyproject.org//topics/single-cell/tutorials/scrna-case_cell-cycle/tutorial.html		Differential gene expression analysis, Principal component visualisation, Expression profile clustering	2023-01-25	2026-06-25	16	True	False	False	True	sort1, tp_easyjoin_tool, addValue, cat1, scanpy_regress_variable, anndata_manipulate, table_compute, scanpy_cluster_reduce_dimension, scanpy_inspect, anndata_inspect, scanpy_plot			0		2394	2803	3.2	0
Single Cell	Comparing inferred cell compositions using MuSiC deconvolution	https://training.galaxyproject.org//topics/single-cell/tutorials/bulk-music-4-compare/tutorial.html			2023-01-20	2026-06-25	11	True	False	False	True	music_compare	UseGalaxy.org.au, UseGalaxy.be, UseGalaxy.cz, UseGalaxy.eu, UseGalaxy.org (Main)		0		378	532	12.583333333333334	0
Single Cell	Combining single cell datasets after pre-processing	https://training.galaxyproject.org//topics/single-cell/tutorials/scrna-case_alevin-combine-datasets/tutorial.html			2022-09-08	2025-11-18	23	True	False	True	True	tp_replace_in_column, anndata_manipulate, anndata_ops, Paste1, anndata_inspect, Cut1	UseGalaxy.org.au, UseGalaxy.be, UseGalaxy.eu	UseGalaxy.cz, UseGalaxy.org (Main)	0		2776	3854	10.483333333333333	0
Single Cell	Filter, plot and explore single-cell RNA-seq data with Scanpy (Python)	https://training.galaxyproject.org//topics/single-cell/tutorials/scrna-case-jupyter_basic-pipeline/tutorial.html			2023-08-25	2025-03-11	13	True	False	True	False			UseGalaxy.eu, UseGalaxy.org, UseGalaxy.org.au, UseGalaxy.fr, UseGalaxy.ca	0		3810	4482	4.15	0
Single Cell	Converting NCBI Data to the AnnData Format	https://training.galaxyproject.org//topics/single-cell/tutorials/scrna-ncbi-anndata/tutorial.html			2023-12-13	2026-06-25	8	True	False	True	True	unzip, tp_replace_in_column, anndata_manipulate, scanpy_filter_cells, anndata_import, anndata_ops, Paste1, anndata_inspect, Cut1	UseGalaxy.org.au, UseGalaxy.be	UseGalaxy.cz, UseGalaxy.org (Main)	0		587	683	11.35	0
Single Cell	Multi-sample batch correction with Harmony and SnapATAC2	https://training.galaxyproject.org//topics/single-cell/tutorials/scatac-batch-correction-snapatac2/tutorial.html		Dimensionality reduction, Essential dynamics, Gene expression profiling	2025-02-28	2025-07-02	2	True	False	False	True	snapatac2_clustering, Show beginning1, snapatac2_preprocessing, snapatac2_peaks_and_motif, anndata_manipulate, __EXTRACT_DATASET__, collection_element_identifiers, fasta_compute_length, snapatac2_plotting, __FILTER_FROM_FILE__, anndata_inspect	UseGalaxy.org.au, UseGalaxy.eu, UseGalaxy.org (Main)		0		790	859	2.6166666666666667	0
Single Cell	Filter, plot and explore single-cell RNA-seq data with Scanpy	https://training.galaxyproject.org//topics/single-cell/tutorials/scrna-case_basic-pipeline/tutorial.html		Differential gene expression analysis, Principal component visualisation, Expression profile clustering	2021-03-24	2025-04-23	24	True	False	True	True	scanpy_normalize, scanpy_plot_embed, scanpy_find_cluster, join1, scanpy_find_variable_genes, scanpy_plot, scanpy_filter, scanpy_run_tsne, retrieve_scxa, scanpy_run_pca, scanpy_filter_cells, anndata_ops, scanpy_compute_graph, scanpy_find_markers, anndata_manipulate, scanpy_filter_genes, anndata_inspect, scanpy_normalise_data, scanpy_cluster_reduce_dimension, scanpy_scale_data, scanpy_inspect, interactive_tool_cellxgene_vip, scanpy_run_umap, Cut1			0		6001	9314	7.75	0
Single Cell	Evaluating Reference Data for Bulk RNA Deconvolution	https://training.galaxyproject.org//topics/single-cell/tutorials/bulk-deconvolution-evaluate/tutorial.html		Visualisation, Annotation	2025-02-02	2026-06-25	4	True	False	False	True	tp_easyjoin_tool, collection_column_join, Remove beginning1, Count1, collapse_dataset, ggplot2_point, join1, datamash_transpose, ggplot2_violin, __DUPLICATE_FILE_TO_COLLECTION__, tp_awk_tool, music_deconvolution, annotatemyids, tp_multijoin_tool, Add_a_column1, Paste1, music_construct_eset, tp_cut_tool, table_compute, bg_column_arrange_by_header, tp_sed_tool, Cut1	UseGalaxy.org.au, UseGalaxy.eu, UseGalaxy.org (Main)	UseGalaxy.be, UseGalaxy.cz	0		215	243	12.683333333333334	0
Single Cell	Clustering 3K PBMCs with Seurat	https://training.galaxyproject.org//topics/single-cell/tutorials/scrna-seurat-pbmc3k/tutorial.html			2025-01-23	2025-05-09	5	True	False	True	True	seurat_preprocessing, csv_to_tabular, Filter1, seurat_plot, seurat_clustering, seurat_data, seurat_reduce_dimension, seurat_create, Cut1	UseGalaxy.org.au, UseGalaxy.be, UseGalaxy.eu, UseGalaxy.fr, UseGalaxy.org (Main)	MISSISSIPPI	0		2530	3061	4.8	0
Single Cell	Filter, plot, and explore single cell RNA-seq data with Seurat	https://training.galaxyproject.org//topics/single-cell/tutorials/scrna-case_FilterPlotandExplore_SeuratTools/tutorial.html			2024-04-09	2025-03-11	10	True	False	False	True	seurat_run_pca, retrieve_scxa, seurat_find_neighbours, seurat_find_clusters, seurat_scale_data, seurat_normalise_data, seurat_find_variable_genes, seurat_plot, seurat_filter_cells, seurat_read10x, seurat_find_markers, seurat_run_umap	UseGalaxy.org.au, UseGalaxy.eu, UseGalaxy.fr, UseGalaxy.org (Main)		0		2775	3286	5.75	0
Single Cell	Scanpy Parameter Iterator	https://training.galaxyproject.org//topics/single-cell/tutorials/scanpy_parameter_iterator/tutorial.html			2023-07-19	2026-06-25	9	True	False	False	True	scanpy_run_tsne, scanpy_plot_embed, scanpy_find_cluster, scanpy_parameter_iterator, scanpy_compute_graph, scanpy_run_umap	UseGalaxy.org.au, UseGalaxy.be, UseGalaxy.org (Main)		0		369	406	7.933333333333334	0
Single Cell	Plates, Batches, and Barcodes	https://training.galaxyproject.org//topics/single-cell/tutorials/scrna-plates-batches-barcodes/slides.html			2019-02-16	2025-02-13	4	False	True	True	False			UseGalaxy.eu, UseGalaxy.org, UseGalaxy.org.au, UseGalaxy.fr, UseGalaxy.ca	0		3918211	9237224	2.0833333333333335	0
Single Cell	Inferring single cell trajectories with Scanpy (Python)	https://training.galaxyproject.org//topics/single-cell/tutorials/scrna-case_JUPYTER-trajectories/tutorial.html			2021-04-07	2025-03-11	20	True	False	True	False			UseGalaxy.eu, UseGalaxy.org, UseGalaxy.org.au, UseGalaxy.fr, UseGalaxy.ca	0		5190	6048	3.7	0
Single Cell	Inferring single cell trajectories with Scanpy	https://training.galaxyproject.org//topics/single-cell/tutorials/scrna-case_trajectories/tutorial.html			2023-12-08	2025-03-11	13	True	False	False	True	scanpy_plot_trajectory, scanpy_plot_embed, anndata_manipulate, scanpy_run_diffmap, scanpy_find_cluster, scanpy_run_paga, scanpy_compute_graph, scanpy_run_dpt, scanpy_run_fdg		UseGalaxy.org.au, UseGalaxy.be, UseGalaxy.org (Main)	0		1563	1937	7.583333333333333	0
Single Cell	Matrix Exchange Format to ESet | Creating a single-cell RNA-seq reference dataset for deconvolution	https://training.galaxyproject.org//topics/single-cell/tutorials/bulk-music-2-preparescref/tutorial.html		Annotation	2023-01-20	2026-06-25	9	True	False	False	True	sort1, scanpy_read_10x, tp_easyjoin_tool, retrieve_scxa, annotatemyids, music_construct_eset, tp_cut_tool, music_manipulate_eset, join1, datamash_transpose, table_compute, regex1, add_line_to_file, tp_awk_tool, anndata_inspect, tp_sed_tool, Cut1		UseGalaxy.cz	0		831	1339	7.933333333333334	0
Single Cell	Single-cell Formats and Resources	https://training.galaxyproject.org//topics/single-cell/tutorials/scrna-data-formats/slides.html			2024-07-26	2025-02-13	4	False	True	True	False			UseGalaxy.eu, UseGalaxy.org, UseGalaxy.org.au, UseGalaxy.fr, UseGalaxy.ca	0		1892871	3581997	1.5833333333333333	0
Single Cell	Inferring single cell trajectories with Monocle3 (R)	https://training.galaxyproject.org//topics/single-cell/tutorials/scrna-case_monocle3-rstudio/tutorial.html			2023-04-12	2025-03-11	13	True	False	False	False			UseGalaxy.eu, UseGalaxy.org, UseGalaxy.org.au, UseGalaxy.fr, UseGalaxy.ca	0		7480	8433	1.5666666666666667	0
Single Cell	Inferring single cell trajectories with Monocle3	https://training.galaxyproject.org//topics/single-cell/tutorials/scrna-case_monocle3-trajectories/tutorial.html			2022-09-30	2025-04-23	24	True	False	True	True	monocle3_partition, monocle3_preprocess, tp_cut_tool, Filter1, monocle3_orderCells, regexColumn1, join1, monocle3_reduceDim, datamash_transpose, monocle3_diffExp, monocle3_create, monocle3_topmarkers, monocle3_plotCells, monocle3_learnGraph, anndata_inspect, Cut1	UseGalaxy.be, UseGalaxy.eu, UseGalaxy.org (Main)		0		4368	5383	3.95	0
Single Cell	Bulk matrix to ESet | Creating the bulk RNA-seq dataset for deconvolution	https://training.galaxyproject.org//topics/single-cell/tutorials/bulk-music-3-preparebulk/tutorial.html		Annotation	2023-01-20	2026-06-25	9	True	False	False	True	sort1, column_remove_by_header, tp_easyjoin_tool, annotatemyids, music_construct_eset, tp_cut_tool, music_manipulate_eset, table_compute, regex1, tp_awk_tool, tp_sed_tool		UseGalaxy.cz	0		867	1292	8.133333333333333	0
Single Cell	Trajectory analysis	https://training.galaxyproject.org//topics/single-cell/tutorials/scrna-trajectories/slides.html			2022-09-30	2025-02-13	4	False	True	False	False			UseGalaxy.eu, UseGalaxy.org, UseGalaxy.org.au, UseGalaxy.fr, UseGalaxy.ca	0		2962949	6150910	1.8666666666666667	0
Single Cell	Automated Cell Annotation	https://training.galaxyproject.org//topics/single-cell/tutorials/scrna-case-cell-annotation/slides.html			2023-09-04	2025-02-27	7	False	True	False	False			UseGalaxy.eu, UseGalaxy.org, UseGalaxy.org.au, UseGalaxy.fr, UseGalaxy.ca	0		2356303	4702902	1.7666666666666666	0
Statistics and machine learning	Machine learning: classification and regression	https://training.galaxyproject.org//topics/statistics/tutorials/classification_regression/tutorial.html			2019-03-07	2025-04-08	13	True	False	False	True	plotly_regression_performance_plots, sklearn_svm_classifier, plotly_ml_performance_plots, sklearn_ensemble	UseGalaxy.org.au, UseGalaxy.be, UseGalaxy.cz, UseGalaxy.eu, UseGalaxy.no, UseGalaxy.org (Main)		0		5883	10443	2.55	0
Statistics and machine learning	Clustering in Machine Learning	https://training.galaxyproject.org//topics/statistics/tutorials/clustering_machinelearning/tutorial.html		Visualisation	2020-05-08	2025-04-08	14	True	False	False	True	ggplot2_point, csv_to_tabular, sklearn_numeric_clustering	UseGalaxy.org.au, UseGalaxy.be, UseGalaxy.eu, UseGalaxy.no, UseGalaxy.org (Main)	UseGalaxy.cz, UseGalaxy.fr	0		8795	14396	2.5	0
Statistics and machine learning	GLEAM Image Learner - Validating Skin Lesion Classification on HAM10000	https://training.galaxyproject.org//topics/statistics/tutorials/image_learner/tutorial.html			2026-01-28	2026-05-18	4	True	True	True	True	image_learner	UseGalaxy.eu, UseGalaxy.org (Main)		0		646180	1020675	7.066666666666666	0
Statistics and machine learning	Image classification in Galaxy with fruit 360 dataset	https://training.galaxyproject.org//topics/statistics/tutorials/fruit_360/tutorial.html			2021-12-01	2024-07-09	8	True	True	True	True	tp_cut_tool, keras_model_builder, model_prediction, keras_train_and_eval, keras_model_config, sklearn_to_categorical, ml_visualization_ex	UseGalaxy.org.au, UseGalaxy.be, UseGalaxy.cz, UseGalaxy.eu, UseGalaxy.org (Main)	UseGalaxy.fr	0		3437152	7608606	5.25	0
Statistics and machine learning	Age prediction using machine learning	https://training.galaxyproject.org//topics/statistics/tutorials/age-prediction-with-ml/tutorial.html			2019-01-25	2025-04-08	12	True	False	False	True	sklearn_searchcv, sklearn_build_pipeline, plotly_regression_performance_plots, plotly_parallel_coordinates_plot, sklearn_ensemble	UseGalaxy.org.au, UseGalaxy.be, UseGalaxy.cz, UseGalaxy.eu, UseGalaxy.org (Main)	UseGalaxy.no	0		13540	21723	2.1333333333333333	0
Statistics and machine learning	A Docker-based interactive Jupyterlab powered by GPU for artificial intelligence in Galaxy	https://training.galaxyproject.org//topics/statistics/tutorials/gpu_jupyter_lab/tutorial.html			2022-04-06	2025-04-08	9	True	False	False	True	Filter1, interactive_tool_ml_jupyter_notebook, Cut1	UseGalaxy.eu		0		1338	1666	8.516666666666667	0
Statistics and machine learning	Modeling Breast Cancer Subtypes with Flexynesis	https://training.galaxyproject.org//topics/statistics/tutorials/flexynesis_classification/tutorial.html			2025-08-13	2026-05-18	7	True	False	True	True	Show beginning1, tabpfn, flexynesis_plot, tp_easyjoin_tool, tp_cut_tool, __EXTRACT_DATASET__, join1, datamash_transpose, table_compute, flexynesis, tp_sort_header_tool	UseGalaxy.be, UseGalaxy.eu	UseGalaxy.fr	0		269	366	17.866666666666667	0
Statistics and machine learning	Basics of machine learning	https://training.galaxyproject.org//topics/statistics/tutorials/machinelearning/tutorial.html			2018-11-05	2026-05-12	16	True	True	True	True	sklearn_svm_classifier	UseGalaxy.org.au, UseGalaxy.be, UseGalaxy.cz, UseGalaxy.eu, UseGalaxy.org (Main)	UseGalaxy.fr, UseGalaxy.no	0		3921402	9241556	12.983333333333333	0
Statistics and machine learning	Gleam Multimodal Learner - Head and Neck cancer Recurrence Prediction with HANCOCK	https://training.galaxyproject.org//topics/statistics/tutorials/multimodal_learner/tutorial.html			2026-03-25	2026-05-18	4	True	True	True	True	multimodal_learner	UseGalaxy.org (Main)	UseGalaxy.eu	0		348796	598728	12.566666666666666	0
Statistics and machine learning	Interval-Wise Testing for omics data	https://training.galaxyproject.org//topics/statistics/tutorials/iwtomics/tutorial.html		Comparison, Differentially-methylated region identification, Genome annotation, Differential gene expression analysis, Peak calling	2018-06-14	2023-11-09	17	True	False	False	True	iwtomics_plotwithscale, iwtomics_loadandplot, iwtomics_testandplot	UseGalaxy.org.au, UseGalaxy.be, UseGalaxy.cz, UseGalaxy.eu, UseGalaxy.no, UseGalaxy.org (Main)		0		419	542	15.05	0
Statistics and machine learning	Regression in Machine Learning	https://training.galaxyproject.org//topics/statistics/tutorials/regression_machinelearning/tutorial.html			2020-01-25	2026-05-12	20	True	True	True	True	sklearn_searchcv, Remove beginning1, sklearn_build_pipeline, sklearn_generalized_linear, plotly_regression_performance_plots, sklearn_ensemble	UseGalaxy.org.au, UseGalaxy.be, UseGalaxy.cz, UseGalaxy.eu, UseGalaxy.fr, UseGalaxy.org (Main)	UseGalaxy.no	0		3921750	9241701	7.766666666666667	0
Statistics and machine learning	Galaxy Tabular Learner - Building a Model using Chowell clinical data	https://training.galaxyproject.org//topics/statistics/tutorials/loris_model/tutorial.html			2024-12-13	2026-05-15	4	True	True	True	True	tabular_learner, PyCaret_Model_Comparison			0		1679285	3041777	12.233333333333333	0
Statistics and machine learning	Deep Learning (Part 3) - Convolutional neural networks (CNN)	https://training.galaxyproject.org//topics/statistics/tutorials/CNN/tutorial.html			2021-04-19	2026-05-11	20	True	True	True	True	keras_model_builder, model_prediction, keras_train_and_eval, keras_model_config, sklearn_to_categorical, ml_visualization_ex	UseGalaxy.org.au, UseGalaxy.be, UseGalaxy.cz, UseGalaxy.eu, UseGalaxy.org (Main)	UseGalaxy.fr	0		3776972	8706275	3.9833333333333334	0
Statistics and machine learning	Deep Learning (Part 2) - Recurrent neural networks (RNN)	https://training.galaxyproject.org//topics/statistics/tutorials/RNN/tutorial.html			2021-02-23	2025-05-10	15	True	True	True	True	keras_model_builder, model_prediction, keras_train_and_eval, keras_model_config, ml_visualization_ex	UseGalaxy.org.au, UseGalaxy.be, UseGalaxy.cz, UseGalaxy.eu, UseGalaxy.org (Main)	UseGalaxy.fr, UseGalaxy.no	0		3851637	8987239	5.316666666666666	0
Statistics and machine learning	Prepare Data from CbioPortal for Flexynesis Integration	https://training.galaxyproject.org//topics/statistics/tutorials/flexynesis_cbio_import/tutorial.html			2025-08-10	2025-08-13	2	True	False	False	True	tp_cut_tool, __EXTRACT_DATASET__, table_compute, tp_sort_header_tool, flexynesis_utils, flexynesis_cbioportal_import	UseGalaxy.eu	UseGalaxy.org.au, UseGalaxy.be, UseGalaxy.org (Main)	0		119	126	8.85	0
