Proteomics	Metaproteomics tutorial	https://training.galaxyproject.org//topics/proteomics/tutorials/metaproteomics/tutorial.html	Proteomics, Proteogenomics, Biodiversity, Taxonomy	Visualisation, Prediction and recognition	2017-06-28	2024-06-14	41	True	False	True	True	unipept, sqlite_to_tabular, query_tabular, peptide_shaker, search_gui	UseGalaxy.eu, UseGalaxy.no, UseGalaxy.org (Main), UseGalaxy.org.au	UseGalaxy.be, UseGalaxy.cz	0		2825	4518	2.683333333333333	0
Proteomics	metaQuantome 3: Taxonomy	https://training.galaxyproject.org//topics/proteomics/tutorials/metaquantome-taxonomy/tutorial.html	Proteomics, Proteogenomics, Metatranscriptomics, Microbial ecology, Metagenomics, Taxonomy	Query and retrieval, Heat map generation, Functional clustering, Quantification, Differential protein expression analysis, Filtering, Indexing, Statistical inference, Principal component visualisation, Visualisation	2020-10-29	2024-03-15	14	True	False	False	True	metaquantome_filter, metaquantome_sample, metaquantome_expand, metaquantome_db, metaquantome_stat, metaquantome_viz	UseGalaxy.be, UseGalaxy.eu	UseGalaxy.cz, UseGalaxy.fr, UseGalaxy.no, UseGalaxy.org.au	0		433	571	2.4	0
Proteomics	Proteogenomics 1: Database Creation	https://training.galaxyproject.org//topics/proteomics/tutorials/proteogenomics-dbcreation/tutorial.html		Transcriptome assembly, Variant calling, Statistical calculation, RNA-Seq analysis, Sequence annotation, Sequence alignment	2018-11-20	2025-05-08	29	True	False	True	True	fasta_merge_files_and_filter_unique_sequences, gffcompare, filter_tabular, freebayes, hisat2, fasta2tab, custom_pro_db, query_tabular, sqlite_to_tabular, stringtie, tab2fasta, cat_multi_datasets, regexColumn1, tp_replace_in_column, gffcompare_to_bed, translate_bed, bed_to_protein_map	UseGalaxy.org (Main)	UseGalaxy.cz, UseGalaxy.eu, UseGalaxy.org.au	0		5646	9312	2.65	0
Proteomics	Peptide and Protein Quantification via Stable Isotope Labelling (SIL)	https://training.galaxyproject.org//topics/proteomics/tutorials/protein-quant-sil/tutorial.html			2017-03-17	2025-04-08	32	True	False	False	True	TextExporter, IDScoreSwitcher, histogram_rpy, Summary_Statistics1, FileInfo, ProteinQuantifier, FidoAdapter, Grep1, FalseDiscoveryRate, MultiplexResolver, XTandemAdapter, PeptideIndexer, IDPosteriorErrorProbability, IDConflictResolver, FeatureFinderMultiplex, tp_tail_tool, IDMapper	UseGalaxy.eu	UseGalaxy.cz, UseGalaxy.no, UseGalaxy.org.au	0		1316	1853	1.6	0
Proteomics	Clinical Metaproteomics 3: Verification	https://training.galaxyproject.org//topics/proteomics/tutorials/clinical-mp-3-verification/tutorial.html			2024-02-06	2025-08-10	7	True	False	True	True	Cut1, Grouping1, fasta_merge_files_and_filter_unique_sequences, collapse_dataset, Remove beginning1, pepquery2, query_tabular, dbbuilder, uniprotxml_downloader, tp_cat, Filter1	UseGalaxy.cz, UseGalaxy.eu	UseGalaxy.org (Main), UseGalaxy.org.au	0		177	241	6.183333333333334	0
Proteomics	MaxQuant and MSstats for the analysis of label-free data	https://training.galaxyproject.org//topics/proteomics/tutorials/maxquant-msstats-dda-lfq/tutorial.html		Protein quantification, Differential protein expression profiling, Heat map generation, Tag-based peptide identification, Clustering, Statistical calculation, Principal component plotting, Standardisation and normalisation, Visualisation, Imputation, Spectrum calculation	2021-02-17	2025-05-14	16	True	False	True	True	msstats, Cut1, maxquant, tp_easyjoin_tool, Summary_Statistics1, fasta2tab, Grep1, uniprot, tp_replace_in_column, ggplot2_heatmap2, datamash_ops, Filter1			0		8248	13278	2.6333333333333333	0
Proteomics	Biomarker candidate identification	https://training.galaxyproject.org//topics/proteomics/tutorials/biomarker_selection/tutorial.html			2019-06-13	2023-11-09	9	True	False	False	True	retr_pepatlas1, IDconverter, prot_features, MQoutputfilter, retrieve_from_hpa, Jvenn, rna_abbased_data, tp_cut_tool		UseGalaxy.be, UseGalaxy.fr	0		1590	2164	2.566666666666667	0
Proteomics	Neoantigen 2: Database merge and FragPipe discovery	https://training.galaxyproject.org//topics/proteomics/tutorials/neoantigen-fragpipe-discovery/tutorial.html			2025-01-14	2025-07-02	1	True	False	False	True	fasta_merge_files_and_filter_unique_sequences, collapse_dataset, Remove beginning1, query_tabular, fragpipe, Grep1, validate_fasta_database	UseGalaxy.eu, UseGalaxy.org (Main)	UseGalaxy.org.au	0		87	109	1.9166666666666667	0
Proteomics	Detection and quantitation of N-termini (degradomics) via N-TAILS	https://training.galaxyproject.org//topics/proteomics/tutorials/ntails/tutorial.html	Proteomics		2017-02-14	2025-04-08	16	True	False	False	True	ConsensusID, MSGFPlusAdapter, IDFilter, MzTabExporter, FileFilter, FalseDiscoveryRate, IDMerger, FileMerger, PeptideIndexer, HighResPrecursorMassCorrector, IDConflictResolver, FeatureFinderMultiplex, IDMapper			0		815	1133	1.4333333333333333	0
Proteomics	Introduction to proteomics, protein identification, quantification and statistical modelling	https://training.galaxyproject.org//topics/proteomics/tutorials/introduction/slides.html			2017-12-01	2024-08-08	3	False	True	True	False			UseGalaxy.eu, UseGalaxy.org, UseGalaxy.org.au, UseGalaxy.fr	0		2723343	7314519	2.5166666666666666	0
Proteomics	Label-free versus Labelled - How to Choose Your Quantitation Method	https://training.galaxyproject.org//topics/proteomics/tutorials/labelfree-vs-labelled/tutorial.html			2017-03-17	2025-05-27	18	True	False	False	False			UseGalaxy.eu, UseGalaxy.org, UseGalaxy.org.au, UseGalaxy.fr	0		7579	12282	0.9	0
Sequence analysis	Quality Control	https://training.galaxyproject.org//topics/sequence-analysis/tutorials/quality-control/tutorial.html		Read pre-processing, Scatter plot plotting, Box-Whisker plot plotting, Primer removal, Statistical calculation, Sequencing quality control, Sequence composition calculation, Sequence trimming, Validation	2016-10-04	2025-03-29	48	True	True	True	True	fastqe, fastqc, cutadapt, multiqc, pycoqc, nanoplot	UseGalaxy.eu, UseGalaxy.org (Main), UseGalaxy.org.au	Galaxy@AuBi, UseGalaxy.cz, UseGalaxy.fr	0		2826541	7503960	5.55	0
Sequence analysis	Quality and contamination control in bacterial isolate using Illumina MiSeq Data	https://training.galaxyproject.org//topics/sequence-analysis/tutorials/quality-contamination-control/tutorial.html	Whole genome sequencing, Genomics, Microbiology, Microbial ecology	Cross-assembly, Statistical calculation, Sequence contamination filtering, Expression analysis, Sequencing quality control, Read mapping, Visualisation, Taxonomic classification	2024-07-15	2025-03-20	4	True	False	True	True	fastp, upload1, est_abundance, recentrifuge, falco, kraken2	UseGalaxy.eu, UseGalaxy.fr	UseGalaxy.cz, UseGalaxy.org (Main)	0		1386	1807	2.95	0
Sequence analysis	Mapping	https://training.galaxyproject.org//topics/sequence-analysis/tutorials/mapping/tutorial.html	Mapping	Sequence alignment analysis, Read pre-processing, Data handling, Primer removal, Genome visualisation, Statistical calculation, Sequencing quality control, Sequence composition calculation, Read mapping, Sequence trimming, Validation	2016-10-04	2025-03-31	43	True	True	True	True	jbrowse, fastqc, trim_galore, multiqc, bowtie2, samtools_stats, bamFilter	UseGalaxy.eu, UseGalaxy.org (Main), UseGalaxy.org.au	Galaxy@AuBi, GalaxyTrakr, UseGalaxy.be, UseGalaxy.cz, UseGalaxy.fr, UseGalaxy.no	0		2787204	7422255	5.216666666666667	0
Sequence analysis	Primer and primer scheme design for pan-specific detection and sequencing of viral pathogens across genotypes	https://training.galaxyproject.org//topics/sequence-analysis/tutorials/viral_primer_design/tutorial.html		PCR primer design, Sequence alignment analysis, Global alignment, Sequence analysis, Multiple sequence alignment, Local alignment, Sequence alignment	2025-03-20	2025-03-20	2	True	False	False	True	varvamp, EMBOSS: degapseq20, fasta_compute_length, rbc_mafft, ncbi_makeblastdb, split_file_to_collection	UseGalaxy.eu		0		401	474	1.0333333333333334	0
Sequence analysis	Clean and manage Sanger sequences from raw files to aligned consensus	https://training.galaxyproject.org//topics/sequence-analysis/tutorials/Manage_AB1_Sanger/tutorial.html		Phylogenetic analysis, Sequence read processing, Data handling, Sequence clustering, Sequencing quality control, Demultiplexing, DNA barcoding, Visualisation, Sequence file editing, Taxonomic classification	2024-01-08	2024-03-05	2	True	False	False	True	ncbi_blastn_wrapper, mothur_degap_seqs, regex1, ab1_fastq_converter, fastq_masker_by_quality, qiime_align_seqs, cshl_fastq_to_fasta, __SORTLIST__, tab2fasta, unzip, seqtk_mergepe, cshl_fastx_reverse_complement, fastq_groomer, aligned_to_consensus, mothur_merge_files, collection_element_identifiers, seqtk_trimfq, filter_by_fasta_ids, __FILTER_FROM_FILE__, fastq_to_tabular	UseGalaxy.cz, UseGalaxy.eu, UseGalaxy.fr		0		2988	3761	1.7666666666666666	0
Sequence analysis	Screening assembled genomes for contamination using NCBI FCS	https://training.galaxyproject.org//topics/sequence-analysis/tutorials/ncbi-fcs/tutorial.html		Sequence trimming, Sequence contamination filtering, Sequence assembly validation	2024-04-16	2024-04-16	2	True	False	False	True	ncbi_fcs_adaptor, ncbi_fcs_gx	GalaxyTrakr, UseGalaxy.org (Main)		0		1631	2223	2.3	0
Single Cell	Pre-processing of 10X Single-Cell ATAC-seq Datasets	https://training.galaxyproject.org//topics/single-cell/tutorials/scatac-preprocessing-tenx/tutorial.html		Statistical calculation, Imputation, Sequence alignment, Genome indexing, Sequence composition calculation, Gene regulatory network analysis, Sequencing quality control, Enrichment analysis, Expression profile clustering, Principal component visualisation, Generation, Read mapping, Peak calling, Differential gene expression analysis, Mapping	2023-04-24	2025-02-13	9	True	False	False	True	tp_sorted_uniq, sinto_fragments, fastqc, anndata_inspect, macs2_callpeak, scanpy_plot, sinto_barcode, bedtools_sortbed, bwa_mem, episcanpy_preprocess, episcanpy_build_matrix	UseGalaxy.eu, UseGalaxy.org (Main), UseGalaxy.org.au	UseGalaxy.cz	0		5734	6759	1.1	0
Single Cell	Single-cell quality control with scater	https://training.galaxyproject.org//topics/single-cell/tutorials/scrna-scater-qc/tutorial.html		Sequence visualisation, Read pre-processing, Sequencing quality control	2019-10-23	2025-02-14	6	True	False	False	True	scater_plot_dist_scatter, scater_create_qcmetric_ready_sce, scater_filter, scater_plot_pca	UseGalaxy.be, UseGalaxy.eu, UseGalaxy.no, UseGalaxy.org.au	UseGalaxy.cz	0		675	764	0.7166666666666667	0
Single Cell	Bulk RNA Deconvolution with MuSiC	https://training.galaxyproject.org//topics/single-cell/tutorials/bulk-music/tutorial.html			2022-02-11	2025-02-14	10	True	False	True	True	music_inspect_eset, music_construct_eset, music_deconvolution	UseGalaxy.cz, UseGalaxy.eu, UseGalaxy.org (Main), UseGalaxy.org.au		0		3719	4728	1.6333333333333333	0
Single Cell	Converting between common single cell data formats	https://training.galaxyproject.org//topics/single-cell/tutorials/scrna-data-ingest/tutorial.html		Community profiling, Loading	2024-02-13	2025-03-11	4	True	False	False	True	join1, monocle3_create, Cut1, dropletutils, Filter1, scanpy_filter_cells, tabular_to_fastq, regexColumn1, dropletutils_read_10x, anndata_inspect, seurat_read10x, anndata_ops, datamash_transpose, sceasy_convert, tp_tail_tool, tp_cut_tool, fastq_to_tabular	UseGalaxy.eu	UseGalaxy.org (Main)	0		2260	2696	1.3	0
Single Cell	Pre-processing of 10X Single-Cell RNA Datasets	https://training.galaxyproject.org//topics/single-cell/tutorials/scrna-preprocessing-tenx/tutorial.html		Community profiling, Validation, Sequence alignment, Loading, Sequencing quality control	2019-09-11	2025-04-29	13	True	False	True	True	dropletutils, multiqc, rna_starsolo	UseGalaxy.eu, UseGalaxy.org (Main), UseGalaxy.org.au	UseGalaxy.be, UseGalaxy.cz, UseGalaxy.fr, UseGalaxy.no	0		11853	15319	1.8666666666666667	0
Single Cell	GO Enrichment Analysis on Single-Cell RNA-Seq Data	https://training.galaxyproject.org//topics/single-cell/tutorials/GO-enrichment/tutorial.html		Gene-set enrichment analysis	2024-09-17	2025-04-08	8	True	True	False	True	Cut1, tp_split_on_column, goenrichment, gprofiler_gost	UseGalaxy.cz, UseGalaxy.eu, UseGalaxy.no, UseGalaxy.org (Main)		0		615986	1488276	3.25	0
Single Cell	Pseudobulk Analysis with Decoupler and EdgeR	https://training.galaxyproject.org//topics/single-cell/tutorials/pseudobulk-analysis/tutorial.html		Expression profile clustering, Differential gene expression analysis, Principal component visualisation	2025-02-12	2025-05-09	8	True	False	True	True	edger, anndata_inspect, scanpy_filter, tp_replace_in_column, decoupler_pseudobulk, volcanoplot, tp_replace_in_line, tp_awk_tool, column_remove_by_header, anndata_manipulate, __EXTRACT_DATASET__	UseGalaxy.eu, UseGalaxy.fr, UseGalaxy.org (Main), UseGalaxy.org.au		0		1254	1459	0.6	0
Single Cell	Generating a single cell matrix using Alevin	https://training.galaxyproject.org//topics/single-cell/tutorials/scrna-case_alevin/tutorial.html		Gene expression analysis, RNA-Seq quantification, Sequence composition calculation	2021-03-03	2025-05-07	24	True	False	True	True	join1, _salmon_kallisto_mtx_to_10x, Cut1, dropletutils_empty_drops, _dropletBarcodePlot, dropletutils_read_10x, anndata_inspect, sceasy_convert, _ensembl_gtf2gene_list, anndata_manipulate, alevin	UseGalaxy.eu, UseGalaxy.fr, UseGalaxy.org (Main), UseGalaxy.org.au		0		3329	5067	3.5166666666666666	0
Single Cell	Pre-processing of Single-Cell RNA Data	https://training.galaxyproject.org//topics/single-cell/tutorials/scrna-preprocessing/tutorial.html		Sequence alignment analysis, Data handling, RNA-Seq quantification, Validation, Read summarisation, Sequence alignment, Sequencing quality control	2019-02-22	2025-04-08	5	True	True	False	True	featurecounts, __FLATTEN__, rna_star, collection_column_join, multiqc, umi_tools_extract, samtools_stats, tp_sed_tool, umi_tools_count, bamFilter	UseGalaxy.eu	UseGalaxy.be, UseGalaxy.cz, UseGalaxy.fr, UseGalaxy.no, UseGalaxy.org (Main), UseGalaxy.org.au	0		2729452	7322470	4.783333333333333	0
Single Cell	An introduction to scRNA-seq data analysis	https://training.galaxyproject.org//topics/single-cell/tutorials/scrna-intro/slides.html			2021-01-29	2025-02-13	8	False	True	True	False			UseGalaxy.eu, UseGalaxy.org, UseGalaxy.org.au, UseGalaxy.fr	0		2690891	7200479	2.5166666666666666	0
Single Cell	Generating a single cell matrix using Alevin and combining datasets (bash + R)	https://training.galaxyproject.org//topics/single-cell/tutorials/alevin-commandline/tutorial.html			2023-12-08	2025-04-22	5	True	False	False	False			UseGalaxy.eu, UseGalaxy.org, UseGalaxy.org.au, UseGalaxy.fr	0		580	815	3.9	0
Single Cell	Combining single cell datasets after pre-processing	https://training.galaxyproject.org//topics/single-cell/tutorials/scrna-case_alevin-combine-datasets/tutorial.html			2022-09-08	2025-04-22	22	True	False	True	True	Cut1, anndata_inspect, tp_replace_in_column, anndata_ops, Paste1, anndata_manipulate	UseGalaxy.eu, UseGalaxy.org.au	UseGalaxy.be, UseGalaxy.org (Main)	0		2408	3365	2.533333333333333	0
Single Cell	Removing the effects of the cell cycle	https://training.galaxyproject.org//topics/single-cell/tutorials/scrna-case_cell-cycle/tutorial.html		Expression profile clustering, Differential gene expression analysis, Principal component visualisation	2023-01-25	2025-03-11	14	True	False	False	True	scanpy_cluster_reduce_dimension, scanpy_inspect, tp_easyjoin_tool, cat1, anndata_inspect, scanpy_plot, addValue, table_compute, scanpy_regress_variable, anndata_manipulate, sort1			0		2021	2387	0.7833333333333333	0
Single Cell	Filter, plot, and explore single cell RNA-seq data with Seurat (R)	https://training.galaxyproject.org//topics/single-cell/tutorials/scrna-case_FilterPlotandExploreRStudio/tutorial.html			2023-10-02	2025-03-11	11	True	False	False	False			UseGalaxy.eu, UseGalaxy.org, UseGalaxy.org.au, UseGalaxy.fr	0		3090	3534	0.9833333333333333	0
Single Cell	Comparing inferred cell compositions using MuSiC deconvolution	https://training.galaxyproject.org//topics/single-cell/tutorials/bulk-music-4-compare/tutorial.html			2023-01-20	2025-02-13	10	True	False	False	True	music_compare	UseGalaxy.cz, UseGalaxy.eu, UseGalaxy.org (Main), UseGalaxy.org.au		0		264	407	1.0833333333333333	0
Single Cell	Importing files from public atlases	https://training.galaxyproject.org//topics/single-cell/tutorials/EBI-retrieval/tutorial.html			2023-11-14	2025-03-11	8	True	False	True	True	scanpy_read_10x, tp_grep_tool, hca_matrix_downloader, regexColumn1, seurat_read10x, anndata_ops, tp_find_and_replace, sceasy_convert, retrieve_scxa	UseGalaxy.eu		0		516	688	4.016666666666667	0
Single Cell	Understanding Barcodes	https://training.galaxyproject.org//topics/single-cell/tutorials/scrna-umis/tutorial.html		Statistical calculation, Sequence composition calculation, Sequencing quality control	2019-02-20	2025-02-14	11	True	False	True	True	seq_filter_by_id, umi_tools_extract, fastqc	UseGalaxy.cz, UseGalaxy.eu, UseGalaxy.fr, UseGalaxy.org (Main), UseGalaxy.org.au	Galaxy@AuBi, UseGalaxy.no	0		6121	7635	1.2333333333333334	0
Single Cell	Single-cell ATAC-seq standard processing with SnapATAC2	https://training.galaxyproject.org//topics/single-cell/tutorials/scatac-standard-processing-snapatac2/tutorial.html		Gene expression profiling, Essential dynamics, Sequence alignment, Genome indexing, Dimensionality reduction, Expression profile clustering, Principal component visualisation, Generation, Read mapping, Differential gene expression analysis	2024-07-11	2025-07-02	5	True	False	False	True	scanpy_inspect, Cut1, snapatac2_plotting, snapatac2_preprocessing, snapatac2_clustering, replace_column_with_key_value_file, anndata_inspect, scanpy_filter, scanpy_normalize, scanpy_plot, bwa_mem, anndata_ops, fasta_compute_length, anndata_manipulate, snapatac2_peaks_and_motif			0		1359	1653	1.1166666666666667	0
Single Cell	Clustering 3K PBMCs with Scanpy	https://training.galaxyproject.org//topics/single-cell/tutorials/scrna-scanpy-pbmc3k/tutorial.html		Expression profile clustering, Differential gene expression analysis, Principal component visualisation	2019-12-19	2025-04-29	16	True	True	True	True	scanpy_cluster_reduce_dimension, scanpy_inspect, scanpy_remove_confounders, anndata_inspect, scanpy_filter, scanpy_normalize, scanpy_plot, anndata_import, datamash_ops, anndata_manipulate	UseGalaxy.eu, UseGalaxy.org (Main), UseGalaxy.org.au	UseGalaxy.be, UseGalaxy.cz, UseGalaxy.fr, UseGalaxy.no	0		2731067	7325571	4.533333333333333	0
Single Cell	Downstream Single-cell RNA analysis with RaceID	https://training.galaxyproject.org//topics/single-cell/tutorials/scrna-raceid/tutorial.html		Expression profile clustering, Expression analysis, Molecular dynamics	2019-03-25	2025-02-14	7	True	False	False	True	tp_sed_tool, raceid_inspecttrajectory, raceid_filtnormconf, raceid_clustering, datamash_transpose, raceid_trajectory, raceid_inspectclusters, tp_head_tool, datamash_ops	UseGalaxy.eu, UseGalaxy.no, UseGalaxy.org (Main)	UseGalaxy.be, UseGalaxy.cz, UseGalaxy.org.au	0		1039	1230	1.3166666666666667	0
Single Cell	Filter, plot and explore single-cell RNA-seq data with Scanpy (Python)	https://training.galaxyproject.org//topics/single-cell/tutorials/scrna-case-jupyter_basic-pipeline/tutorial.html			2023-08-25	2025-03-11	13	True	False	True	False			UseGalaxy.eu, UseGalaxy.org, UseGalaxy.org.au, UseGalaxy.fr	0		3090	3668	1.4833333333333334	0
Single Cell	Scanpy Parameter Iterator	https://training.galaxyproject.org//topics/single-cell/tutorials/scanpy_parameter_iterator/tutorial.html			2023-07-19	2025-02-13	8	True	False	False	True	scanpy_run_umap, scanpy_plot_embed, scanpy_run_tsne, scanpy_find_cluster, scanpy_parameter_iterator, scanpy_compute_graph	UseGalaxy.eu, UseGalaxy.org (Main), UseGalaxy.org.au		0		259	293	1.2	0
Single Cell	Converting NCBI Data to the AnnData Format	https://training.galaxyproject.org//topics/single-cell/tutorials/scrna-ncbi-anndata/tutorial.html			2023-12-13	2025-03-11	7	True	False	True	True	Cut1, scanpy_filter_cells, unzip, anndata_inspect, tp_replace_in_column, anndata_ops, anndata_import, Paste1, anndata_manipulate	UseGalaxy.eu, UseGalaxy.org.au		0		403	476	1.7666666666666666	0
Single Cell	Filter, plot and explore single-cell RNA-seq data with Scanpy	https://training.galaxyproject.org//topics/single-cell/tutorials/scrna-case_basic-pipeline/tutorial.html		Expression profile clustering, Differential gene expression analysis, Principal component visualisation	2021-03-24	2025-04-23	24	True	False	True	True	join1, scanpy_inspect, scanpy_filter, scanpy_plot, anndata_manipulate, Cut1, scanpy_normalise_data, scanpy_run_tsne, anndata_inspect, scanpy_find_cluster, scanpy_run_pca, scanpy_run_umap, anndata_ops, retrieve_scxa, scanpy_cluster_reduce_dimension, scanpy_find_markers, scanpy_filter_cells, scanpy_plot_embed, interactive_tool_cellxgene_vip, scanpy_filter_genes, scanpy_normalize, scanpy_compute_graph, scanpy_scale_data, scanpy_find_variable_genes	UseGalaxy.eu		0		5081	7752	2.6166666666666667	0
Single Cell	Multi-sample batch correction with Harmony and SnapATAC2	https://training.galaxyproject.org//topics/single-cell/tutorials/scatac-batch-correction-snapatac2/tutorial.html		Gene expression profiling, Essential dynamics, Dimensionality reduction	2025-02-28	2025-07-02	2	True	False	False	True	Show beginning1, snapatac2_plotting, snapatac2_preprocessing, snapatac2_peaks_and_motif, collection_element_identifiers, snapatac2_clustering, anndata_inspect, fasta_compute_length, __FILTER_FROM_FILE__, anndata_manipulate, __EXTRACT_DATASET__	UseGalaxy.eu, UseGalaxy.org (Main), UseGalaxy.org.au		0		372	421	0.9333333333333333	0
Single Cell	Evaluating Reference Data for Bulk RNA Deconvolution	https://training.galaxyproject.org//topics/single-cell/tutorials/bulk-deconvolution-evaluate/tutorial.html		Visualisation, Annotation	2025-02-02	2025-03-11	3	True	False	False	True	join1, music_deconvolution, __DUPLICATE_FILE_TO_COLLECTION__, table_compute, tp_multijoin_tool, tp_sed_tool, annotatemyids, Cut1, ggplot2_point, Paste1, music_construct_eset, Add_a_column1, tp_cut_tool, Count1, collapse_dataset, tp_easyjoin_tool, Remove beginning1, ggplot2_violin, collection_column_join, datamash_transpose, tp_awk_tool, bg_column_arrange_by_header	UseGalaxy.eu, UseGalaxy.org (Main), UseGalaxy.org.au	UseGalaxy.cz	0		87	107	1.15	0
Single Cell	Clustering 3K PBMCs with Seurat	https://training.galaxyproject.org//topics/single-cell/tutorials/scrna-seurat-pbmc3k/tutorial.html			2025-01-23	2025-05-09	5	True	False	True	True	Cut1, seurat_create, seurat_plot, seurat_clustering, seurat_reduce_dimension, csv_to_tabular, seurat_data, seurat_preprocessing, Filter1	UseGalaxy.eu, UseGalaxy.fr, UseGalaxy.org (Main), UseGalaxy.org.au	MISSISSIPPI	0		993	1175	1.1833333333333333	0
Single Cell	Filter, plot, and explore single cell RNA-seq data with Seurat	https://training.galaxyproject.org//topics/single-cell/tutorials/scrna-case_FilterPlotandExplore_SeuratTools/tutorial.html			2024-04-09	2025-03-11	10	True	False	False	True	seurat_run_pca, seurat_plot, seurat_find_neighbours, seurat_find_clusters, seurat_find_markers, seurat_scale_data, seurat_read10x, seurat_normalise_data, seurat_find_variable_genes, seurat_filter_cells, seurat_run_umap, retrieve_scxa	UseGalaxy.eu, UseGalaxy.fr, UseGalaxy.org (Main), UseGalaxy.org.au		0		1697	2072	1.2166666666666666	0
Single Cell	Plates, Batches, and Barcodes	https://training.galaxyproject.org//topics/single-cell/tutorials/scrna-plates-batches-barcodes/slides.html			2019-02-16	2025-02-13	4	False	True	True	False			UseGalaxy.eu, UseGalaxy.org, UseGalaxy.org.au, UseGalaxy.fr	0		2723343	7314521	2.5166666666666666	0
Single Cell	Inferring single cell trajectories with Scanpy (Python)	https://training.galaxyproject.org//topics/single-cell/tutorials/scrna-case_JUPYTER-trajectories/tutorial.html			2021-04-07	2025-03-11	20	True	False	True	False			UseGalaxy.eu, UseGalaxy.org, UseGalaxy.org.au, UseGalaxy.fr	0		4343	5152	1.3	0
Single Cell	Matrix Exchange Format to ESet | Creating a single-cell RNA-seq reference dataset for deconvolution	https://training.galaxyproject.org//topics/single-cell/tutorials/bulk-music-2-preparescref/tutorial.html		Annotation	2023-01-20	2024-02-13	8	True	False	False	True	join1, tp_sed_tool, Cut1, annotatemyids, scanpy_read_10x, tp_easyjoin_tool, add_line_to_file, regex1, anndata_inspect, music_manipulate_eset, datamash_transpose, retrieve_scxa, tp_awk_tool, music_construct_eset, sort1, tp_cut_tool, table_compute		UseGalaxy.cz	0		712	1210	2.2333333333333334	0
Single Cell	Inferring single cell trajectories with Scanpy	https://training.galaxyproject.org//topics/single-cell/tutorials/scrna-case_trajectories/tutorial.html			2023-12-08	2025-03-11	13	True	False	False	True	scanpy_plot_trajectory, scanpy_run_paga, scanpy_run_fdg, scanpy_plot_embed, scanpy_run_diffmap, scanpy_find_cluster, scanpy_compute_graph, scanpy_run_dpt, anndata_manipulate	UseGalaxy.eu	UseGalaxy.org (Main), UseGalaxy.org.au	0		1190	1516	2.283333333333333	0
Single Cell	Single-cell Formats and Resources	https://training.galaxyproject.org//topics/single-cell/tutorials/scrna-data-formats/slides.html			2024-07-26	2025-02-13	4	False	True	True	False			UseGalaxy.eu, UseGalaxy.org, UseGalaxy.org.au, UseGalaxy.fr	0		685265	1659292	2.4833333333333334	0
Single Cell	Inferring single cell trajectories with Monocle3 (R)	https://training.galaxyproject.org//topics/single-cell/tutorials/scrna-case_monocle3-rstudio/tutorial.html			2023-04-12	2025-03-11	13	True	False	False	False			UseGalaxy.eu, UseGalaxy.org, UseGalaxy.org.au, UseGalaxy.fr	0		6037	6873	0.7833333333333333	0
