Proteomics	MaxQuant and MSstats for the analysis of label-free data	https://training.galaxyproject.org//topics/proteomics/tutorials/maxquant-msstats-dda-lfq/tutorial.html		Differential protein expression profiling, Clustering, Protein quantification, Visualisation, Principal component plotting, Standardisation and normalisation, Statistical calculation, Tag-based peptide identification, Spectrum calculation, Imputation, Heat map generation	2021-02-17	2025-09-22	19	True	False	True	True	Filter1, tp_easyjoin_tool, fasta2tab, Cut1, Summary_Statistics1, msstats, uniprot, maxquant, ggplot2_heatmap2, datamash_ops, Grep1, tp_replace_in_column		UseGalaxy.cz, UseGalaxy.eu, UseGalaxy.no, UseGalaxy.org (Main), UseGalaxy.org.au	0		8506	13687	2.65	0
Proteomics	Neoantigen 3: PepQuery2 Verification	https://training.galaxyproject.org//topics/proteomics/tutorials/neoantigen-peptide-verification/tutorial.html		Formatting, Filtering	2025-01-14	2025-11-29	3	True	False	False	False	ncbi_blastp_wrapper, tab2fasta, query_tabular, pepquery2, msconvert	UseGalaxy.eu, UseGalaxy.org (Main), UseGalaxy.org.au	UseGalaxy.cz	0		58	66	1.9666666666666666	0
Proteomics	Annotating a protein list identified by LC-MS/MS experiments	https://training.galaxyproject.org//topics/proteomics/tutorials/proteome_annotation/tutorial.html			2019-09-12	2024-06-14	11	True	False	True	True	retrieve_from_hpa, IDconverter, reactome_analysis, MQoutputfilter, cluter_profiler, rna_abbased_data, Jvenn		UseGalaxy.be, UseGalaxy.fr	0		3074	4464	2.7666666666666666	0
Proteomics	DIA Analysis using OpenSwathWorkflow	https://training.galaxyproject.org//topics/proteomics/tutorials/DIA_Analysis_OSW/tutorial.html		Formatting, Filtering	2020-12-02	2025-05-20	12	True	False	False	True	pyprophet_score, pyprophet_merge, OpenSwathWorkflow, pyprophet_protein, pyprophet_peptide, msconvert, Grep1, pyprophet_export	UseGalaxy.eu	UseGalaxy.cz, UseGalaxy.no, UseGalaxy.org.au	0		3228	4596	2.533333333333333	0
Proteomics	EncyclopeDIA	https://training.galaxyproject.org//topics/proteomics/tutorials/encyclopedia/tutorial.html		Formatting, Filtering	2021-06-21	2025-05-19	12	True	False	True	True	msconvert, encyclopedia_quantify, encyclopedia_searchtolib		UseGalaxy.cz, UseGalaxy.eu, UseGalaxy.org (Main), UseGalaxy.org.au	0		2001	2722	1.7666666666666666	0
Proteomics	Peptide and Protein ID using SearchGUI and PeptideShaker	https://training.galaxyproject.org//topics/proteomics/tutorials/protein-id-sg-ps/tutorial.html			2017-06-12	2025-04-08	28	True	False	False	True	peptide_shaker, FileConverter, search_gui, PeakPickerHiRes, Grep1			0		3139	5015	1.8833333333333333	0
Proteomics	Peptide and Protein ID using OpenMS tools	https://training.galaxyproject.org//topics/proteomics/tutorials/protein-id-oms/tutorial.html		Formatting, Filtering	2017-10-16	2025-04-08	32	True	False	False	True	FileInfo, FalseDiscoveryRate, FidoAdapter, IDPosteriorErrorProbability, XTandemAdapter, IDMerger, IDFilter, IDScoreSwitcher, PeptideIndexer, ConsensusID, PeakPickerHiRes, msconvert, MSGFPlusAdapter, Grep1, TextExporter		UseGalaxy.cz, UseGalaxy.eu, UseGalaxy.no, UseGalaxy.org.au	0		3542	5947	2.8833333333333333	0
Proteomics	Clinical Metaproteomics 5: Data Interpretation	https://training.galaxyproject.org//topics/proteomics/tutorials/clinical-mp-5-data-interpretation/tutorial.html		Visualisation, Prediction and recognition	2024-02-06	2025-08-10	4	True	False	True	True	msstatstmt, Grep1, unipept	UseGalaxy.cz, UseGalaxy.eu, UseGalaxy.org (Main), UseGalaxy.org.au		0		281	371	2.6666666666666665	0
Proteomics	Neoantigen 1b: Non-Reference-Database-Generation	https://training.galaxyproject.org//topics/proteomics/tutorials/neoantigen-non-reference-database-generation/tutorial.html		Sequence alignment, Sequence annotation, Statistical calculation, Variant calling, RNA-Seq analysis, Transcriptome assembly	2025-01-14	2025-11-29	5	True	False	False	False	translate_bed, tab2fasta, bed_to_protein_map, fasta2tab, sqlite_to_tabular, hisat2, column_regex_find_and_replace, freebayes, CONVERTER_gz_to_uncompressed, gffcompare, fasta_merge_files_and_filter_unique_sequences, regexColumn1, concatenate, stringtie, gffcompare_to_bed, custom_pro_db			0		82	92	0.45	0
Proteomics	Multiomics data analysis using MultiGSEA	https://training.galaxyproject.org//topics/proteomics/tutorials/multiGSEA-tutorial/tutorial.html		Pathway analysis, Gene-set enrichment analysis, Aggregation	2025-03-10	2025-03-11	2	True	False	False	True	Filter1, multigsea, tp_grep_tool	UseGalaxy.eu	UseGalaxy.cz, UseGalaxy.org.au	0		282	308	1.4833333333333334	0
Proteomics	Metaproteomics tutorial	https://training.galaxyproject.org//topics/proteomics/tutorials/metaproteomics/tutorial.html	Proteomics, Proteogenomics, Biodiversity, Taxonomy	Visualisation, Prediction and recognition	2017-06-28	2024-06-14	41	True	False	True	True	sqlite_to_tabular, peptide_shaker, query_tabular, search_gui, unipept	UseGalaxy.eu, UseGalaxy.no, UseGalaxy.org (Main), UseGalaxy.org.au	UseGalaxy.be, UseGalaxy.cz	0		2914	4632	2.716666666666667	0
Proteomics	Clinical Metaproteomics 3: Verification	https://training.galaxyproject.org//topics/proteomics/tutorials/clinical-mp-3-verification/tutorial.html			2024-02-06	2025-08-10	7	True	False	True	True	Filter1, Remove beginning1, uniprotxml_downloader, Cut1, tp_cat, query_tabular, pepquery2, dbbuilder, Grouping1, fasta_merge_files_and_filter_unique_sequences, collapse_dataset	UseGalaxy.cz, UseGalaxy.eu	UseGalaxy.org (Main), UseGalaxy.org.au	0		201	267	4.116666666666666	0
Proteomics	Peptide and Protein Quantification via Stable Isotope Labelling (SIL)	https://training.galaxyproject.org//topics/proteomics/tutorials/protein-quant-sil/tutorial.html			2017-03-17	2025-04-08	32	True	False	False	True	FileInfo, FalseDiscoveryRate, histogram_rpy, IDConflictResolver, FeatureFinderMultiplex, FidoAdapter, Summary_Statistics1, IDPosteriorErrorProbability, XTandemAdapter, ProteinQuantifier, tp_tail_tool, IDScoreSwitcher, PeptideIndexer, TextExporter, Grep1, MultiplexResolver, IDMapper	UseGalaxy.eu	UseGalaxy.cz, UseGalaxy.no, UseGalaxy.org.au	0		1359	1898	1.55	0
Proteomics	Peptide Library Data Analysis	https://training.galaxyproject.org//topics/proteomics/tutorials/peptide-library-data-analysis/tutorial.html			2021-01-22	2023-11-09	5	True	False	False	True	pdaug_peptide_sequence_analysis, pdaug_peptide_data_access, pdaug_fishers_plot, pdaug_merge_dataframes, pdaug_addclasslabel, pdaug_sequence_property_based_descriptors, pdaug_tsvtofasta, pdaug_basic_plots	UseGalaxy.be		0		740	1005	2.35	0
Proteomics	MaxQuant and MSstats for the analysis of TMT data	https://training.galaxyproject.org//topics/proteomics/tutorials/maxquant-msstats-tmt/tutorial.html		Clustering, Protein quantification, Visualisation, Principal component plotting, Standardisation and normalisation, Statistical calculation, Imputation, Heat map generation	2021-08-13	2025-01-08	11	True	False	False	True	maxquant, msstatstmt	UseGalaxy.eu, UseGalaxy.org.au	UseGalaxy.cz, UseGalaxy.org (Main)	0		4281	5716	1.6333333333333333	0
Proteomics	Secretome Prediction	https://training.galaxyproject.org//topics/proteomics/tutorials/secretome-prediction/tutorial.html			2017-04-13	2025-04-08	15	True	False	False	True	Filter1, tp_easyjoin_tool, Grep1, get_subontology_from, Convert characters1, term_id_vs_term_name, uniprot, wolf_psort, comp1, bg_uniq, tp_sorted_uniq, tp_cut_tool			0		651	970	1.4666666666666666	0
Proteomics	metaQuantome 2: Function	https://training.galaxyproject.org//topics/proteomics/tutorials/metaquantome-function/tutorial.html	Proteomics, Proteogenomics, Metatranscriptomics, Microbial ecology, Metagenomics	Query and retrieval, Visualisation, Indexing, Statistical inference, Differential protein expression analysis, Principal component visualisation, Quantification, Functional clustering, Filtering, Heat map generation	2020-10-29	2024-03-15	14	True	False	False	True	metaquantome_filter, metaquantome_sample, metaquantome_expand, metaquantome_db, metaquantome_viz, metaquantome_stat	UseGalaxy.be, UseGalaxy.eu	UseGalaxy.cz, UseGalaxy.fr, UseGalaxy.no, UseGalaxy.org.au	0		421	592	4.166666666666667	0
Proteomics	metaQuantome 1: Data creation	https://training.galaxyproject.org//topics/proteomics/tutorials/metaquantome-data-creation/tutorial.html	Proteomics, Proteogenomics, Biodiversity, Taxonomy	Label-free quantification, Visualisation, Filtering, Formatting, Prediction and recognition	2020-10-16	2024-03-14	20	True	False	False	True	Filter1, Remove beginning1, flashlfq, Cut1, peptide_shaker, query_tabular, regex1, search_gui, unipept, msconvert, Grep1, tp_replace_in_line, tp_replace_in_column	UseGalaxy.eu	UseGalaxy.cz, UseGalaxy.no, UseGalaxy.org.au	0		891	1505	3.7333333333333334	0
Proteomics	Single Cell Proteomics data analysis with bioconductor-scp	https://training.galaxyproject.org//topics/proteomics/tutorials/bioconductor-scp/tutorial.html		Visualisation, Expression analysis	2025-02-07	2025-02-10	2	True	False	False	False	bioconductor_scp, Grouping1	UseGalaxy.eu, UseGalaxy.org.au		0		222	276	1.0166666666666666	0
Proteomics	Clinical Metaproteomics 1: Database-Generation	https://training.galaxyproject.org//topics/proteomics/tutorials/clinical-mp-1-database-generation/tutorial.html		Protein identification, Target-Decoy, Tag-based peptide identification, Expression analysis, de Novo sequencing	2024-02-06	2025-07-30	7	True	False	True	True	uniprotxml_downloader, metanovo, fasta_merge_files_and_filter_unique_sequences, dbbuilder	UseGalaxy.cz, UseGalaxy.eu, UseGalaxy.org.au	UseGalaxy.org (Main)	0		590	890	3.9166666666666665	0
Proteomics	Introduction to proteomics, protein identification, quantification and statistical modelling	https://training.galaxyproject.org//topics/proteomics/tutorials/introduction/slides.html			2017-12-01	2024-08-08	3	False	True	True	False			UseGalaxy.eu, UseGalaxy.org, UseGalaxy.org.au, UseGalaxy.fr	0		3058923	7867824	2.3333333333333335	0
Proteomics	Label-free versus Labelled - How to Choose Your Quantitation Method	https://training.galaxyproject.org//topics/proteomics/tutorials/labelfree-vs-labelled/tutorial.html			2017-03-17	2025-05-27	18	True	False	False	False			UseGalaxy.eu, UseGalaxy.org, UseGalaxy.org.au, UseGalaxy.fr	0		7672	12387	0.9	0
Sequence analysis	Mapping	https://training.galaxyproject.org//topics/sequence-analysis/tutorials/mapping/tutorial.html	Mapping	Sequence composition calculation, Genome visualisation, Read mapping, Validation, Read pre-processing, Sequence trimming, Sequence alignment analysis, Primer removal, Statistical calculation, Sequencing quality control, Data handling	2016-10-04	2025-03-31	43	True	True	True	True	samtools_stats, bowtie2, multiqc, trim_galore, jbrowse, fastqc, bamFilter	UseGalaxy.eu, UseGalaxy.org (Main), UseGalaxy.org.au	Galaxy@AuBi, GalaxyTrakr, UseGalaxy.be, UseGalaxy.cz, UseGalaxy.fr, UseGalaxy.no	0		3124446	7977752	5.083333333333333	0
Sequence analysis	Clean and manage Sanger sequences from raw files to aligned consensus	https://training.galaxyproject.org//topics/sequence-analysis/tutorials/Manage_AB1_Sanger/tutorial.html		Demultiplexing, DNA barcoding, Visualisation, Sequence file editing, Taxonomic classification, Sequence read processing, Sequencing quality control, Sequence clustering, Data handling, Phylogenetic analysis	2024-01-08	2024-03-05	2	True	False	False	True	mothur_merge_files, seqtk_trimfq, tab2fasta, mothur_degap_seqs, qiime_align_seqs, aligned_to_consensus, unzip, regex1, ab1_fastq_converter, filter_by_fasta_ids, __SORTLIST__, seqtk_mergepe, fastq_to_tabular, collection_element_identifiers, ncbi_blastn_wrapper, fastq_groomer, cshl_fastq_to_fasta, cshl_fastx_reverse_complement, __FILTER_FROM_FILE__, fastq_masker_by_quality	UseGalaxy.cz, UseGalaxy.eu, UseGalaxy.fr		0		3334	4177	1.7	0
Sequence analysis	Primer and primer scheme design for pan-specific detection and sequencing of viral pathogens across genotypes	https://training.galaxyproject.org//topics/sequence-analysis/tutorials/viral_primer_design/tutorial.html		Sequence alignment, Global alignment, Multiple sequence alignment, Local alignment, Sequence analysis, Sequence alignment analysis, PCR primer design	2025-03-20	2025-11-20	3	True	False	False	True	varvamp, fasta_compute_length, ncbi_makeblastdb, split_file_to_collection, EMBOSS: degapseq20, rbc_mafft	UseGalaxy.eu		0		594	688	1.0	0
Sequence analysis	Quality Control	https://training.galaxyproject.org//topics/sequence-analysis/tutorials/quality-control/tutorial.html		Sequence composition calculation, Validation, Scatter plot plotting, Read pre-processing, Sequence trimming, Primer removal, Statistical calculation, Sequencing quality control, Box-Whisker plot plotting	2016-10-04	2025-03-29	48	True	True	True	True	cutadapt, pycoqc, fastqe, nanoplot, multiqc, fastqc	UseGalaxy.eu, UseGalaxy.org (Main), UseGalaxy.org.au	Galaxy@AuBi, UseGalaxy.cz, UseGalaxy.fr	0		3166047	8062611	5.366666666666666	0
Sequence analysis	Screening assembled genomes for contamination using NCBI FCS	https://training.galaxyproject.org//topics/sequence-analysis/tutorials/ncbi-fcs/tutorial.html		Sequence contamination filtering, Sequence trimming, Sequence assembly validation	2024-04-16	2024-04-16	2	True	False	False	True	ncbi_fcs_adaptor, ncbi_fcs_gx	UseGalaxy.eu, UseGalaxy.org (Main)		0		1844	2498	2.3	0
Sequence analysis	Quality and contamination control in bacterial isolate using Illumina MiSeq Data	https://training.galaxyproject.org//topics/sequence-analysis/tutorials/quality-contamination-control/tutorial.html	Whole genome sequencing, Genomics, Microbiology, Microbial ecology	Statistical calculation, Sequence contamination filtering, Expression analysis, Cross-assembly, Visualisation, Read mapping, Sequencing quality control, Taxonomic classification	2024-07-15	2025-03-20	4	True	False	True	True	recentrifuge, kraken2, falco, fastp, est_abundance, upload1	UseGalaxy.eu, UseGalaxy.fr	GalaxyTrakr, UseGalaxy.cz, UseGalaxy.org (Main)	0		1630	2155	2.7333333333333334	0
Single Cell	Bulk RNA Deconvolution with MuSiC	https://training.galaxyproject.org//topics/single-cell/tutorials/bulk-music/tutorial.html			2022-02-11	2025-02-14	10	True	False	True	True	music_inspect_eset, music_construct_eset, music_deconvolution	UseGalaxy.cz, UseGalaxy.eu, UseGalaxy.org (Main), UseGalaxy.org.au		0		3963	5000	1.6	0
Single Cell	Generating a single cell matrix using Alevin	https://training.galaxyproject.org//topics/single-cell/tutorials/scrna-case_alevin/tutorial.html		RNA-Seq quantification, Sequence composition calculation, Gene expression analysis	2021-03-03	2025-11-18	25	True	False	True	True	_ensembl_gtf2gene_list, _dropletBarcodePlot, dropletutils_empty_drops, _salmon_kallisto_mtx_to_10x, sceasy_convert, Cut1, alevin, anndata_inspect, dropletutils_read_10x, anndata_manipulate, join1	UseGalaxy.eu, UseGalaxy.fr, UseGalaxy.org (Main), UseGalaxy.org.au		0		3456	5250	3.4833333333333334	0
Single Cell	Converting between common single cell data formats	https://training.galaxyproject.org//topics/single-cell/tutorials/scrna-data-ingest/tutorial.html		Loading, Community profiling	2024-02-13	2025-03-11	4	True	False	False	True	Filter1, monocle3_create, dropletutils_read_10x, sceasy_convert, Cut1, datamash_transpose, seurat_read10x, tp_tail_tool, anndata_inspect, dropletutils, tabular_to_fastq, scanpy_filter_cells, fastq_to_tabular, regexColumn1, anndata_ops, tp_cut_tool, join1		UseGalaxy.org (Main)	0		2551	3033	1.3	0
Single Cell	Pre-processing of 10X Single-Cell RNA Datasets	https://training.galaxyproject.org//topics/single-cell/tutorials/scrna-preprocessing-tenx/tutorial.html		Sequence alignment, Community profiling, Sequencing quality control, Loading, Validation	2019-09-11	2025-04-29	13	True	False	True	True	dropletutils, multiqc, rna_starsolo	UseGalaxy.eu, UseGalaxy.org (Main), UseGalaxy.org.au	UseGalaxy.be, UseGalaxy.cz, UseGalaxy.fr, UseGalaxy.no	0		12541	16214	1.8666666666666667	0
Single Cell	Pre-processing of Single-Cell RNA Data	https://training.galaxyproject.org//topics/single-cell/tutorials/scrna-preprocessing/tutorial.html		Sequence alignment, Read summarisation, Sequencing quality control, Validation, RNA-Seq quantification, Data handling, Sequence alignment analysis	2019-02-22	2025-04-08	5	True	True	False	True	collection_column_join, featurecounts, samtools_stats, umi_tools_count, multiqc, rna_star, umi_tools_extract, tp_sed_tool, __FLATTEN__, bamFilter	UseGalaxy.eu	UseGalaxy.be, UseGalaxy.cz, UseGalaxy.fr, UseGalaxy.no, UseGalaxy.org (Main), UseGalaxy.org.au	0		3065338	7876136	4.6	0
Single Cell	Pseudobulk Analysis with Decoupler and EdgeR	https://training.galaxyproject.org//topics/single-cell/tutorials/pseudobulk-analysis/tutorial.html		Expression profile clustering, Principal component visualisation, Differential gene expression analysis	2025-02-12	2025-05-09	8	True	False	True	True	__EXTRACT_DATASET__, tp_awk_tool, column_remove_by_header, tp_replace_in_column, volcanoplot, anndata_inspect, scanpy_filter, edger, anndata_manipulate, tp_replace_in_line, decoupler_pseudobulk	UseGalaxy.eu, UseGalaxy.fr, UseGalaxy.org (Main), UseGalaxy.org.au		0		1563	1800	0.65	0
Single Cell	Single-cell quality control with scater	https://training.galaxyproject.org//topics/single-cell/tutorials/scrna-scater-qc/tutorial.html		Sequence visualisation, Sequencing quality control, Read pre-processing	2019-10-23	2025-02-14	6	True	False	False	True	scater_create_qcmetric_ready_sce, scater_plot_dist_scatter, scater_filter, scater_plot_pca	UseGalaxy.be, UseGalaxy.eu, UseGalaxy.no, UseGalaxy.org.au	UseGalaxy.cz	0		704	795	0.7166666666666667	0
Single Cell	GO Enrichment Analysis on Single-Cell RNA-Seq Data	https://training.galaxyproject.org//topics/single-cell/tutorials/GO-enrichment/tutorial.html		Gene-set enrichment analysis	2024-09-17	2025-04-08	8	True	True	False	True	Cut1, gprofiler_gost, goenrichment, tp_split_on_column	UseGalaxy.cz, UseGalaxy.eu, UseGalaxy.no, UseGalaxy.org (Main)		0		948170	2041768	2.75	0
Single Cell	Pre-processing of 10X Single-Cell ATAC-seq Datasets	https://training.galaxyproject.org//topics/single-cell/tutorials/scatac-preprocessing-tenx/tutorial.html		Sequence alignment, Principal component visualisation, Sequence composition calculation, Read mapping, Visualisation, Mapping, Peak calling, Gene regulatory network analysis, Statistical calculation, Genome indexing, Imputation, Enrichment analysis, Expression profile clustering, Sequencing quality control, Generation, Differential gene expression analysis	2023-04-24	2025-10-16	10	True	False	False	True	scanpy_plot, episcanpy_preprocess, sinto_barcode, macs2_callpeak, episcanpy_build_matrix, fastqc, falco, anndata_inspect, bwa_mem, sinto_fragments, tp_sorted_uniq, bedtools_sortbed	UseGalaxy.org (Main), UseGalaxy.org.au	UseGalaxy.cz	0		6000	7058	1.0833333333333333	0
Single Cell	An introduction to scRNA-seq data analysis	https://training.galaxyproject.org//topics/single-cell/tutorials/scrna-intro/slides.html			2021-01-29	2025-02-13	8	False	True	True	False			UseGalaxy.eu, UseGalaxy.org, UseGalaxy.org.au, UseGalaxy.fr	0		3026547	7753787	2.3333333333333335	0
Single Cell	Generating a single cell matrix using Alevin and combining datasets (bash + R)	https://training.galaxyproject.org//topics/single-cell/tutorials/alevin-commandline/tutorial.html			2023-12-08	2025-04-22	5	True	False	False	False			UseGalaxy.eu, UseGalaxy.org, UseGalaxy.org.au, UseGalaxy.fr	0		615	851	3.65	0
Single Cell	Removing the effects of the cell cycle	https://training.galaxyproject.org//topics/single-cell/tutorials/scrna-case_cell-cycle/tutorial.html		Principal component visualisation, Expression profile clustering, Differential gene expression analysis	2023-01-25	2025-03-11	14	True	False	False	True	tp_easyjoin_tool, scanpy_inspect, scanpy_plot, sort1, scanpy_regress_variable, table_compute, cat1, anndata_inspect, addValue, scanpy_cluster_reduce_dimension, anndata_manipulate			0		2107	2480	0.7666666666666667	0
Single Cell	Importing files from public atlases	https://training.galaxyproject.org//topics/single-cell/tutorials/EBI-retrieval/tutorial.html			2023-11-14	2025-03-11	8	True	False	True	True	tp_grep_tool, scanpy_read_10x, sceasy_convert, seurat_read10x, tp_find_and_replace, regexColumn1, anndata_ops, retrieve_scxa, hca_matrix_downloader			0		580	765	3.6333333333333333	0
Single Cell	Single-cell ATAC-seq standard processing with SnapATAC2	https://training.galaxyproject.org//topics/single-cell/tutorials/scatac-standard-processing-snapatac2/tutorial.html		Sequence alignment, Principal component visualisation, Essential dynamics, Read mapping, Dimensionality reduction, Gene expression profiling, Genome indexing, Expression profile clustering, Generation, Differential gene expression analysis	2024-07-11	2025-07-02	5	True	False	False	True	scanpy_inspect, scanpy_plot, scanpy_normalize, Cut1, replace_column_with_key_value_file, fasta_compute_length, snapatac2_peaks_and_motif, anndata_inspect, snapatac2_clustering, snapatac2_preprocessing, anndata_manipulate, scanpy_filter, anndata_ops, bwa_mem, snapatac2_plotting			0		1549	1875	1.1	0
Single Cell	Clustering 3K PBMCs with Scanpy	https://training.galaxyproject.org//topics/single-cell/tutorials/scrna-scanpy-pbmc3k/tutorial.html		Principal component visualisation, Expression profile clustering, Differential gene expression analysis	2019-12-19	2025-04-29	16	True	True	True	True	anndata_import, scanpy_inspect, scanpy_plot, scanpy_normalize, scanpy_remove_confounders, anndata_inspect, scanpy_cluster_reduce_dimension, scanpy_filter, datamash_ops, anndata_manipulate	UseGalaxy.eu, UseGalaxy.org (Main), UseGalaxy.org.au	UseGalaxy.be, UseGalaxy.cz, UseGalaxy.fr, UseGalaxy.no	0		3067002	7879288	4.333333333333333	0
Single Cell	Combining single cell datasets after pre-processing	https://training.galaxyproject.org//topics/single-cell/tutorials/scrna-case_alevin-combine-datasets/tutorial.html			2022-09-08	2025-11-18	23	True	False	True	True	Cut1, anndata_inspect, anndata_ops, Paste1, anndata_manipulate, tp_replace_in_column	UseGalaxy.eu, UseGalaxy.org.au	UseGalaxy.be, UseGalaxy.org (Main)	0		2523	3540	2.533333333333333	0
Single Cell	Filter, plot, and explore single cell RNA-seq data with Seurat (R)	https://training.galaxyproject.org//topics/single-cell/tutorials/scrna-case_FilterPlotandExploreRStudio/tutorial.html			2023-10-02	2025-03-11	11	True	False	False	False			UseGalaxy.eu, UseGalaxy.org, UseGalaxy.org.au, UseGalaxy.fr	0		3266	3727	0.95	0
Single Cell	Understanding Barcodes	https://training.galaxyproject.org//topics/single-cell/tutorials/scrna-umis/tutorial.html		Statistical calculation, Sequence composition calculation, Sequencing quality control	2019-02-20	2025-02-14	11	True	False	True	True	seq_filter_by_id, fastqc, umi_tools_extract	UseGalaxy.cz, UseGalaxy.eu, UseGalaxy.fr, UseGalaxy.org (Main), UseGalaxy.org.au	Galaxy@AuBi, UseGalaxy.no	0		6341	7891	1.2333333333333334	0
Single Cell	Downstream Single-cell RNA analysis with RaceID	https://training.galaxyproject.org//topics/single-cell/tutorials/scrna-raceid/tutorial.html		Molecular dynamics, Expression analysis, Expression profile clustering	2019-03-25	2025-02-14	7	True	False	False	True	raceid_clustering, raceid_inspecttrajectory, datamash_transpose, tp_head_tool, raceid_inspectclusters, datamash_ops, raceid_trajectory, tp_sed_tool, raceid_filtnormconf	UseGalaxy.eu, UseGalaxy.no, UseGalaxy.org (Main)	UseGalaxy.be, UseGalaxy.cz, UseGalaxy.org.au	0		1082	1278	1.2666666666666666	0
Single Cell	Comparing inferred cell compositions using MuSiC deconvolution	https://training.galaxyproject.org//topics/single-cell/tutorials/bulk-music-4-compare/tutorial.html			2023-01-20	2025-02-13	10	True	False	False	True	music_compare	UseGalaxy.cz, UseGalaxy.eu, UseGalaxy.org (Main), UseGalaxy.org.au		0		285	428	1.3833333333333333	0
Single Cell	Filter, plot and explore single-cell RNA-seq data with Scanpy (Python)	https://training.galaxyproject.org//topics/single-cell/tutorials/scrna-case-jupyter_basic-pipeline/tutorial.html			2023-08-25	2025-03-11	13	True	False	True	False			UseGalaxy.eu, UseGalaxy.org, UseGalaxy.org.au, UseGalaxy.fr	0		3312	3934	1.5166666666666666	0
Single Cell	Filter, plot and explore single-cell RNA-seq data with Scanpy	https://training.galaxyproject.org//topics/single-cell/tutorials/scrna-case_basic-pipeline/tutorial.html		Principal component visualisation, Expression profile clustering, Differential gene expression analysis	2021-03-24	2025-04-23	24	True	False	True	True	scanpy_plot, scanpy_run_umap, scanpy_find_cluster, anndata_manipulate, join1, scanpy_normalize, scanpy_find_markers, Cut1, scanpy_scale_data, anndata_inspect, scanpy_filter_genes, scanpy_normalise_data, retrieve_scxa, interactive_tool_cellxgene_vip, scanpy_cluster_reduce_dimension, scanpy_run_pca, scanpy_filter_cells, scanpy_filter, anndata_ops, scanpy_plot_embed, scanpy_run_tsne, scanpy_inspect, scanpy_find_variable_genes, scanpy_compute_graph			0		5397	8491	2.65	0
Single Cell	Clustering 3K PBMCs with Seurat	https://training.galaxyproject.org//topics/single-cell/tutorials/scrna-seurat-pbmc3k/tutorial.html			2025-01-23	2025-05-09	5	True	False	True	True	Filter1, seurat_clustering, seurat_data, seurat_preprocessing, seurat_plot, Cut1, seurat_create, csv_to_tabular, seurat_reduce_dimension	MISSISSIPPI, UseGalaxy.eu, UseGalaxy.fr, UseGalaxy.org (Main), UseGalaxy.org.au		0		1301	1567	1.1833333333333333	0
Single Cell	Filter, plot, and explore single cell RNA-seq data with Seurat	https://training.galaxyproject.org//topics/single-cell/tutorials/scrna-case_FilterPlotandExplore_SeuratTools/tutorial.html			2024-04-09	2025-03-11	10	True	False	False	True	seurat_find_clusters, seurat_plot, seurat_find_variable_genes, seurat_find_neighbours, seurat_normalise_data, seurat_filter_cells, seurat_read10x, seurat_run_pca, seurat_scale_data, seurat_run_umap, retrieve_scxa, seurat_find_markers	UseGalaxy.eu, UseGalaxy.fr, UseGalaxy.org (Main), UseGalaxy.org.au		0		1982	2419	1.4333333333333333	0
