Proteomics	Neoantigen 5a: Predicting HLA Binding	https://training.galaxyproject.org//topics/proteomics/tutorials/neoantigen-predicting-hla-binding/tutorial.html		Genetic variation analysis, Read mapping	2025-01-14	2025-12-03	4	True	False	False	False	query_tabular, optitype, seq2hla, tp_awk_tool	UseGalaxy.org.au, UseGalaxy.eu, UseGalaxy.org (Main)	UseGalaxy.cz	0		107	114	3.533333333333333	0
Proteomics	Library Generation for DIA Analysis	https://training.galaxyproject.org//topics/proteomics/tutorials/DIA_lib_OSW/tutorial.html		Heat map generation, Statistical calculation, Protein quantification, Imputation, Standardisation and normalisation, Visualisation, Clustering, Principal component plotting	2020-12-02	2025-06-02	12	True	False	False	True	TargetedFileConverter, Filter1, OpenSwathDecoyGenerator, OpenSwathAssayGenerator, maxquant, diapysef	UseGalaxy.eu	UseGalaxy.org.au, UseGalaxy.cz, UseGalaxy.no	0		4752	6185	4.233333333333333	0
Proteomics	Neoantigen 1a: Fusion-Database-Generation	https://training.galaxyproject.org//topics/proteomics/tutorials/neoantigen-fusion-database-generation/tutorial.html		Sequence alignment	2025-01-14	2025-12-03	4	True	False	False	False	rna_star, tp_awk_tool, CONVERTER_gz_to_uncompressed, arriba, query_tabular, tab2fasta, regex1, arriba_get_filters	UseGalaxy.org.au, UseGalaxy.eu, UseGalaxy.org (Main)	UseGalaxy.cz	0		250	301	2.8833333333333333	0
Proteomics	EncyclopeDIA	https://training.galaxyproject.org//topics/proteomics/tutorials/encyclopedia/tutorial.html		Filtering, Formatting	2021-06-21	2025-05-19	12	True	False	True	True	msconvert, encyclopedia_searchtolib, encyclopedia_quantify		UseGalaxy.org.au, UseGalaxy.be, UseGalaxy.cz, UseGalaxy.eu, UseGalaxy.org (Main)	0		2056	2784	8.116666666666667	0
Proteomics	Biomarker candidate identification	https://training.galaxyproject.org//topics/proteomics/tutorials/biomarker_selection/tutorial.html			2019-06-13	2023-11-09	9	True	False	False	True	MQoutputfilter, Jvenn, IDconverter, tp_cut_tool, rna_abbased_data, retr_pepatlas1, prot_features, retrieve_from_hpa		UseGalaxy.be, UseGalaxy.fr	0		1802	2453	9.8	0
Proteomics	MaxQuant and MSstats for the analysis of label-free data	https://training.galaxyproject.org//topics/proteomics/tutorials/maxquant-msstats-dda-lfq/tutorial.html		Differential protein expression profiling, Heat map generation, Statistical calculation, Protein quantification, Imputation, Standardisation and normalisation, Visualisation, Clustering, Tag-based peptide identification, Principal component plotting, Spectrum calculation	2021-02-17	2025-09-22	19	True	False	True	True	tp_easyjoin_tool, tp_replace_in_column, ggplot2_heatmap2, uniprot, datamash_ops, Summary_Statistics1, Filter1, fasta2tab, Grep1, Cut1, msstats, maxquant		UseGalaxy.org.au, UseGalaxy.cz, UseGalaxy.eu, UseGalaxy.no, UseGalaxy.org (Main)	0		8775	14129	6.216666666666667	0
Proteomics	Metaproteomics tutorial	https://training.galaxyproject.org//topics/proteomics/tutorials/metaproteomics/tutorial.html	Proteomics, Proteogenomics, Biodiversity, Taxonomy	Visualisation, Prediction and recognition	2017-06-28	2024-06-14	41	True	False	True	True	unipept, search_gui, sqlite_to_tabular, query_tabular, peptide_shaker	UseGalaxy.org.au, UseGalaxy.eu, UseGalaxy.no, UseGalaxy.org (Main)	UseGalaxy.be, UseGalaxy.cz	0		3033	4783	9.583333333333334	0
Proteomics	MaxQuant and MSstats for the analysis of TMT data	https://training.galaxyproject.org//topics/proteomics/tutorials/maxquant-msstats-tmt/tutorial.html		Heat map generation, Statistical calculation, Protein quantification, Imputation, Standardisation and normalisation, Visualisation, Clustering, Principal component plotting	2021-08-13	2025-01-08	11	True	False	False	True	msstatstmt, maxquant	UseGalaxy.org.au, UseGalaxy.be, UseGalaxy.eu	UseGalaxy.cz, UseGalaxy.org (Main)	0		4427	5913	3.85	0
Proteomics	Machine Learning Modeling of Anticancer Peptides	https://training.galaxyproject.org//topics/proteomics/tutorials/ml-modeling-of-anti-cancer-peptides/tutorial.html			2021-01-22	2023-11-09	8	True	False	False	True	pdaug_addclasslabel, pdaug_basic_plots, pdaug_merge_dataframes, pdaug_ml_models, pdaug_sequence_property_based_descriptors	UseGalaxy.be		0		1077	1593	11.616666666666667	0
Proteomics	Peptide and Protein ID using OpenMS tools	https://training.galaxyproject.org//topics/proteomics/tutorials/protein-id-oms/tutorial.html		Filtering, Formatting	2017-10-16	2025-04-08	32	True	False	False	True	msconvert, PeptideIndexer, FileInfo, FalseDiscoveryRate, IDPosteriorErrorProbability, MSGFPlusAdapter, FidoAdapter, IDFilter, PeakPickerHiRes, TextExporter, XTandemAdapter, ConsensusID, IDMerger, Grep1, IDScoreSwitcher		UseGalaxy.org.au, UseGalaxy.be, UseGalaxy.cz, UseGalaxy.eu, UseGalaxy.no	0		3655	6089	7.6	0
Proteomics	Clinical Metaproteomics 4: Quantitation	https://training.galaxyproject.org//topics/proteomics/tutorials/clinical-mp-4-quantitation/tutorial.html		Heat map generation, Statistical calculation, Protein quantification, Imputation, Standardisation and normalisation, Visualisation, Clustering, Principal component plotting	2024-02-06	2025-08-10	5	True	False	True	True	Cut1, Grouping1, maxquant, Grep1	UseGalaxy.org.au, UseGalaxy.eu, UseGalaxy.org (Main)	UseGalaxy.cz, UseGalaxy.fr, UseGalaxy.no	0		210	276	29.833333333333332	0
Proteomics	Protein FASTA Database Handling	https://training.galaxyproject.org//topics/proteomics/tutorials/database-handling/tutorial.html	Proteomics		2017-02-14	2025-04-08	30	True	False	False	True	DecoyDatabase, dbbuilder, fasta_merge_files_and_filter_unique_sequences, fasta2tab, addValue, tab2fasta	UseGalaxy.org.au, UseGalaxy.eu	UseGalaxy.be, UseGalaxy.cz, UseGalaxy.no, UseGalaxy.org (Main)	0		4930	7773	7.966666666666667	0
Proteomics	Neoantigen 5b: IEDB binding Validated Neopeptides	https://training.galaxyproject.org//topics/proteomics/tutorials/neoantigen-hla-binding-novel-peptides/tutorial.html			2025-01-14	2025-12-03	5	True	False	False	False	Filter1, table_compute, fasta_to_tabular, iedb_api, query_tabular			0		109	114	3.933333333333333	0
Proteomics	Clinical Metaproteomics 5: Data Interpretation	https://training.galaxyproject.org//topics/proteomics/tutorials/clinical-mp-5-data-interpretation/tutorial.html		Visualisation, Prediction and recognition	2024-02-06	2025-08-10	4	True	False	True	True	unipept, msstatstmt, Grep1	UseGalaxy.org.au, UseGalaxy.be, UseGalaxy.cz, UseGalaxy.eu, UseGalaxy.org (Main)		0		324	414	20.916666666666668	0
Proteomics	DIA Analysis using OpenSwathWorkflow	https://training.galaxyproject.org//topics/proteomics/tutorials/DIA_Analysis_OSW/tutorial.html		Filtering, Formatting	2020-12-02	2025-05-20	12	True	False	False	True	msconvert, pyprophet_merge, pyprophet_export, pyprophet_score, OpenSwathWorkflow, Grep1, pyprophet_protein, pyprophet_peptide	UseGalaxy.eu	UseGalaxy.org.au, UseGalaxy.be, UseGalaxy.cz, UseGalaxy.no	0		3336	4714	8.183333333333334	0
Proteomics	Clinical Metaproteomics 2: Discovery	https://training.galaxyproject.org//topics/proteomics/tutorials/clinical-mp-2-discovery/tutorial.html		Heat map generation, Statistical calculation, Protein quantification, Filtering, Imputation, Standardisation and normalisation, Visualisation, Clustering, Principal component plotting, Formatting	2024-02-06	2025-08-10	5	True	False	True	True	Grouping1, msconvert, dbbuilder, fasta_cli, fasta_merge_files_and_filter_unique_sequences, search_gui, query_tabular, fasta2tab, Filter1, ident_params, tp_cat, Grep1, Cut1, Remove beginning1, peptide_shaker, maxquant, filter_tabular	UseGalaxy.org.au, UseGalaxy.cz, UseGalaxy.eu, UseGalaxy.org (Main)		0		378	493	22.783333333333335	0
Proteomics	Clinical Metaproteomics 1: Database-Generation	https://training.galaxyproject.org//topics/proteomics/tutorials/clinical-mp-1-database-generation/tutorial.html		Protein identification, de Novo sequencing, Target-Decoy, Expression analysis, Tag-based peptide identification	2024-02-06	2025-07-30	7	True	False	True	True	fasta_merge_files_and_filter_unique_sequences, dbbuilder, metanovo, uniprotxml_downloader	UseGalaxy.org.au, UseGalaxy.cz, UseGalaxy.eu	UseGalaxy.be, UseGalaxy.org (Main)	0		655	963	18.433333333333334	0
Proteomics	Peptide and Protein ID using SearchGUI and PeptideShaker	https://training.galaxyproject.org//topics/proteomics/tutorials/protein-id-sg-ps/tutorial.html			2017-06-12	2025-04-08	28	True	False	False	True	FileConverter, search_gui, Grep1, PeakPickerHiRes, peptide_shaker			0		3313	5206	5.933333333333334	0
Proteomics	Proteogenomics 2: Database Search	https://training.galaxyproject.org//topics/proteomics/tutorials/proteogenomics-dbsearch/tutorial.html		Peptide database search, Conversion	2018-11-20	2025-05-08	24	True	False	True	True	mz_to_sqlite, search_gui, ident_params, query_tabular, tab2fasta, peptide_shaker	UseGalaxy.org.au, UseGalaxy.be, UseGalaxy.eu, UseGalaxy.org (Main)	UseGalaxy.cz	0		1655	2430	11.866666666666667	0
Proteomics	metaQuantome 2: Function	https://training.galaxyproject.org//topics/proteomics/tutorials/metaquantome-function/tutorial.html	Proteomics, Proteogenomics, Metatranscriptomics, Microbial ecology, Metagenomics	Differential protein expression analysis, Functional clustering, Principal component visualisation, Indexing, Heat map generation, Filtering, Query and retrieval, Visualisation, Quantification, Statistical inference	2020-10-29	2024-03-15	14	True	False	False	True	metaquantome_expand, metaquantome_filter, metaquantome_viz, metaquantome_sample, metaquantome_db, metaquantome_stat	UseGalaxy.be, UseGalaxy.eu	UseGalaxy.org.au, UseGalaxy.cz, UseGalaxy.fr, UseGalaxy.no	0		443	615	15.016666666666667	0
Proteomics	Clinical Metaproteomics 3: Verification	https://training.galaxyproject.org//topics/proteomics/tutorials/clinical-mp-3-verification/tutorial.html			2024-02-06	2025-08-10	7	True	False	True	True	Grouping1, dbbuilder, collapse_dataset, fasta_merge_files_and_filter_unique_sequences, query_tabular, Filter1, pepquery2, tp_cat, Cut1, Remove beginning1, uniprotxml_downloader	UseGalaxy.cz, UseGalaxy.eu	UseGalaxy.org.au, UseGalaxy.org (Main)	0		224	290	27.533333333333335	0
Proteomics	Peptide and Protein Quantification via Stable Isotope Labelling (SIL)	https://training.galaxyproject.org//topics/proteomics/tutorials/protein-quant-sil/tutorial.html			2017-03-17	2025-04-08	32	True	False	False	True	PeptideIndexer, FileInfo, FalseDiscoveryRate, IDConflictResolver, IDPosteriorErrorProbability, FidoAdapter, TextExporter, XTandemAdapter, histogram_rpy, Summary_Statistics1, MultiplexResolver, FeatureFinderMultiplex, Grep1, IDScoreSwitcher, tp_tail_tool, ProteinQuantifier, IDMapper	UseGalaxy.eu	UseGalaxy.org.au, UseGalaxy.be, UseGalaxy.cz, UseGalaxy.no	0		1429	1970	8.966666666666667	0
Proteomics	metaQuantome 1: Data creation	https://training.galaxyproject.org//topics/proteomics/tutorials/metaquantome-data-creation/tutorial.html	Proteomics, Proteogenomics, Biodiversity, Taxonomy	Visualisation, Label-free quantification, Prediction and recognition, Filtering, Formatting	2020-10-16	2024-03-14	20	True	False	False	True	msconvert, regex1, tp_replace_in_column, unipept, tp_replace_in_line, search_gui, query_tabular, Filter1, Grep1, Cut1, Remove beginning1, peptide_shaker, flashlfq	UseGalaxy.eu	UseGalaxy.org.au, UseGalaxy.cz, UseGalaxy.no	0		921	1538	9.1	0
Proteomics	Proteogenomics 1: Database Creation	https://training.galaxyproject.org//topics/proteomics/tutorials/proteogenomics-dbcreation/tutorial.html		Variant calling, RNA-Seq analysis, Statistical calculation, Transcriptome assembly, Sequence alignment, Sequence annotation	2018-11-20	2025-05-08	29	True	False	True	True	gffcompare_to_bed, tp_replace_in_column, translate_bed, fasta_merge_files_and_filter_unique_sequences, gffcompare, cat_multi_datasets, fasta2tab, regexColumn1, stringtie, bed_to_protein_map, sqlite_to_tabular, hisat2, query_tabular, tab2fasta, custom_pro_db, freebayes, filter_tabular	UseGalaxy.org.au, UseGalaxy.be, UseGalaxy.org (Main)	UseGalaxy.cz	0		6196	10019	6.583333333333333	0
Proteomics	Neoantigen 3: PepQuery2 Verification	https://training.galaxyproject.org//topics/proteomics/tutorials/neoantigen-peptide-verification/tutorial.html		Filtering, Formatting	2025-01-14	2025-12-03	4	True	False	False	False	msconvert, pepquery2, query_tabular, tab2fasta, ncbi_blastp_wrapper	UseGalaxy.org.au, UseGalaxy.be, UseGalaxy.eu, UseGalaxy.org (Main)	UseGalaxy.cz	0		113	124	8.15	0
Proteomics	Neoantigen 1b: Non-Reference-Database-Generation	https://training.galaxyproject.org//topics/proteomics/tutorials/neoantigen-non-reference-database-generation/tutorial.html		Variant calling, RNA-Seq analysis, Statistical calculation, Transcriptome assembly, Sequence alignment, Sequence annotation	2025-01-14	2025-12-03	6	True	False	False	False	gffcompare_to_bed, translate_bed, column_regex_find_and_replace, fasta_merge_files_and_filter_unique_sequences, gffcompare, fasta2tab, CONVERTER_gz_to_uncompressed, regexColumn1, bed_to_protein_map, stringtie, hisat2, sqlite_to_tabular, tab2fasta, custom_pro_db, freebayes, concatenate			0		148	161	2.9833333333333334	0
Proteomics	Multiomics data analysis using MultiGSEA	https://training.galaxyproject.org//topics/proteomics/tutorials/multiGSEA-tutorial/tutorial.html		Pathway analysis, Gene-set enrichment analysis, Aggregation	2025-03-10	2025-03-11	2	True	False	False	True	Filter1, tp_grep_tool, multigsea	UseGalaxy.eu	UseGalaxy.org.au, UseGalaxy.cz	0		426	471	5.333333333333333	0
Proteomics	Single Cell Proteomics data analysis with bioconductor-scp	https://training.galaxyproject.org//topics/proteomics/tutorials/bioconductor-scp/tutorial.html		Visualisation, Expression analysis	2025-02-07	2025-02-10	2	True	False	False	False	Grouping1, bioconductor_scp	UseGalaxy.org.au, UseGalaxy.eu		0		348	415	5.333333333333333	0
Proteomics	metaQuantome 3: Taxonomy	https://training.galaxyproject.org//topics/proteomics/tutorials/metaquantome-taxonomy/tutorial.html	Proteomics, Proteogenomics, Metatranscriptomics, Microbial ecology, Metagenomics, Taxonomy	Differential protein expression analysis, Functional clustering, Principal component visualisation, Indexing, Heat map generation, Filtering, Query and retrieval, Visualisation, Quantification, Statistical inference	2020-10-29	2024-03-15	14	True	False	False	True	metaquantome_expand, metaquantome_filter, metaquantome_viz, metaquantome_sample, metaquantome_db, metaquantome_stat	UseGalaxy.be, UseGalaxy.eu	UseGalaxy.org.au, UseGalaxy.cz, UseGalaxy.fr, UseGalaxy.no	0		470	610	14.45	0
Proteomics	Neoantigen 4: Variant Annotation	https://training.galaxyproject.org//topics/proteomics/tutorials/neoantigen-variant-annotation/tutorial.html			2025-01-14	2025-12-03	5	True	False	False	False	select, Convert characters1, column_regex_find_and_replace, query_tabular, cut, regexColumn1, pep_pointer, tab2fasta			0		130	147	6.45	0
Proteomics	Proteogenomics 3: Novel peptide analysis	https://training.galaxyproject.org//topics/proteomics/tutorials/proteogenomics-novel-peptide-analysis/tutorial.html			2018-11-20	2025-05-15	20	True	False	True	True	pep_pointer, query_tabular, ncbi_blastp_wrapper, peptide_genomic_coordinate	UseGalaxy.org.au, UseGalaxy.be, UseGalaxy.eu, UseGalaxy.org (Main)	UseGalaxy.cz, UseGalaxy.no	0		1819	2606	12.85	0
Proteomics	Label-free data analysis using MaxQuant	https://training.galaxyproject.org//topics/proteomics/tutorials/maxquant-label-free/tutorial.html		Differential protein expression profiling, Heat map generation, Statistical calculation, Protein quantification, Imputation, Standardisation and normalisation, Visualisation, Clustering, Tag-based peptide identification, Principal component plotting, Spectrum calculation	2020-04-29	2025-05-21	14	True	False	False	True	tp_sort_header_tool, histogram_rpy, Add_a_column1, Filter1, Grep1, Cut1, msstats, maxquant	UseGalaxy.eu, UseGalaxy.no, UseGalaxy.org (Main)	UseGalaxy.org.au, UseGalaxy.cz	0		20427	29734	3.683333333333333	0
Proteomics	Introduction to proteomics, protein identification, quantification and statistical modelling	https://training.galaxyproject.org//topics/proteomics/tutorials/introduction/slides.html			2017-12-01	2024-08-08	3	False	True	True	False			UseGalaxy.eu, UseGalaxy.org, UseGalaxy.org.au, UseGalaxy.fr	0		3551519	8588959	2.15	0
Proteomics	Label-free versus Labelled - How to Choose Your Quantitation Method	https://training.galaxyproject.org//topics/proteomics/tutorials/labelfree-vs-labelled/tutorial.html			2017-03-17	2025-05-27	18	True	False	False	False			UseGalaxy.eu, UseGalaxy.org, UseGalaxy.org.au, UseGalaxy.fr	0		7779	12500	2.5166666666666666	0
Sequence analysis	Screening assembled genomes for contamination using NCBI FCS	https://training.galaxyproject.org//topics/sequence-analysis/tutorials/ncbi-fcs/tutorial.html		Sequence assembly validation, Sequence contamination filtering, Sequence trimming	2024-04-16	2024-04-16	2	True	False	False	True	ncbi_fcs_adaptor, ncbi_fcs_gx	UseGalaxy.be, UseGalaxy.eu, UseGalaxy.org (Main)	UseGalaxy.cz	0		2094	2821	3.8666666666666667	0
Sequence analysis	Primer and primer scheme design for pan-specific detection and sequencing of viral pathogens across genotypes	https://training.galaxyproject.org//topics/sequence-analysis/tutorials/viral_primer_design/tutorial.html		Multiple sequence alignment, Sequence alignment analysis, Sequence alignment, Sequence analysis, PCR primer design, Global alignment, Local alignment	2025-03-20	2025-11-20	3	True	False	False	True	varvamp, ncbi_makeblastdb, split_file_to_collection, EMBOSS: degapseq20, rbc_mafft, fasta_compute_length	UseGalaxy.be, UseGalaxy.eu		0		805	928	2.8	0
Sequence analysis	Quality Control	https://training.galaxyproject.org//topics/sequence-analysis/tutorials/quality-control/tutorial.html		Statistical calculation, Box-Whisker plot plotting, Validation, Read pre-processing, Primer removal, Sequence trimming, Scatter plot plotting, Sequence composition calculation, Sequencing quality control	2016-10-04	2026-03-09	48	True	True	True	True	nanoplot, fastqc, multiqc, fastqe, pycoqc, cutadapt	UseGalaxy.org.au, UseGalaxy.eu, UseGalaxy.org (Main)	Galaxy@AuBi, UseGalaxy.cz, UseGalaxy.fr	0		3663145	8790006	9.1	0
Sequence analysis	Clean and manage Sanger sequences from raw files to aligned consensus	https://training.galaxyproject.org//topics/sequence-analysis/tutorials/Manage_AB1_Sanger/tutorial.html		Taxonomic classification, Phylogenetic analysis, Sequence file editing, Sequence clustering, Data handling, Visualisation, DNA barcoding, Sequencing quality control, Sequence read processing, Demultiplexing	2024-01-08	2024-03-05	2	True	False	False	True	qiime_align_seqs, fastq_groomer, collection_element_identifiers, mothur_merge_files, aligned_to_consensus, cshl_fastx_reverse_complement, seqtk_mergepe, tab2fasta, fastq_to_tabular, regex1, filter_by_fasta_ids, mothur_degap_seqs, cshl_fastq_to_fasta, __SORTLIST__, __FILTER_FROM_FILE__, unzip, seqtk_trimfq, fastq_masker_by_quality, ncbi_blastn_wrapper, ab1_fastq_converter	UseGalaxy.cz, UseGalaxy.eu, UseGalaxy.fr		0		3694	4615	6.533333333333333	0
Sequence analysis	Mapping	https://training.galaxyproject.org//topics/sequence-analysis/tutorials/mapping/tutorial.html	Mapping	Statistical calculation, Validation, Sequence alignment analysis, Read mapping, Read pre-processing, Primer removal, Sequence trimming, Data handling, Sequence composition calculation, Sequencing quality control, Genome visualisation	2016-10-04	2026-03-09	45	True	True	True	True	bowtie2, samtools_stats, fastqc, multiqc, jbrowse, __FLATTEN__, bamFilter, trim_galore	UseGalaxy.org.au, UseGalaxy.eu, UseGalaxy.org (Main)	Galaxy@AuBi, GalaxyTrakr, UseGalaxy.be, UseGalaxy.cz, UseGalaxy.fr, UseGalaxy.no	0		3619426	8701860	9.533333333333333	0
Sequence analysis	Quality and contamination control in bacterial isolate using Illumina MiSeq Data	https://training.galaxyproject.org//topics/sequence-analysis/tutorials/quality-contamination-control/tutorial.html	Whole genome sequencing, Genomics, Microbiology, Microbial ecology	Taxonomic classification, Statistical calculation, Cross-assembly, Expression analysis, Read mapping, Sequence contamination filtering, Visualisation, Sequencing quality control	2024-07-15	2025-12-18	5	True	False	True	True	est_abundance, upload1, recentrifuge, fastp, kraken2, falco	GalaxyTrakr, UseGalaxy.be, UseGalaxy.cz, UseGalaxy.eu, UseGalaxy.fr, UseGalaxy.org (Main)		0		1907	2562	10.65	0
Single Cell	Pre-processing of 10X Single-Cell ATAC-seq Datasets	https://training.galaxyproject.org//topics/single-cell/tutorials/scatac-preprocessing-tenx/tutorial.html		Mapping, Statistical calculation, Expression profile clustering, Gene regulatory network analysis, Imputation, Generation, Read mapping, Visualisation, Principal component visualisation, Sequence composition calculation, Genome indexing, Differential gene expression analysis, Sequence alignment, Enrichment analysis, Sequencing quality control, Peak calling	2023-04-24	2025-10-16	10	True	False	False	True	episcanpy_build_matrix, anndata_inspect, episcanpy_preprocess, scanpy_plot, fastqc, bedtools_sortbed, sinto_barcode, bwa_mem, sinto_fragments, tp_sorted_uniq, falco, macs2_callpeak	UseGalaxy.org.au, UseGalaxy.org (Main)	UseGalaxy.be, UseGalaxy.cz	0		6319	7421	2.3333333333333335	0
Single Cell	Pre-processing of Single-Cell RNA Data	https://training.galaxyproject.org//topics/single-cell/tutorials/scrna-preprocessing/tutorial.html		Read summarisation, Sequence alignment analysis, Validation, Sequencing quality control, Sequence alignment, RNA-Seq quantification, Data handling	2019-02-22	2025-04-08	5	True	True	False	True	umi_tools_extract, samtools_stats, featurecounts, rna_star, umi_tools_count, multiqc, collection_column_join, __FLATTEN__, bamFilter, tp_sed_tool	UseGalaxy.eu	UseGalaxy.org.au, UseGalaxy.be, UseGalaxy.cz, UseGalaxy.fr, UseGalaxy.no, UseGalaxy.org (Main)	0		3558195	8597618	8.55	0
Single Cell	Pseudobulk Analysis with Decoupler and EdgeR	https://training.galaxyproject.org//topics/single-cell/tutorials/pseudobulk-analysis/tutorial.html		Principal component visualisation, Expression profile clustering, Differential gene expression analysis	2025-02-12	2025-05-09	8	True	False	True	True	anndata_inspect, edger, scanpy_filter, tp_replace_in_column, tp_awk_tool, tp_replace_in_line, volcanoplot, __EXTRACT_DATASET__, column_remove_by_header, decoupler_pseudobulk, anndata_manipulate	UseGalaxy.org.au, UseGalaxy.be, UseGalaxy.eu, UseGalaxy.fr, UseGalaxy.org (Main)	UseGalaxy.cz	0		1996	2278	2.3333333333333335	0
Single Cell	Converting between common single cell data formats	https://training.galaxyproject.org//topics/single-cell/tutorials/scrna-data-ingest/tutorial.html		Loading, Community profiling	2024-02-13	2025-03-11	4	True	False	False	True	anndata_inspect, dropletutils_read_10x, join1, monocle3_create, datamash_transpose, tp_cut_tool, anndata_ops, seurat_read10x, Filter1, regexColumn1, sceasy_convert, dropletutils, scanpy_filter_cells, Cut1, tp_tail_tool, fastq_to_tabular, tabular_to_fastq		UseGalaxy.org (Main)	0		2875	3386	3.816666666666667	0
Single Cell	Single-cell quality control with scater	https://training.galaxyproject.org//topics/single-cell/tutorials/scrna-scater-qc/tutorial.html		Sequence visualisation, Sequencing quality control, Read pre-processing	2019-10-23	2025-02-14	6	True	False	False	True	scater_filter, scater_plot_pca, scater_create_qcmetric_ready_sce, scater_plot_dist_scatter	UseGalaxy.org.au, UseGalaxy.be, UseGalaxy.eu, UseGalaxy.no	UseGalaxy.cz	0		739	831	5.716666666666667	0
Single Cell	Bulk RNA Deconvolution with MuSiC	https://training.galaxyproject.org//topics/single-cell/tutorials/bulk-music/tutorial.html			2022-02-11	2025-02-14	10	True	False	True	True	music_inspect_eset, music_deconvolution, music_construct_eset	UseGalaxy.org.au, UseGalaxy.be, UseGalaxy.cz, UseGalaxy.eu, UseGalaxy.org (Main)		0		4237	5312	3.9166666666666665	0
Single Cell	GO Enrichment Analysis on Single-Cell RNA-Seq Data	https://training.galaxyproject.org//topics/single-cell/tutorials/GO-enrichment/tutorial.html		Gene-set enrichment analysis	2024-09-17	2025-04-08	8	True	True	False	True	Cut1, tp_split_on_column, gprofiler_gost, goenrichment	UseGalaxy.be, UseGalaxy.cz, UseGalaxy.eu, UseGalaxy.no, UseGalaxy.org (Main)		0		1451361	2763148	5.45	0
Single Cell	Pre-processing of 10X Single-Cell RNA Datasets	https://training.galaxyproject.org//topics/single-cell/tutorials/scrna-preprocessing-tenx/tutorial.html		Loading, Validation, Community profiling, Sequence alignment, Sequencing quality control	2019-09-11	2025-04-29	13	True	False	True	True	multiqc, dropletutils, rna_starsolo	UseGalaxy.org.au, UseGalaxy.cz, UseGalaxy.eu, UseGalaxy.org (Main)	UseGalaxy.be, UseGalaxy.fr, UseGalaxy.no	0		13329	17218	5.75	0
Single Cell	Generating a single cell matrix using Alevin	https://training.galaxyproject.org//topics/single-cell/tutorials/scrna-case_alevin/tutorial.html		Gene expression analysis, RNA-Seq quantification, Sequence composition calculation	2021-03-03	2025-11-18	25	True	False	True	True	anndata_inspect, dropletutils_read_10x, join1, _dropletBarcodePlot, _salmon_kallisto_mtx_to_10x, dropletutils_empty_drops, _ensembl_gtf2gene_list, sceasy_convert, alevin, Cut1, anndata_manipulate	UseGalaxy.org.au, UseGalaxy.eu, UseGalaxy.fr, UseGalaxy.org (Main)		0		3670	5569	10.683333333333334	0
Single Cell	An introduction to scRNA-seq data analysis	https://training.galaxyproject.org//topics/single-cell/tutorials/scrna-intro/slides.html			2021-01-29	2025-02-13	8	False	True	True	False			UseGalaxy.eu, UseGalaxy.org, UseGalaxy.org.au, UseGalaxy.fr	0		3519133	8474917	2.15	0
Single Cell	Generating a single cell matrix using Alevin and combining datasets (bash + R)	https://training.galaxyproject.org//topics/single-cell/tutorials/alevin-commandline/tutorial.html			2023-12-08	2025-04-22	5	True	False	False	False			UseGalaxy.eu, UseGalaxy.org, UseGalaxy.org.au, UseGalaxy.fr	0		710	957	9.65	0
