Genome Annotation	Essential genes detection with Transposon insertion sequencing	https://training.galaxyproject.org//topics/genome-annotation/tutorials/tnseq/tutorial.html	Genomics, Microbiology, Sequence analysis, Mobile genetic elements	Sequence trimming, Transposon prediction, Primer removal, Read pre-processing	2019-07-02	2024-03-18	12	True	True	False	True	gff_to_prot, cutadapt, bowtie_wrapper, tp_easyjoin_tool, deeptools_bam_coverage, Filter1, __EXTRACT_DATASET__, bg_find_subsequences, Add_a_column1, transit_gumbel, tp_sort_header_tool, Cut1	UseGalaxy.org.au, UseGalaxy.be, UseGalaxy.no	UseGalaxy.cz, UseGalaxy.eu	0		3926930	9252504	5.75	0
Genome Annotation	Genome annotation with Maker	https://training.galaxyproject.org//topics/genome-annotation/tutorials/annotation-with-maker/tutorial.html		Homology-based gene prediction, Ab-initio gene prediction, Sequence annotation, Genome visualisation, Sequence assembly validation, Genome annotation, Gene prediction, Operation	2018-09-24	2024-02-29	14	True	False	False	True	busco, jbrowse, jcvi_gff_stats, fasta-stats, maker, snap_training, maker_map_ids, augustus_training, gffread	UseGalaxy.org.au, UseGalaxy.be, UseGalaxy.eu, UseGalaxy.no, UseGalaxy.org (Main)	UseGalaxy.cz	0		14411	25162	4.4	0
Genome Annotation	Functional annotation of protein sequences	https://training.galaxyproject.org//topics/genome-annotation/tutorials/functional/tutorial.html	Function analysis, Protein sites, features and motifs	Sequence alignment analysis, Fold recognition, Query and retrieval, Sequence motif recognition, Genome annotation, Homology-based gene prediction, Information extraction, Protein feature detection	2022-07-20	2025-06-03	12	True	False	False	True	interproscan, eggnog_mapper, bg_diamond, ncbi_blastp_wrapper	UseGalaxy.org.au, UseGalaxy.be, UseGalaxy.cz, UseGalaxy.eu, UseGalaxy.fr, UseGalaxy.org (Main)	UseGalaxy.no	0		5166	6768	6.216666666666667	0
Genome Annotation	Refining Genome Annotations with Apollo (eukaryotes)	https://training.galaxyproject.org//topics/genome-annotation/tutorials/apollo-euk/tutorial.html	Genomics	Genome visualisation	2022-08-22	2025-06-03	16	True	False	False	False	iframe, create_or_update, jbrowse	UseGalaxy.no	UseGalaxy.be, UseGalaxy.cz, UseGalaxy.eu	0		1741	2538	9.85	0
Genome Annotation	Long non-coding RNAs (lncRNAs) annotation with FEELnc	https://training.galaxyproject.org//topics/genome-annotation/tutorials/lncrna/tutorial.html		Sequence annotation, Classification, Transcriptome assembly, Annotation, RNA-Seq analysis	2022-09-23	2024-09-18	11	True	False	True	True	tp_cat, feelnc, Extract_features1, gffread, stringtie		UseGalaxy.org.au, UseGalaxy.cz, UseGalaxy.eu, UseGalaxy.fr, UseGalaxy.no, UseGalaxy.org (Main)	0		2275	3009	10.033333333333333	0
Genome Annotation	CRISPR screen analysis	https://training.galaxyproject.org//topics/genome-annotation/tutorials/crispr-screen/tutorial.html		Statistical calculation, Genetic variation analysis, Sequencing quality control, Primer removal, Sequence composition calculation, Sequence trimming, Validation, Read pre-processing	2021-10-15	2024-08-08	12	True	True	True	True	cutadapt, mageck_count, mageck_test, mageck_mle, fastqc, tp_awk_tool, volcanoplot, multiqc	UseGalaxy.org.au, UseGalaxy.eu, UseGalaxy.org (Main)	UseGalaxy.be, UseGalaxy.cz, UseGalaxy.fr, UseGalaxy.no	0		3528155	7875276	4.716666666666667	0
Variant Analysis	Microbial Variant Calling	https://training.galaxyproject.org//topics/variant-analysis/tutorials/microbial-variants/tutorial.html	Genomics, Sequence assembly, DNA polymorphism, Microbiology, Sequence analysis, Genetic variation	Variant calling, Phylogenetic tree visualisation, Genome visualisation, Phylogenetic tree generation	2018-02-26	2026-01-23	25	True	False	False	True	snippy, jbrowse	UseGalaxy.be, UseGalaxy.eu, UseGalaxy.org (Main)	GalaxyTrakr, UseGalaxy.org.au, UseGalaxy.cz, UseGalaxy.fr, UseGalaxy.no	0		16380	25775	5.033333333333333	0
Visualisation	Genomic Data Visualisation with JBrowse	https://training.galaxyproject.org//topics/visualisation/tutorials/jbrowse/tutorial.html		Genome visualisation	2020-01-10	2026-04-29	17	True	True	False	False	jbrowse	Galaxy@AuBi, UseGalaxy.org.au, UseGalaxy.be, UseGalaxy.eu, UseGalaxy.fr, UseGalaxy.no, UseGalaxy.org (Main)	Galaxy@Pasteur, GalaxyTrakr, MISSISSIPPI, UseGalaxy.cz	0		3923676	9244287	10.366666666666667	0
Visualisation	Genomic Data Visualisation with JBrowse2	https://training.galaxyproject.org//topics/visualisation/tutorials/jbrowse2/tutorial.html		Pathway visualisation, Structure visualisation, Genome visualisation	2026-04-29	2026-04-29	1	True	False	False	False	jbrowse2	UseGalaxy.be, UseGalaxy.cz, UseGalaxy.eu, UseGalaxy.fr, UseGalaxy.org (Main)	Galaxy@Pasteur, UseGalaxy.org.au	0		257	262	3.783333333333333	0
Imaging	Nucleoli segmentation and feature extraction using CellProfiler	https://training.galaxyproject.org//topics/imaging/tutorials/tutorial-CP/tutorial.html		Parsing, Quantification, Image analysis	2020-07-01	2025-11-26	12	True	True	False	True	cp_enhance_or_suppress_features, cp_display_data_on_image, cp_measure_granularity, cp_export_to_spreadsheet, cp_measure_image_area_occupied, cp_identify_primary_objects, cp_measure_texture, cp_measure_image_quality, cp_convert_objects_to_image, cp_save_images, cp_measure_image_intensity, cp_mask_image, cp_relate_objects, idr_download_by_ids, cp_image_math, cp_cellprofiler, cp_measure_object_size_shape, cp_common, cp_measure_object_intensity, cp_gray_to_color	UseGalaxy.be, UseGalaxy.eu	Galaxy@AuBi, UseGalaxy.org.au, UseGalaxy.cz, UseGalaxy.fr, UseGalaxy.no, UseGalaxy.org (Main)	0		3922249	9242970	5.566666666666666	0
Imaging	Overview of the Galaxy OMERO-suite - Upload images and metadata in OMERO using Galaxy	https://training.galaxyproject.org//topics/imaging/tutorials/omero-suite/tutorial.html		Image analysis	2024-12-04	2026-04-28	9	True	False	False	True	split_file_to_collection, omero_filter, tp_replace_in_line, omero_import, param_value_from_file, omero_roi_import, omero_get_id, omero_get_value, Convert characters1, omero_metadata_import	UseGalaxy.eu	UseGalaxy.org (Main)	0		357	473	8.116666666666667	0
Imaging	Quantitative Analysis of Histological Staining Using Color Deconvolution	https://training.galaxyproject.org//topics/imaging/tutorials/stain-quantification-color-deconvolution/tutorial.html		Image annotation, Image analysis, Visualisation, Data handling	2026-06-15	2026-06-21	2	True	False	False	True	collapse_dataset, collection_element_identifiers, tp_text_file_with_recurring_lines, Show tail1, imagej2_analyze_particles_binary, __EXTRACT_DATASET__, ip_histogram_equalization, ip_imageinfo, ip_color_deconvolution, Show beginning1, cat1, ip_threshold, Add_a_column1, Paste1, ip_2d_feature_extraction, tp_cat, Grep1, ip_split_image, tp_sed_tool, Cut1			0		38	52	19.266666666666666	0
Imaging	Voronoi segmentation	https://training.galaxyproject.org//topics/imaging/tutorials/voronoi-segmentation/tutorial.html		Image annotation, Image analysis, Visualisation, Data handling	2025-05-13	2026-02-20	8	True	False	False	True	ip_filter_standard, ip_count_objects, unzip, ip_2d_feature_extraction, ip_binary_to_labelimage, image_math, ip_overlay_images, ip_convertimage, colorize_labels, ip_threshold, voronoi_tessellation, repeat_channels, ip_imageinfo	UseGalaxy.be, UseGalaxy.eu	UseGalaxy.org (Main)	0		520	705	6.833333333333333	0
Imaging	Segmentation of Anatomical Structures in Medical 3-D Images	https://training.galaxyproject.org//topics/imaging/tutorials/dicom-anatomical-3d/tutorial.html		Image annotation, Image analysis, Visualisation, Data handling	2026-02-26	2026-02-26	1	True	False	False	True	query_tabular, ip_binary_to_labelimage, ip_2d_filter_segmentation_by_features, tp_sort_header_tool, Convert characters1, tp_text_file_with_recurring_lines, unzip, clip_image, ridge_filter_skimage, highdicom_dicom2tiff, param_value_from_file, ip_threshold, Add_a_column1, ip_2d_feature_extraction, ip_concat_channels, tp_replace_in_line, ip_scale_image, libcarna_render, compose_text_param, add_line_to_file	UseGalaxy.eu	UseGalaxy.org (Main)	0		133	152	9.916666666666666	0
Imaging	Analyse HeLa fluorescence siRNA screen	https://training.galaxyproject.org//topics/imaging/tutorials/hela-screen-analysis/tutorial.html		Image annotation, Image analysis, Visualisation, Data handling	2019-08-13	2026-01-18	16	True	False	False	True	ip_filter_standard, unzip, ip_2d_feature_extraction, ip_binary_to_labelimage, ip_2d_filter_segmentation_by_features, collapse_dataset, ip_threshold	UseGalaxy.org.au, UseGalaxy.be, UseGalaxy.cz, UseGalaxy.eu	UseGalaxy.no, UseGalaxy.org (Main)	0		880	1131	14.416666666666666	0
Imaging	Content Tracking and Verification in Galaxy Workflows with ISCC-SUM	https://training.galaxyproject.org//topics/imaging/tutorials/iscc-suite/tutorial.html		Image analysis	2026-02-14	2026-02-16	2	True	False	False	True	iscc_sum_similarity, iscc_sum_verify, param_value_from_file, __EXTRACT_DATASET__, ip_threshold, iscc_sum, ip_split_image	UseGalaxy.eu, UseGalaxy.org (Main)		0		48	48	31.266666666666666	0
Imaging	End-to-End Tissue Microarray Image Analysis with Galaxy-ME	https://training.galaxyproject.org//topics/imaging/tutorials/multiplex-tissue-imaging-TMA/tutorial.html			2023-02-14	2025-11-26	9	True	False	False	True	celesta, rename_tiff_channels, squidpy_spatial, mesmer, basic_illumination, unet_coreograph, quantification, vitessce_spatial, ip_convertimage, palom, gate_finder, ashlar, scanpy_compute_graph, scimap_phenotyping, scimap_mcmicro_to_anndata			0		1703	2268	4.766666666666667	0
Imaging	Object tracking using CellProfiler	https://training.galaxyproject.org//topics/imaging/tutorials/object-tracking-using-cell-profiler/tutorial.html		Parsing, Quantification, Image analysis	2021-03-17	2026-06-23	12	True	False	False	True	unzip, cp_overlay_outlines, cp_save_images, cp_cellprofiler, cp_measure_object_intensity, cp_export_to_spreadsheet, cp_measure_object_size_shape, cp_common, cp_track_objects, cp_identify_primary_objects, cp_tile, cp_color_to_gray	UseGalaxy.org.au, UseGalaxy.be, UseGalaxy.eu	UseGalaxy.cz, UseGalaxy.org (Main)	0		2332	2878	4.466666666666667	0
Imaging	Where to start with bioimage analysis in Galaxy	https://training.galaxyproject.org//topics/imaging/tutorials/where-to-start-bioimaging-galaxy/tutorial.html		Parsing, Visualisation, Image annotation, Quantification, Image analysis, Data handling, Formatting	2026-02-17	2026-02-19	4	True	False	False	False	ip_filter_standard, bf2raw, bioimage_inference, interactive_tool_cellpose, cp_overlay_outlines, interactive_tool_qupath, cellpose, ip_convertimage, ip_histogram_equalization, interactive_tool_cellprofiler, cellposesam, ip_imageinfo, ip_color_deconvolution, interactive_tool_ilastik, ip_threshold, libcarna_render, ip_overlay_images, idr_download_by_ids, ip_split_image			0		245	300	6.25	0
Imaging	Introduction to Image Analysis using Galaxy	https://training.galaxyproject.org//topics/imaging/tutorials/imaging-introduction/tutorial.html		Image annotation, Image analysis, Visualisation, Data handling	2019-08-13	2026-01-18	18	True	False	False	True	ip_filter_standard, ip_count_objects, unzip, ip_binary_to_labelimage, ip_overlay_images, ip_threshold, ip_histogram_equalization, ip_imageinfo	UseGalaxy.org.au, UseGalaxy.be, UseGalaxy.cz, UseGalaxy.eu	UseGalaxy.org (Main)	0		2971	4087	8.916666666666666	0
Imaging	Quantification of single-molecule RNA fluorescence in situ hybridization (smFISH) in yeast cell lines	https://training.galaxyproject.org//topics/imaging/tutorials/2D-spot-detection/tutorial.html		Image annotation, Image analysis, Visualisation, Data handling	2025-03-20	2025-11-26	5	True	False	False	True	unzip, ip_binary_to_labelimage, ip_overlay_images, idr_download_by_ids, __EXTRACT_DATASET__, ip_spot_detection_2d, ip_points_to_label, ip_histogram_equalization	UseGalaxy.be, UseGalaxy.cz, UseGalaxy.eu	UseGalaxy.org (Main)	0		306	363	6.516666666666667	0
Imaging	Using BioImage.IO models for image analysis in Galaxy	https://training.galaxyproject.org//topics/imaging/tutorials/process-image-bioimageio/tutorial.html		Image analysis	2025-04-09	2026-06-23	10	True	False	False	True	ip_binary_to_labelimage, bioimage_inference, image_math, ip_overlay_images, __EXTRACT_DATASET__, ip_threshold, ip_split_image	UseGalaxy.be, UseGalaxy.eu		0		296	343	7.233333333333333	0
Imaging	Execute a BiaPy workflow in Galaxy	https://training.galaxyproject.org//topics/imaging/tutorials/biapy/tutorial.html		Image analysis	2026-02-11	2026-02-17	2	True	False	False	True	ip_binary_to_labelimage, libcarna_render, ip_overlay_images, ip_convertimage, __EXTRACT_DATASET__, biapy	UseGalaxy.eu		0		61	69	19.883333333333333	0
Imaging	Parameter tuning and optimization - Evaluating nuclei segmentation with Galaxy	https://training.galaxyproject.org//topics/imaging/tutorials/parameter-tuning/tutorial.html		Image annotation, Image analysis, Visualisation, Data handling	2025-04-28	2026-01-21	4	True	False	False	True	ip_filter_standard, ip_segmetrics, collapse_dataset, param_value_from_file, ip_threshold, ip_histogram_equalization, tp_split_on_column	UseGalaxy.be	UseGalaxy.cz, UseGalaxy.eu, UseGalaxy.org (Main)	0		168	183	11.733333333333333	0
Imaging	Quantification of electrophoresis gel bands using QuPath and Galaxy imaging tools	https://training.galaxyproject.org//topics/imaging/tutorials/electrophoresis-gel-bands-image-analysis/tutorial.html		Image annotation, Image analysis, Visualisation, Data handling	2025-08-11	2026-06-01	4	True	False	False	True	interactive_tool_qupath, ip_2d_feature_extraction, graphicsmagick_image_convert, __EXTRACT_DATASET__, ip_points_to_label, ip_split_image, ip_imageinfo	UseGalaxy.eu		0		535	621	4.016666666666667	0
Imaging	Training Custom YOLO Models for Segmentation of Bioimages	https://training.galaxyproject.org//topics/imaging/tutorials/yolo-segmentation-training/tutorial.html		Data handling, Image analysis, Visualisation, Image annotation	2025-07-25	2025-11-26	7	True	False	False	True	unzip, json2yolosegment, yolo_training, graphicsmagick_image_convert, ip_histogram_equalization, interactive_tool_anylabeling	UseGalaxy.eu		0		462	534	2.933333333333333	0
Imaging	Tracking of mitochondria and capturing mitoflashes	https://training.galaxyproject.org//topics/imaging/tutorials/detection-of-mitoflashes/tutorial.html		Image analysis	2024-11-20	2025-11-26	5	True	False	False	True	ip_points_association_nn, ip_spot_detection_2d, ip_curve_fitting	UseGalaxy.be, UseGalaxy.cz, UseGalaxy.eu, UseGalaxy.org (Main)		0		282	319	7.5	0
Introduction to Galaxy Analyses	From peaks to genes	https://training.galaxyproject.org//topics/introduction/tutorials/galaxy-intro-peaks2genes/tutorial.html			2016-03-29	2026-03-30	69	True	False	True	True	gops_intersect_1, Grouping1, upload1, tp_replace_in_column, get_flanks1, CONVERTER_interval_to_bed_0, Add_a_column1, tp_sort_header_tool, Cut1, tp_tail_tool	UseGalaxy.be, UseGalaxy.eu, UseGalaxy.fr, UseGalaxy.org (Main)	UseGalaxy.cz, UseGalaxy.no	0		21413	34983	10.55	0
Introduction to Galaxy Analyses	Introduction to Genomics and Galaxy	https://training.galaxyproject.org//topics/introduction/tutorials/galaxy-intro-strands/tutorial.html			2017-10-18	2026-05-17	43	True	False	True	True	gops_intersect_1, tp_cat, cat1, Filter1, tp_sort_header_tool, gene2exon1	UseGalaxy.org.au, UseGalaxy.be, UseGalaxy.cz, UseGalaxy.eu, UseGalaxy.fr, UseGalaxy.org (Main)	MISSISSIPPI, UseGalaxy.no	0		21299	33240	9.633333333333333	0
Introduction to Galaxy Analyses	NGS data logistics	https://training.galaxyproject.org//topics/introduction/tutorials/galaxy-intro-ngs-data-managment/tutorial.html		Sequencing quality control, Sequence contamination filtering, Data handling, Genome indexing, Sequence alignment, Generation, Formatting, SNP detection, Validation, Read mapping	2017-02-22	2026-01-06	40	True	False	True	True	bwa, samtools_stats, snpSift_extractFields, bwa_mem2, snpEff, Filter1, picard_MarkDuplicates, snpeff_sars_cov_2, fasterq_dump, collapse_dataset, fastp, samtools_view, lofreq_viterbi, snpEff_build_gb, bwa_mem, multiqc, lofreq_indelqual, lofreq_call	UseGalaxy.org.au, UseGalaxy.eu, UseGalaxy.fr, UseGalaxy.org (Main)	MISSISSIPPI, UseGalaxy.be, UseGalaxy.cz	0		21666	36440	9.433333333333334	0
Introduction to Galaxy Analyses	Data Manipulation Olympics	https://training.galaxyproject.org//topics/introduction/tutorials/data-manipulation-olympics/tutorial.html			2022-07-20	2026-04-13	16	True	False	False	True	{{version_join}}, {{version_compute}}, {{version_split}}, Remove beginning1, {{version_unique}}, Filter1, Count1, {{version_count}}, {{version_paste}}, join1, {{version_remove_columns_by_header}}, tp_sort_header_tool, {{version_replace_text_line}}, {{version_wc}}, {{version_cut_columns}}, {{version_cut_advanced}}, {{version_replace_text_column}}, {{version_select_first}}, {{version_cat}}, {{version_datamash}}, {{version_sort}}, datamash_ops, {{version_remove_beginning}}, Show beginning1, tabular_to_csv, Grouping1, upload1, cat1, Add_a_column1, tp_sorted_uniq, tp_cat, {{version_filter}}, regexColumn1, tp_split_on_column, wc_gnu, Cut1			0		6960	9990	11.35	0
Introduction to Galaxy Analyses	How to reproduce published Galaxy analyses	https://training.galaxyproject.org//topics/introduction/tutorials/galaxy-reproduce/tutorial.html		Visualisation	2021-08-25	2024-10-15	12	True	False	False	True	csv_to_tabular, Cut1, Grouping1, Remove beginning1, upload1, ggplot2_point, datamash_ops, tp_sorted_uniq	Galaxy@AuBi, UseGalaxy.be, UseGalaxy.eu, UseGalaxy.org (Main)	MISSISSIPPI, UseGalaxy.cz, UseGalaxy.fr, UseGalaxy.no	0		2422	3201	16.616666666666667	0
Introduction to Galaxy Analyses	Introduction to Galaxy	https://training.galaxyproject.org//topics/introduction/tutorials/introduction/slides.html			2016-09-30	2025-09-23	6	False	True	False	False			UseGalaxy.eu, UseGalaxy.org, UseGalaxy.org.au, UseGalaxy.fr, UseGalaxy.ca	0		3918211	9237153	2.0833333333333335	0
Introduction to Galaxy Analyses	Options for using Galaxy	https://training.galaxyproject.org//topics/introduction/tutorials/options-for-using-galaxy/slides.html			2017-05-24	2022-09-23	14	False	True	True	False			UseGalaxy.eu, UseGalaxy.org, UseGalaxy.org.au, UseGalaxy.fr, UseGalaxy.ca	0		3918211	9237153	2.0833333333333335	0
Introduction to Galaxy Analyses	Introduction to the Dataverse Integration in Galaxy	https://training.galaxyproject.org//topics/introduction/tutorials/galaxy-intro-dataverse/tutorial.html			2026-06-25	2026-06-25	1	True	False	False	False			UseGalaxy.eu, UseGalaxy.org, UseGalaxy.org.au, UseGalaxy.fr, UseGalaxy.ca	0		6	6	22.8	0
Introduction to Galaxy Analyses	Upload data to Galaxy	https://training.galaxyproject.org//topics/introduction/tutorials/dummy/tutorial.html			2022-09-23	2023-11-09	5	True	False	False	False			UseGalaxy.eu, UseGalaxy.org, UseGalaxy.org.au, UseGalaxy.fr, UseGalaxy.ca	0		551	626	10.133333333333333	0
Introduction to Galaxy Analyses	Best Practices for Citing Galaxy	https://training.galaxyproject.org//topics/introduction/tutorials/galaxy-cite/tutorial.html			2025-11-06	2026-02-24	2	True	False	False	False			UseGalaxy.eu, UseGalaxy.org, UseGalaxy.org.au, UseGalaxy.fr, UseGalaxy.ca	0		325	350	6.9	0
Introduction to Galaxy Analyses	IGV Introduction	https://training.galaxyproject.org//topics/introduction/tutorials/igv-introduction/tutorial.html			2016-03-30	2023-02-17	11	True	False	False	False			UseGalaxy.eu, UseGalaxy.org, UseGalaxy.org.au, UseGalaxy.fr, UseGalaxy.ca	0		8661	12051	5.366666666666666	0
Introduction to Galaxy Analyses	A short introduction to Galaxy	https://training.galaxyproject.org//topics/introduction/tutorials/galaxy-intro-short/tutorial.html		Statistical calculation, Sequencing quality control, Sequence composition calculation	2018-08-27	2026-01-23	44	True	True	True	True	cshl_fastq_quality_filter, fastqc	UseGalaxy.be, UseGalaxy.eu, UseGalaxy.org (Main)	Galaxy@Pasteur, GalaxyTrakr, MISSISSIPPI, UseGalaxy.org.au, UseGalaxy.cz, UseGalaxy.fr, UseGalaxy.no	0		3979453	9332052	12.2	0
Introduction to Galaxy Analyses	Galaxy Basics for genomics	https://training.galaxyproject.org//topics/introduction/tutorials/galaxy-intro-101/tutorial.html		Mapping	2016-12-19	2025-04-22	68	True	False	True	True	bedtools_intersectbed, upload1, tp_head_tool, datamash_ops, tp_sort_header_tool, comp1	UseGalaxy.cz, UseGalaxy.eu, UseGalaxy.fr, UseGalaxy.org (Main)	Galaxy@AuBi, GalaxyTrakr, MISSISSIPPI, UseGalaxy.be, UseGalaxy.no	0		55529	88307	8.55	0
Introduction to Galaxy Analyses	Galaxy Basics for everyone	https://training.galaxyproject.org//topics/introduction/tutorials/galaxy-intro-101-everyone/tutorial.html		Visualisation	2019-11-14	2025-11-06	35	True	False	True	True	csv_to_tabular, Cut1, Grouping1, Remove beginning1, upload1, ggplot2_point, datamash_ops, tp_sorted_uniq	UseGalaxy.be, UseGalaxy.eu, UseGalaxy.fr, UseGalaxy.no, UseGalaxy.org (Main)	Galaxy@AuBi, MISSISSIPPI, UseGalaxy.cz	0		27819	43512	10.05	0
Introduction to Galaxy Analyses	Introduction to Galaxy as an RDM platform	https://training.galaxyproject.org//topics/introduction/tutorials/galaxy-intro-rdm/tutorial.html		Visualisation	2026-03-19	2026-03-20	2	True	False	False	True	unzip, column_remove_by_header, export_remote, ggplot2_histogram, Add_a_column1, Summary_Statistics1, imagemagick_image_montage	UseGalaxy.be, UseGalaxy.eu	UseGalaxy.org.au, UseGalaxy.cz, UseGalaxy.org (Main)	0		308	391	12.316666666666666	0
Introduction to Galaxy Analyses	Very Short Introductions: QC	https://training.galaxyproject.org//topics/introduction/tutorials/vsi_qc/tutorial.html		Sequence contamination filtering, Sequencing quality control, Validation	2024-03-26	2024-06-25	4	True	False	False	False	fastp, multiqc	Galaxy@AuBi, UseGalaxy.org.au, UseGalaxy.be, UseGalaxy.cz, UseGalaxy.eu, UseGalaxy.fr, UseGalaxy.org (Main)	GalaxyTrakr, MISSISSIPPI, UseGalaxy.no	0		430	501	6.066666666666666	0
Materials Science	Finding the muon stopping site with pymuon-suite in Galaxy	https://training.galaxyproject.org//topics/materials-science/tutorials/muon-stopping-sites-muairss-uep/tutorial.html			2024-01-22	2024-06-14	2	True	False	True	True	pm_muairss_read, pm_uep_opt	UseGalaxy.cz, UseGalaxy.eu	UseGalaxy.be	0		393	486	6.4	0
Metabolomics	Mass spectrometry: LC-MS analysis	https://training.galaxyproject.org//topics/metabolomics/tutorials/lcms/tutorial.html		Peak detection, Chromatogram visualisation, Data filtering, Chromatographic alignment, Label-free quantification, Mass spectrum visualisation, Validation	2019-07-02	2025-09-21	13	True	False	False	True	quality_metrics, xcms_merge, Batch_correction, msnbase_readmsdata, wsdl_hmdb, xcms_plot_chromatogram, abims_xcms_xcmsSet, abims_xcms_retcor, abims_CAMERA_annotateDiffreport, generic_filter, xcms_export_samplemetadata, abims_xcms_group, abims_xcms_fillPeaks, Univariate		UseGalaxy.org.au, UseGalaxy.cz, UseGalaxy.eu, UseGalaxy.fr, UseGalaxy.no	0		13999	22515	3.6333333333333333	0
Metabolomics	Mass spectrometry imaging: Examining the spatial distribution of analytes	https://training.galaxyproject.org//topics/metabolomics/tutorials/msi-analyte-distribution/tutorial.html			2019-02-21	2024-10-15	18	True	False	False	True	cardinal_data_exporter, cardinal_spectra_plots, cardinal_filtering, cardinal_quality_report, Filter1, cardinal_mz_images	UseGalaxy.eu	UseGalaxy.org.au, UseGalaxy.be, UseGalaxy.cz, UseGalaxy.fr, UseGalaxy.no	0		3388	4723	9.0	0
Metabolomics	Molecular formula assignment and mass recalibration with MFAssignR package	https://training.galaxyproject.org//topics/metabolomics/tutorials/mfassignr/tutorial.html		Visualisation, Mass spectra calibration, Deisotoping, Annotation	2025-05-19	2025-05-19	1	True	False	False	True	mfassignr_mfassign, mfassignr_kmdnoise, mfassignr_mfassignCHO, mfassignr_recal, mfassignr_snplot, mfassignr_isofiltr, mfassignr_histnoise, mfassignr_recallist, mfassignr_findRecalSeries			0		316	372	4.4	0
Metabolomics	Mass spectrometry: GC-MS data processing (with XCMS, RAMClustR, RIAssigner, and matchms)	https://training.galaxyproject.org//topics/metabolomics/tutorials/gc_ms_with_xcms/tutorial.html		Standardisation and normalisation, Filtering, Data filtering, Correlation, Spectral library search, Label-free quantification, Mass spectrum visualisation, Peak detection, Imputation, Format validation, Chromatogram visualisation, Chromatographic alignment, Clustering, Formatting, Validation	2023-05-08	2023-11-09	5	True	False	False	True	ramclustr, ramclustr_define_experiment, xcms_merge, matchms_similarity, riassigner, msnbase_readmsdata, msconvert, abims_xcms_xcmsSet, abims_xcms_retcor, matchms_filtering, matchms_formatter, waveica, abims_xcms_group, abims_xcms_fillPeaks	UseGalaxy.eu	UseGalaxy.org.au, UseGalaxy.cz, UseGalaxy.fr	0		3256	4123	3.966666666666667	0
Metabolomics	Predicting EI+ mass spectra with QCxMS	https://training.galaxyproject.org//topics/metabolomics/tutorials/qcxms-predictions/tutorial.html			2024-10-01	2024-10-01	1	True	True	False	True	__FILTER_FAILED_DATASETS__, split_file_to_collection, tp_cat, qcxms_production_run, tp_cut_tool, ctb_im_conformers, param_value_from_file, qcxms_neutral_run, qcxms_getres, openbabel_compound_convert, xtb_molecular_optimization	UseGalaxy.eu	UseGalaxy.org.au, UseGalaxy.be	0		1797351	3348574	5.816666666666666	0
Metabolomics	Mass spectrometry imaging: Finding differential analytes	https://training.galaxyproject.org//topics/metabolomics/tutorials/msi-finding-nglycans/tutorial.html			2019-04-13	2023-11-09	9	True	False	False	True	join_files_on_column_fuzzy, cardinal_segmentations, maldi_quant_preprocessing, cardinal_quality_report, Filter1, Grep1, cardinal_combine, Summary_Statistics1, cardinal_mz_images, cardinal_preprocessing, maldi_quant_peak_detection, cardinal_classification	UseGalaxy.be, UseGalaxy.eu	UseGalaxy.org.au, UseGalaxy.cz, UseGalaxy.fr, UseGalaxy.no	0		2225	3112	8.8	0
