Topic	Title	Link	EDAM topic	EDAM operation	Creation	Last modification	Version	Tutorial	Slides	Video	Workflows	Tools	Servers with precise tool versions	Servers with tool but different versions	Feedback number	Feedback mean note	Visitors	Page views	Visit duration	Video views
Galaxy Server administration	Galaxy on the Cloud	https://training.galaxyproject.org//topics/admin/tutorials/cloudbursting/slides.html			2019-01-31	2024-12-19	7	False	True	False	False				0		3084956	7914236	2.3333333333333335	0
Galaxy Server administration	Galaxy Tool Management with Ephemeris	https://training.galaxyproject.org//topics/admin/tutorials/tool-management/tutorial.html			2019-01-27	2025-04-03	39	True	True	True	False				0		3086767	7916817	5.716666666666667	0
Galaxy Server administration	Galaxy Installation with Ansible	https://training.galaxyproject.org//topics/admin/tutorials/ansible-galaxy/tutorial.html	Database management, Informatics, Data management		2019-01-28	2025-11-28	108	True	True	True	False				0		3110582	7961837	4.066666666666666	0
Galaxy Server administration	Connecting Galaxy to a compute cluster	https://training.galaxyproject.org//topics/admin/tutorials/connect-to-compute-cluster/tutorial.html			2018-01-07	2025-11-24	65	True	True	True	False				0		3089053	7921280	5.583333333333333	0
Galaxy Server administration	Galaxy Monitoring with gxadmin	https://training.galaxyproject.org//topics/admin/tutorials/gxadmin/tutorial.html			2019-01-28	2025-11-13	27	True	True	True	False				0		3085859	7915645	5.083333333333333	0
Galaxy Server administration	Reference Data with CVMFS	https://training.galaxyproject.org//topics/admin/tutorials/cvmfs/tutorial.html			2019-01-27	2025-11-24	54	True	True	True	False				0		3087128	7917438	5.466666666666667	0
Galaxy Server administration	Galaxy Monitoring with Telegraf and Grafana	https://training.galaxyproject.org//topics/admin/tutorials/monitoring/tutorial.html			2019-01-31	2025-11-24	54	True	True	True	False				0		3087856	7919596	3.2	0
Galaxy Server administration	User, Role, Group, Quota, and Authentication managment	https://training.galaxyproject.org//topics/admin/tutorials/users-groups-quotas/slides.html			2018-01-07	2024-08-08	19	False	True	True	False				0		3084956	7914238	2.3333333333333335	0
Galaxy Server administration	Distributed Object Storage	https://training.galaxyproject.org//topics/admin/tutorials/object-store/tutorial.html			2019-01-28	2025-03-24	28	True	True	True	False				0		3086319	7916370	3.9	0
Galaxy Server administration	Galaxy Interactive Tools	https://training.galaxyproject.org//topics/admin/tutorials/interactive-tools/tutorial.html			2020-02-27	2025-11-27	28	True	True	True	False				0		3087292	7917741	4.966666666666667	0
Galaxy Server administration	Gearing towards production	https://training.galaxyproject.org//topics/admin/tutorials/production/slides.html			2019-01-28	2025-11-20	11	False	True	True	False				0		3084956	7914239	2.3333333333333335	0
Galaxy Server administration	Data Libraries	https://training.galaxyproject.org//topics/admin/tutorials/data-library/tutorial.html			2021-01-14	2025-11-24	35	True	True	True	False				0		3068798	7851151	4.35	0
Galaxy Server administration	Server Maintenance: Cleanup, Backup, and Restoration	https://training.galaxyproject.org//topics/admin/tutorials/backup-cleanup/tutorial.html	Database management, Informatics, Data management		2019-01-31	2025-11-24	10	True	True	True	False				0		3085556	7915036	10.933333333333334	0
Galaxy Server administration	Running Jobs on Remote Resources with Pulsar	https://training.galaxyproject.org//topics/admin/tutorials/pulsar/tutorial.html			2019-01-28	2025-11-25	58	True	True	True	False				0		3087538	7918475	5.183333333333334	0
Galaxy Server administration	Ansible	https://training.galaxyproject.org//topics/admin/tutorials/ansible/tutorial.html			2018-07-11	2024-08-08	48	True	True	True	False				0		3091440	7925802	4.016666666666667	0
Galaxy Server administration	Docker and Galaxy	https://training.galaxyproject.org//topics/admin/tutorials/galaxy-docker/slides.html			2016-09-29	2022-10-18	16	False	True	False	False				0		3084956	7914239	2.3333333333333335	0
Galaxy Server administration	uWSGI	https://training.galaxyproject.org//topics/admin/tutorials/uwsgi/slides.html			2019-01-28	2022-03-01	9	False	True	False	False				0		3084956	7914239	2.3333333333333335	0
Galaxy Server administration	Galaxy from an administrator's point of view	https://training.galaxyproject.org//topics/admin/tutorials/introduction/slides.html			2017-06-12	2024-06-25	6	False	True	False	False				0		3084956	7914239	2.3333333333333335	0
Galaxy Server administration	Galaxy Troubleshooting	https://training.galaxyproject.org//topics/admin/tutorials/troubleshooting/slides.html			2019-01-28	2024-06-25	15	False	True	False	False				0		3084956	7914239	2.3333333333333335	0
Galaxy Server administration	External Authentication	https://training.galaxyproject.org//topics/admin/tutorials/external-auth/tutorial.html			2019-01-28	2022-10-18	14	True	True	False	False				0		3085667	7915352	3.1166666666666667	0
Galaxy Server administration	Galactic Database	https://training.galaxyproject.org//topics/admin/tutorials/database/slides.html			2019-01-28	2025-11-20	6	False	True	True	False				0		3084956	7914239	2.3333333333333335	0
Galaxy Server administration	Controlling Galaxy with systemd or Supervisor	https://training.galaxyproject.org//topics/admin/tutorials/systemd-supervisor/slides.html			2019-01-28	2023-04-16	5	False	True	True	False				0		3084956	7914239	2.3333333333333335	0
Galaxy Server administration	Galaxy Monitoring	https://training.galaxyproject.org//topics/admin/tutorials/general-monitoring/slides.html			2019-04-26	2022-03-01	5	False	True	False	False				0		3084956	7914239	2.3333333333333335	0
Galaxy Server administration	Galaxy Administrator Time Burden and Technology Usage	https://training.galaxyproject.org//topics/admin/tutorials/poll-ssa/slides.html			2024-07-10	2024-07-10	1	False	True	False	False				0		1077991	2318324	1.95	0
Galaxy Server administration	Server: Other	https://training.galaxyproject.org//topics/admin/tutorials/stuff/slides.html			2018-01-07	2023-02-17	6	False	True	False	False				0		3084956	7914239	2.3333333333333335	0
Galaxy Server administration	Reference Data with Data Managers	https://training.galaxyproject.org//topics/admin/tutorials/reference-genomes/tutorial.html		Genome indexing, Read mapping, Sequence alignment, Generation	2019-01-28	2023-04-21	7	True	True	False	False	bwa_mem_index_builder_data_manager, data_manager_fetch_genome_all_fasta_dbkey, bwa			0		3085540	7914998	6.516666666666667	0
Galaxy Server administration	Advanced customisation of a Galaxy instance	https://training.galaxyproject.org//topics/admin/tutorials/advanced-galaxy-customisation/slides.html			2017-06-27	2023-04-17	18	False	True	False	False				0		3084956	7914239	2.3333333333333335	0
Galaxy Server administration	Setting up Celery Workers for Galaxy	https://training.galaxyproject.org//topics/admin/tutorials/celery/tutorial.html			2022-07-16	2025-11-24	19	True	True	False	False				0		2229773	5093745	3.716666666666667	0
Galaxy Server administration	Empathy	https://training.galaxyproject.org//topics/admin/tutorials/empathy/slides.html			2019-01-31	2021-04-06	4	False	True	False	False				0		3084956	7914239	2.3333333333333335	0
Galaxy Server administration	Deploying a Beacon v1 in Galaxy	https://training.galaxyproject.org//topics/admin/tutorials/beacon/tutorial.html			2023-04-16	2025-11-22	7	True	False	False	False				0		153	171	1.9	0
Galaxy Server administration	Configuring the Onedata connectors (remotes, Object Store, BYOS, BYOD)	https://training.galaxyproject.org//topics/admin/tutorials/onedata-configuration/tutorial.html			2025-03-24	2025-04-08	2	True	False	False	False				0		53	58	3.2333333333333334	0
Galaxy Server administration	Enable upload via FTP	https://training.galaxyproject.org//topics/admin/tutorials/ftp/tutorial.html			2021-06-18	2025-11-24	28	True	False	False	False				0		1255	1716	1.6166666666666667	0
Galaxy Server administration	Upgrading Galaxy	https://training.galaxyproject.org//topics/admin/tutorials/upgrading/tutorial.html			2021-06-08	2024-11-25	10	True	False	True	False				0		727	1107	2.8833333333333333	0
Galaxy Server administration	Create a subdomain for your community on UseGalaxy.eu	https://training.galaxyproject.org//topics/admin/tutorials/subdomain/tutorial.html			2024-11-27	2024-12-13	2	True	False	False	False				0		46	52	2.566666666666667	0
Galaxy Server administration	Performant Uploads with TUS	https://training.galaxyproject.org//topics/admin/tutorials/tus/tutorial.html			2022-03-01	2025-11-22	22	True	False	True	False				0		885	1291	5.45	0
Galaxy Server administration	Monitoring Galaxy and Pulsar with Sentry	https://training.galaxyproject.org//topics/admin/tutorials/sentry/tutorial.html			2023-04-19	2025-11-25	12	True	False	False	False				0		231	279	1.4166666666666667	0
Galaxy Server administration	Galaxy Monitoring with Reports	https://training.galaxyproject.org//topics/admin/tutorials/reports/tutorial.html			2019-01-31	2025-11-24	47	True	False	False	False				0		506	673	2.7	0
Galaxy Server administration	How I learned to stop worrying and love the systemd	https://training.galaxyproject.org//topics/admin/tutorials/stop-worrying-love-systemd/tutorial.html			2022-07-06	2023-09-28	3	True	False	False	False				0		689	792	0.6166666666666667	0
Galaxy Server administration	Training Infrastructure as a Service (TIaaS)	https://training.galaxyproject.org//topics/admin/tutorials/tiaas/tutorial.html			2020-02-12	2025-11-24	45	True	False	True	False				0		557	742	3.183333333333333	0
Galaxy Server administration	Mapping Jobs to Destinations using TPV	https://training.galaxyproject.org//topics/admin/tutorials/job-destinations/tutorial.html			2021-01-17	2025-11-24	43	True	False	True	False				0		1705	2661	3.35	0
Galaxy Server administration	Customizing the look of Galaxy (Manual)	https://training.galaxyproject.org//topics/admin/tutorials/customization-manual/tutorial.html			2023-04-16	2025-04-08	2	True	False	False	False				0		205	244	2.033333333333333	0
Galaxy Server administration	Customizing the look of Galaxy	https://training.galaxyproject.org//topics/admin/tutorials/customization/tutorial.html			2023-04-16	2025-11-22	8	True	False	False	False				0		601	733	4.333333333333333	0
Galaxy Server administration	Alternative Celery Deployment for Galaxy	https://training.galaxyproject.org//topics/admin/tutorials/celeryless/tutorial.html			2024-11-07	2024-11-07	1	True	False	False	False				0		67	73	2.5833333333333335	0
Galaxy Server administration	Use Apptainer containers for running Galaxy jobs	https://training.galaxyproject.org//topics/admin/tutorials/apptainer/tutorial.html			2021-01-08	2025-11-24	19	True	False	True	False				0		1098	1396	2.6	0
Galaxy Server administration	Galaxy Database schema	https://training.galaxyproject.org//topics/admin/tutorials/database-schema/tutorial.html			2016-07-20	2025-04-08	23	True	False	False	False				0		3046	4973	1.0666666666666667	0
Galaxy Server administration	Adding file-sources to Galaxy	https://training.galaxyproject.org//topics/admin/tutorials/file_sources/tutorial.html			2025-01-20	2025-01-20	1	True	False	False	False				0		59	77	2.6666666666666665	0
Galaxy Server administration	Automation with Jenkins	https://training.galaxyproject.org//topics/admin/tutorials/jenkins/tutorial.html			2019-08-06	2022-10-18	10	True	False	False	False				0		8325	16474	0.7166666666666667	0
Galaxy Server administration	Reference Data with CVMFS without Ansible	https://training.galaxyproject.org//topics/admin/tutorials/cvmfs-manual/tutorial.html			2020-06-17	2023-11-23	9	True	False	False	False				0		406	543	2.3833333333333333	0
Galaxy Server administration	Galaxy Installation on Kubernetes	https://training.galaxyproject.org//topics/admin/tutorials/k8s-deploying-galaxy/tutorial.html			2019-07-02	2024-06-30	7	True	False	False	False				0		1620	2671	2.2666666666666666	0
Galaxy Server administration	Managing Galaxy on Kubernetes	https://training.galaxyproject.org//topics/admin/tutorials/k8s-managing-galaxy/tutorial.html			2019-07-02	2024-12-19	7	True	False	False	False				0		677	987	2.1	0
Galaxy Server administration	Galaxy usage on SURF Research Cloud	https://training.galaxyproject.org//topics/admin/tutorials/surf-research-cloud-galaxy/tutorial.html	Informatics, Data management		2024-12-18	2025-08-05	4	True	False	False	False				0		80	99	1.6333333333333333	0
Galaxy Server administration	Pulsar usage on SURF Research Cloud	https://training.galaxyproject.org//topics/admin/tutorials/surf-research-cloud-pulsar/tutorial.html	Informatics, Data management		2024-12-18	2024-12-19	3	True	False	False	False				0		78	86	0.4666666666666667	0
Galaxy Server administration	Deploying Wireguard for private mesh networking	https://training.galaxyproject.org//topics/admin/tutorials/wireguard/tutorial.html			2022-09-21	2024-12-19	4	True	False	False	False				0		1110	1264	0.3333333333333333	0
Galaxy Server administration	Deploying Tailscale/Headscale for private mesh networking	https://training.galaxyproject.org//topics/admin/tutorials/wireguard-headscale/tutorial.html	Data security, Software engineering		2022-09-21	2024-12-19	4	True	False	False	False				0		2379	3062	0.43333333333333335	0
Galaxy Server administration	Deploying a compute cluster in OpenStack via Terraform	https://training.galaxyproject.org//topics/admin/tutorials/terraform/tutorial.html			2018-10-27	2024-12-19	15	True	True	False	False				0		3101014	7944424	3.283333333333333	0
Image analysis using Deep Learning	Contribute to the BioImage.IO models	https://training.galaxyproject.org//topics/ai4life/tutorials/contribute-materials/slides.html			2023-05-18	2023-05-24	3	False	True	True	False			UseGalaxy.eu, UseGalaxy.org, UseGalaxy.org.au, UseGalaxy.fr	0		1723771	3806092	2.1166666666666667	0
Image analysis using Deep Learning	Welcome to the BioImage Model Zoo	https://training.galaxyproject.org//topics/ai4life/tutorials/welcome-bioimageio/slides.html			2023-05-11	2023-05-18	3	False	True	True	False			UseGalaxy.eu, UseGalaxy.org, UseGalaxy.org.au, UseGalaxy.fr	0		1738054	3838468	2.1166666666666667	0
Image analysis using Deep Learning	BioImage Model Zoo: Advanced models in one-click	https://training.galaxyproject.org//topics/ai4life/tutorials/getting-started/slides.html			2023-04-18	2023-05-24	4	False	True	True	False			UseGalaxy.eu, UseGalaxy.org, UseGalaxy.org.au, UseGalaxy.fr	0		1785004	3941864	2.1166666666666667	0
Assembly	An Introduction to Genome Assembly	https://training.galaxyproject.org//topics/assembly/tutorials/general-introduction/tutorial.html		Visualisation, Sequence composition calculation, De-novo assembly, Formatting, Sequencing quality control, Sequence assembly validation, Statistical calculation, Validation	2017-05-23	2024-09-12	29	True	True	True	True	velvetg, quast, multiqc, fastqc, velveth, fastq_paired_end_interlacer	Galaxy@AuBi, UseGalaxy.org (Main), UseGalaxy.org.au	UseGalaxy.be, UseGalaxy.cz, UseGalaxy.eu, UseGalaxy.fr	0		3120934	7973108	5.183333333333334	0
Assembly	Genome Assembly Quality Control	https://training.galaxyproject.org//topics/assembly/tutorials/assembly-quality-control/tutorial.html	Biodiversity, Sequence assembly, Data quality management	Phasing, Visualisation, Sequence assembly validation, Scaffolding, Genome assembly, k-mer counting, De-novo assembly	2022-08-26	2025-06-04	6	True	True	False	True	busco, quast, meryl, merqury, chromeister	UseGalaxy.eu, UseGalaxy.fr, UseGalaxy.org.au	UseGalaxy.cz	0		2184411	4960582	4.383333333333334	0
Assembly	Genome Assembly of MRSA from Oxford Nanopore MinION data (and optionally Illumina data)	https://training.galaxyproject.org//topics/assembly/tutorials/mrsa-nanopore/tutorial.html	Sequence assembly, Whole genome sequencing, Public health and epidemiology, Genomics, Microbiology, Antimicrobial resistance	Sequence contamination filtering, Filtering, Mapping assembly, Visualisation, Scatter plot plotting, Genome assembly, Read mapping, Cross-assembly, Sequence composition calculation, De-novo assembly, Sequencing quality control, Sequence assembly validation, Sequence alignment, Box-Whisker plot plotting, Sequence assembly visualisation, Statistical calculation, Sequencing error detection	2021-03-24	2024-11-29	15	True	False	False	True	upload1, flye, filtlong, quast, nanoplot, bandage_image, polypolish, porechop, fastqc, CONVERTER_bz2_to_uncompressed, fastp, bwa_mem2	UseGalaxy.eu	UseGalaxy.cz, UseGalaxy.fr	0		10547	15790	3.4	0
Assembly	Large genome assembly and polishing	https://training.galaxyproject.org//topics/assembly/tutorials/largegenome/tutorial.html	Genomics, Sequence assembly, Biodiversity	Base-calling, Mapping assembly, Genome assembly, Cross-assembly, De-novo assembly, Sequence assembly validation, Sequence assembly, Box-Whisker plot plotting, Sequence assembly visualisation, Variant calling, Pairwise sequence alignment, Sequence contamination filtering, Visualisation, Scatter plot plotting, Sequence composition calculation, Sequencing quality control, Statistical calculation, Validation	2023-03-06	2025-06-04	14	True	False	True	True	minimap2, flye, busco, barchart_gnuplot, fasta-stats, genomescope, quast, medaka_consensus_pipeline, nanoplot, bandage_image, meryl, multiqc, fastqc, fastp, racon	UseGalaxy.eu, UseGalaxy.org.au	UseGalaxy.cz	0		7524	9755	1.9833333333333334	0
Assembly	Hybrid genome assembly - Nanopore and Illumina	https://training.galaxyproject.org//topics/assembly/tutorials/hybrid_denovo_assembly/tutorial.html		Read mapping, Mapping assembly, Visualisation, Generation, Genome assembly, Read alignment, Cross-assembly, De-novo assembly, Genome indexing, Sequencing quality control, Sequence assembly validation, Sequence alignment, Analysis, Aggregation, Sequence assembly, Validation	2025-11-03	2025-11-06	2	True	False	False	True	flye, busco, quast, bwa_mem, multiqc, pilon, unicycler	UseGalaxy.cz, UseGalaxy.eu, UseGalaxy.fr, UseGalaxy.org (Main), UseGalaxy.org.au	GalaxyTrakr, UseGalaxy.be, UseGalaxy.no	0		182	234	2.066666666666667	0
Assembly	ERGA post-assembly QC	https://training.galaxyproject.org//topics/assembly/tutorials/ERGA-post-assembly-QC/tutorial.html	Genomics, Sequence assembly, Biodiversity	Sequence alignment analysis, Data deposition, Visualisation, Genome assembly, Pairwise sequence alignment, De-novo assembly, Sequence trimming, Phasing, Sequence assembly validation, Scaffolding, k-mer counting, Data parsing, Sequence alignment, Sequence assembly visualisation, Genotyping, Data handling	2023-06-23	2025-06-04	8	True	False	True	True	busco, samtools_stats, merqury, collapse_dataset, interactive_tool_blobtoolkit, smudgeplot, gfastats, CONVERTER_gz_to_uncompressed, minimap2, blobtoolkit, bellerophon, tp_find_and_replace, meryl, bwa_mem2, pretext_map, genomescope, __EXTRACT_DATASET__, bandage_image, bg_diamond, pretext_snapshot	UseGalaxy.eu	UseGalaxy.org (Main), UseGalaxy.org.au	0		2009	2606	2.05	0
Assembly	Chloroplast genome assembly	https://training.galaxyproject.org//topics/assembly/tutorials/chloroplast-assembly/tutorial.html		Read mapping, Mapping assembly, Generation, Genome assembly, Cross-assembly, De-novo assembly, Genome indexing, Sequence alignment, Sequence assembly, Box-Whisker plot plotting, Sequence assembly visualisation, Scatter plot plotting, Read alignment, Gene prediction, Genome visualisation, Genome annotation, Analysis, Coding region prediction	2020-12-04	2025-05-15	21	True	False	True	True	upload1, flye, fasta-stats, bwa_mem, jbrowse, bandage_image, nanoplot, pilon, prokka, bandage_info	UseGalaxy.eu	UseGalaxy.be, UseGalaxy.cz, UseGalaxy.fr, UseGalaxy.no, UseGalaxy.org (Main)	0		8113	12618	2.8	0
Assembly	Assembly of the mitochondrial genome from PacBio HiFi reads	https://training.galaxyproject.org//topics/assembly/tutorials/mitochondrion-assembly/tutorial.html	Genomics, Sequence assembly, Biodiversity, Mitochondria		2024-09-03	2025-06-04	4	True	False	True	True	mitohifi, compress_file	UseGalaxy.cz, UseGalaxy.eu, UseGalaxy.org (Main), UseGalaxy.org.au		0		906	1098	1.8333333333333333	0
Assembly	Decontamination of a genome assembly	https://training.galaxyproject.org//topics/assembly/tutorials/assembly-decontamination/tutorial.html	Genomics, Sequence assembly, Biodiversity	Data handling, Taxonomic classification	2024-09-04	2025-06-04	5	True	False	True	True	tp_cat, kraken2, ncbi_blastn_wrapper, Cut1, ncbi_dustmasker_wrapper, parse_mito_blast, tp_sed_tool, gfastats, Filter1	UseGalaxy.eu, UseGalaxy.org (Main), UseGalaxy.org.au	UseGalaxy.cz	0		1693	2093	2.433333333333333	0
Assembly	Genome Assembly of a bacterial genome (MRSA) sequenced using Illumina MiSeq Data	https://training.galaxyproject.org//topics/assembly/tutorials/mrsa-illumina/tutorial.html	Sequence assembly, Whole genome sequencing, Public health and epidemiology, Genomics, Microbiology	Sequence contamination filtering, Read mapping, Visualisation, Genome assembly, Sequence composition calculation, Sequencing quality control, Sequence assembly validation, Sequence assembly visualisation, Statistical calculation	2021-03-24	2025-11-18	17	True	False	True	True	upload1, quast, bandage_image, fastqc, fastp, bandage_info, falco, shovill	UseGalaxy.be, UseGalaxy.cz, UseGalaxy.eu, UseGalaxy.fr, UseGalaxy.org (Main)		0		10291	15797	3.55	0
Assembly	Assembly of metagenomic sequencing data	https://training.galaxyproject.org//topics/assembly/tutorials/metagenomics-assembly/tutorial.html	Metagenomics, Sequence assembly	Sequence alignment analysis, Read mapping, Genome assembly, Sequence trimming, Sequence file editing, Sequence assembly validation, Sequence assembly visualisation, Variant calling, Statistical calculation, Sequence contamination filtering, Visualisation, Read pre-processing, Sequence composition calculation, Formatting, Sequencing quality control, Primer removal, Local alignment, Data handling	2025-12-07	2025-12-07	0	True	False	True	True	coverm_contig, random_lines1, bamtools, tp_cat, cutadapt, ngsutils_bam_filter, quast, megahit, bg_uniq, filter_tabular, bandage_image, collection_column_join, megahit_contig2fastg, metaspades, bowtie2, fastqc, bandage_info, seqtk_subseq		UseGalaxy.cz, UseGalaxy.eu	0		1	1	0.0	0
Assembly	De Bruijn Graph Assembly	https://training.galaxyproject.org//topics/assembly/tutorials/debruijn-graph-assembly/tutorial.html		Sequence assembly, Optimisation and refinement, Genome assembly	2017-05-24	2024-02-01	25	True	True	False	True	velvetoptimiser, spades, fasta-stats	Galaxy@AuBi, UseGalaxy.be, UseGalaxy.eu, UseGalaxy.no, UseGalaxy.org (Main), UseGalaxy.org.au	UseGalaxy.cz	0		3091565	7924727	5.016666666666667	0
Assembly	Unicycler Assembly	https://training.galaxyproject.org//topics/assembly/tutorials/unicycler-assembly/tutorial.html	Sequence assembly, Genomics, Microbiology	Visualisation, Genome assembly, Gene prediction, Sequence composition calculation, Sequencing quality control, Sequence assembly validation, Genome annotation, Aggregation, Coding region prediction, Statistical calculation, Validation	2017-10-11	2025-05-15	24	True	True	False	True	quast, multiqc, fastqc, prokka, unicycler	UseGalaxy.eu, UseGalaxy.org (Main), UseGalaxy.org.au	Galaxy@AuBi, GalaxyTrakr, MISSISSIPPI, UseGalaxy.be, UseGalaxy.cz, UseGalaxy.fr, UseGalaxy.no	0		3097980	7936496	4.4	0
Assembly	Unicycler assembly of SARS-CoV-2 genome with preprocessing to remove human genome reads	https://training.galaxyproject.org//topics/assembly/tutorials/assembly-with-preprocessing/tutorial.html		Sequence contamination filtering, Read mapping, Data handling, Scatter plot plotting, Genome assembly, Sequence file editing, Sequencing quality control, Aggregation, Box-Whisker plot plotting, Sequence assembly visualisation, Pairwise sequence alignment, Validation	2020-04-21	2025-05-15	14	True	True	True	True	minimap2, samtools_stats, fasta_filter_by_length, seqtk_sample, nanoplot, bandage_image, collapse_dataset, samtools_view, multiqc, __ZIP_COLLECTION__, fasterq_dump, bowtie2, samtools_fastx, fastp, bandage_info, unicycler	UseGalaxy.eu, UseGalaxy.org.au	Galaxy@AuBi, MISSISSIPPI, UseGalaxy.be, UseGalaxy.cz, UseGalaxy.fr, UseGalaxy.no, UseGalaxy.org (Main)	0		3090975	7924278	5.533333333333333	0
Assembly	Vertebrate genome assembly using HiFi, Bionano and Hi-C data - Step by Step	https://training.galaxyproject.org//topics/assembly/tutorials/vgp_genome_assembly/tutorial.html	Genomics, Sequence assembly, Biodiversity	Visualisation, Genome assembly, Read pre-processing, Pairwise sequence alignment, De-novo assembly, Sequence trimming, Phasing, Sequence assembly validation, Scaffolding, k-mer counting, Read binning, Primer removal, Sequence alignment, Mapping, Data handling	2021-06-04	2025-06-04	57	True	False	True	True	busco, sort1, collection_column_join, merqury, hifiasm, salsa, collapse_dataset, cat1, gfastats, tp_cut_tool, purge_dups, minimap2, cutadapt, quast, bellerophon, tp_find_and_replace, meryl, yahs, gfa_to_fa, bwa_mem2, pretext_map, tp_grep_tool, genomescope, Add_a_column1, Convert characters1, pretext_snapshot, bedtools_bamtobed, bionano_scaffold		UseGalaxy.cz	0		16063	24186	1.9666666666666666	0
Assembly	Genome assembly using PacBio data	https://training.galaxyproject.org//topics/assembly/tutorials/hifi-assembly/tutorial.html	Genomics, Sequence assembly, Biodiversity	Mapping assembly, Sequence assembly validation, Visualisation, Genome assembly, Cross-assembly, De-novo assembly	2021-11-29	2025-06-04	2	True	False	False	True	flye, busco, fasta-stats, quast, hifiasm, gfa_to_fa	UseGalaxy.eu, UseGalaxy.fr, UseGalaxy.org (Main), UseGalaxy.org.au	UseGalaxy.cz, UseGalaxy.no	0		885	1039	1.5333333333333334	0
