Topic	Title	Link	EDAM topic	EDAM operation	Creation	Last modification	Version	Tutorial	Slides	Video	Workflows	Tools	Servers with precise tool versions	Servers with tool but different versions	Feedback number	Feedback mean note	Visitors	Page views	Visit duration	Video views
Galaxy Server administration	Galaxy on the Cloud	https://training.galaxyproject.org//topics/admin/tutorials/cloudbursting/slides.html			2019-01-31	2024-12-19	7	False	True	False	False				0		3518342	8525259	2.15	0
Galaxy Server administration	Reference Data with Data Managers	https://training.galaxyproject.org//topics/admin/tutorials/reference-genomes/tutorial.html		Generation, Sequence alignment, Genome indexing, Read mapping	2019-01-28	2026-01-23	7	True	True	False	False	bwa, data_manager_fetch_genome_all_fasta_dbkey, bwa_mem_index_builder_data_manager			0		3519004	8526104	15.866666666666667	0
Galaxy Server administration	Reference Data with CVMFS	https://training.galaxyproject.org//topics/admin/tutorials/cvmfs/tutorial.html			2019-01-27	2026-01-23	55	True	True	True	False				0		3520628	8528590	11.4	0
Galaxy Server administration	Server: Other	https://training.galaxyproject.org//topics/admin/tutorials/stuff/slides.html			2018-01-07	2023-02-17	6	False	True	False	False				0		3518342	8525259	2.15	0
Galaxy Server administration	Empathy	https://training.galaxyproject.org//topics/admin/tutorials/empathy/slides.html			2019-01-31	2021-04-06	4	False	True	False	False				0		3518342	8525259	2.15	0
Galaxy Server administration	External Authentication	https://training.galaxyproject.org//topics/admin/tutorials/external-auth/tutorial.html			2019-01-28	2022-10-18	14	True	True	False	False				0		3519082	8526402	8.666666666666666	0
Galaxy Server administration	Running Jobs on Remote Resources with Pulsar	https://training.galaxyproject.org//topics/admin/tutorials/pulsar/tutorial.html			2019-01-28	2026-01-23	59	True	True	True	False				0		3521000	8529584	9.683333333333334	0
Galaxy Server administration	Galaxy from an administrator's point of view	https://training.galaxyproject.org//topics/admin/tutorials/introduction/slides.html			2017-06-12	2024-06-25	6	False	True	False	False				0		3518342	8525259	2.15	0
Galaxy Server administration	Distributed Object Storage	https://training.galaxyproject.org//topics/admin/tutorials/object-store/tutorial.html			2019-01-28	2025-03-24	28	True	True	True	False				0		3519745	8527434	7.5	0
Galaxy Server administration	Galaxy Monitoring	https://training.galaxyproject.org//topics/admin/tutorials/general-monitoring/slides.html			2019-04-26	2022-03-01	5	False	True	False	False				0		3518342	8525260	2.15	0
Galaxy Server administration	Setting up Celery Workers for Galaxy	https://training.galaxyproject.org//topics/admin/tutorials/celery/tutorial.html			2022-07-16	2025-11-24	19	True	True	False	False				0		2663258	5704822	9.45	0
Galaxy Server administration	Galaxy Administrator Time Burden and Technology Usage	https://training.galaxyproject.org//topics/admin/tutorials/poll-ssa/slides.html			2024-07-10	2024-07-10	1	False	True	False	False				0		1511757	2929345	1.65	0
Galaxy Server administration	Gearing towards production	https://training.galaxyproject.org//topics/admin/tutorials/production/slides.html			2019-01-28	2025-11-20	11	False	True	True	False				0		3518342	8525260	2.15	0
Galaxy Server administration	Advanced customisation of a Galaxy instance	https://training.galaxyproject.org//topics/admin/tutorials/advanced-galaxy-customisation/slides.html			2017-06-27	2023-04-17	18	False	True	False	False				0		3518342	8525260	2.15	0
Galaxy Server administration	Ansible	https://training.galaxyproject.org//topics/admin/tutorials/ansible/tutorial.html			2018-07-11	2024-08-08	48	True	True	True	False				0		3524937	8536951	7.666666666666667	0
Galaxy Server administration	Galaxy Troubleshooting	https://training.galaxyproject.org//topics/admin/tutorials/troubleshooting/slides.html			2019-01-28	2024-06-25	15	False	True	False	False				0		3518342	8525260	2.15	0
Galaxy Server administration	Connecting Galaxy to a compute cluster	https://training.galaxyproject.org//topics/admin/tutorials/connect-to-compute-cluster/tutorial.html			2018-01-07	2025-11-24	65	True	True	True	False				0		3522504	8532371	10.316666666666666	0
Galaxy Server administration	Galaxy Monitoring with gxadmin	https://training.galaxyproject.org//topics/admin/tutorials/gxadmin/tutorial.html			2019-01-28	2025-11-13	27	True	True	True	False				0		3519276	8526703	14.416666666666666	0
Galaxy Server administration	uWSGI	https://training.galaxyproject.org//topics/admin/tutorials/uwsgi/slides.html			2019-01-28	2022-03-01	9	False	True	False	False				0		3518342	8525260	2.15	0
Galaxy Server administration	User, Role, Group, Quota, and Authentication managment	https://training.galaxyproject.org//topics/admin/tutorials/users-groups-quotas/slides.html			2018-01-07	2024-08-08	19	False	True	True	False				0		3518342	8525260	2.15	0
Galaxy Server administration	Galaxy Tool Management with Ephemeris	https://training.galaxyproject.org//topics/admin/tutorials/tool-management/tutorial.html			2019-01-27	2025-04-03	39	True	True	True	False				0		3520234	8527932	12.25	0
Galaxy Server administration	Galactic Database	https://training.galaxyproject.org//topics/admin/tutorials/database/slides.html			2019-01-28	2025-11-20	6	False	True	True	False				0		3518342	8525260	2.15	0
Galaxy Server administration	Galaxy Monitoring with Telegraf and Grafana	https://training.galaxyproject.org//topics/admin/tutorials/monitoring/tutorial.html			2019-01-31	2025-11-24	54	True	True	True	False				0		3521308	8530691	5.833333333333333	0
Galaxy Server administration	Galaxy Installation with Ansible	https://training.galaxyproject.org//topics/admin/tutorials/ansible-galaxy/tutorial.html	Database management, Informatics, Data management		2019-01-28	2026-01-23	109	True	True	True	False				0		3544244	8573186	5.7	0
Galaxy Server administration	Docker and Galaxy	https://training.galaxyproject.org//topics/admin/tutorials/galaxy-docker/slides.html			2016-09-29	2022-10-18	16	False	True	False	False				0		3518342	8525262	2.15	0
Galaxy Server administration	Controlling Galaxy with systemd or Supervisor	https://training.galaxyproject.org//topics/admin/tutorials/systemd-supervisor/slides.html			2019-01-28	2023-04-16	5	False	True	True	False				0		3518342	8525262	2.15	0
Galaxy Server administration	Server Maintenance: Cleanup, Backup, and Restoration	https://training.galaxyproject.org//topics/admin/tutorials/backup-cleanup/tutorial.html	Database management, Informatics, Data management		2019-01-31	2025-11-24	10	True	True	True	False				0		3518968	8526088	16.533333333333335	0
Galaxy Server administration	Data Libraries	https://training.galaxyproject.org//topics/admin/tutorials/data-library/tutorial.html			2021-01-14	2025-11-24	35	True	True	True	False				0		3502584	8462640	8.6	0
Galaxy Server administration	Galaxy Interactive Tools	https://training.galaxyproject.org//topics/admin/tutorials/interactive-tools/tutorial.html			2020-02-27	2026-01-23	30	True	True	True	False				0		3520753	8528848	9.183333333333334	0
Galaxy Server administration	Monitoring Galaxy and Pulsar with Sentry	https://training.galaxyproject.org//topics/admin/tutorials/sentry/tutorial.html			2023-04-19	2025-12-18	13	True	False	False	False				0		251	299	12.6	0
Galaxy Server administration	Reference Data with CVMFS without Ansible	https://training.galaxyproject.org//topics/admin/tutorials/cvmfs-manual/tutorial.html			2020-06-17	2026-01-23	10	True	False	False	False				0		468	615	9.25	0
Galaxy Server administration	Use Apptainer containers for running Galaxy jobs	https://training.galaxyproject.org//topics/admin/tutorials/apptainer/tutorial.html			2021-01-08	2025-11-24	19	True	False	True	False				0		1153	1461	9.416666666666666	0
Galaxy Server administration	Performant Uploads with TUS	https://training.galaxyproject.org//topics/admin/tutorials/tus/tutorial.html			2022-03-01	2025-11-22	22	True	False	True	False				0		923	1334	13.833333333333334	0
Galaxy Server administration	Customizing the look of Galaxy	https://training.galaxyproject.org//topics/admin/tutorials/customization/tutorial.html			2023-04-16	2025-11-22	8	True	False	False	False				0		634	773	13.766666666666667	0
Galaxy Server administration	Adding file-sources to Galaxy	https://training.galaxyproject.org//topics/admin/tutorials/file_sources/tutorial.html			2025-01-20	2025-01-20	1	True	False	False	False				0		73	91	4.616666666666666	0
Galaxy Server administration	Deploying a Beacon v1 in Galaxy	https://training.galaxyproject.org//topics/admin/tutorials/beacon/tutorial.html			2023-04-16	2025-11-22	7	True	False	False	False				0		168	186	16.416666666666668	0
Galaxy Server administration	Create a subdomain for your community on UseGalaxy.eu	https://training.galaxyproject.org//topics/admin/tutorials/subdomain/tutorial.html			2024-11-27	2024-12-13	2	True	False	False	False				0		70	79	6.55	0
Galaxy Server administration	Automation with Jenkins	https://training.galaxyproject.org//topics/admin/tutorials/jenkins/tutorial.html			2019-08-06	2022-10-18	10	True	False	False	False				0		8362	16514	1.2833333333333334	0
Galaxy Server administration	Configuring the Onedata connectors (remotes, Object Store, BYOS, BYOD)	https://training.galaxyproject.org//topics/admin/tutorials/onedata-configuration/tutorial.html			2025-03-24	2025-04-08	2	True	False	False	False				0		84	95	10.7	0
Galaxy Server administration	Galaxy Monitoring with Reports	https://training.galaxyproject.org//topics/admin/tutorials/reports/tutorial.html			2019-01-31	2026-01-23	49	True	False	False	False				0		540	710	14.233333333333333	0
Galaxy Server administration	Mapping Jobs to Destinations using TPV	https://training.galaxyproject.org//topics/admin/tutorials/job-destinations/tutorial.html			2021-01-17	2026-01-23	44	True	False	True	False				0		1763	2723	11.116666666666667	0
Galaxy Server administration	Customizing the look of Galaxy (Manual)	https://training.galaxyproject.org//topics/admin/tutorials/customization-manual/tutorial.html			2023-04-16	2025-04-08	2	True	False	False	False				0		229	271	7.383333333333334	0
Galaxy Server administration	Galaxy Database schema	https://training.galaxyproject.org//topics/admin/tutorials/database-schema/tutorial.html			2016-07-20	2025-04-08	23	True	False	False	False				0		3090	5020	2.4	0
Galaxy Server administration	Enable upload via FTP	https://training.galaxyproject.org//topics/admin/tutorials/ftp/tutorial.html			2021-06-18	2025-12-18	29	True	False	False	False				0		1311	1775	7.716666666666667	0
Galaxy Server administration	Upgrading Galaxy	https://training.galaxyproject.org//topics/admin/tutorials/upgrading/tutorial.html			2021-06-08	2026-01-23	11	True	False	True	False				0		773	1166	7.583333333333333	0
Galaxy Server administration	Alternative Celery Deployment for Galaxy	https://training.galaxyproject.org//topics/admin/tutorials/celeryless/tutorial.html			2024-11-07	2024-11-07	1	True	False	False	False				0		88	98	8.783333333333333	0
Galaxy Server administration	How I learned to stop worrying and love the systemd	https://training.galaxyproject.org//topics/admin/tutorials/stop-worrying-love-systemd/tutorial.html			2022-07-06	2023-09-28	3	True	False	False	False				0		715	818	4.066666666666666	0
Galaxy Server administration	Training Infrastructure as a Service (TIaaS)	https://training.galaxyproject.org//topics/admin/tutorials/tiaas/tutorial.html			2020-02-12	2025-11-24	45	True	False	True	False				0		596	785	12.483333333333333	0
Galaxy Server administration	Galaxy Installation on Kubernetes	https://training.galaxyproject.org//topics/admin/tutorials/k8s-deploying-galaxy/tutorial.html			2019-07-02	2024-06-30	7	True	False	False	False				0		1661	2714	5.066666666666666	0
Galaxy Server administration	Managing Galaxy on Kubernetes	https://training.galaxyproject.org//topics/admin/tutorials/k8s-managing-galaxy/tutorial.html			2019-07-02	2024-12-19	7	True	False	False	False				0		694	1004	6.666666666666667	0
Galaxy Server administration	Galaxy usage on SURF Research Cloud	https://training.galaxyproject.org//topics/admin/tutorials/surf-research-cloud-galaxy/tutorial.html	Informatics, Data management		2024-12-18	2025-08-05	4	True	False	False	False				0		111	130	5.366666666666666	0
Galaxy Server administration	Pulsar usage on SURF Research Cloud	https://training.galaxyproject.org//topics/admin/tutorials/surf-research-cloud-pulsar/tutorial.html	Informatics, Data management		2024-12-18	2024-12-19	3	True	False	False	False				0		107	115	4.1	0
Galaxy Server administration	Deploying Wireguard for private mesh networking	https://training.galaxyproject.org//topics/admin/tutorials/wireguard/tutorial.html			2022-09-21	2024-12-19	4	True	False	False	False				0		1142	1296	0.85	0
Galaxy Server administration	Deploying Tailscale/Headscale for private mesh networking	https://training.galaxyproject.org//topics/admin/tutorials/wireguard-headscale/tutorial.html	Data security, Software engineering		2022-09-21	2024-12-19	4	True	False	False	False				0		2421	3110	1.0	0
Galaxy Server administration	Deploying a compute cluster in OpenStack via Terraform	https://training.galaxyproject.org//topics/admin/tutorials/terraform/tutorial.html			2018-10-27	2024-12-19	15	True	True	False	False				0		3534475	8555535	3.2666666666666666	0
Image analysis using Deep Learning	BioImage Model Zoo: Advanced models in one-click	https://training.galaxyproject.org//topics/ai4life/tutorials/getting-started/slides.html			2023-04-18	2023-05-24	4	False	True	True	False			UseGalaxy.eu, UseGalaxy.org, UseGalaxy.org.au, UseGalaxy.fr	0		2214775	4552890	1.8833333333333333	0
Image analysis using Deep Learning	Contribute to the BioImage.IO models	https://training.galaxyproject.org//topics/ai4life/tutorials/contribute-materials/slides.html			2023-05-18	2023-05-24	3	False	True	True	False			UseGalaxy.eu, UseGalaxy.org, UseGalaxy.org.au, UseGalaxy.fr	0		2152614	4417118	1.8666666666666667	0
Image analysis using Deep Learning	Welcome to the BioImage Model Zoo	https://training.galaxyproject.org//topics/ai4life/tutorials/welcome-bioimageio/slides.html			2023-05-11	2023-05-18	3	False	True	True	False			UseGalaxy.eu, UseGalaxy.org, UseGalaxy.org.au, UseGalaxy.fr	0		2167534	4449494	1.8666666666666667	0
Assembly	An Introduction to Genome Assembly	https://training.galaxyproject.org//topics/assembly/tutorials/general-introduction/tutorial.html		Sequence assembly validation, Formatting, De-novo assembly, Visualisation, Statistical calculation, Sequence composition calculation, Sequencing quality control, Validation	2017-05-23	2026-01-23	30	True	True	True	True	multiqc, fastq_paired_end_interlacer, quast, velvetg, fastqc, velveth	Galaxy@AuBi, UseGalaxy.org (Main), UseGalaxy.org.au	UseGalaxy.be, UseGalaxy.cz, UseGalaxy.eu, UseGalaxy.fr	0		3555590	8585959	9.033333333333333	0
Assembly	Assembly of metagenomic sequencing data	https://training.galaxyproject.org//topics/assembly/tutorials/metagenomics-assembly/tutorial.html	Metagenomics, Sequence assembly	Sequence assembly visualisation, Sequence assembly validation, Formatting, Sequence contamination filtering, Visualisation, Sequence alignment analysis, Variant calling, Sequencing quality control, Read mapping, Data handling, Primer removal, Statistical calculation, Local alignment, Sequence composition calculation, Sequence file editing, Read pre-processing, Genome assembly, Sequence trimming	2026-03-03	2026-03-03	0	True	False	True	True	megahit_contig2fastg, collection_column_join, coverm_contig, ngsutils_bam_filter, bamtools, bowtie2, megahit, metaspades, quast, bandage_info, fastqc, cutadapt, random_lines1, bandage_image, tp_cat, seqtk_subseq, bg_uniq, filter_tabular		UseGalaxy.be, UseGalaxy.cz, UseGalaxy.eu, UseGalaxy.org (Main)	0		16	21	3.05	0
Assembly	Assembly of the mitochondrial genome from PacBio HiFi reads	https://training.galaxyproject.org//topics/assembly/tutorials/mitochondrion-assembly/tutorial.html	Genomics, Sequence assembly, Biodiversity, Mitochondria		2024-09-03	2025-06-04	4	True	False	True	True	mitohifi, compress_file	UseGalaxy.be, UseGalaxy.cz, UseGalaxy.eu, UseGalaxy.org (Main), UseGalaxy.org.au		0		1064	1275	11.116666666666667	0
Assembly	Large genome assembly and polishing	https://training.galaxyproject.org//topics/assembly/tutorials/largegenome/tutorial.html	Genomics, Sequence assembly, Biodiversity	Sequence assembly visualisation, Sequence assembly validation, Mapping assembly, Sequence contamination filtering, Base-calling, Visualisation, Variant calling, Sequencing quality control, Pairwise sequence alignment, Validation, Sequence assembly, Cross-assembly, Box-Whisker plot plotting, De-novo assembly, Statistical calculation, Sequence composition calculation, Scatter plot plotting, Genome assembly	2023-03-06	2026-01-23	15	True	False	True	True	busco, meryl, fastp, genomescope, multiqc, racon, flye, quast, fasta-stats, nanoplot, barchart_gnuplot, medaka_consensus_pipeline, minimap2, bandage_image, fastqc	UseGalaxy.be, UseGalaxy.eu, UseGalaxy.org.au	UseGalaxy.cz	0		8009	10326	5.266666666666667	0
Assembly	Unicycler Assembly	https://training.galaxyproject.org//topics/assembly/tutorials/unicycler-assembly/tutorial.html	Sequence assembly, Genomics, Microbiology	Sequence assembly validation, Aggregation, Genome assembly, Visualisation, Coding region prediction, Genome annotation, Statistical calculation, Sequence composition calculation, Sequencing quality control, Gene prediction, Validation	2017-10-11	2026-01-23	25	True	True	False	True	multiqc, unicycler, prokka, quast, fastqc	UseGalaxy.eu, UseGalaxy.org (Main), UseGalaxy.org.au	Galaxy@AuBi, GalaxyTrakr, MISSISSIPPI, UseGalaxy.be, UseGalaxy.cz, UseGalaxy.fr, UseGalaxy.no	0		3531554	8547731	7.133333333333334	0
Assembly	Using the VGP workflows to assemble a vertebrate genome with HiFi and Hi-C data	https://training.galaxyproject.org//topics/assembly/tutorials/vgp_workflow_training/tutorial.html	Sequence assembly, Chromosome conformation capture	Sequence assembly validation, Visualisation	2022-04-06	2025-09-09	26	True	False	True	False	quast	Galaxy@AuBi, GalaxyTrakr, MISSISSIPPI, UseGalaxy.be, UseGalaxy.cz, UseGalaxy.eu, UseGalaxy.fr, UseGalaxy.no, UseGalaxy.org (Main), UseGalaxy.org.au		0		3899	5354	7.483333333333333	0
Assembly	Genome Assembly of MRSA from Oxford Nanopore MinION data (and optionally Illumina data)	https://training.galaxyproject.org//topics/assembly/tutorials/mrsa-nanopore/tutorial.html	Sequence assembly, Whole genome sequencing, Public health and epidemiology, Genomics, Microbiology, Antimicrobial resistance	Sequence assembly visualisation, Box-Whisker plot plotting, Sequence assembly validation, Mapping assembly, Sequence contamination filtering, De-novo assembly, Visualisation, Statistical calculation, Sequence composition calculation, Sequence alignment, Sequencing error detection, Sequencing quality control, Read mapping, Scatter plot plotting, Filtering, Genome assembly, Cross-assembly	2021-03-24	2026-01-05	16	True	False	False	True	fastp, porechop, bwa_mem2, upload1, flye, __FLATTEN__, CONVERTER_bz2_to_uncompressed, nanoplot, __EXTRACT_DATASET__, quast, bandage_image, fastqc, polypolish, filtlong	UseGalaxy.be, UseGalaxy.eu	UseGalaxy.cz, UseGalaxy.fr	0		10893	16217	7.6	0
Assembly	Chloroplast genome assembly	https://training.galaxyproject.org//topics/assembly/tutorials/chloroplast-assembly/tutorial.html		Sequence assembly, Sequence assembly visualisation, Generation, Box-Whisker plot plotting, Read alignment, Mapping assembly, De-novo assembly, Analysis, Coding region prediction, Genome annotation, Genome visualisation, Sequence alignment, Genome indexing, Read mapping, Gene prediction, Scatter plot plotting, Genome assembly, Cross-assembly	2020-12-04	2026-01-23	22	True	False	True	True	jbrowse, prokka, upload1, flye, fasta-stats, bandage_info, bwa_mem, nanoplot, bandage_image, pilon	UseGalaxy.eu	UseGalaxy.be, UseGalaxy.cz, UseGalaxy.fr, UseGalaxy.no, UseGalaxy.org (Main)	0		8337	12878	7.916666666666667	0
Assembly	Genome Assembly of a bacterial genome (MRSA) sequenced using Illumina MiSeq Data	https://training.galaxyproject.org//topics/assembly/tutorials/mrsa-illumina/tutorial.html	Sequence assembly, Whole genome sequencing, Public health and epidemiology, Genomics, Microbiology	Sequence assembly visualisation, Sequence assembly validation, Sequence contamination filtering, Visualisation, Sequencing quality control, Read mapping, Genome assembly	2021-03-24	2026-01-05	18	True	False	True	True	fastp, shovill, upload1, quast, bandage_info, falco, bandage_image	UseGalaxy.be, UseGalaxy.cz, UseGalaxy.eu, UseGalaxy.fr, UseGalaxy.org (Main)		0		10823	16559	9.616666666666667	0
Assembly	Genome assembly using PacBio data	https://training.galaxyproject.org//topics/assembly/tutorials/hifi-assembly/tutorial.html	Genomics, Sequence assembly, Biodiversity	Sequence assembly validation, Mapping assembly, De-novo assembly, Visualisation, Genome assembly, Cross-assembly	2021-11-29	2025-06-04	2	True	False	False	True	hifiasm, gfa_to_fa, flye, quast, fasta-stats, busco	UseGalaxy.eu, UseGalaxy.fr, UseGalaxy.org (Main), UseGalaxy.org.au	UseGalaxy.cz, UseGalaxy.no	0		1163	1389	6.383333333333334	0
Assembly	Genome Assembly Quality Control	https://training.galaxyproject.org//topics/assembly/tutorials/assembly-quality-control/tutorial.html	Biodiversity, Sequence assembly, Data quality management	Scaffolding, Sequence assembly validation, Phasing, k-mer counting, De-novo assembly, Visualisation, Genome assembly	2022-08-26	2025-06-04	6	True	True	False	True	meryl, chromeister, merqury, quast, busco	UseGalaxy.be, UseGalaxy.eu, UseGalaxy.fr, UseGalaxy.org.au	UseGalaxy.cz	0		2618054	5571957	10.316666666666666	0
Assembly	Making sense of a newly assembled genome	https://training.galaxyproject.org//topics/assembly/tutorials/ecoli_comparison/tutorial.html	Sequence assembly, Genomics, Microbiology	Mapping, Sequence visualisation, Sequence alignment, Read mapping, Genome visualisation	2018-06-14	2024-06-24	29	True	False	False	True	tp_replace_in_column, fasta_filter_by_length, fasta_compute_length, tp_grep_tool, upload1, bedtools_sortbed, bedtools_intersectbed, random_lines1, tp_sed_tool, cat1, circos, Grep1, jbrowse, tp_sort_header_tool, join1, Cut1, addValue, tp_replace_in_line, collapse_dataset, circos_interval_to_tiles, datamash_ops, bedtools_complementbed, lastz_wrapper_2, mergeCols1, circos_aln_to_links, Filter1, tp_cat			0		6839	13092	8.066666666666666	0
Assembly	Vertebrate genome assembly using HiFi, Bionano and Hi-C data - Step by Step	https://training.galaxyproject.org//topics/assembly/tutorials/vgp_genome_assembly/tutorial.html	Genomics, Sequence assembly, Biodiversity	Sequence assembly validation, Read binning, Pairwise sequence alignment, Mapping, Primer removal, De-novo assembly, Visualisation, Scaffolding, Sequence alignment, Phasing, k-mer counting, Read pre-processing, Data handling, Genome assembly, Sequence trimming	2021-06-04	2026-01-23	58	True	False	True	True	purge_dups, bwa_mem2, gfastats, cutadapt, minimap2, bionano_scaffold, pretext_map, hifiasm, tp_grep_tool, collection_column_join, gfa_to_fa, tp_find_and_replace, yahs, merqury, sort1, Add_a_column1, tp_cut_tool, salsa, bedtools_bamtobed, cat1, genomescope, quast, busco, Convert characters1, collapse_dataset, meryl, bellerophon, pretext_snapshot		UseGalaxy.cz	0		16903	25304	3.4166666666666665	0
Assembly	Decontamination of a genome assembly	https://training.galaxyproject.org//topics/assembly/tutorials/assembly-decontamination/tutorial.html	Genomics, Sequence assembly, Biodiversity	Data handling, Taxonomic classification	2024-09-04	2025-06-04	5	True	False	True	True	gfastats, ncbi_blastn_wrapper, Cut1, ncbi_dustmasker_wrapper, kraken2, parse_mito_blast, Filter1, tp_sed_tool, tp_cat	UseGalaxy.eu, UseGalaxy.org (Main), UseGalaxy.org.au	UseGalaxy.cz	0		1886	2312	8.9	0
Assembly	ERGA post-assembly QC	https://training.galaxyproject.org//topics/assembly/tutorials/ERGA-post-assembly-QC/tutorial.html	Genomics, Sequence assembly, Biodiversity	Sequence assembly visualisation, Sequence assembly validation, Pairwise sequence alignment, Data deposition, Data parsing, De-novo assembly, Genotyping, Visualisation, Scaffolding, Sequence alignment analysis, Sequence alignment, Phasing, k-mer counting, Data handling, Genome assembly, Sequence trimming	2023-06-23	2025-06-04	8	True	False	True	True	blobtoolkit, bwa_mem2, gfastats, __EXTRACT_DATASET__, bg_diamond, minimap2, CONVERTER_gz_to_uncompressed, samtools_stats, pretext_map, tp_find_and_replace, merqury, genomescope, busco, bandage_image, collapse_dataset, meryl, bellerophon, pretext_snapshot, interactive_tool_blobtoolkit, smudgeplot	UseGalaxy.eu	UseGalaxy.org (Main), UseGalaxy.org.au	0		2219	2857	8.283333333333333	0
Assembly	De Bruijn Graph Assembly	https://training.galaxyproject.org//topics/assembly/tutorials/debruijn-graph-assembly/tutorial.html		Sequence assembly, Sequence assembly visualisation, Optimisation and refinement, Formatting, De-novo assembly, Genome assembly	2017-05-24	2026-01-07	26	True	True	False	True	fasta-stats, velvetoptimiser, bandage_image, velvetg, spades, velveth	UseGalaxy.eu, UseGalaxy.org (Main), UseGalaxy.org.au	Galaxy@AuBi, UseGalaxy.be, UseGalaxy.cz	0		3525159	8536026	10.683333333333334	0
Assembly	Hybrid genome assembly - Nanopore and Illumina	https://training.galaxyproject.org//topics/assembly/tutorials/hybrid_denovo_assembly/tutorial.html		Sequence assembly, Generation, Sequence assembly validation, Read alignment, Aggregation, Mapping assembly, De-novo assembly, Analysis, Visualisation, Validation, Sequence alignment, Genome indexing, Sequencing quality control, Read mapping, Genome assembly, Cross-assembly	2025-11-03	2025-11-06	2	True	False	False	True	multiqc, unicycler, flye, quast, bwa_mem, busco, pilon	UseGalaxy.be, UseGalaxy.cz, UseGalaxy.eu, UseGalaxy.fr, UseGalaxy.org (Main), UseGalaxy.org.au	GalaxyTrakr, UseGalaxy.no	0		725	866	4.316666666666666	0
