Topic	Title	Link	EDAM topic	EDAM operation	Creation	Last modification	Version	Tutorial	Slides	Video	Workflows	Tools	Servers with precise tool versions	Servers with tool but different versions	Feedback number	Feedback mean note	Visitors	Page views	Visit duration	Video views
Galaxy Server administration	Galaxy on the Cloud	https://training.galaxyproject.org//topics/admin/tutorials/cloudbursting/slides.html			2019-01-31	2024-12-19	7	False	True	False	False				0		2844954	7529722	2.45	0
Galaxy Server administration	Reference Data with Data Managers	https://training.galaxyproject.org//topics/admin/tutorials/reference-genomes/tutorial.html		Read mapping, Sequence alignment, Generation, Genome indexing	2019-01-28	2023-04-21	7	True	True	False	False	bwa, bwa_mem_index_builder_data_manager, data_manager_fetch_genome_all_fasta_dbkey			0		2845508	7530446	6.9	0
Galaxy Server administration	Advanced customisation of a Galaxy instance	https://training.galaxyproject.org//topics/admin/tutorials/advanced-galaxy-customisation/slides.html			2017-06-27	2023-04-17	18	False	True	False	False				0		2844954	7529722	2.45	0
Galaxy Server administration	Connecting Galaxy to a compute cluster	https://training.galaxyproject.org//topics/admin/tutorials/connect-to-compute-cluster/tutorial.html			2018-01-07	2025-04-08	59	True	True	True	False				0		2848976	7536676	5.716666666666667	0
Galaxy Server administration	Setting up Celery Workers for Galaxy	https://training.galaxyproject.org//topics/admin/tutorials/celery/tutorial.html			2022-07-16	2025-04-08	12	True	True	False	False				0		1990818	4709175	3.8833333333333333	0
Galaxy Server administration	Empathy	https://training.galaxyproject.org//topics/admin/tutorials/empathy/slides.html			2019-01-31	2021-04-06	4	False	True	False	False				0		2844954	7529722	2.45	0
Galaxy Server administration	Galaxy Monitoring with gxadmin	https://training.galaxyproject.org//topics/admin/tutorials/gxadmin/tutorial.html			2019-01-28	2024-08-08	27	True	True	True	False				0		2845823	7531085	5.166666666666667	0
Galaxy Server administration	User, Role, Group, Quota, and Authentication managment	https://training.galaxyproject.org//topics/admin/tutorials/users-groups-quotas/slides.html			2018-01-07	2024-08-08	19	False	True	True	False				0		2844954	7529722	2.45	0
Galaxy Server administration	External Authentication	https://training.galaxyproject.org//topics/admin/tutorials/external-auth/tutorial.html			2019-01-28	2022-10-18	14	True	True	False	False				0		2845650	7530820	3.25	0
Galaxy Server administration	Running Jobs on Remote Resources with Pulsar	https://training.galaxyproject.org//topics/admin/tutorials/pulsar/tutorial.html			2019-01-28	2025-04-08	49	True	True	True	False				0		2847466	7533865	5.283333333333333	0
Galaxy Server administration	Gearing towards production	https://training.galaxyproject.org//topics/admin/tutorials/production/slides.html			2019-01-28	2025-04-08	10	False	True	True	False				0		2844954	7529723	2.45	0
Galaxy Server administration	uWSGI	https://training.galaxyproject.org//topics/admin/tutorials/uwsgi/slides.html			2019-01-28	2022-03-01	9	False	True	False	False				0		2844954	7529723	2.45	0
Galaxy Server administration	Distributed Object Storage	https://training.galaxyproject.org//topics/admin/tutorials/object-store/tutorial.html			2019-01-28	2025-03-24	28	True	True	True	False				0		2846296	7531829	4.0	0
Galaxy Server administration	Galactic Database	https://training.galaxyproject.org//topics/admin/tutorials/database/slides.html			2019-01-28	2022-06-16	5	False	True	True	False				0		2844954	7529723	2.45	0
Galaxy Server administration	Server Maintenance: Cleanup, Backup, and Restoration	https://training.galaxyproject.org//topics/admin/tutorials/backup-cleanup/tutorial.html	Database management, Informatics, Data management		2019-01-31	2024-08-09	5	True	True	True	False				0		2845513	7530470	11.633333333333333	0
Galaxy Server administration	Galaxy Troubleshooting	https://training.galaxyproject.org//topics/admin/tutorials/troubleshooting/slides.html			2019-01-28	2024-06-25	15	False	True	False	False				0		2844954	7529723	2.45	0
Galaxy Server administration	Galaxy from an administrator's point of view	https://training.galaxyproject.org//topics/admin/tutorials/introduction/slides.html			2017-06-12	2024-06-25	6	False	True	False	False				0		2844954	7529723	2.45	0
Galaxy Server administration	Ansible	https://training.galaxyproject.org//topics/admin/tutorials/ansible/tutorial.html			2018-07-11	2024-08-08	48	True	True	True	False				0		2851328	7541143	4.116666666666666	0
Galaxy Server administration	Docker and Galaxy	https://training.galaxyproject.org//topics/admin/tutorials/galaxy-docker/slides.html			2016-09-29	2022-10-18	16	False	True	False	False				0		2844954	7529723	2.45	0
Galaxy Server administration	Reference Data with CVMFS	https://training.galaxyproject.org//topics/admin/tutorials/cvmfs/tutorial.html			2019-01-27	2025-04-03	50	True	True	True	False				0		2847053	7532836	5.6	0
Galaxy Server administration	Controlling Galaxy with systemd or Supervisor	https://training.galaxyproject.org//topics/admin/tutorials/systemd-supervisor/slides.html			2019-01-28	2023-04-16	5	False	True	True	False				0		2844954	7529723	2.45	0
Galaxy Server administration	Data Libraries	https://training.galaxyproject.org//topics/admin/tutorials/data-library/tutorial.html			2021-01-14	2024-06-14	32	True	True	True	False				0		2828550	7466343	4.5	0
Galaxy Server administration	Galaxy Tool Management with Ephemeris	https://training.galaxyproject.org//topics/admin/tutorials/tool-management/tutorial.html			2019-01-27	2025-04-03	39	True	True	True	False				0		2846727	7532262	5.916666666666667	0
Galaxy Server administration	Galaxy Monitoring	https://training.galaxyproject.org//topics/admin/tutorials/general-monitoring/slides.html			2019-04-26	2022-03-01	5	False	True	False	False				0		2844954	7529723	2.45	0
Galaxy Server administration	Server: Other	https://training.galaxyproject.org//topics/admin/tutorials/stuff/slides.html			2018-01-07	2023-02-17	6	False	True	False	False				0		2844954	7529723	2.45	0
Galaxy Server administration	Galaxy Installation with Ansible	https://training.galaxyproject.org//topics/admin/tutorials/ansible-galaxy/tutorial.html	Database management, Informatics, Data management		2019-01-28	2025-04-08	102	True	True	True	False				0		2870349	7577049	4.183333333333334	0
Galaxy Server administration	Galaxy Monitoring with Telegraf and Grafana	https://training.galaxyproject.org//topics/admin/tutorials/monitoring/tutorial.html			2019-01-31	2024-12-18	47	True	True	True	False				0		2847807	7535025	3.316666666666667	0
Galaxy Server administration	Galaxy Administrator Time Burden and Technology Usage	https://training.galaxyproject.org//topics/admin/tutorials/poll-ssa/slides.html			2024-07-10	2024-07-10	1	False	True	False	False				0		833446	1933808	2.25	0
Galaxy Server administration	Galaxy Interactive Tools	https://training.galaxyproject.org//topics/admin/tutorials/interactive-tools/tutorial.html			2020-02-27	2025-04-08	27	True	True	True	False				0		2847210	7533129	5.166666666666667	0
Galaxy Server administration	Upgrading Galaxy	https://training.galaxyproject.org//topics/admin/tutorials/upgrading/tutorial.html			2021-06-08	2024-11-25	10	True	False	True	False				0		682	1061	3.0	0
Galaxy Server administration	How I learned to stop worrying and love the systemd	https://training.galaxyproject.org//topics/admin/tutorials/stop-worrying-love-systemd/tutorial.html			2022-07-06	2023-09-28	3	True	False	False	False				0		669	771	0.6333333333333333	0
Galaxy Server administration	Galaxy Database schema	https://training.galaxyproject.org//topics/admin/tutorials/database-schema/tutorial.html			2016-07-20	2025-04-08	23	True	False	False	False				0		3013	4938	1.0666666666666667	0
Galaxy Server administration	Customizing the look of Galaxy (Manual)	https://training.galaxyproject.org//topics/admin/tutorials/customization-manual/tutorial.html			2023-04-16	2025-04-08	2	True	False	False	False				0		191	230	2.216666666666667	0
Galaxy Server administration	Reference Data with CVMFS without Ansible	https://training.galaxyproject.org//topics/admin/tutorials/cvmfs-manual/tutorial.html			2020-06-17	2023-11-23	9	True	False	False	False				0		389	525	2.466666666666667	0
Galaxy Server administration	Automation with Jenkins	https://training.galaxyproject.org//topics/admin/tutorials/jenkins/tutorial.html			2019-08-06	2022-10-18	10	True	False	False	False				0		8218	16273	0.65	0
Galaxy Server administration	Performant Uploads with TUS	https://training.galaxyproject.org//topics/admin/tutorials/tus/tutorial.html			2022-03-01	2024-06-14	17	True	False	True	False				0		851	1247	5.333333333333333	0
Galaxy Server administration	Deploying a Beacon v1 in Galaxy	https://training.galaxyproject.org//topics/admin/tutorials/beacon/tutorial.html			2023-04-16	2024-12-18	5	True	False	False	False				0		141	159	2.1333333333333333	0
Galaxy Server administration	Galaxy Monitoring with Reports	https://training.galaxyproject.org//topics/admin/tutorials/reports/tutorial.html			2019-01-31	2025-04-08	43	True	False	False	False				0		493	659	2.783333333333333	0
Galaxy Server administration	Enable upload via FTP	https://training.galaxyproject.org//topics/admin/tutorials/ftp/tutorial.html			2021-06-18	2024-02-20	23	True	False	False	False				0		1231	1692	1.65	0
Galaxy Server administration	Customizing the look of Galaxy	https://training.galaxyproject.org//topics/admin/tutorials/customization/tutorial.html			2023-04-16	2025-04-08	5	True	False	False	False				0		571	699	4.666666666666667	0
Galaxy Server administration	Training Infrastructure as a Service (TIaaS)	https://training.galaxyproject.org//topics/admin/tutorials/tiaas/tutorial.html			2020-02-12	2024-12-18	38	True	False	True	False				0		536	717	3.3833333333333333	0
Galaxy Server administration	Use Apptainer containers for running Galaxy jobs	https://training.galaxyproject.org//topics/admin/tutorials/apptainer/tutorial.html			2021-01-08	2025-04-08	13	True	False	True	False				0		1050	1340	2.6	0
Galaxy Server administration	Configuring the Onedata connectors (remotes, Object Store, BYOS, BYOD)	https://training.galaxyproject.org//topics/admin/tutorials/onedata-configuration/tutorial.html			2025-03-24	2025-04-08	2	True	False	False	False				0		40	45	4.9	0
Galaxy Server administration	Mapping Jobs to Destinations using TPV	https://training.galaxyproject.org//topics/admin/tutorials/job-destinations/tutorial.html			2021-01-17	2024-06-14	36	True	False	True	False				0		1653	2598	3.2666666666666666	0
Galaxy Server administration	Adding file-sources to Galaxy	https://training.galaxyproject.org//topics/admin/tutorials/file_sources/tutorial.html			2025-01-20	2025-01-20	1	True	False	False	False				0		49	67	3.316666666666667	0
Galaxy Server administration	Create a subdomain for your community on UseGalaxy.eu	https://training.galaxyproject.org//topics/admin/tutorials/subdomain/tutorial.html			2024-11-27	2024-12-13	2	True	False	False	False				0		30	35	4.683333333333334	0
Galaxy Server administration	Monitoring Galaxy and Pulsar with Sentry	https://training.galaxyproject.org//topics/admin/tutorials/sentry/tutorial.html			2023-04-19	2024-03-18	6	True	False	False	False				0		211	256	1.0833333333333333	0
Galaxy Server administration	Alternative Celery Deployment for Galaxy	https://training.galaxyproject.org//topics/admin/tutorials/celeryless/tutorial.html			2024-11-07	2024-11-07	1	True	False	False	False				0		56	62	3.6666666666666665	0
Galaxy Server administration	Galaxy Installation on Kubernetes	https://training.galaxyproject.org//topics/admin/tutorials/k8s-deploying-galaxy/tutorial.html			2019-07-02	2024-06-30	7	True	False	False	False				0		1598	2648	2.283333333333333	0
Galaxy Server administration	Managing Galaxy on Kubernetes	https://training.galaxyproject.org//topics/admin/tutorials/k8s-managing-galaxy/tutorial.html			2019-07-02	2024-12-19	7	True	False	False	False				0		656	966	2.1666666666666665	0
Galaxy Server administration	Galaxy usage on SURF Research Cloud	https://training.galaxyproject.org//topics/admin/tutorials/surf-research-cloud-galaxy/tutorial.html	Informatics, Data management		2024-12-18	2025-08-05	4	True	False	False	False				0		63	82	2.1166666666666667	0
Galaxy Server administration	Pulsar usage on SURF Research Cloud	https://training.galaxyproject.org//topics/admin/tutorials/surf-research-cloud-pulsar/tutorial.html	Informatics, Data management		2024-12-18	2024-12-19	3	True	False	False	False				0		54	62	0.5	0
Galaxy Server administration	Deploying Tailscale/Headscale for private mesh networking	https://training.galaxyproject.org//topics/admin/tutorials/wireguard-headscale/tutorial.html	Data security, Software engineering		2022-09-21	2024-12-19	4	True	False	False	False				0		2342	3025	0.43333333333333335	0
Galaxy Server administration	Deploying Wireguard for private mesh networking	https://training.galaxyproject.org//topics/admin/tutorials/wireguard/tutorial.html			2022-09-21	2024-12-19	4	True	False	False	False				0		1097	1251	0.3333333333333333	0
Galaxy Server administration	Deploying a compute cluster in OpenStack via Terraform	https://training.galaxyproject.org//topics/admin/tutorials/terraform/tutorial.html			2018-10-27	2024-12-19	15	True	True	False	False				0		2860781	7559499	3.3666666666666667	0
Image analysis using Deep Learning	Contribute to the BioImage.IO models	https://training.galaxyproject.org//topics/ai4life/tutorials/contribute-materials/slides.html			2023-05-18	2023-05-24	3	False	True	True	False			UseGalaxy.eu, UseGalaxy.org, UseGalaxy.org.au, UseGalaxy.fr	0		1483114	3421577	2.3	0
Image analysis using Deep Learning	BioImage Model Zoo: Advanced models in one-click	https://training.galaxyproject.org//topics/ai4life/tutorials/getting-started/slides.html			2023-04-18	2023-05-24	4	False	True	True	False			UseGalaxy.eu, UseGalaxy.org, UseGalaxy.org.au, UseGalaxy.fr	0		1544330	3557349	2.3	0
Image analysis using Deep Learning	Welcome to the BioImage Model Zoo	https://training.galaxyproject.org//topics/ai4life/tutorials/welcome-bioimageio/slides.html			2023-05-11	2023-05-18	3	False	True	True	False			UseGalaxy.eu, UseGalaxy.org, UseGalaxy.org.au, UseGalaxy.fr	0		1497391	3453953	2.3	0
Assembly	An Introduction to Genome Assembly	https://training.galaxyproject.org//topics/assembly/tutorials/general-introduction/tutorial.html		Statistical calculation, Formatting, Sequence composition calculation, Validation, Visualisation, De-novo assembly, Sequencing quality control, Sequence assembly validation	2017-05-23	2024-09-12	29	True	True	True	True	fastq_paired_end_interlacer, velvetg, multiqc, fastqc, velveth, quast	Galaxy@AuBi, UseGalaxy.org (Main), UseGalaxy.org.au	UseGalaxy.be, UseGalaxy.cz, UseGalaxy.eu, UseGalaxy.fr	0		2880158	7587603	5.3	0
Assembly	Decontamination of a genome assembly	https://training.galaxyproject.org//topics/assembly/tutorials/assembly-decontamination/tutorial.html	Genomics, Sequence assembly, Biodiversity	Data handling, Taxonomic classification	2024-09-04	2025-06-04	5	True	False	True	True	ncbi_blastn_wrapper, tp_sed_tool, parse_mito_blast, Filter1, ncbi_dustmasker_wrapper, kraken2, Cut1, gfastats, tp_cat	UseGalaxy.eu, UseGalaxy.org (Main), UseGalaxy.org.au	UseGalaxy.cz	0		1536	1921	2.533333333333333	0
Assembly	Unicycler Assembly	https://training.galaxyproject.org//topics/assembly/tutorials/unicycler-assembly/tutorial.html	Sequence assembly, Genomics, Microbiology	Statistical calculation, Genome assembly, Coding region prediction, Sequencing quality control, Genome annotation, Gene prediction, Aggregation, Sequence composition calculation, Validation, Visualisation, Sequence assembly validation	2017-10-11	2025-05-15	24	True	True	False	True	unicycler, multiqc, fastqc, prokka, quast	UseGalaxy.eu, UseGalaxy.org (Main), UseGalaxy.org.au	Galaxy@AuBi, GalaxyTrakr, MISSISSIPPI, UseGalaxy.be, UseGalaxy.cz, UseGalaxy.fr, UseGalaxy.no	0		2857850	7551800	4.516666666666667	0
Assembly	Chloroplast genome assembly	https://training.galaxyproject.org//topics/assembly/tutorials/chloroplast-assembly/tutorial.html		Generation, Analysis, Sequence assembly visualisation, Coding region prediction, Box-Whisker plot plotting, Read alignment, Genome indexing, Genome assembly, Mapping assembly, Genome visualisation, Cross-assembly, Genome annotation, Gene prediction, Sequence alignment, Scatter plot plotting, Read mapping, De-novo assembly, Sequence assembly	2020-12-04	2025-05-15	21	True	False	True	True	bandage_image, bwa_mem, jbrowse, upload1, prokka, fasta-stats, nanoplot, pilon, bandage_info, flye	UseGalaxy.eu	GalaxyTrakr, UseGalaxy.be, UseGalaxy.cz, UseGalaxy.fr, UseGalaxy.no, UseGalaxy.org (Main)	0		7834	12151	2.8	0
Assembly	Unicycler assembly of SARS-CoV-2 genome with preprocessing to remove human genome reads	https://training.galaxyproject.org//topics/assembly/tutorials/assembly-with-preprocessing/tutorial.html		Read mapping, Genome assembly, Sequence assembly visualisation, Sequence contamination filtering, Box-Whisker plot plotting, Data handling, Sequencing quality control, Scatter plot plotting, Aggregation, Validation, Pairwise sequence alignment, Sequence file editing	2020-04-21	2025-05-15	14	True	True	True	True	unicycler, multiqc, seqtk_sample, fasterq_dump, collapse_dataset, fasta_filter_by_length, samtools_view, nanoplot, minimap2, bandage_info, fastp, samtools_fastx, bandage_image, bowtie2, samtools_stats, __ZIP_COLLECTION__	UseGalaxy.eu, UseGalaxy.org.au	Galaxy@AuBi, MISSISSIPPI, UseGalaxy.be, UseGalaxy.cz, UseGalaxy.fr, UseGalaxy.no, UseGalaxy.org (Main)	0		2850785	7539499	5.733333333333333	0
Assembly	Genome Assembly of a bacterial genome (MRSA) sequenced using Illumina MiSeq Data	https://training.galaxyproject.org//topics/assembly/tutorials/mrsa-illumina/tutorial.html	Sequence assembly, Whole genome sequencing, Public health and epidemiology, Genomics, Microbiology	Statistical calculation, Genome assembly, Sequence assembly visualisation, Sequencing quality control, Sequence composition calculation, Read mapping, Visualisation, Sequence contamination filtering, Sequence assembly validation	2021-03-24	2025-03-20	16	True	False	True	True	shovill, upload1, fastqc, falco, bandage_info, fastp, bandage_image, quast	UseGalaxy.be, UseGalaxy.cz, UseGalaxy.eu, UseGalaxy.fr, UseGalaxy.org (Main)		0		9861	15245	3.6333333333333333	0
Assembly	Making sense of a newly assembled genome	https://training.galaxyproject.org//topics/assembly/tutorials/ecoli_comparison/tutorial.html	Sequence assembly, Genomics, Microbiology	Sequence alignment, Mapping, Sequence visualisation, Read mapping, Genome visualisation	2018-06-14	2024-06-24	29	True	False	False	True	random_lines1, tp_sed_tool, tp_replace_in_line, circos_interval_to_tiles, collapse_dataset, bedtools_sortbed, tp_cat, circos, join1, tp_replace_in_column, bedtools_complementbed, circos_aln_to_links, tp_sort_header_tool, fasta_filter_by_length, lastz_wrapper_2, Grep1, mergeCols1, tp_grep_tool, datamash_ops, bedtools_intersectbed, jbrowse, upload1, addValue, Filter1, cat1, Cut1, fasta_compute_length			0		6714	12964	2.933333333333333	0
Assembly	Using the VGP workflows to assemble a vertebrate genome with HiFi and Hi-C data	https://training.galaxyproject.org//topics/assembly/tutorials/vgp_workflow_training/tutorial.html	Sequence assembly, Chromosome conformation capture	Visualisation, Sequence assembly validation	2022-04-06	2025-09-09	26	True	False	True	False	quast	Galaxy@AuBi, GalaxyTrakr, MISSISSIPPI, UseGalaxy.be, UseGalaxy.cz, UseGalaxy.eu, UseGalaxy.fr, UseGalaxy.org (Main), UseGalaxy.org.au	UseGalaxy.no	0		3427	4757	2.716666666666667	0
Assembly	Vertebrate genome assembly using HiFi, Bionano and Hi-C data - Step by Step	https://training.galaxyproject.org//topics/assembly/tutorials/vgp_genome_assembly/tutorial.html	Genomics, Sequence assembly, Biodiversity	Genome assembly, k-mer counting, Read binning, Sequence trimming, Primer removal, Mapping, Data handling, De-novo assembly, Phasing, Sequence alignment, Read pre-processing, Scaffolding, Visualisation, Pairwise sequence alignment, Sequence assembly validation	2021-06-04	2025-06-04	57	True	False	True	True	purge_dups, pretext_snapshot, collapse_dataset, Add_a_column1, yahs, tp_find_and_replace, tp_cut_tool, busco, minimap2, genomescope, quast, pretext_map, bwa_mem2, merqury, tp_grep_tool, bellerophon, bionano_scaffold, cutadapt, bedtools_bamtobed, cat1, collection_column_join, Convert characters1, salsa, gfa_to_fa, sort1, gfastats, meryl, hifiasm		UseGalaxy.cz	0		15552	23573	2.0	0
Assembly	ERGA post-assembly QC	https://training.galaxyproject.org//topics/assembly/tutorials/ERGA-post-assembly-QC/tutorial.html	Genomics, Sequence assembly, Biodiversity	Genome assembly, Sequence assembly visualisation, k-mer counting, Sequence alignment analysis, Sequence trimming, Data parsing, Data handling, De-novo assembly, Phasing, Data deposition, Sequence alignment, Genotyping, Scaffolding, Visualisation, Pairwise sequence alignment, Sequence assembly validation	2023-06-23	2025-06-04	8	True	False	True	True	pretext_snapshot, collapse_dataset, tp_find_and_replace, samtools_stats, bg_diamond, busco, minimap2, interactive_tool_blobtoolkit, genomescope, smudgeplot, pretext_map, bwa_mem2, merqury, __EXTRACT_DATASET__, blobtoolkit, bellerophon, CONVERTER_gz_to_uncompressed, bandage_image, gfastats, meryl	UseGalaxy.eu	UseGalaxy.org (Main), UseGalaxy.org.au	0		1868	2396	1.9666666666666666	0
Assembly	Assembly of metagenomic sequencing data	https://training.galaxyproject.org//topics/assembly/tutorials/metagenomics-assembly/tutorial.html	Metagenomics, Sequence assembly	Genome assembly, Sequence assembly visualisation, Data handling, Variant calling, Local alignment, Formatting, Read mapping, Visualisation, Sequence file editing, Read pre-processing, Statistical calculation, Sequence alignment analysis, Sequence trimming, Primer removal, Sequencing quality control, Sequence composition calculation, Sequence contamination filtering, Sequence assembly validation	2025-10-19	2025-10-19	0	True	False	True	True	coverm_contig, filter_tabular, random_lines1, cutadapt, fastqc, megahit_contig2fastg, ngsutils_bam_filter, megahit, bg_uniq, bandage_info, collection_column_join, seqtk_subseq, bandage_image, metaspades, bowtie2, quast, bamtools, tp_cat		UseGalaxy.cz, UseGalaxy.eu	0		1	2	0.0	0
Assembly	Genome Assembly of MRSA from Oxford Nanopore MinION data (and optionally Illumina data)	https://training.galaxyproject.org//topics/assembly/tutorials/mrsa-nanopore/tutorial.html	Sequence assembly, Whole genome sequencing, Public health and epidemiology, Genomics, Microbiology, Antimicrobial resistance	Statistical calculation, Sequence assembly validation, Genome assembly, Sequence assembly visualisation, Box-Whisker plot plotting, Sequencing error detection, Filtering, Sequencing quality control, Cross-assembly, Sequence alignment, Scatter plot plotting, Sequence composition calculation, Read mapping, Visualisation, De-novo assembly, Sequence contamination filtering, Mapping assembly	2021-03-24	2024-11-29	15	True	False	False	True	CONVERTER_bz2_to_uncompressed, bandage_image, bwa_mem2, upload1, fastqc, porechop, nanoplot, fastp, filtlong, polypolish, flye, quast	UseGalaxy.eu	UseGalaxy.cz, UseGalaxy.fr	0		10187	15281	3.4166666666666665	0
Assembly	De Bruijn Graph Assembly	https://training.galaxyproject.org//topics/assembly/tutorials/debruijn-graph-assembly/tutorial.html		Optimisation and refinement, Genome assembly, Sequence assembly	2017-05-24	2024-02-01	25	True	True	False	True	velvetoptimiser, spades, fasta-stats	Galaxy@AuBi, UseGalaxy.be, UseGalaxy.eu, UseGalaxy.no, UseGalaxy.org (Main), UseGalaxy.org.au	UseGalaxy.cz	0		2851324	7539810	5.05	0
Assembly	Genome Assembly Quality Control	https://training.galaxyproject.org//topics/assembly/tutorials/assembly-quality-control/tutorial.html	Biodiversity, Sequence assembly, Data quality management	Genome assembly, Phasing, k-mer counting, Scaffolding, Visualisation, De-novo assembly, Sequence assembly validation	2022-08-26	2025-06-04	6	True	True	False	True	merqury, busco, chromeister, quast, meryl	UseGalaxy.eu, UseGalaxy.fr, UseGalaxy.org.au	UseGalaxy.cz	0		1943408	4575657	4.516666666666667	0
Assembly	Large genome assembly and polishing	https://training.galaxyproject.org//topics/assembly/tutorials/largegenome/tutorial.html	Genomics, Sequence assembly, Biodiversity	Genome assembly, Sequence assembly visualisation, Box-Whisker plot plotting, Variant calling, Scatter plot plotting, Validation, Visualisation, De-novo assembly, Mapping assembly, Statistical calculation, Sequence assembly, Sequencing quality control, Cross-assembly, Sequence composition calculation, Base-calling, Pairwise sequence alignment, Sequence contamination filtering, Sequence assembly validation	2023-03-06	2025-06-04	14	True	False	True	True	bandage_image, barchart_gnuplot, medaka_consensus_pipeline, racon, busco, multiqc, fastqc, fasta-stats, nanoplot, minimap2, fastp, genomescope, flye, quast, meryl	UseGalaxy.eu, UseGalaxy.org.au	UseGalaxy.cz	0		7105	9251	2.033333333333333	0
Assembly	Assembly of the mitochondrial genome from PacBio HiFi reads	https://training.galaxyproject.org//topics/assembly/tutorials/mitochondrion-assembly/tutorial.html	Genomics, Sequence assembly, Biodiversity, Mitochondria		2024-09-03	2025-06-04	4	True	False	True	True	mitohifi, compress_file	UseGalaxy.cz, UseGalaxy.eu, UseGalaxy.org (Main), UseGalaxy.org.au		0		809	992	2.05	0
Assembly	Genome assembly using PacBio data	https://training.galaxyproject.org//topics/assembly/tutorials/hifi-assembly/tutorial.html	Genomics, Sequence assembly, Biodiversity	Genome assembly, Mapping assembly, Cross-assembly, Visualisation, De-novo assembly, Sequence assembly validation	2021-11-29	2025-06-04	2	True	False	False	True	busco, fasta-stats, flye, gfa_to_fa, quast, hifiasm	UseGalaxy.eu, UseGalaxy.fr, UseGalaxy.org (Main), UseGalaxy.org.au	GalaxyTrakr, UseGalaxy.cz	0		702	831	1.4833333333333334	0
