Topic	Title	Link	EDAM topic	EDAM operation	Creation	Last modification	Version	Tutorial	Slides	Video	Workflows	Tools	Servers with precise tool versions	Servers with tool but different versions	Feedback number	Feedback mean note	Visitors	Page views	Visit duration	Video views
Galaxy Server administration	Galaxy on the Cloud	https://training.galaxyproject.org//topics/admin/tutorials/cloudbursting/slides.html			2019-01-31	2024-12-19	7	False	True	False	False				0		3058712	7867576	2.3333333333333335	0
Galaxy Server administration	Galaxy Tool Management with Ephemeris	https://training.galaxyproject.org//topics/admin/tutorials/tool-management/tutorial.html			2019-01-27	2025-04-03	39	True	True	True	False				0		3060521	7870155	5.716666666666667	0
Galaxy Server administration	Galaxy Installation with Ansible	https://training.galaxyproject.org//topics/admin/tutorials/ansible-galaxy/tutorial.html	Database management, Informatics, Data management		2019-01-28	2025-11-28	108	True	True	True	False				0		3084312	7915150	4.066666666666666	0
Galaxy Server administration	Connecting Galaxy to a compute cluster	https://training.galaxyproject.org//topics/admin/tutorials/connect-to-compute-cluster/tutorial.html			2018-01-07	2025-11-24	65	True	True	True	False				0		3062804	7874612	5.583333333333333	0
Galaxy Server administration	Galaxy Monitoring with gxadmin	https://training.galaxyproject.org//topics/admin/tutorials/gxadmin/tutorial.html			2019-01-28	2025-11-13	27	True	True	True	False				0		3059612	7868981	5.1	0
Galaxy Server administration	Reference Data with CVMFS	https://training.galaxyproject.org//topics/admin/tutorials/cvmfs/tutorial.html			2019-01-27	2025-11-24	54	True	True	True	False				0		3060872	7870764	5.483333333333333	0
Galaxy Server administration	Galaxy Monitoring with Telegraf and Grafana	https://training.galaxyproject.org//topics/admin/tutorials/monitoring/tutorial.html			2019-01-31	2025-11-24	54	True	True	True	False				0		3061609	7872930	3.2	0
Galaxy Server administration	User, Role, Group, Quota, and Authentication managment	https://training.galaxyproject.org//topics/admin/tutorials/users-groups-quotas/slides.html			2018-01-07	2024-08-08	19	False	True	True	False				0		3058712	7867576	2.3333333333333335	0
Galaxy Server administration	Distributed Object Storage	https://training.galaxyproject.org//topics/admin/tutorials/object-store/tutorial.html			2019-01-28	2025-03-24	28	True	True	True	False				0		3060074	7869706	3.9	0
Galaxy Server administration	Galaxy Interactive Tools	https://training.galaxyproject.org//topics/admin/tutorials/interactive-tools/tutorial.html			2020-02-27	2025-11-27	28	True	True	True	False				0		3061043	7871074	4.966666666666667	0
Galaxy Server administration	Gearing towards production	https://training.galaxyproject.org//topics/admin/tutorials/production/slides.html			2019-01-28	2025-11-20	11	False	True	True	False				0		3058712	7867577	2.3333333333333335	0
Galaxy Server administration	Data Libraries	https://training.galaxyproject.org//topics/admin/tutorials/data-library/tutorial.html			2021-01-14	2025-11-24	35	True	True	True	False				0		3042503	7804443	4.366666666666666	0
Galaxy Server administration	Server Maintenance: Cleanup, Backup, and Restoration	https://training.galaxyproject.org//topics/admin/tutorials/backup-cleanup/tutorial.html	Database management, Informatics, Data management		2019-01-31	2025-11-24	10	True	True	True	False				0		3059305	7868368	11.166666666666666	0
Galaxy Server administration	Running Jobs on Remote Resources with Pulsar	https://training.galaxyproject.org//topics/admin/tutorials/pulsar/tutorial.html			2019-01-28	2025-11-25	58	True	True	True	False				0		3061287	7871806	5.183333333333334	0
Galaxy Server administration	Ansible	https://training.galaxyproject.org//topics/admin/tutorials/ansible/tutorial.html			2018-07-11	2024-08-08	48	True	True	True	False				0		3065182	7879128	4.016666666666667	0
Galaxy Server administration	Docker and Galaxy	https://training.galaxyproject.org//topics/admin/tutorials/galaxy-docker/slides.html			2016-09-29	2022-10-18	16	False	True	False	False				0		3058712	7867579	2.3333333333333335	0
Galaxy Server administration	uWSGI	https://training.galaxyproject.org//topics/admin/tutorials/uwsgi/slides.html			2019-01-28	2022-03-01	9	False	True	False	False				0		3058712	7867579	2.3333333333333335	0
Galaxy Server administration	Galaxy from an administrator's point of view	https://training.galaxyproject.org//topics/admin/tutorials/introduction/slides.html			2017-06-12	2024-06-25	6	False	True	False	False				0		3058712	7867579	2.3333333333333335	0
Galaxy Server administration	Galaxy Troubleshooting	https://training.galaxyproject.org//topics/admin/tutorials/troubleshooting/slides.html			2019-01-28	2024-06-25	15	False	True	False	False				0		3058712	7867579	2.3333333333333335	0
Galaxy Server administration	External Authentication	https://training.galaxyproject.org//topics/admin/tutorials/external-auth/tutorial.html			2019-01-28	2022-10-18	14	True	True	False	False				0		3059420	7868689	3.1166666666666667	0
Galaxy Server administration	Galactic Database	https://training.galaxyproject.org//topics/admin/tutorials/database/slides.html			2019-01-28	2025-11-20	6	False	True	True	False				0		3058712	7867579	2.3333333333333335	0
Galaxy Server administration	Controlling Galaxy with systemd or Supervisor	https://training.galaxyproject.org//topics/admin/tutorials/systemd-supervisor/slides.html			2019-01-28	2023-04-16	5	False	True	True	False				0		3058712	7867579	2.3333333333333335	0
Galaxy Server administration	Galaxy Monitoring	https://training.galaxyproject.org//topics/admin/tutorials/general-monitoring/slides.html			2019-04-26	2022-03-01	5	False	True	False	False				0		3058712	7867579	2.3333333333333335	0
Galaxy Server administration	Galaxy Administrator Time Burden and Technology Usage	https://training.galaxyproject.org//topics/admin/tutorials/poll-ssa/slides.html			2024-07-10	2024-07-10	1	False	True	False	False				0		1042714	2271664	1.9833333333333334	0
Galaxy Server administration	Server: Other	https://training.galaxyproject.org//topics/admin/tutorials/stuff/slides.html			2018-01-07	2023-02-17	6	False	True	False	False				0		3058712	7867579	2.3333333333333335	0
Galaxy Server administration	Reference Data with Data Managers	https://training.galaxyproject.org//topics/admin/tutorials/reference-genomes/tutorial.html		Sequence alignment, Genome indexing, Read mapping, Generation	2019-01-28	2023-04-21	7	True	True	False	False	bwa_mem_index_builder_data_manager, data_manager_fetch_genome_all_fasta_dbkey, bwa			0		3059293	7868335	6.55	0
Galaxy Server administration	Advanced customisation of a Galaxy instance	https://training.galaxyproject.org//topics/admin/tutorials/advanced-galaxy-customisation/slides.html			2017-06-27	2023-04-17	18	False	True	False	False				0		3058712	7867579	2.3333333333333335	0
Galaxy Server administration	Setting up Celery Workers for Galaxy	https://training.galaxyproject.org//topics/admin/tutorials/celery/tutorial.html			2022-07-16	2025-11-24	19	True	True	False	False				0		2203515	5047080	3.75	0
Galaxy Server administration	Empathy	https://training.galaxyproject.org//topics/admin/tutorials/empathy/slides.html			2019-01-31	2021-04-06	4	False	True	False	False				0		3058712	7867579	2.3333333333333335	0
Galaxy Server administration	Deploying a Beacon v1 in Galaxy	https://training.galaxyproject.org//topics/admin/tutorials/beacon/tutorial.html			2023-04-16	2025-11-22	7	True	False	False	False				0		153	171	1.9	0
Galaxy Server administration	Configuring the Onedata connectors (remotes, Object Store, BYOS, BYOD)	https://training.galaxyproject.org//topics/admin/tutorials/onedata-configuration/tutorial.html			2025-03-24	2025-04-08	2	True	False	False	False				0		51	56	3.55	0
Galaxy Server administration	Enable upload via FTP	https://training.galaxyproject.org//topics/admin/tutorials/ftp/tutorial.html			2021-06-18	2025-11-24	28	True	False	False	False				0		1253	1714	1.6166666666666667	0
Galaxy Server administration	Upgrading Galaxy	https://training.galaxyproject.org//topics/admin/tutorials/upgrading/tutorial.html			2021-06-08	2024-11-25	10	True	False	True	False				0		719	1099	2.8833333333333333	0
Galaxy Server administration	Create a subdomain for your community on UseGalaxy.eu	https://training.galaxyproject.org//topics/admin/tutorials/subdomain/tutorial.html			2024-11-27	2024-12-13	2	True	False	False	False				0		46	52	2.566666666666667	0
Galaxy Server administration	Performant Uploads with TUS	https://training.galaxyproject.org//topics/admin/tutorials/tus/tutorial.html			2022-03-01	2025-11-22	22	True	False	True	False				0		883	1289	5.483333333333333	0
Galaxy Server administration	Monitoring Galaxy and Pulsar with Sentry	https://training.galaxyproject.org//topics/admin/tutorials/sentry/tutorial.html			2023-04-19	2025-11-25	12	True	False	False	False				0		230	278	1.4333333333333333	0
Galaxy Server administration	Galaxy Monitoring with Reports	https://training.galaxyproject.org//topics/admin/tutorials/reports/tutorial.html			2019-01-31	2025-11-24	47	True	False	False	False				0		506	673	2.7	0
Galaxy Server administration	How I learned to stop worrying and love the systemd	https://training.galaxyproject.org//topics/admin/tutorials/stop-worrying-love-systemd/tutorial.html			2022-07-06	2023-09-28	3	True	False	False	False				0		685	788	0.6166666666666667	0
Galaxy Server administration	Training Infrastructure as a Service (TIaaS)	https://training.galaxyproject.org//topics/admin/tutorials/tiaas/tutorial.html			2020-02-12	2025-11-24	45	True	False	True	False				0		557	742	3.183333333333333	0
Galaxy Server administration	Mapping Jobs to Destinations using TPV	https://training.galaxyproject.org//topics/admin/tutorials/job-destinations/tutorial.html			2021-01-17	2025-11-24	43	True	False	True	False				0		1703	2659	3.3666666666666667	0
Galaxy Server administration	Customizing the look of Galaxy (Manual)	https://training.galaxyproject.org//topics/admin/tutorials/customization-manual/tutorial.html			2023-04-16	2025-04-08	2	True	False	False	False				0		203	242	2.05	0
Galaxy Server administration	Customizing the look of Galaxy	https://training.galaxyproject.org//topics/admin/tutorials/customization/tutorial.html			2023-04-16	2025-11-22	8	True	False	False	False				0		597	728	4.416666666666667	0
Galaxy Server administration	Alternative Celery Deployment for Galaxy	https://training.galaxyproject.org//topics/admin/tutorials/celeryless/tutorial.html			2024-11-07	2024-11-07	1	True	False	False	False				0		67	73	2.5833333333333335	0
Galaxy Server administration	Use Apptainer containers for running Galaxy jobs	https://training.galaxyproject.org//topics/admin/tutorials/apptainer/tutorial.html			2021-01-08	2025-11-24	19	True	False	True	False				0		1094	1392	2.6166666666666667	0
Galaxy Server administration	Galaxy Database schema	https://training.galaxyproject.org//topics/admin/tutorials/database-schema/tutorial.html			2016-07-20	2025-04-08	23	True	False	False	False				0		3042	4967	1.0666666666666667	0
Galaxy Server administration	Adding file-sources to Galaxy	https://training.galaxyproject.org//topics/admin/tutorials/file_sources/tutorial.html			2025-01-20	2025-01-20	1	True	False	False	False				0		56	74	2.8333333333333335	0
Galaxy Server administration	Automation with Jenkins	https://training.galaxyproject.org//topics/admin/tutorials/jenkins/tutorial.html			2019-08-06	2022-10-18	10	True	False	False	False				0		8323	16472	0.7166666666666667	0
Galaxy Server administration	Reference Data with CVMFS without Ansible	https://training.galaxyproject.org//topics/admin/tutorials/cvmfs-manual/tutorial.html			2020-06-17	2023-11-23	9	True	False	False	False				0		403	540	2.4	0
Galaxy Server administration	Galaxy Installation on Kubernetes	https://training.galaxyproject.org//topics/admin/tutorials/k8s-deploying-galaxy/tutorial.html			2019-07-02	2024-06-30	7	True	False	False	False				0		1620	2671	2.2666666666666666	0
Galaxy Server administration	Managing Galaxy on Kubernetes	https://training.galaxyproject.org//topics/admin/tutorials/k8s-managing-galaxy/tutorial.html			2019-07-02	2024-12-19	7	True	False	False	False				0		675	985	2.1	0
Galaxy Server administration	Galaxy usage on SURF Research Cloud	https://training.galaxyproject.org//topics/admin/tutorials/surf-research-cloud-galaxy/tutorial.html	Informatics, Data management		2024-12-18	2025-08-05	4	True	False	False	False				0		78	97	1.65	0
Galaxy Server administration	Pulsar usage on SURF Research Cloud	https://training.galaxyproject.org//topics/admin/tutorials/surf-research-cloud-pulsar/tutorial.html	Informatics, Data management		2024-12-18	2024-12-19	3	True	False	False	False				0		68	76	0.5666666666666667	0
Galaxy Server administration	Deploying Wireguard for private mesh networking	https://training.galaxyproject.org//topics/admin/tutorials/wireguard/tutorial.html			2022-09-21	2024-12-19	4	True	False	False	False				0		1109	1263	0.3333333333333333	0
Galaxy Server administration	Deploying Tailscale/Headscale for private mesh networking	https://training.galaxyproject.org//topics/admin/tutorials/wireguard-headscale/tutorial.html	Data security, Software engineering		2022-09-21	2024-12-19	4	True	False	False	False				0		2374	3057	0.43333333333333335	0
Galaxy Server administration	Deploying a compute cluster in OpenStack via Terraform	https://training.galaxyproject.org//topics/admin/tutorials/terraform/tutorial.html			2018-10-27	2024-12-19	15	True	True	False	False				0		3074759	7897747	3.283333333333333	0
Image analysis using Deep Learning	Contribute to the BioImage.IO models	https://training.galaxyproject.org//topics/ai4life/tutorials/contribute-materials/slides.html			2023-05-18	2023-05-24	3	False	True	True	False			UseGalaxy.eu, UseGalaxy.org, UseGalaxy.org.au, UseGalaxy.fr	0		1695659	3759430	2.1333333333333333	0
Image analysis using Deep Learning	Welcome to the BioImage Model Zoo	https://training.galaxyproject.org//topics/ai4life/tutorials/welcome-bioimageio/slides.html			2023-05-11	2023-05-18	3	False	True	True	False			UseGalaxy.eu, UseGalaxy.org, UseGalaxy.org.au, UseGalaxy.fr	0		1709928	3791806	2.1333333333333333	0
Image analysis using Deep Learning	BioImage Model Zoo: Advanced models in one-click	https://training.galaxyproject.org//topics/ai4life/tutorials/getting-started/slides.html			2023-04-18	2023-05-24	4	False	True	True	False			UseGalaxy.eu, UseGalaxy.org, UseGalaxy.org.au, UseGalaxy.fr	0		1756875	3895203	2.1333333333333333	0
Assembly	An Introduction to Genome Assembly	https://training.galaxyproject.org//topics/assembly/tutorials/general-introduction/tutorial.html		Sequence composition calculation, Visualisation, Validation, Formatting, De-novo assembly, Statistical calculation, Sequence assembly validation, Sequencing quality control	2017-05-23	2024-09-12	29	True	True	True	True	quast, fastq_paired_end_interlacer, velveth, multiqc, velvetg, fastqc	Galaxy@AuBi, UseGalaxy.org (Main), UseGalaxy.org.au	UseGalaxy.be, UseGalaxy.cz, UseGalaxy.eu, UseGalaxy.fr	0		3094687	7926353	5.183333333333334	0
Assembly	Genome Assembly Quality Control	https://training.galaxyproject.org//topics/assembly/tutorials/assembly-quality-control/tutorial.html	Biodiversity, Sequence assembly, Data quality management	Scaffolding, Genome assembly, Sequence assembly validation, Phasing, Visualisation, k-mer counting, De-novo assembly	2022-08-26	2025-06-04	6	True	True	False	True	quast, chromeister, meryl, busco, merqury	UseGalaxy.eu, UseGalaxy.fr, UseGalaxy.org.au	UseGalaxy.cz	0		2158110	4913787	4.416666666666667	0
Assembly	Genome Assembly of MRSA from Oxford Nanopore MinION data (and optionally Illumina data)	https://training.galaxyproject.org//topics/assembly/tutorials/mrsa-nanopore/tutorial.html	Sequence assembly, Whole genome sequencing, Public health and epidemiology, Genomics, Microbiology, Antimicrobial resistance	Sequence assembly visualisation, Sequence alignment, Sequence composition calculation, Mapping assembly, Genome assembly, Box-Whisker plot plotting, Cross-assembly, Visualisation, Read mapping, Scatter plot plotting, Sequencing error detection, De-novo assembly, Statistical calculation, Sequence contamination filtering, Sequence assembly validation, Sequencing quality control, Filtering	2021-03-24	2024-11-29	15	True	False	False	True	quast, flye, bwa_mem2, porechop, fastp, CONVERTER_bz2_to_uncompressed, nanoplot, bandage_image, polypolish, upload1, filtlong, fastqc	UseGalaxy.eu	UseGalaxy.cz, UseGalaxy.fr	0		10498	15725	3.4166666666666665	0
Assembly	Large genome assembly and polishing	https://training.galaxyproject.org//topics/assembly/tutorials/largegenome/tutorial.html	Genomics, Sequence assembly, Biodiversity	Genome assembly, Visualisation, Sequence assembly validation, Box-Whisker plot plotting, Sequence assembly, Sequence assembly visualisation, Sequence composition calculation, Mapping assembly, Cross-assembly, Base-calling, Scatter plot plotting, Validation, De-novo assembly, Statistical calculation, Sequence contamination filtering, Sequencing quality control, Variant calling, Pairwise sequence alignment	2023-03-06	2025-06-04	14	True	False	True	True	quast, flye, barchart_gnuplot, racon, fastp, nanoplot, minimap2, bandage_image, meryl, medaka_consensus_pipeline, multiqc, fasta-stats, genomescope, busco, fastqc	UseGalaxy.eu, UseGalaxy.org.au	UseGalaxy.cz	0		7460	9674	2.0	0
Assembly	Hybrid genome assembly - Nanopore and Illumina	https://training.galaxyproject.org//topics/assembly/tutorials/hybrid_denovo_assembly/tutorial.html		Sequence alignment, Mapping assembly, Genome assembly, Read mapping, Cross-assembly, Visualisation, Validation, De-novo assembly, Read alignment, Analysis, Genome indexing, Sequence assembly validation, Sequence assembly, Sequencing quality control, Generation, Aggregation	2025-11-03	2025-11-06	2	True	False	False	True	quast, flye, unicycler, pilon, multiqc, bwa_mem, busco	UseGalaxy.cz, UseGalaxy.eu, UseGalaxy.fr, UseGalaxy.org (Main), UseGalaxy.org.au	GalaxyTrakr, UseGalaxy.be, UseGalaxy.no	0		149	197	2.3333333333333335	0
Assembly	ERGA post-assembly QC	https://training.galaxyproject.org//topics/assembly/tutorials/ERGA-post-assembly-QC/tutorial.html	Genomics, Sequence assembly, Biodiversity	Sequence assembly visualisation, Data deposition, Sequence alignment, Genome assembly, Phasing, Visualisation, Scaffolding, Genotyping, Sequence trimming, De-novo assembly, Data parsing, Sequence assembly validation, Data handling, Sequence alignment analysis, k-mer counting, Pairwise sequence alignment	2023-06-23	2025-06-04	8	True	False	True	True	__EXTRACT_DATASET__, samtools_stats, busco, collapse_dataset, bandage_image, CONVERTER_gz_to_uncompressed, meryl, blobtoolkit, smudgeplot, merqury, minimap2, interactive_tool_blobtoolkit, bg_diamond, bwa_mem2, pretext_snapshot, tp_find_and_replace, bellerophon, pretext_map, genomescope, gfastats	UseGalaxy.eu	UseGalaxy.org (Main), UseGalaxy.org.au	0		1992	2583	2.033333333333333	0
Assembly	Chloroplast genome assembly	https://training.galaxyproject.org//topics/assembly/tutorials/chloroplast-assembly/tutorial.html		Gene prediction, Sequence assembly visualisation, Sequence alignment, Mapping assembly, Genome assembly, Genome visualisation, Cross-assembly, Read mapping, Scatter plot plotting, De-novo assembly, Read alignment, Analysis, Genome indexing, Coding region prediction, Sequence assembly, Box-Whisker plot plotting, Generation, Genome annotation	2020-12-04	2025-05-15	21	True	False	True	True	flye, nanoplot, prokka, pilon, bandage_image, bandage_info, jbrowse, upload1, bwa_mem, fasta-stats	UseGalaxy.eu	UseGalaxy.be, UseGalaxy.cz, UseGalaxy.fr, UseGalaxy.no, UseGalaxy.org (Main)	0		8097	12597	2.8	0
Assembly	Assembly of the mitochondrial genome from PacBio HiFi reads	https://training.galaxyproject.org//topics/assembly/tutorials/mitochondrion-assembly/tutorial.html	Genomics, Sequence assembly, Biodiversity, Mitochondria		2024-09-03	2025-06-04	4	True	False	True	True	mitohifi, compress_file	UseGalaxy.cz, UseGalaxy.eu, UseGalaxy.org (Main), UseGalaxy.org.au		0		891	1082	1.8833333333333333	0
Assembly	Decontamination of a genome assembly	https://training.galaxyproject.org//topics/assembly/tutorials/assembly-decontamination/tutorial.html	Genomics, Sequence assembly, Biodiversity	Data handling, Taxonomic classification	2024-09-04	2025-06-04	5	True	False	True	True	Filter1, parse_mito_blast, kraken2, Cut1, tp_cat, ncbi_blastn_wrapper, ncbi_dustmasker_wrapper, tp_sed_tool, gfastats	UseGalaxy.eu, UseGalaxy.org (Main), UseGalaxy.org.au	UseGalaxy.cz	0		1681	2075	2.45	0
Assembly	Genome Assembly of a bacterial genome (MRSA) sequenced using Illumina MiSeq Data	https://training.galaxyproject.org//topics/assembly/tutorials/mrsa-illumina/tutorial.html	Sequence assembly, Whole genome sequencing, Public health and epidemiology, Genomics, Microbiology	Sequence assembly visualisation, Sequence composition calculation, Genome assembly, Read mapping, Visualisation, Statistical calculation, Sequence contamination filtering, Sequence assembly validation, Sequencing quality control	2021-03-24	2025-11-18	17	True	False	True	True	quast, shovill, falco, fastp, bandage_image, bandage_info, upload1, fastqc	UseGalaxy.be, UseGalaxy.cz, UseGalaxy.eu, UseGalaxy.fr, UseGalaxy.org (Main)		0		10239	15724	3.566666666666667	0
Assembly	Assembly of metagenomic sequencing data	https://training.galaxyproject.org//topics/assembly/tutorials/metagenomics-assembly/tutorial.html	Metagenomics, Sequence assembly	Sequence assembly visualisation, Sequence composition calculation, Genome assembly, Read mapping, Visualisation, Formatting, Local alignment, Read pre-processing, Sequence trimming, Sequence alignment analysis, Primer removal, Statistical calculation, Sequence contamination filtering, Sequence assembly validation, Sequencing quality control, Variant calling, Data handling, Sequence file editing	2025-11-30	2025-11-30	0	True	False	True	True	collection_column_join, filter_tabular, quast, cutadapt, bamtools, megahit_contig2fastg, tp_cat, seqtk_subseq, fastqc, ngsutils_bam_filter, bandage_image, bowtie2, megahit, bandage_info, metaspades, bg_uniq, random_lines1, coverm_contig		UseGalaxy.cz, UseGalaxy.eu	0		1	3	0.0	0
Assembly	De Bruijn Graph Assembly	https://training.galaxyproject.org//topics/assembly/tutorials/debruijn-graph-assembly/tutorial.html		Optimisation and refinement, Genome assembly, Sequence assembly	2017-05-24	2024-02-01	25	True	True	False	True	spades, velvetoptimiser, fasta-stats	Galaxy@AuBi, UseGalaxy.be, UseGalaxy.eu, UseGalaxy.no, UseGalaxy.org (Main), UseGalaxy.org.au	UseGalaxy.cz	0		3065361	7877999	4.983333333333333	0
Assembly	Unicycler Assembly	https://training.galaxyproject.org//topics/assembly/tutorials/unicycler-assembly/tutorial.html	Sequence assembly, Genomics, Microbiology	Gene prediction, Sequence composition calculation, Genome assembly, Visualisation, Validation, Statistical calculation, Aggregation, Coding region prediction, Sequence assembly validation, Sequencing quality control, Genome annotation	2017-10-11	2025-05-15	24	True	True	False	True	quast, unicycler, prokka, multiqc, fastqc	UseGalaxy.eu, UseGalaxy.org (Main), UseGalaxy.org.au	Galaxy@AuBi, GalaxyTrakr, MISSISSIPPI, UseGalaxy.be, UseGalaxy.cz, UseGalaxy.fr, UseGalaxy.no	0		3071799	7889815	4.4	0
Assembly	Unicycler assembly of SARS-CoV-2 genome with preprocessing to remove human genome reads	https://training.galaxyproject.org//topics/assembly/tutorials/assembly-with-preprocessing/tutorial.html		Sequence assembly visualisation, Genome assembly, Read mapping, Validation, Scatter plot plotting, Sequence contamination filtering, Pairwise sequence alignment, Sequencing quality control, Box-Whisker plot plotting, Data handling, Aggregation, Sequence file editing	2020-04-21	2025-05-15	14	True	True	True	True	samtools_view, seqtk_sample, fasterq_dump, __ZIP_COLLECTION__, unicycler, samtools_stats, fastp, nanoplot, minimap2, bandage_image, collapse_dataset, bowtie2, multiqc, bandage_info, fasta_filter_by_length, samtools_fastx	UseGalaxy.eu, UseGalaxy.org.au	Galaxy@AuBi, MISSISSIPPI, UseGalaxy.be, UseGalaxy.cz, UseGalaxy.fr, UseGalaxy.no, UseGalaxy.org (Main)	0		3064780	7877580	5.533333333333333	0
Assembly	Vertebrate genome assembly using HiFi, Bionano and Hi-C data - Step by Step	https://training.galaxyproject.org//topics/assembly/tutorials/vgp_genome_assembly/tutorial.html	Genomics, Sequence assembly, Biodiversity	Sequence alignment, Genome assembly, Phasing, Scaffolding, Visualisation, Mapping, Read pre-processing, Sequence trimming, De-novo assembly, Primer removal, Sequence assembly validation, Read binning, Data handling, k-mer counting, Pairwise sequence alignment	2021-06-04	2025-06-04	57	True	False	True	True	collection_column_join, quast, cutadapt, Convert characters1, salsa, bedtools_bamtobed, busco, hifiasm, tp_cut_tool, collapse_dataset, gfa_to_fa, meryl, merqury, tp_grep_tool, sort1, yahs, purge_dups, minimap2, Add_a_column1, bionano_scaffold, bwa_mem2, pretext_snapshot, cat1, tp_find_and_replace, bellerophon, pretext_map, genomescope, gfastats		UseGalaxy.cz	0		15996	24106	1.9666666666666666	0
Assembly	Genome assembly using PacBio data	https://training.galaxyproject.org//topics/assembly/tutorials/hifi-assembly/tutorial.html	Genomics, Sequence assembly, Biodiversity	Mapping assembly, Genome assembly, Sequence assembly validation, Cross-assembly, Visualisation, De-novo assembly	2021-11-29	2025-06-04	2	True	False	False	True	quast, flye, gfa_to_fa, busco, hifiasm, fasta-stats	UseGalaxy.eu, UseGalaxy.fr, UseGalaxy.org (Main), UseGalaxy.org.au	UseGalaxy.cz, UseGalaxy.no	0		852	1000	1.5	0
