Proteomics	MaxQuant and MSstats for the analysis of label-free data	https://training.galaxyproject.org//topics/proteomics/tutorials/maxquant-msstats-dda-lfq/tutorial.html		Differential protein expression profiling, Imputation, Principal component plotting, Protein quantification, Clustering, Visualisation, Heat map generation, Tag-based peptide identification, Standardisation and normalisation, Statistical calculation, Spectrum calculation	2021-02-17	2025-09-22	19	True	False	True	True	Filter1, datamash_ops, uniprot, msstats, Grep1, Summary_Statistics1, tp_replace_in_column, ggplot2_heatmap2, tp_easyjoin_tool, Cut1, fasta2tab, maxquant		UseGalaxy.cz, UseGalaxy.eu, UseGalaxy.no, UseGalaxy.org (Main), UseGalaxy.org.au	0		8522	13705	2.65	0
Proteomics	Neoantigen 3: PepQuery2 Verification	https://training.galaxyproject.org//topics/proteomics/tutorials/neoantigen-peptide-verification/tutorial.html		Filtering, Formatting	2025-01-14	2025-12-03	4	True	False	False	False	ncbi_blastp_wrapper, pepquery2, query_tabular, msconvert, tab2fasta	UseGalaxy.eu, UseGalaxy.org (Main), UseGalaxy.org.au	UseGalaxy.cz	0		61	69	1.9333333333333333	0
Proteomics	Annotating a protein list identified by LC-MS/MS experiments	https://training.galaxyproject.org//topics/proteomics/tutorials/proteome_annotation/tutorial.html			2019-09-12	2024-06-14	11	True	False	True	True	IDconverter, reactome_analysis, cluter_profiler, rna_abbased_data, MQoutputfilter, retrieve_from_hpa, Jvenn		UseGalaxy.be, UseGalaxy.fr	0		3087	4480	2.7666666666666666	0
Proteomics	DIA Analysis using OpenSwathWorkflow	https://training.galaxyproject.org//topics/proteomics/tutorials/DIA_Analysis_OSW/tutorial.html		Filtering, Formatting	2020-12-02	2025-05-20	12	True	False	False	True	pyprophet_merge, pyprophet_protein, pyprophet_score, pyprophet_peptide, Grep1, OpenSwathWorkflow, pyprophet_export, msconvert	UseGalaxy.eu	UseGalaxy.cz, UseGalaxy.no, UseGalaxy.org.au	0		3233	4601	2.533333333333333	0
Proteomics	EncyclopeDIA	https://training.galaxyproject.org//topics/proteomics/tutorials/encyclopedia/tutorial.html		Filtering, Formatting	2021-06-21	2025-05-19	12	True	False	True	True	msconvert, encyclopedia_quantify, encyclopedia_searchtolib		UseGalaxy.cz, UseGalaxy.eu, UseGalaxy.org (Main), UseGalaxy.org.au	0		2002	2723	1.7666666666666666	0
Proteomics	Peptide and Protein ID using SearchGUI and PeptideShaker	https://training.galaxyproject.org//topics/proteomics/tutorials/protein-id-sg-ps/tutorial.html			2017-06-12	2025-04-08	28	True	False	False	True	PeakPickerHiRes, FileConverter, search_gui, peptide_shaker, Grep1			0		3154	5035	1.8833333333333333	0
Proteomics	Peptide and Protein ID using OpenMS tools	https://training.galaxyproject.org//topics/proteomics/tutorials/protein-id-oms/tutorial.html		Filtering, Formatting	2017-10-16	2025-04-08	32	True	False	False	True	PeakPickerHiRes, FidoAdapter, TextExporter, ConsensusID, IDFilter, IDScoreSwitcher, Grep1, MSGFPlusAdapter, FileInfo, FalseDiscoveryRate, PeptideIndexer, msconvert, IDPosteriorErrorProbability, IDMerger, XTandemAdapter		UseGalaxy.cz, UseGalaxy.eu, UseGalaxy.no, UseGalaxy.org.au	0		3548	5953	2.8833333333333333	0
Proteomics	Clinical Metaproteomics 5: Data Interpretation	https://training.galaxyproject.org//topics/proteomics/tutorials/clinical-mp-5-data-interpretation/tutorial.html		Prediction and recognition, Visualisation	2024-02-06	2025-08-10	4	True	False	True	True	Grep1, msstatstmt, unipept	UseGalaxy.cz, UseGalaxy.eu, UseGalaxy.org (Main), UseGalaxy.org.au		0		282	372	2.6333333333333333	0
Proteomics	Neoantigen 1b: Non-Reference-Database-Generation	https://training.galaxyproject.org//topics/proteomics/tutorials/neoantigen-non-reference-database-generation/tutorial.html		Variant calling, Transcriptome assembly, Sequence annotation, Statistical calculation, Sequence alignment, RNA-Seq analysis	2025-01-14	2025-12-03	6	True	False	False	False	custom_pro_db, hisat2, stringtie, bed_to_protein_map, fasta_merge_files_and_filter_unique_sequences, translate_bed, concatenate, regexColumn1, CONVERTER_gz_to_uncompressed, column_regex_find_and_replace, freebayes, gffcompare, gffcompare_to_bed, sqlite_to_tabular, fasta2tab, tab2fasta			0		87	97	0.43333333333333335	0
Proteomics	Multiomics data analysis using MultiGSEA	https://training.galaxyproject.org//topics/proteomics/tutorials/multiGSEA-tutorial/tutorial.html		Gene-set enrichment analysis, Aggregation, Pathway analysis	2025-03-10	2025-03-11	2	True	False	False	True	Filter1, tp_grep_tool, multigsea	UseGalaxy.eu	UseGalaxy.cz, UseGalaxy.org.au	0		292	321	1.4166666666666667	0
Proteomics	Metaproteomics tutorial	https://training.galaxyproject.org//topics/proteomics/tutorials/metaproteomics/tutorial.html	Proteomics, Proteogenomics, Biodiversity, Taxonomy	Prediction and recognition, Visualisation	2017-06-28	2024-06-14	41	True	False	True	True	search_gui, peptide_shaker, query_tabular, sqlite_to_tabular, unipept	UseGalaxy.eu, UseGalaxy.no, UseGalaxy.org (Main), UseGalaxy.org.au	UseGalaxy.be, UseGalaxy.cz	0		2916	4634	2.7	0
Proteomics	Clinical Metaproteomics 3: Verification	https://training.galaxyproject.org//topics/proteomics/tutorials/clinical-mp-3-verification/tutorial.html			2024-02-06	2025-08-10	7	True	False	True	True	uniprotxml_downloader, Filter1, fasta_merge_files_and_filter_unique_sequences, Grouping1, tp_cat, dbbuilder, Remove beginning1, collapse_dataset, pepquery2, query_tabular, Cut1	UseGalaxy.cz, UseGalaxy.eu	UseGalaxy.org (Main), UseGalaxy.org.au	0		206	272	3.7666666666666666	0
Proteomics	Peptide and Protein Quantification via Stable Isotope Labelling (SIL)	https://training.galaxyproject.org//topics/proteomics/tutorials/protein-quant-sil/tutorial.html			2017-03-17	2025-04-08	32	True	False	False	True	FeatureFinderMultiplex, FidoAdapter, MultiplexResolver, IDConflictResolver, TextExporter, IDScoreSwitcher, ProteinQuantifier, Grep1, Summary_Statistics1, FileInfo, IDMapper, FalseDiscoveryRate, PeptideIndexer, histogram_rpy, IDPosteriorErrorProbability, XTandemAdapter, tp_tail_tool	UseGalaxy.eu	UseGalaxy.cz, UseGalaxy.no, UseGalaxy.org.au	0		1365	1904	1.5333333333333334	0
Proteomics	Peptide Library Data Analysis	https://training.galaxyproject.org//topics/proteomics/tutorials/peptide-library-data-analysis/tutorial.html			2021-01-22	2023-11-09	5	True	False	False	True	pdaug_addclasslabel, pdaug_sequence_property_based_descriptors, pdaug_peptide_sequence_analysis, pdaug_basic_plots, pdaug_merge_dataframes, pdaug_tsvtofasta, pdaug_fishers_plot, pdaug_peptide_data_access	UseGalaxy.be		0		747	1012	2.316666666666667	0
Proteomics	MaxQuant and MSstats for the analysis of TMT data	https://training.galaxyproject.org//topics/proteomics/tutorials/maxquant-msstats-tmt/tutorial.html		Imputation, Principal component plotting, Protein quantification, Clustering, Visualisation, Heat map generation, Standardisation and normalisation, Statistical calculation	2021-08-13	2025-01-08	11	True	False	False	True	msstatstmt, maxquant	UseGalaxy.eu, UseGalaxy.org.au	UseGalaxy.cz, UseGalaxy.org (Main)	0		4286	5722	1.6333333333333333	0
Proteomics	Secretome Prediction	https://training.galaxyproject.org//topics/proteomics/tutorials/secretome-prediction/tutorial.html			2017-04-13	2025-04-08	15	True	False	False	True	tp_sorted_uniq, Convert characters1, Filter1, uniprot, bg_uniq, get_subontology_from, tp_cut_tool, Grep1, tp_easyjoin_tool, comp1, wolf_psort, term_id_vs_term_name			0		652	971	1.4666666666666666	0
Proteomics	metaQuantome 2: Function	https://training.galaxyproject.org//topics/proteomics/tutorials/metaquantome-function/tutorial.html	Proteomics, Proteogenomics, Metatranscriptomics, Microbial ecology, Metagenomics	Statistical inference, Query and retrieval, Quantification, Principal component visualisation, Functional clustering, Differential protein expression analysis, Visualisation, Heat map generation, Indexing, Filtering	2020-10-29	2024-03-15	14	True	False	False	True	metaquantome_db, metaquantome_viz, metaquantome_sample, metaquantome_filter, metaquantome_expand, metaquantome_stat	UseGalaxy.be, UseGalaxy.eu	UseGalaxy.cz, UseGalaxy.fr, UseGalaxy.no, UseGalaxy.org.au	0		421	592	4.166666666666667	0
Proteomics	metaQuantome 1: Data creation	https://training.galaxyproject.org//topics/proteomics/tutorials/metaquantome-data-creation/tutorial.html	Proteomics, Proteogenomics, Biodiversity, Taxonomy	Visualisation, Filtering, Formatting, Prediction and recognition, Label-free quantification	2020-10-16	2024-03-14	20	True	False	False	True	search_gui, Filter1, peptide_shaker, regex1, flashlfq, Remove beginning1, tp_replace_in_line, Grep1, tp_replace_in_column, query_tabular, Cut1, msconvert, unipept	UseGalaxy.eu	UseGalaxy.cz, UseGalaxy.no, UseGalaxy.org.au	0		892	1506	3.7333333333333334	0
Proteomics	Single Cell Proteomics data analysis with bioconductor-scp	https://training.galaxyproject.org//topics/proteomics/tutorials/bioconductor-scp/tutorial.html		Visualisation, Expression analysis	2025-02-07	2025-02-10	2	True	False	False	False	Grouping1, bioconductor_scp	UseGalaxy.eu, UseGalaxy.org.au		0		229	283	0.9833333333333333	0
Proteomics	Clinical Metaproteomics 1: Database-Generation	https://training.galaxyproject.org//topics/proteomics/tutorials/clinical-mp-1-database-generation/tutorial.html		Protein identification, Tag-based peptide identification, Target-Decoy, Expression analysis, de Novo sequencing	2024-02-06	2025-07-30	7	True	False	True	True	uniprotxml_downloader, dbbuilder, fasta_merge_files_and_filter_unique_sequences, metanovo	UseGalaxy.cz, UseGalaxy.eu, UseGalaxy.org.au	UseGalaxy.org (Main)	0		592	892	3.8666666666666667	0
Proteomics	Introduction to proteomics, protein identification, quantification and statistical modelling	https://training.galaxyproject.org//topics/proteomics/tutorials/introduction/slides.html			2017-12-01	2024-08-08	3	False	True	True	False			UseGalaxy.eu, UseGalaxy.org, UseGalaxy.org.au, UseGalaxy.fr	0		3076989	7899321	2.3333333333333335	0
Proteomics	Label-free versus Labelled - How to Choose Your Quantitation Method	https://training.galaxyproject.org//topics/proteomics/tutorials/labelfree-vs-labelled/tutorial.html			2017-03-17	2025-05-27	18	True	False	False	False			UseGalaxy.eu, UseGalaxy.org, UseGalaxy.org.au, UseGalaxy.fr	0		7687	12402	0.9	0
Sequence analysis	Mapping	https://training.galaxyproject.org//topics/sequence-analysis/tutorials/mapping/tutorial.html	Mapping	Sequence trimming, Primer removal, Read mapping, Statistical calculation, Validation, Sequencing quality control, Read pre-processing, Data handling, Sequence alignment analysis, Sequence composition calculation, Genome visualisation	2016-10-04	2025-03-31	43	True	True	True	True	bowtie2, samtools_stats, jbrowse, multiqc, bamFilter, fastqc, trim_galore	UseGalaxy.eu, UseGalaxy.org (Main), UseGalaxy.org.au	Galaxy@AuBi, GalaxyTrakr, UseGalaxy.be, UseGalaxy.cz, UseGalaxy.fr, UseGalaxy.no	0		3142832	8009456	5.083333333333333	0
Sequence analysis	Clean and manage Sanger sequences from raw files to aligned consensus	https://training.galaxyproject.org//topics/sequence-analysis/tutorials/Manage_AB1_Sanger/tutorial.html		Sequence file editing, Sequence clustering, Phylogenetic analysis, Sequencing quality control, Visualisation, Demultiplexing, Data handling, Sequence read processing, DNA barcoding, Taxonomic classification	2024-01-08	2024-03-05	2	True	False	False	True	filter_by_fasta_ids, seqtk_trimfq, mothur_degap_seqs, __FILTER_FROM_FILE__, seqtk_mergepe, qiime_align_seqs, unzip, aligned_to_consensus, __SORTLIST__, cshl_fastx_reverse_complement, cshl_fastq_to_fasta, ab1_fastq_converter, fastq_masker_by_quality, ncbi_blastn_wrapper, tab2fasta, collection_element_identifiers, fastq_groomer, regex1, fastq_to_tabular, mothur_merge_files	UseGalaxy.cz, UseGalaxy.eu, UseGalaxy.fr		0		3365	4210	1.6833333333333333	0
Sequence analysis	Primer and primer scheme design for pan-specific detection and sequencing of viral pathogens across genotypes	https://training.galaxyproject.org//topics/sequence-analysis/tutorials/viral_primer_design/tutorial.html		Multiple sequence alignment, Global alignment, Sequence analysis, Local alignment, Sequence alignment analysis, Sequence alignment, PCR primer design	2025-03-20	2025-11-20	3	True	False	False	True	ncbi_makeblastdb, split_file_to_collection, fasta_compute_length, rbc_mafft, varvamp, EMBOSS: degapseq20	UseGalaxy.eu		0		612	709	1.0	0
Sequence analysis	Quality Control	https://training.galaxyproject.org//topics/sequence-analysis/tutorials/quality-control/tutorial.html		Sequence trimming, Primer removal, Box-Whisker plot plotting, Scatter plot plotting, Validation, Sequencing quality control, Read pre-processing, Statistical calculation, Sequence composition calculation	2016-10-04	2025-03-29	48	True	True	True	True	multiqc, fastqe, cutadapt, pycoqc, fastqc, nanoplot	UseGalaxy.eu, UseGalaxy.org (Main), UseGalaxy.org.au	Galaxy@AuBi, UseGalaxy.cz, UseGalaxy.fr	0		3184294	8094376	5.35	0
Sequence analysis	Screening assembled genomes for contamination using NCBI FCS	https://training.galaxyproject.org//topics/sequence-analysis/tutorials/ncbi-fcs/tutorial.html		Sequence trimming, Sequence assembly validation, Sequence contamination filtering	2024-04-16	2024-04-16	2	True	False	False	True	ncbi_fcs_adaptor, ncbi_fcs_gx	UseGalaxy.eu, UseGalaxy.org (Main)		0		1858	2516	2.283333333333333	0
Sequence analysis	Quality and contamination control in bacterial isolate using Illumina MiSeq Data	https://training.galaxyproject.org//topics/sequence-analysis/tutorials/quality-contamination-control/tutorial.html	Whole genome sequencing, Genomics, Microbiology, Microbial ecology	Sequencing quality control, Visualisation, Read mapping, Statistical calculation, Taxonomic classification, Cross-assembly, Expression analysis, Sequence contamination filtering	2024-07-15	2025-03-20	4	True	False	True	True	kraken2, falco, fastp, recentrifuge, upload1, est_abundance	UseGalaxy.eu, UseGalaxy.fr	GalaxyTrakr, UseGalaxy.cz, UseGalaxy.org (Main)	0		1654	2198	2.6666666666666665	0
Single Cell	Bulk RNA Deconvolution with MuSiC	https://training.galaxyproject.org//topics/single-cell/tutorials/bulk-music/tutorial.html			2022-02-11	2025-02-14	10	True	False	True	True	music_inspect_eset, music_construct_eset, music_deconvolution	UseGalaxy.cz, UseGalaxy.eu, UseGalaxy.org (Main), UseGalaxy.org.au		0		3977	5016	1.5833333333333333	0
Single Cell	Generating a single cell matrix using Alevin	https://training.galaxyproject.org//topics/single-cell/tutorials/scrna-case_alevin/tutorial.html		Gene expression analysis, Sequence composition calculation, RNA-Seq quantification	2021-03-03	2025-11-18	25	True	False	True	True	dropletutils_empty_drops, _ensembl_gtf2gene_list, anndata_manipulate, sceasy_convert, _dropletBarcodePlot, join1, dropletutils_read_10x, anndata_inspect, _salmon_kallisto_mtx_to_10x, Cut1, alevin	UseGalaxy.eu, UseGalaxy.fr, UseGalaxy.org (Main), UseGalaxy.org.au		0		3483	5282	3.45	0
Single Cell	Converting between common single cell data formats	https://training.galaxyproject.org//topics/single-cell/tutorials/scrna-data-ingest/tutorial.html		Community profiling, Loading	2024-02-13	2025-03-11	4	True	False	False	True	tabular_to_fastq, datamash_transpose, Filter1, sceasy_convert, monocle3_create, regexColumn1, join1, tp_cut_tool, fastq_to_tabular, dropletutils_read_10x, anndata_inspect, Cut1, scanpy_filter_cells, anndata_ops, seurat_read10x, dropletutils, tp_tail_tool		UseGalaxy.org (Main)	0		2584	3066	1.2833333333333334	0
Single Cell	Pre-processing of 10X Single-Cell RNA Datasets	https://training.galaxyproject.org//topics/single-cell/tutorials/scrna-preprocessing-tenx/tutorial.html		Validation, Sequencing quality control, Loading, Sequence alignment, Community profiling	2019-09-11	2025-04-29	13	True	False	True	True	multiqc, rna_starsolo, dropletutils	UseGalaxy.eu, UseGalaxy.org (Main), UseGalaxy.org.au	UseGalaxy.be, UseGalaxy.cz, UseGalaxy.fr, UseGalaxy.no	0		12590	16273	1.8666666666666667	0
Single Cell	Pre-processing of Single-Cell RNA Data	https://training.galaxyproject.org//topics/single-cell/tutorials/scrna-preprocessing/tutorial.html		Validation, Sequencing quality control, Data handling, RNA-Seq quantification, Read summarisation, Sequence alignment analysis, Sequence alignment	2019-02-22	2025-04-08	5	True	True	False	True	collection_column_join, multiqc, rna_star, bamFilter, umi_tools_count, __FLATTEN__, tp_sed_tool, umi_tools_extract, featurecounts, samtools_stats	UseGalaxy.eu	UseGalaxy.be, UseGalaxy.cz, UseGalaxy.fr, UseGalaxy.no, UseGalaxy.org (Main), UseGalaxy.org.au	0		3083405	7907675	4.616666666666666	0
Single Cell	Pseudobulk Analysis with Decoupler and EdgeR	https://training.galaxyproject.org//topics/single-cell/tutorials/pseudobulk-analysis/tutorial.html		Expression profile clustering, Differential gene expression analysis, Principal component visualisation	2025-02-12	2025-05-09	8	True	False	True	True	anndata_manipulate, volcanoplot, __EXTRACT_DATASET__, decoupler_pseudobulk, scanpy_filter, tp_replace_in_line, column_remove_by_header, tp_replace_in_column, tp_awk_tool, anndata_inspect, edger	UseGalaxy.eu, UseGalaxy.fr, UseGalaxy.org (Main), UseGalaxy.org.au		0		1582	1820	0.6333333333333333	0
Single Cell	Single-cell quality control with scater	https://training.galaxyproject.org//topics/single-cell/tutorials/scrna-scater-qc/tutorial.html		Sequencing quality control, Read pre-processing, Sequence visualisation	2019-10-23	2025-02-14	6	True	False	False	True	scater_plot_dist_scatter, scater_filter, scater_plot_pca, scater_create_qcmetric_ready_sce	UseGalaxy.be, UseGalaxy.eu, UseGalaxy.no, UseGalaxy.org.au	UseGalaxy.cz	0		708	799	0.7166666666666667	0
Single Cell	GO Enrichment Analysis on Single-Cell RNA-Seq Data	https://training.galaxyproject.org//topics/single-cell/tutorials/GO-enrichment/tutorial.html		Gene-set enrichment analysis	2024-09-17	2025-04-08	8	True	True	False	True	goenrichment, gprofiler_gost, tp_split_on_column, Cut1	UseGalaxy.cz, UseGalaxy.eu, UseGalaxy.no, UseGalaxy.org (Main)		0		967169	2073285	2.716666666666667	0
Single Cell	Pre-processing of 10X Single-Cell ATAC-seq Datasets	https://training.galaxyproject.org//topics/single-cell/tutorials/scatac-preprocessing-tenx/tutorial.html		Read mapping, Differential gene expression analysis, Imputation, Genome indexing, Principal component visualisation, Mapping, Gene regulatory network analysis, Sequencing quality control, Visualisation, Expression profile clustering, Generation, Sequence composition calculation, Statistical calculation, Sequence alignment, Enrichment analysis, Peak calling	2023-04-24	2025-10-16	10	True	False	False	True	tp_sorted_uniq, bedtools_sortbed, episcanpy_build_matrix, sinto_barcode, sinto_fragments, falco, episcanpy_preprocess, anndata_inspect, bwa_mem, scanpy_plot, fastqc, macs2_callpeak	UseGalaxy.org (Main), UseGalaxy.org.au	UseGalaxy.cz	0		6020	7080	1.0833333333333333	0
Single Cell	An introduction to scRNA-seq data analysis	https://training.galaxyproject.org//topics/single-cell/tutorials/scrna-intro/slides.html			2021-01-29	2025-02-13	8	False	True	True	False			UseGalaxy.eu, UseGalaxy.org, UseGalaxy.org.au, UseGalaxy.fr	0		3044560	7785281	2.3333333333333335	0
Single Cell	Generating a single cell matrix using Alevin and combining datasets (bash + R)	https://training.galaxyproject.org//topics/single-cell/tutorials/alevin-commandline/tutorial.html			2023-12-08	2025-04-22	5	True	False	False	False			UseGalaxy.eu, UseGalaxy.org, UseGalaxy.org.au, UseGalaxy.fr	0		618	854	3.6333333333333333	0
Single Cell	Removing the effects of the cell cycle	https://training.galaxyproject.org//topics/single-cell/tutorials/scrna-case_cell-cycle/tutorial.html		Expression profile clustering, Differential gene expression analysis, Principal component visualisation	2023-01-25	2025-03-11	14	True	False	False	True	addValue, anndata_manipulate, scanpy_cluster_reduce_dimension, scanpy_plot, scanpy_regress_variable, table_compute, scanpy_inspect, tp_easyjoin_tool, anndata_inspect, sort1, cat1			0		2114	2487	0.7666666666666667	0
Single Cell	Importing files from public atlases	https://training.galaxyproject.org//topics/single-cell/tutorials/EBI-retrieval/tutorial.html			2023-11-14	2025-03-11	8	True	False	True	True	sceasy_convert, scanpy_read_10x, regexColumn1, tp_grep_tool, hca_matrix_downloader, tp_find_and_replace, retrieve_scxa, anndata_ops, seurat_read10x			0		583	768	3.6	0
Single Cell	Single-cell ATAC-seq standard processing with SnapATAC2	https://training.galaxyproject.org//topics/single-cell/tutorials/scatac-standard-processing-snapatac2/tutorial.html		Essential dynamics, Differential gene expression analysis, Principal component visualisation, Read mapping, Genome indexing, Dimensionality reduction, Gene expression profiling, Expression profile clustering, Generation, Sequence alignment	2024-07-11	2025-07-02	5	True	False	False	True	snapatac2_clustering, anndata_manipulate, scanpy_normalize, snapatac2_plotting, scanpy_filter, scanpy_inspect, snapatac2_peaks_and_motif, Cut1, anndata_inspect, fasta_compute_length, bwa_mem, scanpy_plot, anndata_ops, snapatac2_preprocessing, replace_column_with_key_value_file			0		1569	1896	1.1	0
Single Cell	Clustering 3K PBMCs with Scanpy	https://training.galaxyproject.org//topics/single-cell/tutorials/scrna-scanpy-pbmc3k/tutorial.html		Expression profile clustering, Differential gene expression analysis, Principal component visualisation	2019-12-19	2025-04-29	16	True	True	True	True	datamash_ops, scanpy_cluster_reduce_dimension, anndata_manipulate, scanpy_normalize, scanpy_filter, scanpy_inspect, anndata_import, anndata_inspect, scanpy_plot, scanpy_remove_confounders	UseGalaxy.eu, UseGalaxy.org (Main), UseGalaxy.org.au	UseGalaxy.be, UseGalaxy.cz, UseGalaxy.fr, UseGalaxy.no	0		3085072	7910837	4.333333333333333	0
Single Cell	Combining single cell datasets after pre-processing	https://training.galaxyproject.org//topics/single-cell/tutorials/scrna-case_alevin-combine-datasets/tutorial.html			2022-09-08	2025-11-18	23	True	False	True	True	anndata_manipulate, Paste1, tp_replace_in_column, anndata_inspect, Cut1, anndata_ops	UseGalaxy.eu, UseGalaxy.org.au	UseGalaxy.be, UseGalaxy.org (Main)	0		2529	3546	2.533333333333333	0
Single Cell	Filter, plot, and explore single cell RNA-seq data with Seurat (R)	https://training.galaxyproject.org//topics/single-cell/tutorials/scrna-case_FilterPlotandExploreRStudio/tutorial.html			2023-10-02	2025-03-11	11	True	False	False	False			UseGalaxy.eu, UseGalaxy.org, UseGalaxy.org.au, UseGalaxy.fr	0		3293	3754	0.95	0
Single Cell	Understanding Barcodes	https://training.galaxyproject.org//topics/single-cell/tutorials/scrna-umis/tutorial.html		Sequencing quality control, Sequence composition calculation, Statistical calculation	2019-02-20	2025-02-14	11	True	False	True	True	fastqc, umi_tools_extract, seq_filter_by_id	UseGalaxy.cz, UseGalaxy.eu, UseGalaxy.fr, UseGalaxy.org (Main), UseGalaxy.org.au	Galaxy@AuBi, UseGalaxy.no	0		6382	7936	1.2333333333333334	0
Single Cell	Downstream Single-cell RNA analysis with RaceID	https://training.galaxyproject.org//topics/single-cell/tutorials/scrna-raceid/tutorial.html		Expression profile clustering, Molecular dynamics, Expression analysis	2019-03-25	2025-02-14	7	True	False	False	True	datamash_ops, raceid_trajectory, raceid_clustering, tp_head_tool, raceid_inspecttrajectory, tp_sed_tool, raceid_filtnormconf, datamash_transpose, raceid_inspectclusters	UseGalaxy.eu, UseGalaxy.no, UseGalaxy.org (Main)	UseGalaxy.be, UseGalaxy.cz, UseGalaxy.org.au	0		1089	1285	1.2666666666666666	0
Single Cell	Comparing inferred cell compositions using MuSiC deconvolution	https://training.galaxyproject.org//topics/single-cell/tutorials/bulk-music-4-compare/tutorial.html			2023-01-20	2025-02-13	10	True	False	False	True	music_compare	UseGalaxy.cz, UseGalaxy.eu, UseGalaxy.org (Main), UseGalaxy.org.au		0		287	430	1.3833333333333333	0
Single Cell	Filter, plot and explore single-cell RNA-seq data with Scanpy (Python)	https://training.galaxyproject.org//topics/single-cell/tutorials/scrna-case-jupyter_basic-pipeline/tutorial.html			2023-08-25	2025-03-11	13	True	False	True	False			UseGalaxy.eu, UseGalaxy.org, UseGalaxy.org.au, UseGalaxy.fr	0		3330	3952	1.5	0
Single Cell	Filter, plot and explore single-cell RNA-seq data with Scanpy	https://training.galaxyproject.org//topics/single-cell/tutorials/scrna-case_basic-pipeline/tutorial.html		Expression profile clustering, Differential gene expression analysis, Principal component visualisation	2021-03-24	2025-04-23	24	True	False	True	True	scanpy_cluster_reduce_dimension, scanpy_compute_graph, anndata_inspect, scanpy_plot_embed, scanpy_plot, anndata_ops, scanpy_find_variable_genes, scanpy_run_umap, interactive_tool_cellxgene_vip, scanpy_filter, scanpy_filter_genes, scanpy_filter_cells, retrieve_scxa, scanpy_run_pca, join1, scanpy_find_markers, scanpy_find_cluster, scanpy_normalise_data, anndata_manipulate, scanpy_run_tsne, scanpy_normalize, scanpy_inspect, scanpy_scale_data, Cut1			0		5430	8552	2.683333333333333	0
Single Cell	Clustering 3K PBMCs with Seurat	https://training.galaxyproject.org//topics/single-cell/tutorials/scrna-seurat-pbmc3k/tutorial.html			2025-01-23	2025-05-09	5	True	False	True	True	Filter1, seurat_data, seurat_preprocessing, seurat_clustering, seurat_plot, seurat_create, csv_to_tabular, Cut1, seurat_reduce_dimension	MISSISSIPPI, UseGalaxy.eu, UseGalaxy.fr, UseGalaxy.org (Main), UseGalaxy.org.au		0		1324	1593	1.1666666666666667	0
Single Cell	Filter, plot, and explore single cell RNA-seq data with Seurat	https://training.galaxyproject.org//topics/single-cell/tutorials/scrna-case_FilterPlotandExplore_SeuratTools/tutorial.html			2024-04-09	2025-03-11	10	True	False	False	True	seurat_normalise_data, seurat_plot, seurat_find_neighbours, seurat_run_umap, seurat_scale_data, seurat_find_markers, seurat_run_pca, seurat_find_variable_genes, seurat_filter_cells, retrieve_scxa, seurat_find_clusters, seurat_read10x	UseGalaxy.eu, UseGalaxy.fr, UseGalaxy.org (Main), UseGalaxy.org.au		0		2004	2441	1.4	0
