Proteomics	Neoantigen 5a: Predicting HLA Binding	https://training.galaxyproject.org//topics/proteomics/tutorials/neoantigen-predicting-hla-binding/tutorial.html		Genetic variation analysis, Read mapping	2025-01-14	2025-12-03	4	True	False	False	False	optitype, tp_awk_tool, seq2hla, query_tabular	UseGalaxy.eu, UseGalaxy.org (Main), UseGalaxy.org.au	UseGalaxy.cz	0		103	110	3.6666666666666665	0
Proteomics	Library Generation for DIA Analysis	https://training.galaxyproject.org//topics/proteomics/tutorials/DIA_lib_OSW/tutorial.html		Principal component plotting, Heat map generation, Protein quantification, Clustering, Imputation, Visualisation, Statistical calculation, Standardisation and normalisation	2020-12-02	2025-06-02	12	True	False	False	True	TargetedFileConverter, maxquant, OpenSwathDecoyGenerator, diapysef, Filter1, OpenSwathAssayGenerator	UseGalaxy.eu	UseGalaxy.cz, UseGalaxy.no, UseGalaxy.org.au	0		4735	6166	4.2	0
Proteomics	Neoantigen 1a: Fusion-Database-Generation	https://training.galaxyproject.org//topics/proteomics/tutorials/neoantigen-fusion-database-generation/tutorial.html		Sequence alignment	2025-01-14	2025-12-03	4	True	False	False	False	tab2fasta, arriba_get_filters, rna_star, query_tabular, regex1, arriba, tp_awk_tool, CONVERTER_gz_to_uncompressed	UseGalaxy.eu, UseGalaxy.org (Main), UseGalaxy.org.au	UseGalaxy.cz	0		236	285	2.933333333333333	0
Proteomics	EncyclopeDIA	https://training.galaxyproject.org//topics/proteomics/tutorials/encyclopedia/tutorial.html		Filtering, Formatting	2021-06-21	2025-05-19	12	True	False	True	True	msconvert, encyclopedia_quantify, encyclopedia_searchtolib		UseGalaxy.be, UseGalaxy.cz, UseGalaxy.eu, UseGalaxy.org (Main), UseGalaxy.org.au	0		2051	2779	8.133333333333333	0
Proteomics	Biomarker candidate identification	https://training.galaxyproject.org//topics/proteomics/tutorials/biomarker_selection/tutorial.html			2019-06-13	2023-11-09	9	True	False	False	True	retr_pepatlas1, Jvenn, MQoutputfilter, retrieve_from_hpa, IDconverter, tp_cut_tool, rna_abbased_data, prot_features		UseGalaxy.be, UseGalaxy.fr	0		1766	2399	9.85	0
Proteomics	MaxQuant and MSstats for the analysis of label-free data	https://training.galaxyproject.org//topics/proteomics/tutorials/maxquant-msstats-dda-lfq/tutorial.html		Principal component plotting, Heat map generation, Protein quantification, Clustering, Imputation, Visualisation, Statistical calculation, Tag-based peptide identification, Standardisation and normalisation, Spectrum calculation, Differential protein expression profiling	2021-02-17	2025-09-22	19	True	False	True	True	ggplot2_heatmap2, fasta2tab, Grep1, maxquant, uniprot, tp_easyjoin_tool, Summary_Statistics1, tp_replace_in_column, Cut1, datamash_ops, Filter1, msstats		UseGalaxy.cz, UseGalaxy.eu, UseGalaxy.no, UseGalaxy.org (Main), UseGalaxy.org.au	0		8758	14110	6.183333333333334	0
Proteomics	Metaproteomics tutorial	https://training.galaxyproject.org//topics/proteomics/tutorials/metaproteomics/tutorial.html	Proteomics, Proteogenomics, Biodiversity, Taxonomy	Prediction and recognition, Visualisation	2017-06-28	2024-06-14	41	True	False	True	True	search_gui, query_tabular, peptide_shaker, unipept, sqlite_to_tabular	UseGalaxy.eu, UseGalaxy.no, UseGalaxy.org (Main), UseGalaxy.org.au	UseGalaxy.be, UseGalaxy.cz	0		3021	4768	9.616666666666667	0
Proteomics	MaxQuant and MSstats for the analysis of TMT data	https://training.galaxyproject.org//topics/proteomics/tutorials/maxquant-msstats-tmt/tutorial.html		Principal component plotting, Heat map generation, Protein quantification, Clustering, Imputation, Visualisation, Statistical calculation, Standardisation and normalisation	2021-08-13	2025-01-08	11	True	False	False	True	msstatstmt, maxquant	UseGalaxy.be, UseGalaxy.eu, UseGalaxy.org.au	UseGalaxy.cz, UseGalaxy.org (Main)	0		4401	5880	3.85	0
Proteomics	Machine Learning Modeling of Anticancer Peptides	https://training.galaxyproject.org//topics/proteomics/tutorials/ml-modeling-of-anti-cancer-peptides/tutorial.html			2021-01-22	2023-11-09	8	True	False	False	True	pdaug_merge_dataframes, pdaug_sequence_property_based_descriptors, pdaug_ml_models, pdaug_basic_plots, pdaug_addclasslabel	UseGalaxy.be		0		1074	1590	11.633333333333333	0
Proteomics	Peptide and Protein ID using OpenMS tools	https://training.galaxyproject.org//topics/proteomics/tutorials/protein-id-oms/tutorial.html		Filtering, Formatting	2017-10-16	2025-04-08	32	True	False	False	True	FidoAdapter, IDMerger, FalseDiscoveryRate, Grep1, TextExporter, FileInfo, IDScoreSwitcher, PeakPickerHiRes, MSGFPlusAdapter, XTandemAdapter, msconvert, ConsensusID, PeptideIndexer, IDPosteriorErrorProbability, IDFilter		UseGalaxy.be, UseGalaxy.cz, UseGalaxy.eu, UseGalaxy.no, UseGalaxy.org.au	0		3639	6066	7.6	0
Proteomics	Clinical Metaproteomics 4: Quantitation	https://training.galaxyproject.org//topics/proteomics/tutorials/clinical-mp-4-quantitation/tutorial.html		Principal component plotting, Heat map generation, Protein quantification, Clustering, Imputation, Visualisation, Statistical calculation, Standardisation and normalisation	2024-02-06	2025-08-10	5	True	False	True	True	Cut1, maxquant, Grouping1, Grep1	UseGalaxy.eu, UseGalaxy.org (Main), UseGalaxy.org.au	UseGalaxy.cz, UseGalaxy.fr, UseGalaxy.no	0		208	274	30.1	0
Proteomics	Protein FASTA Database Handling	https://training.galaxyproject.org//topics/proteomics/tutorials/database-handling/tutorial.html	Proteomics		2017-02-14	2025-04-08	30	True	False	False	True	DecoyDatabase, fasta2tab, tab2fasta, addValue, fasta_merge_files_and_filter_unique_sequences, dbbuilder	UseGalaxy.eu, UseGalaxy.org.au	UseGalaxy.be, UseGalaxy.cz, UseGalaxy.no, UseGalaxy.org (Main)	0		4916	7756	7.95	0
Proteomics	Neoantigen 5b: IEDB binding Validated Neopeptides	https://training.galaxyproject.org//topics/proteomics/tutorials/neoantigen-hla-binding-novel-peptides/tutorial.html			2025-01-14	2025-12-03	5	True	False	False	False	fasta_to_tabular, query_tabular, table_compute, Filter1, iedb_api			0		100	105	4.0	0
Proteomics	Clinical Metaproteomics 5: Data Interpretation	https://training.galaxyproject.org//topics/proteomics/tutorials/clinical-mp-5-data-interpretation/tutorial.html		Prediction and recognition, Visualisation	2024-02-06	2025-08-10	4	True	False	True	True	msstatstmt, unipept, Grep1	UseGalaxy.be, UseGalaxy.cz, UseGalaxy.eu, UseGalaxy.org (Main), UseGalaxy.org.au		0		323	413	20.983333333333334	0
Proteomics	DIA Analysis using OpenSwathWorkflow	https://training.galaxyproject.org//topics/proteomics/tutorials/DIA_Analysis_OSW/tutorial.html		Filtering, Formatting	2020-12-02	2025-05-20	12	True	False	False	True	Grep1, pyprophet_protein, pyprophet_merge, pyprophet_score, msconvert, pyprophet_export, pyprophet_peptide, OpenSwathWorkflow	UseGalaxy.eu	UseGalaxy.be, UseGalaxy.cz, UseGalaxy.no, UseGalaxy.org.au	0		3321	4698	8.183333333333334	0
Proteomics	Clinical Metaproteomics 2: Discovery	https://training.galaxyproject.org//topics/proteomics/tutorials/clinical-mp-2-discovery/tutorial.html		Principal component plotting, Heat map generation, Formatting, Protein quantification, Clustering, Imputation, Visualisation, Statistical calculation, Standardisation and normalisation, Filtering	2024-02-06	2025-08-10	5	True	False	True	True	fasta2tab, msconvert, Grep1, fasta_merge_files_and_filter_unique_sequences, maxquant, search_gui, ident_params, peptide_shaker, query_tabular, Cut1, fasta_cli, Grouping1, Remove beginning1, Filter1, tp_cat, filter_tabular, dbbuilder	UseGalaxy.cz, UseGalaxy.eu, UseGalaxy.org (Main), UseGalaxy.org.au		0		376	491	22.866666666666667	0
Proteomics	Clinical Metaproteomics 1: Database-Generation	https://training.galaxyproject.org//topics/proteomics/tutorials/clinical-mp-1-database-generation/tutorial.html		Tag-based peptide identification, de Novo sequencing, Expression analysis, Protein identification, Target-Decoy	2024-02-06	2025-07-30	7	True	False	True	True	uniprotxml_downloader, fasta_merge_files_and_filter_unique_sequences, metanovo, dbbuilder	UseGalaxy.cz, UseGalaxy.eu, UseGalaxy.org.au	UseGalaxy.be, UseGalaxy.org (Main)	0		647	955	18.516666666666666	0
Proteomics	Peptide and Protein ID using SearchGUI and PeptideShaker	https://training.galaxyproject.org//topics/proteomics/tutorials/protein-id-sg-ps/tutorial.html			2017-06-12	2025-04-08	28	True	False	False	True	FileConverter, Grep1, search_gui, peptide_shaker, PeakPickerHiRes			0		3290	5183	5.966666666666667	0
Proteomics	Proteogenomics 2: Database Search	https://training.galaxyproject.org//topics/proteomics/tutorials/proteogenomics-dbsearch/tutorial.html		Conversion, Peptide database search	2018-11-20	2025-05-08	24	True	False	True	True	tab2fasta, search_gui, ident_params, peptide_shaker, query_tabular, mz_to_sqlite	UseGalaxy.be, UseGalaxy.eu, UseGalaxy.org (Main), UseGalaxy.org.au	UseGalaxy.cz	0		1634	2409	11.983333333333333	0
Proteomics	metaQuantome 2: Function	https://training.galaxyproject.org//topics/proteomics/tutorials/metaquantome-function/tutorial.html	Proteomics, Proteogenomics, Metatranscriptomics, Microbial ecology, Metagenomics	Heat map generation, Functional clustering, Visualisation, Indexing, Differential protein expression analysis, Statistical inference, Principal component visualisation, Query and retrieval, Filtering, Quantification	2020-10-29	2024-03-15	14	True	False	False	True	metaquantome_viz, metaquantome_expand, metaquantome_db, metaquantome_stat, metaquantome_sample, metaquantome_filter	UseGalaxy.be, UseGalaxy.eu	UseGalaxy.cz, UseGalaxy.fr, UseGalaxy.no, UseGalaxy.org.au	0		440	612	15.1	0
Proteomics	Clinical Metaproteomics 3: Verification	https://training.galaxyproject.org//topics/proteomics/tutorials/clinical-mp-3-verification/tutorial.html			2024-02-06	2025-08-10	7	True	False	True	True	fasta_merge_files_and_filter_unique_sequences, query_tabular, Cut1, Grouping1, uniprotxml_downloader, Remove beginning1, Filter1, pepquery2, tp_cat, collapse_dataset, dbbuilder	UseGalaxy.cz, UseGalaxy.eu	UseGalaxy.org (Main), UseGalaxy.org.au	0		221	287	27.866666666666667	0
Proteomics	Peptide and Protein Quantification via Stable Isotope Labelling (SIL)	https://training.galaxyproject.org//topics/proteomics/tutorials/protein-quant-sil/tutorial.html			2017-03-17	2025-04-08	32	True	False	False	True	FidoAdapter, IDConflictResolver, MultiplexResolver, FalseDiscoveryRate, IDMapper, Grep1, ProteinQuantifier, FileInfo, IDScoreSwitcher, histogram_rpy, Summary_Statistics1, IDPosteriorErrorProbability, XTandemAdapter, TextExporter, PeptideIndexer, FeatureFinderMultiplex, tp_tail_tool	UseGalaxy.eu	UseGalaxy.be, UseGalaxy.cz, UseGalaxy.no, UseGalaxy.org.au	0		1418	1958	8.883333333333333	0
Proteomics	metaQuantome 1: Data creation	https://training.galaxyproject.org//topics/proteomics/tutorials/metaquantome-data-creation/tutorial.html	Proteomics, Proteogenomics, Biodiversity, Taxonomy	Prediction and recognition, Formatting, Label-free quantification, Filtering, Visualisation	2020-10-16	2024-03-14	20	True	False	False	True	msconvert, Grep1, flashlfq, search_gui, query_tabular, tp_replace_in_column, peptide_shaker, Cut1, tp_replace_in_line, regex1, unipept, Remove beginning1, Filter1	UseGalaxy.eu	UseGalaxy.cz, UseGalaxy.no, UseGalaxy.org.au	0		917	1534	9.133333333333333	0
Proteomics	Proteogenomics 1: Database Creation	https://training.galaxyproject.org//topics/proteomics/tutorials/proteogenomics-dbcreation/tutorial.html		RNA-Seq analysis, Variant calling, Sequence alignment, Transcriptome assembly, Sequence annotation, Statistical calculation	2018-11-20	2025-05-08	29	True	False	True	True	bed_to_protein_map, fasta2tab, gffcompare, tab2fasta, cat_multi_datasets, query_tabular, tp_replace_in_column, translate_bed, stringtie, custom_pro_db, freebayes, hisat2, fasta_merge_files_and_filter_unique_sequences, sqlite_to_tabular, gffcompare_to_bed, filter_tabular, regexColumn1	UseGalaxy.be, UseGalaxy.org (Main), UseGalaxy.org.au	UseGalaxy.cz	0		6155	9975	6.616666666666666	0
Proteomics	Neoantigen 3: PepQuery2 Verification	https://training.galaxyproject.org//topics/proteomics/tutorials/neoantigen-peptide-verification/tutorial.html		Filtering, Formatting	2025-01-14	2025-12-03	4	True	False	False	False	tab2fasta, query_tabular, ncbi_blastp_wrapper, msconvert, pepquery2	UseGalaxy.be, UseGalaxy.eu, UseGalaxy.org (Main), UseGalaxy.org.au	UseGalaxy.cz	0		106	115	3.35	0
Proteomics	Neoantigen 1b: Non-Reference-Database-Generation	https://training.galaxyproject.org//topics/proteomics/tutorials/neoantigen-non-reference-database-generation/tutorial.html		RNA-Seq analysis, Variant calling, Sequence alignment, Transcriptome assembly, Sequence annotation, Statistical calculation	2025-01-14	2025-12-03	6	True	False	False	False	bed_to_protein_map, fasta2tab, gffcompare, tab2fasta, concatenate, translate_bed, stringtie, custom_pro_db, freebayes, column_regex_find_and_replace, hisat2, fasta_merge_files_and_filter_unique_sequences, sqlite_to_tabular, gffcompare_to_bed, CONVERTER_gz_to_uncompressed, regexColumn1			0		137	149	2.8666666666666667	0
Proteomics	Multiomics data analysis using MultiGSEA	https://training.galaxyproject.org//topics/proteomics/tutorials/multiGSEA-tutorial/tutorial.html		Pathway analysis, Aggregation, Gene-set enrichment analysis	2025-03-10	2025-03-11	2	True	False	False	True	Filter1, tp_grep_tool, multigsea	UseGalaxy.eu	UseGalaxy.cz, UseGalaxy.org.au	0		410	454	5.216666666666667	0
Proteomics	Single Cell Proteomics data analysis with bioconductor-scp	https://training.galaxyproject.org//topics/proteomics/tutorials/bioconductor-scp/tutorial.html		Expression analysis, Visualisation	2025-02-07	2025-02-10	2	True	False	False	False	bioconductor_scp, Grouping1	UseGalaxy.eu, UseGalaxy.org.au		0		328	394	5.466666666666667	0
Proteomics	metaQuantome 3: Taxonomy	https://training.galaxyproject.org//topics/proteomics/tutorials/metaquantome-taxonomy/tutorial.html	Proteomics, Proteogenomics, Metatranscriptomics, Microbial ecology, Metagenomics, Taxonomy	Heat map generation, Functional clustering, Visualisation, Indexing, Differential protein expression analysis, Statistical inference, Principal component visualisation, Query and retrieval, Filtering, Quantification	2020-10-29	2024-03-15	14	True	False	False	True	metaquantome_viz, metaquantome_expand, metaquantome_db, metaquantome_stat, metaquantome_sample, metaquantome_filter	UseGalaxy.be, UseGalaxy.eu	UseGalaxy.cz, UseGalaxy.fr, UseGalaxy.no, UseGalaxy.org.au	0		463	603	13.3	0
Proteomics	Neoantigen 4: Variant Annotation	https://training.galaxyproject.org//topics/proteomics/tutorials/neoantigen-variant-annotation/tutorial.html			2025-01-14	2025-12-03	5	True	False	False	False	pep_pointer, cut, tab2fasta, query_tabular, select, column_regex_find_and_replace, Convert characters1, regexColumn1			0		112	129	4.916666666666667	0
Proteomics	Proteogenomics 3: Novel peptide analysis	https://training.galaxyproject.org//topics/proteomics/tutorials/proteogenomics-novel-peptide-analysis/tutorial.html			2018-11-20	2025-05-15	20	True	False	True	True	pep_pointer, peptide_genomic_coordinate, query_tabular, ncbi_blastp_wrapper	UseGalaxy.be, UseGalaxy.eu, UseGalaxy.org (Main), UseGalaxy.org.au	UseGalaxy.cz, UseGalaxy.no	0		1802	2587	12.866666666666667	0
Proteomics	Label-free data analysis using MaxQuant	https://training.galaxyproject.org//topics/proteomics/tutorials/maxquant-label-free/tutorial.html		Principal component plotting, Heat map generation, Protein quantification, Clustering, Imputation, Visualisation, Statistical calculation, Tag-based peptide identification, Standardisation and normalisation, Spectrum calculation, Differential protein expression profiling	2020-04-29	2025-05-21	14	True	False	False	True	Grep1, maxquant, tp_sort_header_tool, histogram_rpy, Cut1, Add_a_column1, Filter1, msstats	UseGalaxy.eu, UseGalaxy.no, UseGalaxy.org (Main)	UseGalaxy.cz, UseGalaxy.org.au	0		20384	29677	3.683333333333333	0
Proteomics	Introduction to proteomics, protein identification, quantification and statistical modelling	https://training.galaxyproject.org//topics/proteomics/tutorials/introduction/slides.html			2017-12-01	2024-08-08	3	False	True	True	False			UseGalaxy.eu, UseGalaxy.org, UseGalaxy.org.au, UseGalaxy.fr	0		3518428	8525555	2.15	0
Proteomics	Label-free versus Labelled - How to Choose Your Quantitation Method	https://training.galaxyproject.org//topics/proteomics/tutorials/labelfree-vs-labelled/tutorial.html			2017-03-17	2025-05-27	18	True	False	False	False			UseGalaxy.eu, UseGalaxy.org, UseGalaxy.org.au, UseGalaxy.fr	0		7766	12485	2.5166666666666666	0
Sequence analysis	Screening assembled genomes for contamination using NCBI FCS	https://training.galaxyproject.org//topics/sequence-analysis/tutorials/ncbi-fcs/tutorial.html		Sequence assembly validation, Sequence contamination filtering, Sequence trimming	2024-04-16	2024-04-16	2	True	False	False	True	ncbi_fcs_gx, ncbi_fcs_adaptor	UseGalaxy.be, UseGalaxy.eu, UseGalaxy.org (Main)	UseGalaxy.cz	0		2043	2758	3.75	0
Sequence analysis	Primer and primer scheme design for pan-specific detection and sequencing of viral pathogens across genotypes	https://training.galaxyproject.org//topics/sequence-analysis/tutorials/viral_primer_design/tutorial.html		Local alignment, Sequence analysis, Sequence alignment analysis, Multiple sequence alignment, Sequence alignment, PCR primer design, Global alignment	2025-03-20	2025-11-20	3	True	False	False	True	ncbi_makeblastdb, fasta_compute_length, split_file_to_collection, rbc_mafft, varvamp, EMBOSS: degapseq20	UseGalaxy.be, UseGalaxy.eu		0		774	891	2.85	0
Sequence analysis	Quality Control	https://training.galaxyproject.org//topics/sequence-analysis/tutorials/quality-control/tutorial.html		Box-Whisker plot plotting, Primer removal, Statistical calculation, Sequence composition calculation, Sequencing quality control, Read pre-processing, Scatter plot plotting, Validation, Sequence trimming	2016-10-04	2025-03-29	48	True	True	True	True	multiqc, nanoplot, fastqe, cutadapt, fastqc, pycoqc	UseGalaxy.eu, UseGalaxy.org (Main), UseGalaxy.org.au	Galaxy@AuBi, UseGalaxy.cz, UseGalaxy.fr	0		3629362	8725656	9.083333333333334	0
Sequence analysis	Clean and manage Sanger sequences from raw files to aligned consensus	https://training.galaxyproject.org//topics/sequence-analysis/tutorials/Manage_AB1_Sanger/tutorial.html		DNA barcoding, Phylogenetic analysis, Sequence clustering, Visualisation, Taxonomic classification, Sequence file editing, Sequencing quality control, Sequence read processing, Demultiplexing, Data handling	2024-01-08	2024-03-05	2	True	False	False	True	__SORTLIST__, cshl_fastx_reverse_complement, fastq_groomer, regex1, collection_element_identifiers, seqtk_trimfq, mothur_merge_files, qiime_align_seqs, ncbi_blastn_wrapper, mothur_degap_seqs, __FILTER_FROM_FILE__, ab1_fastq_converter, seqtk_mergepe, tab2fasta, aligned_to_consensus, filter_by_fasta_ids, fastq_to_tabular, cshl_fastq_to_fasta, fastq_masker_by_quality, unzip	UseGalaxy.cz, UseGalaxy.eu, UseGalaxy.fr		0		3638	4549	6.516666666666667	0
Sequence analysis	Mapping	https://training.galaxyproject.org//topics/sequence-analysis/tutorials/mapping/tutorial.html	Mapping	Primer removal, Genome visualisation, Statistical calculation, Sequence alignment analysis, Sequence composition calculation, Sequencing quality control, Read mapping, Read pre-processing, Data handling, Validation, Sequence trimming	2016-10-04	2026-02-25	45	True	True	True	True	multiqc, bamFilter, jbrowse, bowtie2, __FLATTEN__, samtools_stats, fastqc, trim_galore	UseGalaxy.eu, UseGalaxy.org (Main), UseGalaxy.org.au	Galaxy@AuBi, GalaxyTrakr, UseGalaxy.be, UseGalaxy.cz, UseGalaxy.fr, UseGalaxy.no	0		3586115	8638197	9.533333333333333	0
Sequence analysis	Quality and contamination control in bacterial isolate using Illumina MiSeq Data	https://training.galaxyproject.org//topics/sequence-analysis/tutorials/quality-contamination-control/tutorial.html	Whole genome sequencing, Genomics, Microbiology, Microbial ecology	Expression analysis, Sequence contamination filtering, Visualisation, Taxonomic classification, Statistical calculation, Sequencing quality control, Read mapping, Cross-assembly	2024-07-15	2025-12-18	5	True	False	True	True	fastp, upload1, est_abundance, falco, kraken2, recentrifuge	GalaxyTrakr, UseGalaxy.be, UseGalaxy.cz, UseGalaxy.eu, UseGalaxy.fr, UseGalaxy.org (Main)		0		1869	2519	10.766666666666667	0
Single Cell	Pre-processing of 10X Single-Cell ATAC-seq Datasets	https://training.galaxyproject.org//topics/single-cell/tutorials/scatac-preprocessing-tenx/tutorial.html		Gene regulatory network analysis, Generation, Enrichment analysis, Mapping, Differential gene expression analysis, Imputation, Visualisation, Statistical calculation, Sequence composition calculation, Principal component visualisation, Expression profile clustering, Sequence alignment, Read mapping, Sequencing quality control, Peak calling, Genome indexing	2023-04-24	2025-10-16	10	True	False	False	True	scanpy_plot, sinto_fragments, macs2_callpeak, episcanpy_build_matrix, bedtools_sortbed, anndata_inspect, episcanpy_preprocess, falco, bwa_mem, sinto_barcode, tp_sorted_uniq, fastqc	UseGalaxy.org (Main), UseGalaxy.org.au	UseGalaxy.be, UseGalaxy.cz	0		6269	7366	2.316666666666667	0
Single Cell	Pre-processing of Single-Cell RNA Data	https://training.galaxyproject.org//topics/single-cell/tutorials/scrna-preprocessing/tutorial.html		Sequence alignment analysis, Sequence alignment, Read summarisation, Sequencing quality control, RNA-Seq quantification, Data handling, Validation	2019-02-22	2025-04-08	5	True	True	False	True	multiqc, bamFilter, collection_column_join, rna_star, featurecounts, __FLATTEN__, umi_tools_count, tp_sed_tool, umi_tools_extract, samtools_stats	UseGalaxy.eu	UseGalaxy.be, UseGalaxy.cz, UseGalaxy.fr, UseGalaxy.no, UseGalaxy.org (Main), UseGalaxy.org.au	0		3525069	8534177	8.516666666666667	0
Single Cell	Pseudobulk Analysis with Decoupler and EdgeR	https://training.galaxyproject.org//topics/single-cell/tutorials/pseudobulk-analysis/tutorial.html		Expression profile clustering, Principal component visualisation, Differential gene expression analysis	2025-02-12	2025-05-09	8	True	False	True	True	anndata_manipulate, scanpy_filter, column_remove_by_header, edger, decoupler_pseudobulk, volcanoplot, tp_replace_in_column, __EXTRACT_DATASET__, tp_replace_in_line, tp_awk_tool, anndata_inspect	UseGalaxy.be, UseGalaxy.eu, UseGalaxy.fr, UseGalaxy.org (Main), UseGalaxy.org.au	UseGalaxy.cz	0		1942	2221	2.3833333333333333	0
Single Cell	Converting between common single cell data formats	https://training.galaxyproject.org//topics/single-cell/tutorials/scrna-data-ingest/tutorial.html		Loading, Community profiling	2024-02-13	2025-03-11	4	True	False	False	True	anndata_ops, sceasy_convert, dropletutils, regexColumn1, seurat_read10x, datamash_transpose, join1, dropletutils_read_10x, Cut1, tp_cut_tool, fastq_to_tabular, monocle3_create, scanpy_filter_cells, Filter1, anndata_inspect, tabular_to_fastq, tp_tail_tool		UseGalaxy.org (Main)	0		2839	3347	3.816666666666667	0
Single Cell	Single-cell quality control with scater	https://training.galaxyproject.org//topics/single-cell/tutorials/scrna-scater-qc/tutorial.html		Sequence visualisation, Sequencing quality control, Read pre-processing	2019-10-23	2025-02-14	6	True	False	False	True	scater_create_qcmetric_ready_sce, scater_plot_dist_scatter, scater_plot_pca, scater_filter	UseGalaxy.be, UseGalaxy.eu, UseGalaxy.no, UseGalaxy.org.au	UseGalaxy.cz	0		733	825	5.75	0
Single Cell	Bulk RNA Deconvolution with MuSiC	https://training.galaxyproject.org//topics/single-cell/tutorials/bulk-music/tutorial.html			2022-02-11	2025-02-14	10	True	False	True	True	music_deconvolution, music_inspect_eset, music_construct_eset	UseGalaxy.be, UseGalaxy.cz, UseGalaxy.eu, UseGalaxy.org (Main), UseGalaxy.org.au		0		4202	5275	3.85	0
Single Cell	GO Enrichment Analysis on Single-Cell RNA-Seq Data	https://training.galaxyproject.org//topics/single-cell/tutorials/GO-enrichment/tutorial.html		Gene-set enrichment analysis	2024-09-17	2025-04-08	8	True	True	False	True	Cut1, tp_split_on_column, gprofiler_gost, goenrichment	UseGalaxy.be, UseGalaxy.cz, UseGalaxy.eu, UseGalaxy.no, UseGalaxy.org (Main)		0		1417169	2699711	5.483333333333333	0
Single Cell	Pre-processing of 10X Single-Cell RNA Datasets	https://training.galaxyproject.org//topics/single-cell/tutorials/scrna-preprocessing-tenx/tutorial.html		Sequence alignment, Sequencing quality control, Loading, Validation, Community profiling	2019-09-11	2025-04-29	13	True	False	True	True	dropletutils, multiqc, rna_starsolo	UseGalaxy.cz, UseGalaxy.eu, UseGalaxy.org (Main), UseGalaxy.org.au	UseGalaxy.be, UseGalaxy.fr, UseGalaxy.no	0		13229	17091	5.733333333333333	0
Single Cell	Generating a single cell matrix using Alevin	https://training.galaxyproject.org//topics/single-cell/tutorials/scrna-case_alevin/tutorial.html		Sequence composition calculation, Gene expression analysis, RNA-Seq quantification	2021-03-03	2025-11-18	25	True	False	True	True	sceasy_convert, anndata_manipulate, alevin, _dropletBarcodePlot, join1, dropletutils_read_10x, Cut1, _ensembl_gtf2gene_list, dropletutils_empty_drops, _salmon_kallisto_mtx_to_10x, anndata_inspect	UseGalaxy.eu, UseGalaxy.fr, UseGalaxy.org (Main), UseGalaxy.org.au		0		3640	5514	10.7	0
Single Cell	An introduction to scRNA-seq data analysis	https://training.galaxyproject.org//topics/single-cell/tutorials/scrna-intro/slides.html			2021-01-29	2025-02-13	8	False	True	True	False			UseGalaxy.eu, UseGalaxy.org, UseGalaxy.org.au, UseGalaxy.fr	0		3485966	8411515	2.15	0
Single Cell	Generating a single cell matrix using Alevin and combining datasets (bash + R)	https://training.galaxyproject.org//topics/single-cell/tutorials/alevin-commandline/tutorial.html			2023-12-08	2025-04-22	5	True	False	False	False			UseGalaxy.eu, UseGalaxy.org, UseGalaxy.org.au, UseGalaxy.fr	0		705	951	9.7	0
