Proteomics	Annotating a protein list identified by LC-MS/MS experiments	https://training.galaxyproject.org//topics/proteomics/tutorials/proteome_annotation/tutorial.html			2019-09-12	2024-06-14	11	True	False	True	True	Jvenn, cluter_profiler, IDconverter, retrieve_from_hpa, MQoutputfilter, reactome_analysis, rna_abbased_data		UseGalaxy.be, UseGalaxy.fr	0		3090	4483	2.7666666666666666	0
Proteomics	DIA Analysis using OpenSwathWorkflow	https://training.galaxyproject.org//topics/proteomics/tutorials/DIA_Analysis_OSW/tutorial.html		Filtering, Formatting	2020-12-02	2025-05-20	12	True	False	False	True	pyprophet_export, pyprophet_protein, msconvert, pyprophet_peptide, pyprophet_merge, pyprophet_score, OpenSwathWorkflow, Grep1	UseGalaxy.eu	UseGalaxy.cz, UseGalaxy.no, UseGalaxy.org.au	0		3234	4602	2.533333333333333	0
Proteomics	EncyclopeDIA	https://training.galaxyproject.org//topics/proteomics/tutorials/encyclopedia/tutorial.html		Filtering, Formatting	2021-06-21	2025-05-19	12	True	False	True	True	msconvert, encyclopedia_searchtolib, encyclopedia_quantify		UseGalaxy.cz, UseGalaxy.eu, UseGalaxy.org (Main), UseGalaxy.org.au	0		2002	2723	1.7666666666666666	0
Proteomics	Peptide and Protein ID using SearchGUI and PeptideShaker	https://training.galaxyproject.org//topics/proteomics/tutorials/protein-id-sg-ps/tutorial.html			2017-06-12	2025-04-08	28	True	False	False	True	search_gui, FileConverter, peptide_shaker, PeakPickerHiRes, Grep1			0		3158	5039	1.8833333333333333	0
Proteomics	Peptide and Protein ID using OpenMS tools	https://training.galaxyproject.org//topics/proteomics/tutorials/protein-id-oms/tutorial.html		Filtering, Formatting	2017-10-16	2025-04-08	32	True	False	False	True	PeptideIndexer, ConsensusID, IDScoreSwitcher, FidoAdapter, IDFilter, MSGFPlusAdapter, FileInfo, FalseDiscoveryRate, msconvert, IDMerger, IDPosteriorErrorProbability, TextExporter, PeakPickerHiRes, Grep1, XTandemAdapter		UseGalaxy.cz, UseGalaxy.eu, UseGalaxy.no, UseGalaxy.org.au	0		3549	5957	2.8833333333333333	0
Proteomics	Clinical Metaproteomics 5: Data Interpretation	https://training.galaxyproject.org//topics/proteomics/tutorials/clinical-mp-5-data-interpretation/tutorial.html		Visualisation, Prediction and recognition	2024-02-06	2025-08-10	4	True	False	True	True	unipept, msstatstmt, Grep1	UseGalaxy.cz, UseGalaxy.eu, UseGalaxy.org (Main), UseGalaxy.org.au		0		282	372	2.6333333333333333	0
Proteomics	Neoantigen 1b: Non-Reference-Database-Generation	https://training.galaxyproject.org//topics/proteomics/tutorials/neoantigen-non-reference-database-generation/tutorial.html		RNA-Seq analysis, Sequence alignment, Sequence annotation, Transcriptome assembly, Variant calling, Statistical calculation	2025-01-14	2025-12-03	6	True	False	False	False	CONVERTER_gz_to_uncompressed, stringtie, tab2fasta, custom_pro_db, column_regex_find_and_replace, fasta_merge_files_and_filter_unique_sequences, bed_to_protein_map, hisat2, fasta2tab, gffcompare_to_bed, sqlite_to_tabular, concatenate, gffcompare, freebayes, regexColumn1, translate_bed			0		88	98	0.43333333333333335	0
Proteomics	Multiomics data analysis using MultiGSEA	https://training.galaxyproject.org//topics/proteomics/tutorials/multiGSEA-tutorial/tutorial.html		Gene-set enrichment analysis, Pathway analysis, Aggregation	2025-03-10	2025-03-11	2	True	False	False	True	Filter1, multigsea, tp_grep_tool	UseGalaxy.eu	UseGalaxy.cz, UseGalaxy.org.au	0		298	327	1.3833333333333333	0
Proteomics	Metaproteomics tutorial	https://training.galaxyproject.org//topics/proteomics/tutorials/metaproteomics/tutorial.html	Proteomics, Proteogenomics, Biodiversity, Taxonomy	Visualisation, Prediction and recognition	2017-06-28	2024-06-14	41	True	False	True	True	search_gui, unipept, sqlite_to_tabular, peptide_shaker, query_tabular	UseGalaxy.eu, UseGalaxy.no, UseGalaxy.org (Main), UseGalaxy.org.au	UseGalaxy.be, UseGalaxy.cz	0		2916	4634	2.7	0
Proteomics	Clinical Metaproteomics 3: Verification	https://training.galaxyproject.org//topics/proteomics/tutorials/clinical-mp-3-verification/tutorial.html			2024-02-06	2025-08-10	7	True	False	True	True	uniprotxml_downloader, pepquery2, tp_cat, fasta_merge_files_and_filter_unique_sequences, collapse_dataset, Cut1, Remove beginning1, Grouping1, Filter1, dbbuilder, query_tabular	UseGalaxy.cz, UseGalaxy.eu	UseGalaxy.org (Main), UseGalaxy.org.au	0		207	273	3.7	0
Proteomics	Peptide and Protein Quantification via Stable Isotope Labelling (SIL)	https://training.galaxyproject.org//topics/proteomics/tutorials/protein-quant-sil/tutorial.html			2017-03-17	2025-04-08	32	True	False	False	True	Summary_Statistics1, PeptideIndexer, IDConflictResolver, IDScoreSwitcher, FidoAdapter, FileInfo, TextExporter, FalseDiscoveryRate, tp_tail_tool, FeatureFinderMultiplex, IDPosteriorErrorProbability, ProteinQuantifier, IDMapper, MultiplexResolver, histogram_rpy, Grep1, XTandemAdapter	UseGalaxy.eu	UseGalaxy.cz, UseGalaxy.no, UseGalaxy.org.au	0		1366	1905	1.5333333333333334	0
Proteomics	Peptide Library Data Analysis	https://training.galaxyproject.org//topics/proteomics/tutorials/peptide-library-data-analysis/tutorial.html			2021-01-22	2023-11-09	5	True	False	False	True	pdaug_basic_plots, pdaug_sequence_property_based_descriptors, pdaug_merge_dataframes, pdaug_tsvtofasta, pdaug_addclasslabel, pdaug_peptide_data_access, pdaug_peptide_sequence_analysis, pdaug_fishers_plot	UseGalaxy.be		0		747	1012	2.316666666666667	0
Proteomics	MaxQuant and MSstats for the analysis of TMT data	https://training.galaxyproject.org//topics/proteomics/tutorials/maxquant-msstats-tmt/tutorial.html		Principal component plotting, Visualisation, Protein quantification, Clustering, Standardisation and normalisation, Heat map generation, Statistical calculation, Imputation	2021-08-13	2025-01-08	11	True	False	False	True	msstatstmt, maxquant	UseGalaxy.eu, UseGalaxy.org.au	UseGalaxy.cz, UseGalaxy.org (Main)	0		4286	5722	1.6333333333333333	0
Proteomics	Secretome Prediction	https://training.galaxyproject.org//topics/proteomics/tutorials/secretome-prediction/tutorial.html			2017-04-13	2025-04-08	15	True	False	False	True	uniprot, comp1, bg_uniq, wolf_psort, term_id_vs_term_name, tp_sorted_uniq, Convert characters1, tp_easyjoin_tool, get_subontology_from, tp_cut_tool, Filter1, Grep1			0		652	971	1.4666666666666666	0
Proteomics	metaQuantome 2: Function	https://training.galaxyproject.org//topics/proteomics/tutorials/metaquantome-function/tutorial.html	Proteomics, Proteogenomics, Metatranscriptomics, Microbial ecology, Metagenomics	Quantification, Heat map generation, Indexing, Filtering, Visualisation, Differential protein expression analysis, Principal component visualisation, Statistical inference, Query and retrieval, Functional clustering	2020-10-29	2024-03-15	14	True	False	False	True	metaquantome_filter, metaquantome_viz, metaquantome_sample, metaquantome_expand, metaquantome_db, metaquantome_stat	UseGalaxy.be, UseGalaxy.eu	UseGalaxy.cz, UseGalaxy.fr, UseGalaxy.no, UseGalaxy.org.au	0		421	592	4.166666666666667	0
Proteomics	metaQuantome 1: Data creation	https://training.galaxyproject.org//topics/proteomics/tutorials/metaquantome-data-creation/tutorial.html	Proteomics, Proteogenomics, Biodiversity, Taxonomy	Filtering, Visualisation, Label-free quantification, Prediction and recognition, Formatting	2020-10-16	2024-03-14	20	True	False	False	True	search_gui, unipept, Cut1, Remove beginning1, msconvert, regex1, peptide_shaker, tp_replace_in_line, Filter1, flashlfq, tp_replace_in_column, Grep1, query_tabular	UseGalaxy.eu	UseGalaxy.cz, UseGalaxy.no, UseGalaxy.org.au	0		892	1506	3.7333333333333334	0
Proteomics	Single Cell Proteomics data analysis with bioconductor-scp	https://training.galaxyproject.org//topics/proteomics/tutorials/bioconductor-scp/tutorial.html		Visualisation, Expression analysis	2025-02-07	2025-02-10	2	True	False	False	False	Grouping1, bioconductor_scp	UseGalaxy.eu, UseGalaxy.org.au		0		234	288	0.9666666666666667	0
Proteomics	Clinical Metaproteomics 1: Database-Generation	https://training.galaxyproject.org//topics/proteomics/tutorials/clinical-mp-1-database-generation/tutorial.html		Target-Decoy, Protein identification, de Novo sequencing, Expression analysis, Tag-based peptide identification	2024-02-06	2025-07-30	7	True	False	True	True	fasta_merge_files_and_filter_unique_sequences, metanovo, uniprotxml_downloader, dbbuilder	UseGalaxy.cz, UseGalaxy.eu, UseGalaxy.org.au	UseGalaxy.org (Main)	0		593	893	3.8666666666666667	0
Proteomics	Introduction to proteomics, protein identification, quantification and statistical modelling	https://training.galaxyproject.org//topics/proteomics/tutorials/introduction/slides.html			2017-12-01	2024-08-08	3	False	True	True	False			UseGalaxy.eu, UseGalaxy.org, UseGalaxy.org.au, UseGalaxy.fr	0		3085082	7914452	2.3333333333333335	0
Proteomics	Label-free versus Labelled - How to Choose Your Quantitation Method	https://training.galaxyproject.org//topics/proteomics/tutorials/labelfree-vs-labelled/tutorial.html			2017-03-17	2025-05-27	18	True	False	False	False			UseGalaxy.eu, UseGalaxy.org, UseGalaxy.org.au, UseGalaxy.fr	0		7688	12403	0.9	0
Sequence analysis	Mapping	https://training.galaxyproject.org//topics/sequence-analysis/tutorials/mapping/tutorial.html	Mapping	Sequence alignment analysis, Read mapping, Read pre-processing, Genome visualisation, Sequence composition calculation, Sequence trimming, Sequencing quality control, Primer removal, Statistical calculation, Data handling, Validation	2016-10-04	2025-03-31	43	True	True	True	True	samtools_stats, trim_galore, jbrowse, multiqc, fastqc, bowtie2, bamFilter	UseGalaxy.eu, UseGalaxy.org (Main), UseGalaxy.org.au	Galaxy@AuBi, GalaxyTrakr, UseGalaxy.be, UseGalaxy.cz, UseGalaxy.fr, UseGalaxy.no	0		3150953	8024634	5.083333333333333	0
Sequence analysis	Clean and manage Sanger sequences from raw files to aligned consensus	https://training.galaxyproject.org//topics/sequence-analysis/tutorials/Manage_AB1_Sanger/tutorial.html		Visualisation, Taxonomic classification, Demultiplexing, Phylogenetic analysis, Sequence file editing, Sequencing quality control, Sequence read processing, DNA barcoding, Sequence clustering, Data handling	2024-01-08	2024-03-05	2	True	False	False	True	cshl_fastx_reverse_complement, fastq_to_tabular, mothur_merge_files, ab1_fastq_converter, filter_by_fasta_ids, __FILTER_FROM_FILE__, __SORTLIST__, unzip, seqtk_trimfq, collection_element_identifiers, qiime_align_seqs, mothur_degap_seqs, aligned_to_consensus, cshl_fastq_to_fasta, fastq_groomer, tab2fasta, ncbi_blastn_wrapper, regex1, seqtk_mergepe, fastq_masker_by_quality	UseGalaxy.cz, UseGalaxy.eu, UseGalaxy.fr		0		3376	4225	1.6666666666666667	0
Sequence analysis	Primer and primer scheme design for pan-specific detection and sequencing of viral pathogens across genotypes	https://training.galaxyproject.org//topics/sequence-analysis/tutorials/viral_primer_design/tutorial.html		Sequence alignment analysis, Sequence alignment, PCR primer design, Sequence analysis, Multiple sequence alignment, Local alignment, Global alignment	2025-03-20	2025-11-20	3	True	False	False	True	split_file_to_collection, EMBOSS: degapseq20, rbc_mafft, ncbi_makeblastdb, varvamp, fasta_compute_length	UseGalaxy.eu		0		614	711	1.0	0
Sequence analysis	Quality Control	https://training.galaxyproject.org//topics/sequence-analysis/tutorials/quality-control/tutorial.html		Scatter plot plotting, Read pre-processing, Sequence composition calculation, Sequence trimming, Sequencing quality control, Primer removal, Box-Whisker plot plotting, Statistical calculation, Validation	2016-10-04	2025-03-29	48	True	True	True	True	cutadapt, fastqe, nanoplot, multiqc, fastqc, pycoqc	UseGalaxy.eu, UseGalaxy.org (Main), UseGalaxy.org.au	Galaxy@AuBi, UseGalaxy.cz, UseGalaxy.fr	0		3192486	8109620	5.35	0
Sequence analysis	Screening assembled genomes for contamination using NCBI FCS	https://training.galaxyproject.org//topics/sequence-analysis/tutorials/ncbi-fcs/tutorial.html		Sequence contamination filtering, Sequence assembly validation, Sequence trimming	2024-04-16	2024-04-16	2	True	False	False	True	ncbi_fcs_gx, ncbi_fcs_adaptor	UseGalaxy.eu, UseGalaxy.org (Main)	UseGalaxy.cz	0		1862	2526	2.3	0
Sequence analysis	Quality and contamination control in bacterial isolate using Illumina MiSeq Data	https://training.galaxyproject.org//topics/sequence-analysis/tutorials/quality-contamination-control/tutorial.html	Whole genome sequencing, Genomics, Microbiology, Microbial ecology	Sequence contamination filtering, Read mapping, Visualisation, Taxonomic classification, Cross-assembly, Sequencing quality control, Expression analysis, Statistical calculation	2024-07-15	2025-03-20	4	True	False	True	True	upload1, kraken2, est_abundance, recentrifuge, fastp, falco	UseGalaxy.eu, UseGalaxy.fr	GalaxyTrakr, UseGalaxy.cz, UseGalaxy.org (Main)	0		1665	2226	2.783333333333333	0
Single Cell	Bulk RNA Deconvolution with MuSiC	https://training.galaxyproject.org//topics/single-cell/tutorials/bulk-music/tutorial.html			2022-02-11	2025-02-14	10	True	False	True	True	music_inspect_eset, music_deconvolution, music_construct_eset	UseGalaxy.cz, UseGalaxy.eu, UseGalaxy.org (Main), UseGalaxy.org.au		0		3985	5026	1.5833333333333333	0
Single Cell	Generating a single cell matrix using Alevin	https://training.galaxyproject.org//topics/single-cell/tutorials/scrna-case_alevin/tutorial.html		RNA-Seq quantification, Gene expression analysis, Sequence composition calculation	2021-03-03	2025-11-18	25	True	False	True	True	_dropletBarcodePlot, anndata_inspect, _ensembl_gtf2gene_list, dropletutils_empty_drops, join1, Cut1, anndata_manipulate, _salmon_kallisto_mtx_to_10x, sceasy_convert, dropletutils_read_10x, alevin	UseGalaxy.eu, UseGalaxy.fr, UseGalaxy.org (Main), UseGalaxy.org.au		0		3484	5283	3.45	0
Single Cell	Converting between common single cell data formats	https://training.galaxyproject.org//topics/single-cell/tutorials/scrna-data-ingest/tutorial.html		Community profiling, Loading	2024-02-13	2025-03-11	4	True	False	False	True	anndata_inspect, datamash_transpose, dropletutils_read_10x, join1, dropletutils, tp_tail_tool, Cut1, fastq_to_tabular, monocle3_create, seurat_read10x, scanpy_filter_cells, sceasy_convert, tp_cut_tool, tabular_to_fastq, Filter1, anndata_ops, regexColumn1		UseGalaxy.org (Main)	0		2592	3074	1.2833333333333334	0
Single Cell	Pre-processing of 10X Single-Cell RNA Datasets	https://training.galaxyproject.org//topics/single-cell/tutorials/scrna-preprocessing-tenx/tutorial.html		Community profiling, Sequencing quality control, Sequence alignment, Loading, Validation	2019-09-11	2025-04-29	13	True	False	True	True	multiqc, dropletutils, rna_starsolo	UseGalaxy.cz, UseGalaxy.eu, UseGalaxy.org (Main), UseGalaxy.org.au	UseGalaxy.be, UseGalaxy.fr, UseGalaxy.no	0		12616	16317	1.8666666666666667	0
Single Cell	Pre-processing of Single-Cell RNA Data	https://training.galaxyproject.org//topics/single-cell/tutorials/scrna-preprocessing/tutorial.html		RNA-Seq quantification, Sequencing quality control, Read summarisation, Sequence alignment, Sequence alignment analysis, Data handling, Validation	2019-02-22	2025-04-08	5	True	True	False	True	featurecounts, samtools_stats, rna_star, umi_tools_extract, umi_tools_count, __FLATTEN__, collection_column_join, multiqc, tp_sed_tool, bamFilter	UseGalaxy.eu	UseGalaxy.be, UseGalaxy.cz, UseGalaxy.fr, UseGalaxy.no, UseGalaxy.org (Main), UseGalaxy.org.au	0		3091508	7922819	4.6	0
Single Cell	Pseudobulk Analysis with Decoupler and EdgeR	https://training.galaxyproject.org//topics/single-cell/tutorials/pseudobulk-analysis/tutorial.html		Differential gene expression analysis, Expression profile clustering, Principal component visualisation	2025-02-12	2025-05-09	8	True	False	True	True	anndata_inspect, column_remove_by_header, volcanoplot, __EXTRACT_DATASET__, anndata_manipulate, decoupler_pseudobulk, scanpy_filter, tp_replace_in_line, edger, tp_replace_in_column, tp_awk_tool	UseGalaxy.eu, UseGalaxy.fr, UseGalaxy.org (Main), UseGalaxy.org.au	UseGalaxy.cz	0		1589	1827	0.6333333333333333	0
Single Cell	Single-cell quality control with scater	https://training.galaxyproject.org//topics/single-cell/tutorials/scrna-scater-qc/tutorial.html		Sequencing quality control, Read pre-processing, Sequence visualisation	2019-10-23	2025-02-14	6	True	False	False	True	scater_filter, scater_plot_dist_scatter, scater_plot_pca, scater_create_qcmetric_ready_sce	UseGalaxy.be, UseGalaxy.eu, UseGalaxy.no, UseGalaxy.org.au	UseGalaxy.cz	0		711	802	0.7166666666666667	0
Single Cell	GO Enrichment Analysis on Single-Cell RNA-Seq Data	https://training.galaxyproject.org//topics/single-cell/tutorials/GO-enrichment/tutorial.html		Gene-set enrichment analysis	2024-09-17	2025-04-08	8	True	True	False	True	goenrichment, gprofiler_gost, Cut1, tp_split_on_column	UseGalaxy.cz, UseGalaxy.eu, UseGalaxy.no, UseGalaxy.org (Main)		0		976745	2088421	2.7	0
Single Cell	Pre-processing of 10X Single-Cell ATAC-seq Datasets	https://training.galaxyproject.org//topics/single-cell/tutorials/scatac-preprocessing-tenx/tutorial.html		Read mapping, Generation, Visualisation, Differential gene expression analysis, Enrichment analysis, Principal component visualisation, Sequence composition calculation, Genome indexing, Expression profile clustering, Sequencing quality control, Sequence alignment, Mapping, Gene regulatory network analysis, Peak calling, Statistical calculation, Imputation	2023-04-24	2025-10-16	10	True	False	False	True	anndata_inspect, episcanpy_build_matrix, bedtools_sortbed, episcanpy_preprocess, sinto_barcode, bwa_mem, sinto_fragments, tp_sorted_uniq, macs2_callpeak, scanpy_plot, fastqc, falco	UseGalaxy.org (Main), UseGalaxy.org.au	UseGalaxy.cz	0		6025	7085	1.0833333333333333	0
Single Cell	An introduction to scRNA-seq data analysis	https://training.galaxyproject.org//topics/single-cell/tutorials/scrna-intro/slides.html			2021-01-29	2025-02-13	8	False	True	True	False			UseGalaxy.eu, UseGalaxy.org, UseGalaxy.org.au, UseGalaxy.fr	0		3052681	7800413	2.3333333333333335	0
Single Cell	Generating a single cell matrix using Alevin and combining datasets (bash + R)	https://training.galaxyproject.org//topics/single-cell/tutorials/alevin-commandline/tutorial.html			2023-12-08	2025-04-22	5	True	False	False	False			UseGalaxy.eu, UseGalaxy.org, UseGalaxy.org.au, UseGalaxy.fr	0		619	855	3.6166666666666667	0
Single Cell	Removing the effects of the cell cycle	https://training.galaxyproject.org//topics/single-cell/tutorials/scrna-case_cell-cycle/tutorial.html		Expression profile clustering, Differential gene expression analysis, Principal component visualisation	2023-01-25	2025-03-11	14	True	False	False	True	anndata_inspect, addValue, scanpy_cluster_reduce_dimension, sort1, scanpy_regress_variable, anndata_manipulate, cat1, scanpy_plot, table_compute, tp_easyjoin_tool, scanpy_inspect			0		2115	2488	0.7666666666666667	0
Single Cell	Importing files from public atlases	https://training.galaxyproject.org//topics/single-cell/tutorials/EBI-retrieval/tutorial.html			2023-11-14	2025-03-11	8	True	False	True	True	retrieve_scxa, tp_grep_tool, tp_find_and_replace, seurat_read10x, sceasy_convert, scanpy_read_10x, hca_matrix_downloader, regexColumn1, anndata_ops			0		583	768	3.6	0
Single Cell	Single-cell ATAC-seq standard processing with SnapATAC2	https://training.galaxyproject.org//topics/single-cell/tutorials/scatac-standard-processing-snapatac2/tutorial.html		Read mapping, Generation, Essential dynamics, Differential gene expression analysis, Principal component visualisation, Genome indexing, Dimensionality reduction, Gene expression profiling, Sequence alignment, Expression profile clustering	2024-07-11	2025-07-02	5	True	False	False	True	anndata_inspect, snapatac2_preprocessing, replace_column_with_key_value_file, bwa_mem, snapatac2_clustering, Cut1, anndata_manipulate, snapatac2_peaks_and_motif, snapatac2_plotting, scanpy_plot, scanpy_filter, fasta_compute_length, anndata_ops, scanpy_normalize, scanpy_inspect			0		1573	1900	1.1	0
Single Cell	Clustering 3K PBMCs with Scanpy	https://training.galaxyproject.org//topics/single-cell/tutorials/scrna-scanpy-pbmc3k/tutorial.html		Expression profile clustering, Differential gene expression analysis, Principal component visualisation	2019-12-19	2025-04-29	16	True	True	True	True	anndata_inspect, anndata_import, scanpy_cluster_reduce_dimension, scanpy_remove_confounders, anndata_manipulate, scanpy_plot, scanpy_filter, scanpy_normalize, scanpy_inspect, datamash_ops	UseGalaxy.cz, UseGalaxy.eu, UseGalaxy.org (Main), UseGalaxy.org.au	UseGalaxy.be, UseGalaxy.fr, UseGalaxy.no	0		3093180	7925989	4.333333333333333	0
Single Cell	Combining single cell datasets after pre-processing	https://training.galaxyproject.org//topics/single-cell/tutorials/scrna-case_alevin-combine-datasets/tutorial.html			2022-09-08	2025-11-18	23	True	False	True	True	anndata_inspect, Cut1, anndata_manipulate, Paste1, tp_replace_in_column, anndata_ops	UseGalaxy.eu, UseGalaxy.org.au	UseGalaxy.be, UseGalaxy.cz, UseGalaxy.org (Main)	0		2531	3548	2.533333333333333	0
Single Cell	Filter, plot, and explore single cell RNA-seq data with Seurat (R)	https://training.galaxyproject.org//topics/single-cell/tutorials/scrna-case_FilterPlotandExploreRStudio/tutorial.html			2023-10-02	2025-03-11	11	True	False	False	False			UseGalaxy.eu, UseGalaxy.org, UseGalaxy.org.au, UseGalaxy.fr	0		3300	3761	0.95	0
Single Cell	Understanding Barcodes	https://training.galaxyproject.org//topics/single-cell/tutorials/scrna-umis/tutorial.html		Sequencing quality control, Sequence composition calculation, Statistical calculation	2019-02-20	2025-02-14	11	True	False	True	True	umi_tools_extract, seq_filter_by_id, fastqc	UseGalaxy.cz, UseGalaxy.eu, UseGalaxy.fr, UseGalaxy.org (Main), UseGalaxy.org.au	Galaxy@AuBi, UseGalaxy.no	0		6393	7955	1.2333333333333334	0
Single Cell	Downstream Single-cell RNA analysis with RaceID	https://training.galaxyproject.org//topics/single-cell/tutorials/scrna-raceid/tutorial.html		Expression profile clustering, Molecular dynamics, Expression analysis	2019-03-25	2025-02-14	7	True	False	False	True	datamash_transpose, raceid_clustering, raceid_filtnormconf, raceid_inspecttrajectory, tp_head_tool, raceid_trajectory, raceid_inspectclusters, tp_sed_tool, datamash_ops	UseGalaxy.eu, UseGalaxy.no, UseGalaxy.org (Main)	UseGalaxy.be, UseGalaxy.cz, UseGalaxy.org.au	0		1091	1287	1.25	0
Single Cell	Comparing inferred cell compositions using MuSiC deconvolution	https://training.galaxyproject.org//topics/single-cell/tutorials/bulk-music-4-compare/tutorial.html			2023-01-20	2025-02-13	10	True	False	False	True	music_compare	UseGalaxy.cz, UseGalaxy.eu, UseGalaxy.org (Main), UseGalaxy.org.au		0		287	430	1.3833333333333333	0
Single Cell	Filter, plot and explore single-cell RNA-seq data with Scanpy (Python)	https://training.galaxyproject.org//topics/single-cell/tutorials/scrna-case-jupyter_basic-pipeline/tutorial.html			2023-08-25	2025-03-11	13	True	False	True	False			UseGalaxy.eu, UseGalaxy.org, UseGalaxy.org.au, UseGalaxy.fr	0		3336	3959	1.5	0
Single Cell	Filter, plot and explore single-cell RNA-seq data with Scanpy	https://training.galaxyproject.org//topics/single-cell/tutorials/scrna-case_basic-pipeline/tutorial.html		Expression profile clustering, Differential gene expression analysis, Principal component visualisation	2021-03-24	2025-04-23	24	True	False	True	True	scanpy_filter_genes, scanpy_plot_embed, anndata_manipulate, scanpy_run_umap, scanpy_compute_graph, scanpy_find_cluster, retrieve_scxa, scanpy_filter, interactive_tool_cellxgene_vip, scanpy_filter_cells, scanpy_normalise_data, scanpy_normalize, scanpy_scale_data, anndata_inspect, scanpy_cluster_reduce_dimension, join1, Cut1, scanpy_plot, scanpy_find_markers, scanpy_run_tsne, scanpy_find_variable_genes, anndata_ops, scanpy_inspect, scanpy_run_pca			0		5449	8576	2.683333333333333	0
Single Cell	Clustering 3K PBMCs with Seurat	https://training.galaxyproject.org//topics/single-cell/tutorials/scrna-seurat-pbmc3k/tutorial.html			2025-01-23	2025-05-09	5	True	False	True	True	seurat_data, Cut1, seurat_plot, seurat_clustering, seurat_reduce_dimension, seurat_preprocessing, Filter1, csv_to_tabular, seurat_create	MISSISSIPPI, UseGalaxy.eu, UseGalaxy.fr, UseGalaxy.org (Main), UseGalaxy.org.au		0		1333	1602	1.1666666666666667	0
Single Cell	Filter, plot, and explore single cell RNA-seq data with Seurat	https://training.galaxyproject.org//topics/single-cell/tutorials/scrna-case_FilterPlotandExplore_SeuratTools/tutorial.html			2024-04-09	2025-03-11	10	True	False	False	True	seurat_run_umap, retrieve_scxa, seurat_normalise_data, seurat_find_variable_genes, seurat_find_neighbours, seurat_scale_data, seurat_plot, seurat_find_markers, seurat_read10x, seurat_run_pca, seurat_filter_cells, seurat_find_clusters	UseGalaxy.eu, UseGalaxy.fr, UseGalaxy.org (Main), UseGalaxy.org.au		0		2015	2452	1.4	0
Single Cell	Scanpy Parameter Iterator	https://training.galaxyproject.org//topics/single-cell/tutorials/scanpy_parameter_iterator/tutorial.html			2023-07-19	2025-02-13	8	True	False	False	True	scanpy_find_cluster, scanpy_parameter_iterator, scanpy_plot_embed, scanpy_run_tsne, scanpy_run_umap, scanpy_compute_graph	UseGalaxy.org (Main), UseGalaxy.org.au		0		292	326	1.05	0
Single Cell	Converting NCBI Data to the AnnData Format	https://training.galaxyproject.org//topics/single-cell/tutorials/scrna-ncbi-anndata/tutorial.html			2023-12-13	2025-03-11	7	True	False	True	True	unzip, anndata_inspect, anndata_import, Cut1, anndata_manipulate, scanpy_filter_cells, Paste1, tp_replace_in_column, anndata_ops	UseGalaxy.org.au	UseGalaxy.cz	0		463	547	1.6	0
