Name	Source	ID	Link	Creators	Tags	Creation time	Update time	Latest version	Versions	Number of steps	Tools	EDAM operations	EDAM topics	License	DOI	Projects	To keep	Deprecated
Genome assembly workflow for nanopore reads, for TSI	WorkflowHub	1114	https://workflowhub.eu/workflows/1114?version=1	Anna Syme	tsi, genome_assembly, nanopore	2024-09-03	2024-09-03	1	1	10.0	split_file_to_collection, bandage_info, bandage_image, collapse_dataset, fasta-stats, flye, porechop, fastqc, nanofilt	Mapping assembly, Sequence assembly visualisation, Sequencing quality control, Sequence composition calculation, Statistical calculation, Genome assembly, Cross-assembly, De-novo assembly		GPL-3.0-or-later	10.48546/workflowhub.workflow.1114.1	Australian BioCommons, Galaxy Australia	True	False
ERGA-BGE Genome Report ANNOT analyses	WorkflowHub	1096	https://workflowhub.eu/workflows/1096?version=2	Diego De Panis	annotation, biodiversity, erga, genomics, qc	2025-02-05	2025-02-24	2	2	13.0	busco, agat, collapse_dataset, tp_text_file_with_recurring_lines, omark, pick_value, lftp	Sequence assembly validation, Data handling, Genome annotation, Differential protein expression profiling	Genomics	MIT		ERGA Annotation	True	False
ERGA Long reads+HiC Assembly+QC Hifiasm v2602 (WF2)	WorkflowHub	605	https://workflowhub.eu/workflows/605?version=2	Diego De Panis	assembly+qc, erga, hi-c, hifi	2026-02-11	2026-02-11	2	2	25.0	busco, gfa_to_fa, gfastats, hifiasm, merqury, param_value_from_file, bandage_image, pick_value	Sequence assembly validation, Data handling, Phasing, k-mer counting, Sequence assembly visualisation, Scaffolding, Genome assembly, De-novo assembly	Whole genome sequencing	MIT		ERGA Assembly	True	False
ERGA Profiling Long Reads v2602 (WF1)	WorkflowHub	603	https://workflowhub.eu/workflows/603?version=2	Diego De Panis	erga, profiling	2024-09-18	2026-02-11	2	2	17.0	meryl, Cut1, param_value_from_file, Convert characters1, tp_grep_tool, tp_find_and_replace, smudgeplot, genomescope, Add_a_column1, tp_cut_tool	Sequence trimming, k-mer counting, Genotyping	Whole genome sequencing	MIT		ERGA Assembly	True	False
ERGA DataQC HiFi v2601 (WF0)	WorkflowHub	602	https://workflowhub.eu/workflows/602?version=2	Diego De Panis	dataqc, erga, hifi	2024-09-18	2026-01-20	2	2	5.0	multiqc, collapse_dataset, fastqc, cutadapt, seqkit_stats	Sequence conversion, DNA translation, Sequence composition calculation, Primer removal, Statistical calculation, Sequence trimming, Validation, DNA transcription, Sequencing quality control, Read pre-processing	Whole genome sequencing	MIT		ERGA Assembly	True	False
ERGA DataQC Illumina v2601 (WF0)	WorkflowHub	601	https://workflowhub.eu/workflows/601?version=2	Diego De Panis	dataqc, erga, illumina	2024-09-18	2026-01-20	2	2	7.0	multiqc, __FLATTEN__, collapse_dataset, fastp, fastqc, seqkit_stats	Sequence conversion, DNA translation, Sequence composition calculation, Statistical calculation, Sequence trimming, Validation, DNA transcription, Sequencing quality control, Sequence contamination filtering	Whole genome sequencing	MIT		ERGA Assembly	True	False
ERGA DataQC ONT v2505 (WF0)	WorkflowHub	697	https://workflowhub.eu/workflows/697?version=1	Diego De Panis	dataqc, erga, ont	2024-01-08	2025-06-01	1	1	3.0	nanoplot, seqkit_stats, collapse_dataset	Scatter plot plotting, Sequence conversion, Box-Whisker plot plotting, DNA translation, DNA transcription, Sequence trimming	Whole genome sequencing	MIT		ERGA Assembly	True	False
ERGA Long Reads PriAlt Purge+QC v2505 (WF3)	WorkflowHub	1163	https://workflowhub.eu/workflows/1163?version=2	Diego De Panis	assembly, erga, hifi, qc	2025-06-01	2025-06-01	2	2	25.0	busco, gfa_to_fa, gfastats, cat1, param_value_from_file, merqury, purge_dups, minimap2	Phasing, Data handling, Scaffolding, Read binning, Pairwise sequence alignment, Sequence assembly validation, k-mer counting, Genome assembly, De-novo assembly	Whole genome sequencing	MIT		ERGA Assembly	True	False
ERGA HiC Pri Scaffolding+QC YaHS v2505 (WF4)	WorkflowHub	1164	https://workflowhub.eu/workflows/1164?version=2	Diego De Panis	assembly, erga, hic, qc	2025-02-03	2025-06-01	2	2	33.0	busco, CONVERTER_fasta_to_fai, yahs, sambamba_merge, bwa_mem2, pretext_snapshot, pick_value, gfa_to_fa, Cut1, merqury, pairtools_parse, __EXTRACT_DATASET__, gfastats, pairtools_split, sambamba_flagstat, param_value_from_file, pretext_map, pairtools_dedup, pairtools_sort	Sequence assembly validation, Phasing, k-mer counting, Data handling, Scaffolding, De-novo assembly, Genome assembly, Sequence alignment	Whole genome sequencing	MIT		ERGA Assembly	True	False
ERGA Long reads-only Assembly+QC Hifiasm v2505 (WF2)	WorkflowHub	1162	https://workflowhub.eu/workflows/1162?version=2	Diego De Panis	assembly, erga, hifi, ont, qc	2025-05-30	2025-09-09	2	2	22.0	busco, gfa_to_fa, gfastats, hifiasm, merqury, param_value_from_file, bandage_image	Sequence assembly validation, Data handling, Phasing, k-mer counting, Sequence assembly visualisation, Scaffolding, Genome assembly, De-novo assembly	Whole genome sequencing	MIT		ERGA Assembly	True	False
ERGA-BGE Genome Report ASM analyses (one-asm HiFi + HiC)	WorkflowHub	1104	https://workflowhub.eu/workflows/1104?version=2	Diego De Panis	genome assembly, genomics, qc	2024-11-04	2024-12-05	2	2	45.0	busco, blobtoolkit, bg_diamond, fasterq_dump, CONVERTER_fasta_to_fai, fastp, cutadapt, sambamba_merge, cooler_csort_tabix, bwa_mem2, hicexplorer_hicplotmatrix, sam_merge2, genomescope, pick_value, lftp, rseqc_bam_stat, meryl, Cut1, merqury, datasets_download_genome, __FLATTEN__, hicexplorer_hicmergematrixbins, tp_text_file_with_recurring_lines, smudgeplot, minimap2, pairtools_parse, __EXTRACT_DATASET__, gfastats, cooler_cload_tabix, pairtools_split, sambamba_flagstat, bedtools_makewindowsbed, collapse_dataset, pairtools_dedup, pairtools_sort	Phasing, Data handling, Data retrieval, Scaffolding, Sequence trimming, Pairwise sequence alignment, Sequence alignment, Sequence assembly validation, Sequencing quality control, k-mer counting, Data parsing, Data deposition, De-novo assembly, Mapping, Sequence database search, Primer removal, Sequence alignment analysis, Visualisation, Sequence contamination filtering, Genome assembly, Genotyping, Read pre-processing	Genomics	MIT		ERGA Assembly	True	False
ERGA HiC Collapsed Scaffolding+QC YaHS v2311 (WF4)	WorkflowHub	702	https://workflowhub.eu/workflows/702?version=1	Diego De Panis	erga, hic, name:assembly+qc	2024-01-09	2024-01-09	1	1	16.0	busco, gfa_to_fa, bwa_mem2, gfastats, pretext_snapshot, merqury, param_value_from_file, pretext_map, yahs, bellerophon	Phasing, Data handling, Scaffolding, Sequence alignment, Sequence assembly validation, k-mer counting, Genome assembly, De-novo assembly	Whole genome sequencing	MIT		ERGA Assembly	True	False
ERGA ONT+Illumina Collapsed Purge+QC v2311 (WF3)	WorkflowHub	701	https://workflowhub.eu/workflows/701?version=1	Diego De Panis	erga, illumina, name:assembly+qc	2024-01-09	2024-01-09	1	1	14.0	busco, gfa_to_fa, gfastats, merqury, param_value_from_file, purge_dups, minimap2	Phasing, Data handling, Scaffolding, Read binning, Pairwise sequence alignment, Sequence assembly validation, k-mer counting, Genome assembly, De-novo assembly	Whole genome sequencing	MIT		ERGA Assembly	True	False
ERGA HiC Hap1Hap2 Scaffolding+QC YaHS v2309 (WF4)	WorkflowHub	608	https://workflowhub.eu/workflows/608?version=1	Diego De Panis	assembly+qc, erga, hi-c	2023-10-11	2024-03-13	1	1	30.0	busco, gfa_to_fa, bwa_mem2, gfastats, pretext_snapshot, merqury, param_value_from_file, pretext_map, yahs, bellerophon	Phasing, Data handling, Scaffolding, Sequence alignment, Sequence assembly validation, k-mer counting, Genome assembly, De-novo assembly	Whole genome sequencing	MIT	10.48546/workflowhub.workflow.608.1	ERGA Assembly	True	False
Refining Genome Annotations with Apollo (prokaryotes)	WorkflowHub	749	https://workflowhub.eu/workflows/749?version=1	Anthony Bretaudeau	genome-annotation	2024-02-14	2025-11-04	1	1	5.0	list_organism, iframe, create_or_update, jbrowse, create_account	Genome visualisation		CC-BY-4.0	10.48546/workflowhub.workflow.749.1	EuroScienceGateway	True	False
GigaScience_Peptide_Annotation_demonstration_STS26T_neoantigen_candidates_workflow	WorkflowHub	1790	https://workflowhub.eu/workflows/1790?version=1		gtn, galaxy, name:neoantigen	2025-07-07	2025-07-07	1	1	11.0	"query_tabular, pep_pointer, converting colons to columns
Convert characters1, converting pipes to columns
Convert characters1, regexColumn1, tab2fasta"			GPL-3.0-or-later		Galaxy Training Network	True	False
Workflow 'Biodiversity data exploration tuto'	WorkflowHub	1693	https://workflowhub.eu/workflows/1693?version=1		ecology, gtn, galaxy	2025-06-02	2025-06-02	1	1	6.0	tool_anonymization, ecology_link_between_var, ecology_beta_diversity, ecology_homogeneity_normality, ecology_stat_presence_abs, ecology_presence_abs_abund			CC-BY-4.0		Galaxy Training Network	True	False
Metagenomics assembly tutorial workflow	WorkflowHub	1634	https://workflowhub.eu/workflows/1634?version=1		gtn, galaxy	2025-06-02	2025-06-02	1	1	8.0	megahit_contig2fastg, bandage_info, bowtie2, bandage_image, collection_column_join, megahit, metaspades, quast	Sequence assembly validation, Sequence assembly visualisation, Visualisation, Read mapping, Genome assembly		CC-BY-4.0		Galaxy Training Network	True	False
Genome Annotation with Prokka	WorkflowHub	1497	https://workflowhub.eu/workflows/1497?version=1		gtn, galaxy, genome-annotation	2025-06-02	2025-06-02	1	1	2.0	prokka, jbrowse	Genome annotation, Gene prediction, Genome visualisation, Coding region prediction		GPL-3.0-or-later		Galaxy Training Network	True	False
ONT -- Metagenomics-Kraken2-Krona	WorkflowHub	53	https://workflowhub.eu/workflows/53?version=1	Milad Miladi	ont	2020-08-05	2023-02-13	1	1	4.0	datamash_reverse, kraken2, taxonomy_krona_chart, tp_replace_in_line	Visualisation, Taxonomic classification		MIT		NanoGalaxy	True	False
Biodiversity data exploration tutorial	WorkflowHub	656	https://workflowhub.eu/workflows/656?version=1	Yvan Le Bras, Coline Royaux, Marie Jossé	biodiversity, ecology	2023-11-09	2024-12-09	1	1	6.0	tool_anonymization, ecology_link_between_var, ecology_beta_diversity, ecology_homogeneity_normality, ecology_stat_presence_abs, ecology_presence_abs_abund		Biodiversity, Ecology	CC-BY-4.0	10.48546/workflowhub.workflow.656.1	PNDB	True	False
Population and community metrics calculation from Biodiversity data	WorkflowHub	49	https://workflowhub.eu/workflows/49?version=2	Yvan Le Bras, Coline Royaux	biodiversity, community_metrics, ecology, glm, modeling, presence_absence, species abundance, statistics	2020-07-24	2024-12-09	2	1	4.0				MIT	10.48546/workflowhub.workflow.49.2	PNDB	True	False
Workflow CESAB Biodiversity data training 2025 - data access exercise bonus	https://usegalaxy.eu	39366728f462b4f1	https://usegalaxy.eu/published/workflow?id=39366728f462b4f1		cesab, frb, gbif, pndb, biodiversity, data, occurences, map, gis, spatial, training	2025-11-06	2025-11-06	12	12		cat1, collapse_dataset, tp_text_file_with_recurring_lines, interactive_tool_jupyter_notebook, Remove beginning1, lftp			MIT			True	False
Workflow CESAB Biodiversity data training 2025 - data access exercise 1	https://usegalaxy.eu	a52ea1bae6683dce	https://usegalaxy.eu/published/workflow?id=a52ea1bae6683dce		cesab, frb, gbif, pndb, biodiversity, data, download, training	2025-11-05	2025-11-06	15	15		interactive_tool_jupyter_notebook, lftp, collapse_dataset, tp_text_file_with_recurring_lines			MIT			True	False
Workflow CESAB Biodiversity data training 2025 - data access exercise 2	https://usegalaxy.eu	ca0775b90e12a784	https://usegalaxy.eu/published/workflow?id=ca0775b90e12a784		cesab, gbif, pndb, biodiversity, data, occurences, training	2025-11-05	2025-11-06	9	9		interactive_tool_jupyter_notebook, lftp, collapse_dataset, tp_text_file_with_recurring_lines			MIT			True	False
Obitools eDNA metabarcoding	https://usegalaxy.eu	afad9a17a80bb26d	https://usegalaxy.eu/published/workflow?id=afad9a17a80bb26d		ecology, biodiversity, edna	2023-11-09	2025-09-12	1	1		obi_illumina_pairend, obi_grep, obi_tab, Filter1, join1, fastq_groomer, Cut1, obi_annotate, obi_ngsfilter, obi_stat, seq_filter_by_id, fastqc, ncbi_blastn_wrapper, obi_clean, obi_uniq, wc_gnu, unzip	Sequencing quality control, Sequence composition calculation, Sequence analysis, Statistical calculation		MIT			True	False
Satellite data for biodiversity	https://usegalaxy.eu	1d2cd0af01a30a46	https://usegalaxy.eu/published/workflow?id=1d2cd0af01a30a46	Marie Josse	ecology, earth-system, satellite	2023-03-01	2024-05-27	5	5		srs_global_indices, srs_spectral_indices, srs_diversity_maps, srs_preprocess_s2			MIT			True	False
Obis biodiversity indicator on Asian pacific	https://usegalaxy.eu	9e05bd65faf58ab3	https://usegalaxy.eu/published/workflow?id=9e05bd65faf58ab3			2023-03-13	2023-11-10	2	2		csv_to_tabular, obisindicators, Filter1, tp_cut_tool						True	False
Remote sensing Sentinel 2 data analysis to produce biodiversity metrics	https://usegalaxy.eu	da88448ab15d167d	https://usegalaxy.eu/published/workflow?id=da88448ab15d167d			2023-11-09	2023-11-09	1	1		srs_global_indices, srs_spectral_indices, srs_diversity_maps, srs_preprocess_s2						True	False
Compute and analyze biodiversity metrics with PAMPA toolsuite	https://usegalaxy.eu	d33ab07e4cf44f8c	https://usegalaxy.eu/published/workflow?id=d33ab07e4cf44f8c		ecology	2021-02-24	2021-02-24	0	0		tp_cat, pampa_presabs, pampa_glmcomm, Filter1, pampa_glmsp, datamash_transpose, regex1, mergeCols1, pampa_plotglm, regexColumn1, tp_cut_tool, Count1, tp_sort_header_tool, pampa_communitymetrics						True	False
16S_biodiversity_BIOM	https://usegalaxy.org.au	ca6f29110df8dadc	https://usegalaxy.org.au/published/workflow?id=ca6f29110df8dadc		metadegalaxy	2019-03-21	2021-04-01	9	9		phyloseq_richness, biom_add_metadata, phyloseq_net, phyloseq_abundance, phyloseq_taxonomy, phyloseq_DESeq2, biom_convert, symmetricPlot	Formatting					True	False
16S_biodiversity_for_nonoverlap_paired_end	https://usegalaxy.org.au	869440d35a618836	https://usegalaxy.org.au/published/workflow?id=869440d35a618836		metadegalaxy	2019-03-21	2021-04-01	18	18		uclust2otutable, bwa_mem, samtools_fastx, biom_convert, biom_add_metadata, phyloseq_net, vsearch_clustering, phyloseq_richness, Cut1, cat1, phyloseq_abundance, picard_FilterSamReads, addValue, vsearch_dereplication, trimmomatic, vsearch_search, vsearch_chimera_detection, phyloseq_taxonomy, phyloseq_DESeq2, fastqc, cat_multi_datasets, symmetricPlot	Chimera detection, Genome indexing, DNA mapping, Sequence composition calculation, Statistical calculation, Sequence alignment, Formatting, Sequencing quality control, Generation, Read mapping					True	False
16S_biodiversity_for_overlap_paired_end	https://usegalaxy.org.au	14e80b7f9f68ec2a	https://usegalaxy.org.au/published/workflow?id=14e80b7f9f68ec2a		metadegalaxy	2019-03-21	2021-04-01	16	16		uclust2otutable, bwa_mem, samtools_fastx, iuc_pear, biom_convert, biom_add_metadata, phyloseq_net, vsearch_clustering, phyloseq_richness, Cut1, cat1, phyloseq_abundance, picard_FilterSamReads, addValue, vsearch_dereplication, trimmomatic, picard_MergeSamFiles, vsearch_search, vsearch_chimera_detection, phyloseq_taxonomy, phyloseq_DESeq2, fastqc, symmetricPlot	Chimera detection, Genome indexing, DNA mapping, Sequence composition calculation, Statistical calculation, Sequence merging, Sequence alignment, Formatting, Sequencing quality control, Generation, Read mapping					True	False
