Name	Source	ID	Link	Creators	Tags	Creation time	Update time	Latest version	Versions	Number of steps	Tools	EDAM operations	EDAM topics	License	DOI	Projects	To keep	Deprecated
Genome assembly workflow for nanopore reads, for TSI	WorkflowHub	1114	https://workflowhub.eu/workflows/1114?version=1	Anna Syme	tsi, genome_assembly, nanopore	2024-09-03	2026-05-13	1	1	10.0	bandage_info, flye, nanofilt, split_file_to_collection, collapse_dataset, fastqc, bandage_image, fasta-stats, porechop	Mapping assembly, Sequence assembly visualisation, Cross-assembly, De-novo assembly, Sequence composition calculation, Statistical calculation, Sequencing quality control, Genome assembly		GPL-3.0-or-later	10.48546/workflowhub.workflow.1114.1	Australian BioCommons, Galaxy Australia	True	False
ERGA-BGE Genome Report ANNOT analyses	WorkflowHub	1096	https://workflowhub.eu/workflows/1096?version=2	Diego De Panis	annotation, biodiversity, erga, genomics, qc	2025-02-05	2026-05-13	2	2	13.0	tp_text_file_with_recurring_lines, omark, collapse_dataset, lftp, busco, pick_value, agat	Differential protein expression profiling, Genome annotation, Data handling, Sequence assembly validation	Genomics	MIT		ERGA Annotation	True	False
Galaxy Workflow ERGA-BGE Genome Report ASM analyses (one-asm Long Reads + HiC)	WorkflowHub	1104	https://workflowhub.eu/workflows/1104?version=2	Diego De Panis	genome assembly, genomics, qc	2024-11-04	2026-06-15	2	2	48.0	tp_text_file_with_recurring_lines, genomescope, __UNZIP_COLLECTION__, cooler_csort_tabix, CONVERTER_fasta_to_fai, gfastats, meryl, bg_diamond, hicexplorer_hicmergematrixbins, datasets_download_genome, Cut1, smudgeplot, minimap2, hicexplorer_hicplotmatrix, __EXTRACT_DATASET__, busco, sambamba_merge, __ZIP_COLLECTION__, chromap, pick_value, merqury, cooler_cload_tabix, collapse_dataset, lftp, __FLATTEN__, sambamba_flagstat, fasterq_dump, blobtoolkit, bedtools_makewindowsbed	Data retrieval, k-mer counting, Data deposition, Scaffolding, Pairwise sequence alignment, Sequence database search, Data handling, Sequence assembly validation, De-novo assembly, Data parsing, Visualisation, Genotyping, Genome assembly, Phasing, Sequence alignment analysis, Mapping, Sequence trimming	Genomics	MIT		ERGA Assembly	True	False
ERGA Long reads+HiC Assembly+QC Hifiasm v2602 (WF2)	WorkflowHub	605	https://workflowhub.eu/workflows/605?version=2	Diego De Panis	assembly+qc, erga, hi-c, hifi	2026-02-11	2026-05-13	2	2	25.0	gfa_to_fa, gfastats, param_value_from_file, merqury, hifiasm, busco, bandage_image, pick_value	De-novo assembly, k-mer counting, Scaffolding, Genome assembly, Sequence assembly visualisation, Phasing, Data handling, Sequence assembly validation	Whole genome sequencing	MIT		ERGA Assembly	True	False
ERGA Profiling Long Reads v2602 (WF1)	WorkflowHub	603	https://workflowhub.eu/workflows/603?version=2	Diego De Panis	erga, profiling	2024-09-18	2026-05-13	2	2	17.0	meryl, param_value_from_file, genomescope, Cut1, tp_find_and_replace, tp_grep_tool, tp_cut_tool, Add_a_column1, Convert characters1, smudgeplot	k-mer counting, Genotyping, Sequence trimming	Whole genome sequencing	MIT		ERGA Assembly	True	False
ERGA DataQC HiFi v2601 (WF0)	WorkflowHub	602	https://workflowhub.eu/workflows/602?version=2	Diego De Panis	dataqc, erga, hifi	2024-09-18	2026-05-13	2	2	5.0	cutadapt, collapse_dataset, seqkit_stats, fastqc, multiqc	Sequence conversion, Read pre-processing, Validation, Primer removal, Sequence composition calculation, Statistical calculation, Sequencing quality control, DNA transcription, DNA translation, Sequence trimming	Whole genome sequencing	MIT		ERGA Assembly	True	False
ERGA DataQC Illumina v2601 (WF0)	WorkflowHub	601	https://workflowhub.eu/workflows/601?version=2	Diego De Panis	dataqc, erga, illumina	2024-09-18	2026-05-13	2	2	7.0	fastp, collapse_dataset, seqkit_stats, fastqc, multiqc, __FLATTEN__	Sequence conversion, Sequence contamination filtering, Validation, Sequence composition calculation, Statistical calculation, Sequencing quality control, DNA transcription, DNA translation, Sequence trimming	Whole genome sequencing	MIT		ERGA Assembly	True	False
ERGA DataQC ONT v2505 (WF0)	WorkflowHub	697	https://workflowhub.eu/workflows/697?version=1	Diego De Panis	dataqc, erga, ont	2024-01-08	2026-05-13	1	1	3.0	nanoplot, seqkit_stats, collapse_dataset	Scatter plot plotting, DNA transcription, DNA translation, Box-Whisker plot plotting, Sequence conversion, Sequence trimming	Whole genome sequencing	MIT		ERGA Assembly	True	False
ERGA Long Reads PriAlt Purge+QC v2505 (WF3)	WorkflowHub	1163	https://workflowhub.eu/workflows/1163?version=2	Diego De Panis	assembly, erga, hifi, qc	2025-06-01	2026-05-13	2	2	25.0	minimap2, gfa_to_fa, gfastats, param_value_from_file, merqury, cat1, busco, purge_dups	k-mer counting, Scaffolding, Pairwise sequence alignment, Data handling, Sequence assembly validation, De-novo assembly, Read binning, Genome assembly, Phasing	Whole genome sequencing	MIT		ERGA Assembly	True	False
ERGA HiC Pri Scaffolding+QC YaHS v2505 (WF4)	WorkflowHub	1164	https://workflowhub.eu/workflows/1164?version=2	Diego De Panis	assembly, erga, hic, qc	2025-02-03	2026-05-13	2	2	33.0	pretext_map, bwa_mem2, CONVERTER_fasta_to_fai, gfa_to_fa, gfastats, Cut1, pairtools_dedup, param_value_from_file, __EXTRACT_DATASET__, busco, sambamba_merge, pairtools_sort, pick_value, pairtools_parse, merqury, yahs, pretext_snapshot, sambamba_flagstat, pairtools_split	k-mer counting, Scaffolding, Data handling, Sequence assembly validation, Sequence alignment, De-novo assembly, Genome assembly, Phasing	Whole genome sequencing	MIT		ERGA Assembly	True	False
ERGA Long reads-only Assembly+QC Hifiasm v2505 (WF2)	WorkflowHub	1162	https://workflowhub.eu/workflows/1162?version=2	Diego De Panis	assembly, erga, hifi, ont, qc	2025-05-30	2026-05-13	2	2	22.0	gfa_to_fa, gfastats, param_value_from_file, merqury, hifiasm, busco, bandage_image	De-novo assembly, k-mer counting, Scaffolding, Genome assembly, Sequence assembly visualisation, Phasing, Data handling, Sequence assembly validation	Whole genome sequencing	MIT		ERGA Assembly	True	False
ERGA HiC Collapsed Scaffolding+QC YaHS v2311 (WF4)	WorkflowHub	702	https://workflowhub.eu/workflows/702?version=1	Diego De Panis	erga, hic, name:assembly+qc	2024-01-09	2026-05-13	1	1	16.0	gfa_to_fa, gfastats, param_value_from_file, merqury, busco, yahs, pretext_map, pretext_snapshot, bwa_mem2, bellerophon	De-novo assembly, Sequence alignment, k-mer counting, Scaffolding, Genome assembly, Phasing, Data handling, Sequence assembly validation	Whole genome sequencing	MIT		ERGA Assembly	True	False
ERGA ONT+Illumina Collapsed Purge+QC v2311 (WF3)	WorkflowHub	701	https://workflowhub.eu/workflows/701?version=1	Diego De Panis	erga, illumina, name:assembly+qc	2024-01-09	2026-05-13	1	1	14.0	minimap2, gfa_to_fa, gfastats, param_value_from_file, merqury, busco, purge_dups	k-mer counting, Scaffolding, Pairwise sequence alignment, Data handling, Sequence assembly validation, De-novo assembly, Read binning, Genome assembly, Phasing	Whole genome sequencing	MIT		ERGA Assembly	True	False
ERGA HiC Hap1Hap2 Scaffolding+QC YaHS v2309 (WF4)	WorkflowHub	608	https://workflowhub.eu/workflows/608?version=1	Diego De Panis	assembly+qc, erga, hi-c	2023-10-11	2026-05-13	1	1	30.0	gfa_to_fa, gfastats, param_value_from_file, merqury, busco, yahs, pretext_map, pretext_snapshot, bwa_mem2, bellerophon	De-novo assembly, Sequence alignment, k-mer counting, Scaffolding, Genome assembly, Phasing, Data handling, Sequence assembly validation	Whole genome sequencing	MIT	10.48546/workflowhub.workflow.608.1	ERGA Assembly	True	False
Refining Genome Annotations with Apollo (prokaryotes)	WorkflowHub	749	https://workflowhub.eu/workflows/749?version=1	Anthony Bretaudeau	genome-annotation	2024-02-14	2025-11-04	1	1	5.0	jbrowse, list_organism, iframe, create_account, create_or_update	Genome visualisation		CC-BY-4.0	10.48546/workflowhub.workflow.749.1	EuroScienceGateway	True	False
GigaScience_Peptide_Annotation_demonstration_STS26T_neoantigen_candidates_workflow	WorkflowHub	1790	https://workflowhub.eu/workflows/1790?version=1		gtn, galaxy, name:neoantigen	2025-07-07	2025-07-07	1	1	11.0	"regexColumn1, converting colons to columns
Convert characters1, tab2fasta, query_tabular, pep_pointer, converting pipes to columns
Convert characters1"			GPL-3.0-or-later		Galaxy Training Network	True	False
Workflow 'Biodiversity data exploration tuto'	WorkflowHub	1693	https://workflowhub.eu/workflows/1693?version=1		ecology, gtn, galaxy	2025-06-02	2025-06-02	1	1	6.0	ecology_link_between_var, tool_anonymization, ecology_beta_diversity, ecology_presence_abs_abund, ecology_homogeneity_normality, ecology_stat_presence_abs			CC-BY-4.0		Galaxy Training Network	True	False
Metagenomics assembly tutorial workflow	WorkflowHub	1634	https://workflowhub.eu/workflows/1634?version=1		gtn, galaxy	2025-06-02	2025-06-02	1	1	8.0	bandage_info, quast, metaspades, megahit_contig2fastg, megahit, bandage_image, bowtie2, collection_column_join	Read mapping, Visualisation, Genome assembly, Sequence assembly visualisation, Sequence assembly validation		CC-BY-4.0		Galaxy Training Network	True	False
Genome Annotation with Prokka	WorkflowHub	1497	https://workflowhub.eu/workflows/1497?version=1		gtn, galaxy, genome-annotation	2025-06-02	2025-06-02	1	1	2.0	jbrowse, prokka	Gene prediction, Genome visualisation, Genome annotation, Coding region prediction		GPL-3.0-or-later		Galaxy Training Network	True	False
ONT -- Metagenomics-Kraken2-Krona	WorkflowHub	53	https://workflowhub.eu/workflows/53?version=1	Milad Miladi	ont	2020-08-05	2026-05-13	1	1	4.0	kraken2, datamash_reverse, taxonomy_krona_chart, tp_replace_in_line	Taxonomic classification, Visualisation		MIT		NanoGalaxy	True	False
Biodiversity data exploration tutorial	WorkflowHub	656	https://workflowhub.eu/workflows/656?version=1	Yvan Le Bras, Coline Royaux, Marie Jossé	biodiversity, ecology	2023-11-09	2026-05-13	1	1	6.0	ecology_link_between_var, tool_anonymization, ecology_beta_diversity, ecology_presence_abs_abund, ecology_homogeneity_normality, ecology_stat_presence_abs		Biodiversity, Ecology	CC-BY-4.0	10.48546/workflowhub.workflow.656.1	PNDB	True	False
Population and community metrics calculation from Biodiversity data	WorkflowHub	49	https://workflowhub.eu/workflows/49?version=2	Yvan Le Bras, Coline Royaux	biodiversity, community_metrics, ecology, glm, modeling, presence_absence, species abundance, statistics	2020-07-24	2026-05-13	2	1	4.0				MIT	10.48546/workflowhub.workflow.49.2	PNDB	True	False
Workflow CESAB Biodiversity data training 2025 - data access exercise bonus	https://usegalaxy.eu	39366728f462b4f1	https://usegalaxy.eu/published/workflow?id=39366728f462b4f1		cesab, frb, gbif, pndb, biodiversity, data, occurences, map, gis, spatial, training	2025-11-06	2025-11-06	12	12		tp_text_file_with_recurring_lines, interactive_tool_jupyter_notebook, cat1, collapse_dataset, lftp, Remove beginning1			MIT			True	False
Workflow CESAB Biodiversity data training 2025 - data access exercise 1	https://usegalaxy.eu	a52ea1bae6683dce	https://usegalaxy.eu/published/workflow?id=a52ea1bae6683dce		cesab, frb, gbif, pndb, biodiversity, data, download, training	2025-11-05	2025-11-06	15	15		collapse_dataset, lftp, interactive_tool_jupyter_notebook, tp_text_file_with_recurring_lines			MIT			True	False
Workflow CESAB Biodiversity data training 2025 - data access exercise 2	https://usegalaxy.eu	ca0775b90e12a784	https://usegalaxy.eu/published/workflow?id=ca0775b90e12a784		cesab, gbif, pndb, biodiversity, data, occurences, training	2025-11-05	2025-11-06	9	9		collapse_dataset, lftp, interactive_tool_jupyter_notebook, tp_text_file_with_recurring_lines			MIT			True	False
Obitools eDNA metabarcoding	https://usegalaxy.eu	afad9a17a80bb26d	https://usegalaxy.eu/published/workflow?id=afad9a17a80bb26d		ecology, biodiversity, edna	2023-11-09	2025-09-12	1	1		fastq_groomer, ncbi_blastn_wrapper, seq_filter_by_id, obi_tab, join1, obi_annotate, fastqc, obi_ngsfilter, obi_uniq, Cut1, obi_illumina_pairend, obi_clean, unzip, obi_stat, wc_gnu, obi_grep, Filter1	Sequence composition calculation, Statistical calculation, Sequencing quality control		MIT			True	False
Satellite data for biodiversity	https://usegalaxy.eu	1d2cd0af01a30a46	https://usegalaxy.eu/published/workflow?id=1d2cd0af01a30a46	Marie Josse	ecology, earth-system, satellite	2023-03-01	2024-05-27	5	5		srs_spectral_indices, srs_diversity_maps, srs_global_indices, srs_preprocess_s2			MIT			True	False
Obis biodiversity indicator on Asian pacific	https://usegalaxy.eu	9e05bd65faf58ab3	https://usegalaxy.eu/published/workflow?id=9e05bd65faf58ab3			2023-03-13	2023-11-10	2	2		csv_to_tabular, obisindicators, Filter1, tp_cut_tool						True	False
Remote sensing Sentinel 2 data analysis to produce biodiversity metrics	https://usegalaxy.eu	da88448ab15d167d	https://usegalaxy.eu/published/workflow?id=da88448ab15d167d			2023-11-09	2023-11-09	1	1		srs_global_indices, srs_diversity_maps, srs_spectral_indices, srs_preprocess_s2						True	False
Compute and analyze biodiversity metrics with PAMPA toolsuite	https://usegalaxy.eu	d33ab07e4cf44f8c	https://usegalaxy.eu/published/workflow?id=d33ab07e4cf44f8c		ecology	2021-02-24	2021-02-24	0	0		tp_cat, pampa_presabs, tp_sort_header_tool, regexColumn1, datamash_transpose, pampa_plotglm, pampa_communitymetrics, pampa_glmsp, regex1, tp_cut_tool, pampa_glmcomm, mergeCols1, Filter1, Count1						True	False
16S_biodiversity_BIOM	https://usegalaxy.org.au	ca6f29110df8dadc	https://usegalaxy.org.au/published/workflow?id=ca6f29110df8dadc		metadegalaxy	2019-03-21	2021-04-01	9	9		phyloseq_net, phyloseq_DESeq2, phyloseq_abundance, phyloseq_richness, phyloseq_taxonomy, symmetricPlot, biom_add_metadata, biom_convert	Formatting					True	False
16S_biodiversity_for_nonoverlap_paired_end	https://usegalaxy.org.au	869440d35a618836	https://usegalaxy.org.au/published/workflow?id=869440d35a618836		metadegalaxy	2019-03-21	2021-04-01	18	18		addValue, picard_FilterSamReads, trimmomatic, samtools_fastx, biom_convert, phyloseq_abundance, cat1, fastqc, Cut1, vsearch_search, phyloseq_richness, cat_multi_datasets, phyloseq_DESeq2, vsearch_clustering, biom_add_metadata, phyloseq_net, uclust2otutable, bwa_mem, vsearch_dereplication, phyloseq_taxonomy, symmetricPlot, vsearch_chimera_detection	Genome indexing, Read mapping, Generation, DNA mapping, Sequence alignment, Sequence composition calculation, Formatting, Sequencing quality control, Statistical calculation, Chimera detection					True	False
16S_biodiversity_for_overlap_paired_end	https://usegalaxy.org.au	14e80b7f9f68ec2a	https://usegalaxy.org.au/published/workflow?id=14e80b7f9f68ec2a		metadegalaxy	2019-03-21	2021-04-01	16	16		addValue, picard_FilterSamReads, trimmomatic, samtools_fastx, biom_convert, phyloseq_abundance, cat1, picard_MergeSamFiles, fastqc, Cut1, vsearch_search, phyloseq_richness, phyloseq_DESeq2, vsearch_clustering, biom_add_metadata, phyloseq_net, uclust2otutable, bwa_mem, vsearch_dereplication, iuc_pear, phyloseq_taxonomy, symmetricPlot, vsearch_chimera_detection	Genome indexing, Read mapping, Sequence merging, Generation, DNA mapping, Sequence alignment, Sequence composition calculation, Formatting, Sequencing quality control, Statistical calculation, Chimera detection					True	False
