Topic	Title	Link	EDAM topic	EDAM operation	Creation	Last modification	Version	Tutorial	Slides	Video	Workflows	Tools	Servers with precise tool versions	Servers with tool but different versions	Feedback number	Feedback mean note	Visitors	Page views	Visit duration	Video views
Assembly	Genome Assembly Quality Control	https://training.galaxyproject.org//topics/assembly/tutorials/assembly-quality-control/tutorial.html	Biodiversity, Sequence assembly, Data quality management	Sequence assembly validation, Visualisation, Phasing, Scaffolding, Genome assembly, De-novo assembly, k-mer counting	2022-08-26	2025-06-04	6	True	True	False	True	busco, chromeister, meryl, merqury, quast	UseGalaxy.eu, UseGalaxy.fr, UseGalaxy.org.au	UseGalaxy.cz	0		2214986	5010914	4.366666666666666	0
Assembly	Large genome assembly and polishing	https://training.galaxyproject.org//topics/assembly/tutorials/largegenome/tutorial.html	Genomics, Sequence assembly, Biodiversity	Sequence assembly, Sequence contamination filtering, Validation, Sequence assembly visualisation, Cross-assembly, Scatter plot plotting, Genome assembly, Statistical calculation, Sequence composition calculation, Variant calling, Sequence assembly validation, Visualisation, Mapping assembly, Sequencing quality control, De-novo assembly, Box-Whisker plot plotting, Pairwise sequence alignment, Base-calling	2023-03-06	2025-06-04	14	True	False	True	True	busco, barchart_gnuplot, bandage_image, meryl, minimap2, medaka_consensus_pipeline, fasta-stats, quast, fastqc, genomescope, flye, fastp, racon, nanoplot, multiqc	UseGalaxy.eu, UseGalaxy.org.au	UseGalaxy.cz	0		7592	9844	1.9833333333333334	0
Assembly	ERGA post-assembly QC	https://training.galaxyproject.org//topics/assembly/tutorials/ERGA-post-assembly-QC/tutorial.html	Genomics, Sequence assembly, Biodiversity	Sequence assembly validation, Visualisation, Phasing, Data deposition, Sequence trimming, De-novo assembly, Sequence alignment analysis, Sequence assembly visualisation, Genotyping, Data handling, Scaffolding, Genome assembly, Data parsing, Sequence alignment, Pairwise sequence alignment, k-mer counting	2023-06-23	2025-06-04	8	True	False	True	True	busco, bg_diamond, meryl, pretext_map, samtools_stats, pretext_snapshot, smudgeplot, gfastats, __EXTRACT_DATASET__, interactive_tool_blobtoolkit, merqury, bellerophon, collapse_dataset, bandage_image, blobtoolkit, bwa_mem2, CONVERTER_gz_to_uncompressed, minimap2, genomescope, tp_find_and_replace	UseGalaxy.eu	UseGalaxy.org (Main), UseGalaxy.org.au	0		2041	2644	2.033333333333333	0
Assembly	Chloroplast genome assembly	https://training.galaxyproject.org//topics/assembly/tutorials/chloroplast-assembly/tutorial.html		Read alignment, Analysis, Read mapping, Generation, Sequence assembly, Genome annotation, Coding region prediction, Mapping assembly, Genome indexing, De-novo assembly, Box-Whisker plot plotting, Sequence assembly visualisation, Cross-assembly, Genome visualisation, Scatter plot plotting, Genome assembly, Sequence alignment, Gene prediction	2020-12-04	2025-05-15	21	True	False	True	True	bandage_info, upload1, jbrowse, bandage_image, fasta-stats, pilon, nanoplot, flye, bwa_mem, prokka	UseGalaxy.eu	UseGalaxy.be, UseGalaxy.cz, UseGalaxy.fr, UseGalaxy.no, UseGalaxy.org (Main)	0		8143	12654	2.783333333333333	0
Assembly	Assembly of the mitochondrial genome from PacBio HiFi reads	https://training.galaxyproject.org//topics/assembly/tutorials/mitochondrion-assembly/tutorial.html	Genomics, Sequence assembly, Biodiversity, Mitochondria		2024-09-03	2025-06-04	4	True	False	True	True	mitohifi, compress_file	UseGalaxy.cz, UseGalaxy.eu, UseGalaxy.org (Main), UseGalaxy.org.au		0		922	1116	1.8166666666666667	0
Assembly	Decontamination of a genome assembly	https://training.galaxyproject.org//topics/assembly/tutorials/assembly-decontamination/tutorial.html	Genomics, Sequence assembly, Biodiversity	Taxonomic classification, Data handling	2024-09-04	2025-06-04	5	True	False	True	True	ncbi_dustmasker_wrapper, parse_mito_blast, ncbi_blastn_wrapper, tp_sed_tool, Cut1, Filter1, tp_cat, kraken2, gfastats	UseGalaxy.eu, UseGalaxy.org (Main), UseGalaxy.org.au	UseGalaxy.cz	0		1725	2128	2.433333333333333	0
Assembly	Unicycler Assembly	https://training.galaxyproject.org//topics/assembly/tutorials/unicycler-assembly/tutorial.html	Sequence assembly, Genomics, Microbiology	Sequence assembly validation, Visualisation, Genome annotation, Coding region prediction, Sequencing quality control, Validation, Aggregation, Genome assembly, Gene prediction, Statistical calculation, Sequence composition calculation	2017-10-11	2025-05-15	24	True	True	False	True	unicycler, quast, fastqc, multiqc, prokka	UseGalaxy.eu, UseGalaxy.org (Main), UseGalaxy.org.au	Galaxy@AuBi, GalaxyTrakr, MISSISSIPPI, UseGalaxy.be, UseGalaxy.cz, UseGalaxy.fr, UseGalaxy.no	0		3128570	7986804	4.383333333333334	0
Assembly	Unicycler assembly of SARS-CoV-2 genome with preprocessing to remove human genome reads	https://training.galaxyproject.org//topics/assembly/tutorials/assembly-with-preprocessing/tutorial.html		Read mapping, Sequencing quality control, Sequence contamination filtering, Validation, Box-Whisker plot plotting, Sequence assembly visualisation, Scatter plot plotting, Data handling, Aggregation, Genome assembly, Pairwise sequence alignment, Sequence file editing	2020-04-21	2025-05-15	14	True	True	True	True	bandage_info, fasta_filter_by_length, seqtk_sample, __ZIP_COLLECTION__, fasterq_dump, collapse_dataset, bandage_image, unicycler, samtools_stats, minimap2, samtools_fastx, samtools_view, fastp, multiqc, nanoplot, bowtie2	UseGalaxy.eu, UseGalaxy.org.au	Galaxy@AuBi, MISSISSIPPI, UseGalaxy.be, UseGalaxy.cz, UseGalaxy.fr, UseGalaxy.no, UseGalaxy.org (Main)	0		3121575	7974601	5.5	0
Assembly	Vertebrate genome assembly using HiFi, Bionano and Hi-C data - Step by Step	https://training.galaxyproject.org//topics/assembly/tutorials/vgp_genome_assembly/tutorial.html	Genomics, Sequence assembly, Biodiversity	Sequence assembly validation, Visualisation, Phasing, Read binning, Sequence trimming, De-novo assembly, Scaffolding, Data handling, Genome assembly, Primer removal, Sequence alignment, Pairwise sequence alignment, Read pre-processing, Mapping, k-mer counting	2021-06-04	2025-06-04	57	True	False	True	True	busco, meryl, tp_grep_tool, Convert characters1, pretext_map, salsa, pretext_snapshot, gfastats, merqury, yahs, bellerophon, collapse_dataset, hifiasm, gfa_to_fa, bionano_scaffold, sort1, purge_dups, cutadapt, Add_a_column1, bwa_mem2, cat1, minimap2, tp_cut_tool, genomescope, tp_find_and_replace, quast, bedtools_bamtobed, collection_column_join		UseGalaxy.cz	0		16177	24332	1.9666666666666666	0
Assembly	Genome assembly using PacBio data	https://training.galaxyproject.org//topics/assembly/tutorials/hifi-assembly/tutorial.html	Genomics, Sequence assembly, Biodiversity	Sequence assembly validation, Visualisation, Genome assembly, Mapping assembly, De-novo assembly, Cross-assembly	2021-11-29	2025-06-04	2	True	False	False	True	busco, hifiasm, gfa_to_fa, fasta-stats, flye, quast	UseGalaxy.eu, UseGalaxy.fr, UseGalaxy.org (Main), UseGalaxy.org.au	UseGalaxy.cz, UseGalaxy.no	0		915	1076	1.55	0
Assembly	Using the VGP workflows to assemble a vertebrate genome with HiFi and Hi-C data	https://training.galaxyproject.org//topics/assembly/tutorials/vgp_workflow_training/tutorial.html	Sequence assembly, Chromosome conformation capture	Sequence assembly validation, Visualisation	2022-04-06	2025-09-09	26	True	False	True	False	quast	Galaxy@AuBi, GalaxyTrakr, MISSISSIPPI, UseGalaxy.be, UseGalaxy.cz, UseGalaxy.eu, UseGalaxy.fr, UseGalaxy.no, UseGalaxy.org (Main), UseGalaxy.org.au		0		3673	5082	2.6166666666666667	0
Climate	Getting your hands-on earth data	https://training.galaxyproject.org//topics/climate/tutorials/earth_system/tutorial.html			2024-10-04	2025-05-10	2	True	False	False	False	c3s, argo_getdata, spocc_occ, obis_data	UseGalaxy.eu		0		115	149	1.9166666666666667	0
Ecology	Sentinel 2 biodiversity	https://training.galaxyproject.org//topics/ecology/tutorials/remote-sensing/tutorial.html			2023-04-13	2025-12-08	7	True	False	False	True	srs_pca, srs_preprocess_s2, srs_global_indices, srs_process_data, srs_spectral_indices, srs_diversity_maps	UseGalaxy.cz, UseGalaxy.eu, UseGalaxy.fr		0		634	810	1.5833333333333333	0
Ecology	Compute and analyze biodiversity metrics with PAMPA toolsuite	https://training.galaxyproject.org//topics/ecology/tutorials/PAMPA-toolsuite-tutorial/tutorial.html			2020-11-19	2025-09-03	23	True	False	True	True	regex1, pampa_glmcomm, tp_sort_header_tool, pampa_communitymetrics, Count1, Filter1, regexColumn1, tp_cat, tp_cut_tool, mergeCols1, pampa_plotglm, tp_easyjoin_tool, datamash_transpose, pampa_glmsp, pampa_presabs	UseGalaxy.eu	UseGalaxy.cz, UseGalaxy.fr, UseGalaxy.org.au	0		1120	1487	1.9166666666666667	0
Ecology	RAD-Seq to construct genetic maps	https://training.galaxyproject.org//topics/ecology/tutorials/genetic-map-rad-seq/tutorial.html		Data handling	2017-02-14	2025-06-03	13	True	False	False	True	stacks_denovomap, stacks_genotypes	UseGalaxy.be, UseGalaxy.cz, UseGalaxy.eu, UseGalaxy.no, UseGalaxy.org.au		0		906	1268	1.3166666666666667	0
Ecology	Champs blocs indicators	https://training.galaxyproject.org//topics/ecology/tutorials/champs-blocs/tutorial.html			2023-01-04	2025-12-02	12	True	False	False	True	cb_eco, cb_ivr, cb_qecb, cb_dissim, cb_div			0		181	331	1.8166666666666667	0
Ecology	Species distribution modeling	https://training.galaxyproject.org//topics/ecology/tutorials/species-distribution-modeling/tutorial.html			2019-07-04	2025-06-03	18	True	False	False	True	spocc_occ, Filter1, tabular_to_csv, tp_cut_tool, tp_find_and_replace, interactive_tool_wallace	UseGalaxy.eu, UseGalaxy.fr		0		3221	4856	1.15	0
Ecology	RAD-Seq de-novo data analysis	https://training.galaxyproject.org//topics/ecology/tutorials/de-novo-rad-seq/tutorial.html		Data handling, Sequencing quality control, Statistical calculation, Sequence composition calculation	2017-02-14	2025-06-03	14	True	False	False	True	stacks_populations, stacks_denovomap, fastqc, stacks_procrad	UseGalaxy.be, UseGalaxy.eu	UseGalaxy.cz, UseGalaxy.no, UseGalaxy.org.au	0		2718	4315	2.0833333333333335	0
Ecology	Regional GAM	https://training.galaxyproject.org//topics/ecology/tutorials/regionalGAM/tutorial.html	Ecology	Visualisation	2019-07-04	2025-06-03	18	True	False	False	True	tab2csv_R, regionalgam_gls, Remove beginning1, regionalgam_ab_index, regionalgam_glmmpql, Count1, regionalgam_autocor_acf, regionalgam_plot_trend, regionalgam_flight_curve, ggplot2_point, Filter1, regexColumn1, flight-curve, Paste1, mergeCols1, tp_awk_tool, csv2tab_R			0		351	469	3.4	0
Ecology	Metabarcoding/eDNA through Obitools	https://training.galaxyproject.org//topics/ecology/tutorials/Obitools-metabarcoding/tutorial.html		Sequence analysis, Sequencing quality control, Statistical calculation, Sequence composition calculation	2022-02-28	2025-06-03	12	True	False	True	True	obi_ngsfilter, obi_tab, obi_uniq, ncbi_blastn_wrapper, obi_grep, obi_illumina_pairend, fastq_groomer, Cut1, Filter1, obi_annotate, obi_stat, seq_filter_by_id, fastqc, join1, unzip, obi_clean, wc_gnu	UseGalaxy.eu, UseGalaxy.no, UseGalaxy.org.au	UseGalaxy.cz, UseGalaxy.fr	0		4572	6351	1.9333333333333333	0
Ecology	Obis marine indicators	https://training.galaxyproject.org//topics/ecology/tutorials/obisindicators/tutorial.html	Biodiversity, Ecology, Data mining		2023-04-11	2025-06-03	9	True	False	False	True	tp_cut_tool, obisindicators, obis_data	UseGalaxy.eu		0		320	400	2.0	0
Ecology	Preparing genomic data for phylogeny reconstruction	https://training.galaxyproject.org//topics/ecology/tutorials/phylogeny-data-prep/tutorial.html		Sequence assembly validation, Genome annotation, Sequence clustering, Sequence analysis, Multiple sequence alignment, Genetic variation analysis	2022-10-21	2025-06-03	5	True	False	False	True	regex1, busco, collapse_dataset, clipkit, Filter1, funannotate_predict, glimmer_gbk_to_orf, proteinortho, clustalw, proteinortho_grab_proteins, phykit_alignment_based, tp_replace_in_line, repeatmasker_wrapper			0		2267	3123	2.816666666666667	0
Ecology	Ecoregionalization workflow tutorial	https://training.galaxyproject.org//topics/ecology/tutorials/Ecoregionalization_tutorial/tutorial.html			2024-09-16	2025-06-03	7	True	False	False	True	ecoregion_GeoNearestNeighbor, ecoregion_taxa_seeker, filter_tabular, regexColumn1, ecoregion_eco_map, ecoregion_brt_analysis, tp_cut_tool, mergeCols1, ecoregion_clara_cluster, interactive_tool_jupyter_notebook, unzip, ecoregion_cluster_estimate	UseGalaxy.eu		0		293	387	2.566666666666667	0
Ecology	Life Traits Ecoregionalization workflow	https://training.galaxyproject.org//topics/ecology/tutorials/ecoregiolifetraits/tutorial.html			2025-06-02	2025-06-10	3	True	False	False	False	ecoregion_GeoNearestNeighbor, ecoregion_taxa_seeker, WormsMeasurements, column_remove_by_header, Filter1, regexColumn1, ecoregion_eco_map, ecoregion_brt_analysis, tp_cut_tool, ClaraGuess, unzip	UseGalaxy.eu		0		46	49	2.1	0
Ecology	RAD-Seq Reference-based data analysis	https://training.galaxyproject.org//topics/ecology/tutorials/ref-based-rad-seq/tutorial.html		Generation, Read mapping, Sequencing quality control, Genome indexing, Validation, Sequence alignment, Data handling, Statistical calculation, Sequence composition calculation	2017-02-14	2025-11-06	15	True	False	False	True	addValue, regex_replace, Grep1, tp_sort_header_tool, Count1, cat1, Cut1, Filter1, bwa_wrapper, stacks_populations, stacks_procrad, Convert characters1, fastqc, stacks_refmap, Summary_Statistics1, multiqc, tp_replace_in_line, bwa			0		3180	4945	1.8166666666666667	0
Ecology	Creating FAIR Quality assessment reports and draft of Data Papers from EML metadata with MetaShRIMPS	https://training.galaxyproject.org//topics/ecology/tutorials/Metashrimps_tutorial/tutorial.html			2024-01-22	2025-06-03	6	True	False	False	False	interactive_tool_metashrimps	UseGalaxy.eu		0		115	125	1.45	0
Ecology	Taxonomic Analysis of eDNA	https://training.galaxyproject.org//topics/ecology/tutorials/eDNA-taxonomic-analysis/tutorial.html		Sequencing quality control, Sequence contamination filtering	2025-06-02	2025-06-03	2	True	False	False	True	Count1, fastp, ncbi_blastn_wrapper, cshl_fastq_to_fasta	UseGalaxy.cz, UseGalaxy.eu, UseGalaxy.fr, UseGalaxy.org (Main), UseGalaxy.org.au	Galaxy@AuBi, GalaxyTrakr, MISSISSIPPI, UseGalaxy.be, UseGalaxy.no	0		488	613	0.7666666666666667	0
Ecology	Cleaning GBIF data for the use in Ecology	https://training.galaxyproject.org//topics/ecology/tutorials/gbif_cleaning/tutorial.html			2022-10-28	2025-06-03	6	True	False	False	True	spocc_occ, Count1, Filter1, Summary_Statistics1, gdal_ogr2ogr	UseGalaxy.cz, UseGalaxy.eu, UseGalaxy.fr, UseGalaxy.no		0		654	809	0.9166666666666666	0
Ecology	Marine Omics identifying biosynthetic gene clusters	https://training.galaxyproject.org//topics/ecology/tutorials/marine_omics_bgc/tutorial.html		Sequence motif recognition, Genome annotation, Protein feature detection	2024-08-19	2025-06-03	3	True	False	False	True	sanntis_marine, interproscan, regex1, prodigal, SanntiS_marine			0		195	229	2.283333333333333	0
Ecology	Biodiversity data exploration	https://training.galaxyproject.org//topics/ecology/tutorials/biodiversity-data-exploration/tutorial.html			2022-03-01	2025-06-03	15	True	False	True	True	Remove beginning1, regexColumn1, ecology_beta_diversity, ecology_homogeneity_normality, tp_cut_tool, ecology_link_between_var, ecology_stat_presence_abs, ecology_presence_abs_abund, tool_anonymization	UseGalaxy.eu	UseGalaxy.cz, UseGalaxy.fr	0		1643	2296	2.7	0
Ecology	Audio data annotation with NEAL (Nature + Energy Audio labeler)	https://training.galaxyproject.org//topics/ecology/tutorials/NEAL_tutorial/tutorial.html			2025-10-14	2025-11-06	3	True	False	False	False			UseGalaxy.eu, UseGalaxy.org, UseGalaxy.org.au, UseGalaxy.fr	0		22	25	0.0	0
Ecology	Cleaning GBIF data using OpenRefine	https://training.galaxyproject.org//topics/ecology/tutorials/openrefine_gbif/tutorial.html			2025-01-21	2025-06-03	5	True	False	False	False	regex1, interactive_tool_openrefine	UseGalaxy.eu, UseGalaxy.fr		0		168	205	1.0833333333333333	0
Ecology	QGIS Web Feature Services	https://training.galaxyproject.org//topics/ecology/tutorials/QGIS_Web_Feature_Services/tutorial.html			2023-10-11	2025-06-03	6	True	False	False	False	interactive_tool_qgis	UseGalaxy.eu		0		289	332	1.6166666666666667	0
Genome Annotation	Comparison of two annotation tools - Helixer and Braker3	https://training.galaxyproject.org//topics/genome-annotation/tutorials/comparison-braker-helixer-annotation/tutorial.html	Sequence assembly, Genomics	Differential protein expression profiling, Sequence assembly validation, Genome annotation, Genome visualisation, Sequence alignment, Gene prediction, Sequence annotation	2025-06-20	2025-06-25	2	True	False	False	True	busco, jbrowse, rna_star, helixer, braker3, omark, gffread			0		394	469	1.6	0
Genome Annotation	Masking repeats with RepeatMasker	https://training.galaxyproject.org//topics/genome-annotation/tutorials/repeatmasker/tutorial.html	Sequence composition, complexity and repeats, Genomics	RNA-Seq analysis, Genome annotation, Mapping, Editing, Repeat sequence detection	2021-11-29	2025-06-03	22	True	False	True	True	repeatmodeler, red, bedtools_maskfastabed, repeatmasker_wrapper	UseGalaxy.cz, UseGalaxy.eu, UseGalaxy.fr, UseGalaxy.org (Main), UseGalaxy.org.au		0		10219	13000	1.3666666666666667	0
Genome Annotation	Refining Genome Annotations with Apollo (prokaryotes)	https://training.galaxyproject.org//topics/genome-annotation/tutorials/apollo/tutorial.html	Genomics, Microbiology, Gene and protein families, Sequence analysis	Genome visualisation	2021-06-04	2025-05-15	22	True	True	True	True	list_organism, jbrowse, iframe, create_account, create_or_update		UseGalaxy.cz, UseGalaxy.eu, UseGalaxy.no	0		2890530	7188062	5.1	0
Genome Annotation	Genome annotation with Braker3	https://training.galaxyproject.org//topics/genome-annotation/tutorials/braker3/tutorial.html	Sequence assembly, Genomics, Biodiversity, Zoology, Plant biology	Differential protein expression profiling, Sequence assembly validation, Genome annotation, Genome visualisation, Sequence alignment, Gene prediction, Sequence annotation	2025-03-17	2025-06-20	4	True	False	False	True	busco, jbrowse, fasta-stats, rna_star, braker3, omark, gffread			0		1436	1766	1.8166666666666667	0
Genome Annotation	Genome annotation with Helixer	https://training.galaxyproject.org//topics/genome-annotation/tutorials/helixer/tutorial.html	Biodiversity, Genomics, Zoology, Plant biology	Differential protein expression profiling, Sequence assembly validation, Genome annotation, Genome visualisation, Gene prediction, Sequence annotation	2024-08-21	2025-06-04	8	True	False	False	True	busco, jbrowse, helixer, omark, jcvi_gff_stats, gffread			0		1261	1498	1.65	0
Genome Annotation	Genome annotation with Funannotate	https://training.galaxyproject.org//topics/genome-annotation/tutorials/funannotate/tutorial.html	Gene and protein families	Sequence motif recognition, Sequence assembly validation, Genome annotation, Query and retrieval, Information extraction, Formatting, Protein feature detection, Genome visualisation, Homology-based gene prediction, Sequence alignment, Sequence annotation, Fold recognition	2021-11-29	2025-06-10	26	True	False	True	True	busco, interproscan, jbrowse, picard_MergeSamFiles, eggnog_mapper, funannotate_compare, funannotate_predict, aegean_parseval, funannotate_annotate, rna_star	UseGalaxy.eu, UseGalaxy.fr, UseGalaxy.org (Main)	UseGalaxy.be, UseGalaxy.cz, UseGalaxy.org.au	0		10825	15308	1.95	0
Genome Annotation	Comparative gene analysis in unannotated genomes	https://training.galaxyproject.org//topics/genome-annotation/tutorials/gene-centric/tutorial.html	Genomics, Gene and protein families, Sequence analysis, Phylogeny, Comparative genomics	Database search, Sequence alignment analysis, Coding region prediction, Multiple sequence alignment, Transcriptome assembly, De-novo assembly, Phylogenetic tree generation	2022-09-08	2025-06-03	10	True	False	False	True	Add_a_column1, rapidnj, bg_diamond_view, orfipy, collapse_dataset, bg_diamond, tab2fasta, cat1, rbc_mafft, Cut1, Filter1, bg_diamond_makedb, tp_split_on_column, regexColumn1, join1, gops_intersect_1	UseGalaxy.eu, UseGalaxy.org (Main)	UseGalaxy.cz	0		1877	2628	3.0166666666666666	0
Genome Annotation	Functional annotation of protein sequences	https://training.galaxyproject.org//topics/genome-annotation/tutorials/functional/tutorial.html	Function analysis, Protein sites, features and motifs	Sequence motif recognition, Genome annotation, Query and retrieval, Homology-based gene prediction, Sequence alignment analysis, Information extraction, Protein feature detection, Fold recognition	2022-07-20	2025-06-03	12	True	False	False	True	eggnog_mapper, ncbi_blastp_wrapper, interproscan, bg_diamond	UseGalaxy.cz, UseGalaxy.eu, UseGalaxy.fr, UseGalaxy.org (Main), UseGalaxy.org.au	UseGalaxy.no	0		4355	5823	1.6666666666666667	0
Genome Annotation	Refining Genome Annotations with Apollo (eukaryotes)	https://training.galaxyproject.org//topics/genome-annotation/tutorials/apollo-euk/tutorial.html	Genomics	Genome visualisation	2022-08-22	2025-06-03	16	True	False	False	False	iframe, create_or_update, jbrowse	UseGalaxy.no	UseGalaxy.cz, UseGalaxy.eu	0		1469	2235	2.55	0
